DOI,Title,Authors,Journal,Year,Abstract,ResearchRabbitId,Cited By,References,PubMedId
(missing DOI),Strengthening Industry-Academia Collaboration: Enhancing Continuous Professional Development for Engineers,"Christian E. Coronado Mondragon, Luis H. González-Guerra, María Yolanda Burgos López, Pedro Pérez-Murueta, Víctor Manuel de la Cueva Hernández",2025 World Engineering Education Forum - Global Engineering Deans Council (WEEF-GEDC),2025,"In an era marked by accelerated technological change and digital transformation, the need for continuous professional development among engineers has become more urgent than ever. The World Economic Forum's 2023 report forecasts that 50 % of all employees will require reskilling by 2025, with the engineering sector experiencing particularly high pressure to adapt. More than 70 % of engineers are expected to upskill in emerging areas, including artificial intelligence, sustainable engineering, data analytics, and advanced manufacturing technologies. Despite this pressing demand, a persistent gap remains between the competencies developed through academic programs and the practical skills required by industry. This disconnect poses a significant challenge to both educational institutions and employers seeking to prepare and retain a future-ready engineering workforce. This paper explores the potential of industry-academia collaboration as a strategic mechanism to bridge this gap and enhance the continuous professional development of engineering students. By analyzing a series of case studies and existing partnership models, the research examines the effectiveness of collaborative initiatives, including structured internship programs, co-designed curricula, joint research projects, and faculty-industry exchanges. These initiatives are shown to enrich students' learning experiences by integrating real-world challenges into academic settings, thereby fostering a more holistic and practice-oriented educational approach. Findings indicate that such partnerships significantly improve students' disciplinary competencies, critical thinking, and problem-solving abilities. Graduates emerging from programs with strong industry ties demonstrate a higher degree of professional readiness, adaptability, and alignment with current technological and business trends. Furthermore, sustained collaboration helps academic institutions stay abreast of evolving industry standards while enabling companies to influence talent development. Ultimately, the paper argues that a deepening alliance between industry and academia is not only beneficial but essential for cultivating a responsive, innovative, and competitive engineering workforce capable of thriving in the dynamic landscape of the 21st century.",294289562,0,8,(missing PubMedId)
(missing DOI),Academia-Industry Linkages for Sustainable Innovation in Agriculture Higher Education in India,"S. K. Soam, Yashavanth Basavapatna Subbanna, Surya Rathore, V. V. Sumanth Kumar, Sanjiv Kumar, S. S. Vinayagam, S. Rakesh, Raghupathi Balasani, Dhumantarao Thammi Raju, Alok Kumar, Nukella Srinivasa Rao, Pandian Krishnan, S. Marwaha, Anuradha Agrawal, Cherukumalli Srinivasa Rao, Rakesh Chandra Agrawal",Sustainability,2023,"The Indian Council of Agricultural Research (ICAR) and the World Bank have collaborated on a project entitled the National Agricultural Higher Education Project (NAHEP) to improve agricultural higher education in India, paving the way for sustainable higher education in agriculture. As part of this project, the present investigation was carried out through national-level workshops involving seven State Agricultural Universities (SAUs) across India, with participants from academia and industry, to strengthen ‘academia–industry collaboration’ through effective linkages. Based on the responses of 199 respondents from academia and industry, the study demonstrates an absolute need for linkages between universities and industries (p < 0.001), which are perceived to help improve higher education sustainably. Academic institutions believe that such linkages benefit students concerning their employability, entrepreneurial skills, and financial support received. At the same time, industries believe that they would benefit from novel technologies and influencing academic curricula. This article also establishes an alliance between some parts of academia and industry in the form of MoUs in the identified areas. However, many other areas need more appropriate linkage models. Both sectors, i.e., academia and industry, concur that such exposure and collaboration between the two entities will help to improve the quality of education. Moreover, such collaborations provide financial support, increase students’ employability, and improve their entrepreneurial skills. Among the areas requiring collaboration, the ‘capacity building of students’ was rated most important by academia and industry. Overall, the present study has significant implications for university administrators and industry leaders involved in enhancing academia–industry cooperation and improving the quality and sustainability of higher education in agriculture. Further, the study greatly contributes to the National Education Policy (NEP) to promote innovation among the student communities through Higher Educational Institutes (HEIs) and to the Sustainable Development Goals (SDGs).",266882154,13,75,(missing PubMedId)
(missing DOI),Special issue on collaboration in software testing between industry and academia,"M. Felderer, R. Ramler",Software Quality Journal,2017,(missing abstract),151843887,3,5,(missing PubMedId)
(missing DOI),Industry-Academia Collaboration in Software Testing: An Overview of TAIC PART 2016,"Rudolf Ramler, Michael Felderer, Takashi Kitamura, Darko Marinov",(missing journal),2016,"Collaboration between industry and academia in software testing leads to improvement and innovation in industry, and it is the basis for achieving transferable and empirically evaluated results. Thus, the aim of TAIC PART is to forge collaboration between industry and academia on the challenging and exciting problem of real-world software testing. The workshop is promoted by representatives of both industry and academia, bringing together industrial software engineers and testers with researchers working on theory and practice of software testing. We present an overview of the 11th Workshop on Testing: Academia-Industry Collaboration, Practice and Research Techniques (TAIC PART 2016) and its contributions.",146613378,5,4,(missing PubMedId)
10.16920/JEET/2017/V30I3/110556,OBE based Industry Academy Approach for Embedded System Design Course,"M. Rajendra Prasasd, B. Santosh Kumar, A. Swarnamani",(missing journal),2016,"Outcome-Based Education (OBE) is a powerful framework which emphasizes on the outcomes of the course. OBE is the student-centred learning method that focuses on measuring the student performance. At the end of each course, student should fulfill the course outcomes.The purpose of this paper is to investigate and present an analysis report that gives the methodology to enhance the capabilities of a student from the existing courses by OBE based industry academy approach for embedded system design course. The objective for the Embedded Systems(ES) course enables the students to understand basics and program of an embedded system. It helps to learn and understand the method of designing, operating systems concepts, types and choosing an RTOS for an embedded system for any type of applications. It lets students design, implement and test an embedded system.The interaction between the Industry and Academia creates a path for the exchange of knowledge which is very crucial. Academia is the major source of knowledge for industry which provides required infrastructure and support to the Academia. This interaction provides a platform for the students to foster research interests. Through this paper, we have implemented Industry-Academia Approach (IAA) to meet the outcomes of industry oriented course and also discuss the outcomes of the projects that we have undertaken during and after the training program through the collaboration with the industry.",f3ef6ddc-1f12-4c49-9f39-f8947ce53279,2,17,(missing PubMedId)
(missing DOI),Industry-Academia Collaboration in Software Testing: An Overview of TAIC PART 2017,"Takashi Kitamura, Emil Alégroth, Rudolf Ramler",(missing journal),2017,"Collaboration between industry and academia in software testing leads to improvement and innovation in industry, and it is the basis for achieving transferable and empirically evaluated results. Thus, the aim of TAIC PART is to forge collaboration between industry and academia on the challenging and exciting problem of real-world software testing. The workshop is promoted by representatives of both industry and academia, bringing together industrial software engineers and testers with researchers working on theory and practice of software testing. We present an overview of the 12th Workshop on Testing: Academia-Industry Collaboration, Practice and Research Techniques (TAIC PART 2017) and its contributions.",58277531,5,8,(missing PubMedId)
