Lens ID,Title,Date Published,Publication Year,Publication Type,Source Title,ISSNs,Publisher,Source Country,Author/s,Abstract,Volume,Issue Number,Start Page,End Page,Fields of Study,Keywords,MeSH Terms,Chemicals,Funding,Source URLs,External URL,PMID,DOI,Microsoft Academic ID,PMCID,Citing Patents Count,References,Citing Works Count,Is Open Access,Open Access License,Open Access Colour
053-483-344-419-756,Ontology-Based Knowledge Management Tools for Knowledge Sharing in Organization—A Review,,2022,journal article,IEEE Access,21693536,Institute of Electrical and Electronics Engineers (IEEE),United States,Mohamad Amin Osman; Shahrul Azman Mohd Noah; Saidah Saad,"Knowledge management (KM) comprises several processes, and one of the most important is the knowledge sharing activities. The ability of an organization to manage its organizational knowledge, specifically in the context of knowledge sharing, may enhance the organization's overall performance. Various approaches and technologies have been introduced to assist the process in achieving that target. Ontology as one of the knowledge representation methods has been becoming popular to assist knowledge sharing in the organization. Previous reviews have mainly focused on general KM issues, with little emphasis on the use of ontology in knowledge sharing. Thus, this article reviews several ontology-based KM tools that can support knowledge-sharing activities to provide some insight into future research in this area. Thirteen ontology-based KM tools were reviewed using ten elements' comparison criteria: the motivation, domain, source of knowledge, type of knowledge, knowledge extraction, knowledge input process, knowledge retrieval process, knowledge sharing technology, source of ontology component, and ontology methodology. The review found that several elements can be further studied to improve KM implementation in the organization, especially on the knowledge sharing dimension. This includes simplifying the knowledge extraction and retrieval process to explore various knowledge domains from implicit knowledge sources. The review's outcome also includes proposed components and functions of an ideal ontology-based KM tool.",10,,43267,43283,Computer science; Ontology; Knowledge management; Open Knowledge Base Connectivity; Knowledge sharing; Domain knowledge; Knowledge extraction; Knowledge organization; Personal knowledge management; Knowledge engineering; Knowledge representation and reasoning; Knowledge value chain; Knowledge-based systems; Knowledge integration; Body of knowledge; Context (archaeology); Knowledge retrieval; Data science; Organizational learning; Data mining; Artificial intelligence; Paleontology; Philosophy; Epistemology; Biology,Knowledge; knowledge management; knowledge sharing; ontology; organization,,,Universiti Kebangsaan Malaysia,https://ieeexplore.ieee.org/ielx7/6287639/9668973/09745581.pdf https://doi.org/10.1109/access.2022.3163758,http://dx.doi.org/10.1109/access.2022.3163758,,10.1109/access.2022.3163758,,,2,000-717-366-133-368; 004-618-010-065-933; 005-494-086-861-068; 006-350-641-241-874; 006-865-431-146-417; 007-176-214-630-387; 007-246-401-441-902; 010-047-068-492-621; 010-708-983-768-041; 011-734-201-503-360; 014-564-010-475-432; 018-193-051-842-281; 019-286-395-486-398; 020-679-782-779-345; 024-910-970-137-264; 025-093-499-509-52X; 025-273-771-892-889; 026-128-028-132-504; 029-922-726-890-414; 030-661-197-138-368; 030-999-434-748-097; 036-184-185-827-018; 042-407-046-486-025; 046-547-268-714-476; 047-708-333-238-092; 049-926-453-062-528; 050-075-070-428-29X; 050-099-231-780-347; 050-170-779-842-610; 054-993-280-123-468; 055-464-082-021-383; 061-764-221-106-902; 062-553-481-388-834; 063-092-254-329-743; 064-536-652-025-746; 070-566-592-010-781; 071-432-465-620-571; 072-783-024-468-755; 075-347-287-020-491; 077-457-226-451-423; 079-115-488-248-823; 085-433-441-363-42X; 090-533-147-551-349; 093-816-986-951-086; 094-455-914-801-105; 095-073-078-853-139; 098-222-719-251-580; 099-466-183-825-458; 100-445-029-445-191; 100-606-500-805-190; 102-048-049-769-728; 103-127-105-768-597; 105-520-770-889-771; 108-785-457-182-932; 112-336-548-385-04X; 113-680-606-982-782; 113-908-181-172-415; 116-186-582-198-023; 117-081-890-448-480; 120-325-909-935-26X; 121-140-428-420-340; 130-866-391-930-396; 133-078-056-476-036; 136-437-563-667-743; 139-199-714-482-753; 145-725-424-478-128; 151-277-564-518-890; 160-405-189-836-765; 160-845-267-554-368; 163-469-201-429-874; 170-407-588-413-083; 181-072-396-769-365; 181-089-429-747-420; 194-769-647-717-781,34,true,"CC BY, CC BY-NC-ND",gold
086-797-078-937-41X,"Artificial intelligence in traditional Chinese medicine: from systems biological mechanism discovery, real-world clinical evidence inference to personalized clinical decision support.",,2025,journal article,Chinese journal of natural medicines,18755364,Elsevier BV,China,Dengying Yan; Qiguang Zheng; Kai Chang; Rui Hua; Yiming Liu; Jingyan Xue; Zixin Shu; Yunhui Hu; Pengcheng Yang; Yu Wei; Jidong Lang; Haibin Yu; Xiaodong Li; Runshun Zhang; Wenjia Wang; Baoyan Liu; Xuezhong Zhou,,23,11,1310,1328,,Artificial intelligence; Clinical decision support; Real-world clinical evidence; Systems biological mechanism,"Medicine, Chinese Traditional/methods; Artificial Intelligence; Humans; Precision Medicine; Decision Support Systems, Clinical",,,,http://dx.doi.org/10.1016/s1875-5364(25)60983-6,41260781,10.1016/s1875-5364(25)60983-6,,,0,000-250-568-511-420; 000-970-501-891-938; 000-980-538-849-652; 001-685-312-084-022; 001-783-867-194-558; 003-395-885-197-224; 004-814-662-457-260; 004-910-205-121-075; 005-998-824-513-356; 006-104-664-386-845; 007-452-283-268-471; 007-536-315-950-888; 007-909-524-700-34X; 008-645-017-214-697; 009-305-548-395-795; 009-648-784-224-669; 010-502-180-251-328; 011-043-039-578-803; 011-283-312-546-638; 012-063-995-867-300; 012-070-432-095-197; 013-033-776-687-35X; 013-230-495-530-367; 013-500-445-643-002; 013-539-229-382-045; 013-671-046-475-431; 015-208-369-921-035; 015-496-260-119-654; 015-716-182-963-332; 015-801-430-523-763; 015-988-856-600-247; 016-028-123-615-853; 016-489-127-449-970; 017-731-320-265-38X; 019-745-278-290-249; 020-342-917-126-947; 021-056-667-361-918; 021-159-441-907-078; 021-372-042-110-507; 022-178-533-300-02X; 022-808-838-045-369; 022-814-494-846-824; 023-156-701-939-869; 023-174-632-416-683; 023-597-952-142-962; 023-937-903-609-050; 024-182-904-807-191; 024-232-756-025-106; 026-589-199-075-796; 027-059-632-993-167; 027-446-747-209-491; 027-964-636-591-253; 028-132-043-726-890; 028-473-142-165-246; 029-046-536-064-632; 029-855-732-406-054; 030-069-949-925-776; 030-204-199-599-340; 030-724-559-603-18X; 031-066-853-466-707; 031-168-392-819-270; 031-360-818-265-341; 031-661-106-492-107; 032-111-707-334-93X; 032-187-317-833-785; 032-657-649-136-728; 032-711-229-634-338; 034-587-111-699-184; 035-362-179-191-490; 035-603-121-682-013; 036-774-601-518-311; 038-457-980-385-38X; 038-875-171-796-578; 038-911-799-034-646; 038-947-551-877-230; 040-872-203-875-51X; 041-010-080-269-102; 042-677-537-623-119; 043-500-609-327-187; 043-830-981-209-98X; 044-436-365-081-469; 045-792-272-733-381; 046-507-852-238-185; 047-680-194-329-864; 049-086-476-062-96X; 049-199-976-023-933; 049-224-529-673-127; 050-243-907-469-617; 051-538-721-549-162; 053-208-927-606-848; 053-437-643-366-44X; 053-569-478-519-231; 053-944-470-487-345; 054-025-137-423-750; 054-114-803-410-279; 054-169-163-957-257; 054-215-707-709-572; 054-506-133-186-142; 054-627-514-698-652; 056-355-696-308-315; 057-769-139-889-889; 058-243-094-404-613; 059-126-355-213-959; 059-144-064-530-881; 059-502-333-665-846; 059-752-747-472-43X; 060-605-208-085-479; 061-043-216-470-62X; 062-872-350-658-919; 063-331-381-888-981; 063-940-037-041-371; 064-224-089-539-349; 066-869-796-643-410; 067-316-822-569-370; 068-271-986-860-893; 068-814-412-185-41X; 069-537-481-932-056; 070-039-235-134-618; 072-892-087-043-36X; 073-798-435-800-730; 075-028-735-809-819; 075-482-583-343-211; 078-023-943-043-420; 078-555-359-846-061; 079-120-628-646-628; 079-952-778-785-422; 080-244-416-614-368; 081-501-215-801-213; 082-668-964-617-537; 082-865-609-532-646; 083-662-811-872-552; 084-308-105-867-398; 084-449-663-565-588; 084-841-123-477-751; 086-734-084-006-939; 087-197-460-731-989; 087-702-957-154-966; 088-510-290-446-96X; 088-546-716-241-908; 088-831-667-451-564; 088-848-238-892-290; 088-927-352-835-092; 089-180-880-205-346; 091-522-084-370-753; 093-228-078-990-994; 095-618-533-415-454; 096-984-519-946-490; 097-278-738-812-298; 099-887-947-387-394; 100-348-698-742-367; 100-532-472-362-804; 100-840-528-972-746; 102-289-550-093-44X; 102-741-562-717-430; 103-127-105-768-597; 103-205-750-922-682; 103-212-983-826-945; 103-902-327-991-449; 105-174-905-533-58X; 105-831-280-260-557; 108-531-853-049-391; 110-910-639-258-856; 112-369-597-237-554; 112-711-450-889-751; 118-932-915-199-839; 120-670-493-162-706; 120-804-024-157-307; 127-734-814-239-247; 128-473-590-954-05X; 130-638-362-643-262; 132-401-257-686-452; 139-934-928-018-129; 141-035-385-798-319; 141-747-284-070-594; 148-090-672-269-811; 151-865-866-529-297; 156-724-795-750-252; 159-193-706-890-499; 163-298-324-923-115; 163-719-342-104-829; 164-765-098-297-959; 169-079-858-368-361; 170-005-847-283-462; 171-420-721-594-34X; 172-108-488-918-853; 176-020-425-556-364; 180-740-084-008-908; 181-072-396-769-365; 182-274-860-077-998; 184-112-162-624-676; 184-259-705-080-377; 185-229-376-822-681; 187-142-505-152-866; 188-861-083-266-448; 189-628-839-422-419; 190-368-918-090-720; 192-874-951-122-194; 195-614-445-736-589; 198-188-321-116-820; 198-709-610-257-559,0,false,,
138-335-845-819-982,Traceability of Architectural Design Decisions and Software Artifacts: A Systematic Mapping Study,2023-12-01,2023,journal article,Foundations of Computing and Decision Sciences,23003405; 08676356,Walter de Gruyter GmbH,Germany,Santiago Hyun; Julio Ariel Hurtado,"<jats:title>Abstract</jats:title>;                <jats:p>The definition of architecture is a crucial task in software development, where the architect is responsible for making the right decisions to meet specific functional and quality requirements. These architectural design decisions form the foundation that shapes the arrangement of elements within a system. Unfortunately, these decisions are often poorly documented, implicit in various artifacts, or inadequately updated, leading to negative consequences on the maintainability of a system and resulting in rework and cost overruns. The objective of this systematic mapping study is to comprehend the current state regarding approaches for traceability of architectural design decisions and how these decisions are linked with the different artifacts used in software development. To achieve this, an information extraction protocol is followed, utilizing databases with search strings, inclusion, and exclusion criteria. The findings demonstrate that this knowledge is highly relevant; however, it is rarely explicitly documented. As a result, most works propose diverse approaches to extract this knowledge from existing technical documentation, commonly used tools, and other sources of product and process information. In contrast, it is evident that there is no standard for documenting design decisions, leading each author to present a subjective version of what is important and where to trace these decisions. This suggests that there is still a significant amount of research to be conducted regarding the traceability of these architectural design decisions and their connection with software artifacts. Such research could lead to intriguing new proposals for investigation.</jats:p>",48,4,401,423,Computer science; Traceability; Software engineering; Maintainability; Architectural pattern; Software development; Software architecture; Documentation; Process (computing); Software design; Risk analysis (engineering); Software; Medicine; Programming language; Operating system,,,,,https://sciendo.com/pdf/10.2478/fcds-2023-0018 https://doi.org/10.2478/fcds-2023-0018,http://dx.doi.org/10.2478/fcds-2023-0018,,10.2478/fcds-2023-0018,,,0,004-872-825-309-867; 005-653-266-157-09X; 013-035-137-085-343; 013-766-702-668-007; 016-853-344-254-764; 017-253-981-578-179; 017-770-818-030-846; 019-164-639-115-871; 020-465-663-897-978; 022-070-268-084-13X; 022-598-069-432-037; 023-978-972-796-41X; 027-904-325-809-089; 028-215-061-308-899; 028-230-869-809-042; 028-333-769-388-289; 028-836-914-272-587; 029-509-670-807-095; 032-397-527-054-515; 033-332-417-648-629; 036-067-250-639-118; 039-235-666-391-514; 040-369-681-015-698; 044-956-875-882-839; 046-579-802-721-809; 048-734-677-260-512; 049-082-894-957-442; 050-058-251-115-853; 051-275-718-853-030; 053-409-011-862-703; 060-552-627-753-332; 062-920-793-433-392; 068-584-401-474-08X; 069-969-331-457-455; 075-460-699-878-78X; 078-822-806-611-605; 080-159-813-414-486; 080-351-706-015-893; 081-686-850-377-62X; 086-354-087-152-013; 091-206-648-631-943; 095-060-038-140-609; 103-127-105-768-597; 107-824-222-075-916; 124-689-589-878-181; 137-293-042-634-379; 150-274-493-211-073; 153-030-091-084-09X; 174-690-563-295-086; 190-574-981-866-648; 193-652-964-330-294,3,true,cc-by-nc-nd,gold
144-312-320-765-892,Updating a Systematic Literature Review on Knowledge Management Diagnostics in Software Development Organizations,2024-11-05,2024,conference proceedings article,Proceedings of the XXIII Brazilian Symposium on Software Quality,,ACM,,Daniela dos Santos Alves; Deivid José Smek; Érica Ferreira de Souza; Katia Romero Felizardo; Nandamudi L. Vijaykumar,,,,125,135,Computer science; Software engineering; Software development; Data science; Software; Knowledge management; Programming language,,,,,,http://dx.doi.org/10.1145/3701625.3701652,,10.1145/3701625.3701652,,,0,001-162-203-276-487; 001-319-036-333-28X; 005-842-894-870-067; 024-043-679-120-974; 024-843-062-294-216; 027-476-833-806-054; 031-056-855-501-837; 031-307-112-855-507; 034-702-120-144-00X; 040-795-814-553-281; 043-894-684-983-680; 044-647-273-143-44X; 047-260-023-419-020; 049-382-806-003-484; 063-332-637-558-607; 072-340-374-829-378; 080-351-706-015-893; 088-605-958-352-819; 096-638-316-633-732; 103-127-105-768-597; 103-584-554-904-850; 113-031-910-577-52X; 118-731-693-819-164; 124-763-383-906-979; 125-039-593-949-415; 137-137-797-450-610; 140-397-216-738-245; 143-193-604-404-049; 147-724-863-924-60X; 157-368-136-778-081; 182-097-887-968-892; 182-198-474-715-865; 195-773-468-220-401,1,false,,
152-472-953-946-944,Ontology-based systems engineering: A state-of-the-art review,,2019,journal article,Computers in Industry,01663615,Elsevier BV,Netherlands,Lan Yang; Kathryn Cormican; Ming Yu,,111,,148,171,Formal semantics (linguistics); Knowledge representation and reasoning; Ontology (information science); Body of knowledge; Systems engineering; Enabling; Ontology engineering; Support system; State of the art review; Computer science,,,,"National University of Ireland, Galway",https://www.sciencedirect.com/science/article/pii/S0166361518307887 https://doi.org/10.1016/j.compind.2019.05.003 https://dblp.uni-trier.de/db/journals/cii/cii111.html#YangCY19,http://dx.doi.org/10.1016/j.compind.2019.05.003,,10.1016/j.compind.2019.05.003,2970012586,,0,000-000-902-662-135; 000-006-492-339-366; 000-322-786-989-983; 000-444-109-701-677; 001-519-384-344-846; 002-326-846-470-923; 003-065-631-600-480; 003-849-646-994-289; 004-185-195-041-522; 005-097-796-925-282; 005-505-697-487-133; 006-072-884-753-658; 006-586-010-608-319; 007-479-625-409-247; 007-722-499-943-402; 007-789-878-364-028; 007-959-359-504-999; 008-163-695-586-877; 008-589-005-617-364; 008-798-452-801-914; 008-831-636-552-600; 009-157-950-785-896; 009-202-369-358-639; 009-350-147-358-400; 009-726-978-954-097; 010-322-100-584-774; 010-943-338-665-699; 012-262-477-759-985; 012-742-231-837-798; 013-095-788-748-504; 013-226-543-173-869; 014-697-360-827-29X; 014-705-040-095-71X; 014-791-206-114-102; 016-591-831-510-406; 017-007-518-731-094; 017-139-727-020-162; 017-162-502-281-05X; 017-577-292-898-186; 017-622-854-658-871; 018-430-248-941-554; 019-901-022-330-456; 020-323-473-965-139; 020-878-934-248-845; 021-168-285-310-935; 022-210-099-712-589; 023-219-145-353-87X; 024-919-507-572-388; 025-259-915-293-578; 026-239-789-943-039; 026-543-747-965-21X; 026-712-844-452-082; 027-154-088-021-422; 027-367-050-473-406; 027-387-273-051-903; 027-762-161-045-201; 027-868-882-204-167; 028-981-585-660-036; 029-352-726-016-936; 029-952-096-745-155; 030-136-936-524-671; 030-148-298-024-506; 030-883-726-621-261; 031-150-595-017-029; 032-763-826-528-706; 033-323-277-612-899; 034-420-912-853-562; 036-395-354-949-13X; 036-965-017-303-698; 037-413-978-142-214; 037-847-084-347-243; 038-089-400-793-269; 038-154-197-561-54X; 038-774-981-522-357; 039-021-033-623-633; 039-295-475-235-88X; 039-910-283-278-932; 040-230-083-552-77X; 040-934-324-947-445; 041-815-676-754-115; 042-562-358-378-912; 042-994-959-356-507; 043-263-070-910-443; 043-925-835-863-723; 045-234-153-430-365; 045-873-994-498-728; 048-496-370-346-978; 048-597-165-518-999; 049-070-845-981-122; 049-294-389-328-607; 050-674-902-460-343; 051-248-326-403-328; 051-427-352-737-421; 054-736-179-208-144; 054-833-530-944-988; 055-562-388-947-049; 055-709-566-196-991; 057-208-924-693-478; 058-174-890-263-341; 059-556-119-315-857; 061-550-764-527-478; 061-581-343-082-687; 064-655-862-911-625; 065-089-238-480-49X; 065-568-015-090-951; 066-009-185-161-826; 066-884-808-434-276; 067-090-329-384-517; 068-673-802-238-728; 068-930-003-699-346; 070-144-693-412-915; 070-273-173-696-396; 070-314-243-999-092; 070-897-421-483-310; 070-991-197-462-849; 072-003-999-138-385; 072-868-759-636-636; 073-680-986-754-407; 073-889-153-745-60X; 075-582-654-326-143; 075-787-317-213-083; 077-016-906-064-669; 079-783-690-742-060; 080-796-108-894-367; 081-241-360-423-214; 081-742-070-744-218; 082-674-772-856-200; 083-261-053-551-604; 085-300-287-100-525; 087-756-655-295-783; 088-094-438-392-049; 091-989-244-279-22X; 094-321-369-641-623; 094-435-790-073-266; 094-513-186-660-932; 094-758-939-915-078; 095-489-351-679-581; 097-895-563-035-979; 098-483-825-609-027; 098-490-845-003-677; 099-693-450-372-132; 099-755-789-460-001; 099-768-941-527-083; 100-046-684-144-688; 100-203-464-517-311; 100-453-345-248-085; 102-118-270-897-367; 103-127-105-768-597; 103-944-579-134-190; 104-402-865-687-255; 105-479-280-616-605; 107-674-981-576-200; 107-814-239-050-521; 111-051-293-735-873; 113-181-996-048-736; 114-889-372-075-808; 125-829-771-963-567; 129-179-408-410-195; 131-058-997-295-930; 131-645-280-919-263; 132-000-161-703-775; 132-427-471-071-702; 134-299-050-841-27X; 135-324-674-967-821; 135-807-482-654-421; 137-256-480-760-778; 139-671-080-405-33X; 141-924-572-934-347; 144-827-211-136-571; 145-658-174-593-387; 146-094-458-231-412; 146-771-539-417-900; 146-838-548-497-109; 147-900-096-108-053; 148-012-722-407-300; 150-941-041-652-413; 151-451-936-917-376; 154-318-950-718-126; 154-762-252-796-048; 158-676-298-633-281; 158-882-182-218-526; 160-157-930-865-498; 162-704-058-333-386; 163-719-051-421-381; 167-088-082-733-975; 167-675-522-662-522; 172-926-396-618-903; 181-072-396-769-365; 181-161-216-642-274; 186-257-405-008-318; 189-387-292-329-952; 199-802-898-210-567,130,false,,
166-371-196-029-350,An Efficient Ontology‐Based Semantic Interoperability Using MSGO‐RNN in Cloud Computing,2024-08-24,2024,journal article,Journal of Optimization,2356752x; 23146486,Wiley,,Chithambaramani R.; Jayashree K.; Krishna B. V.; Prakash Mohan,"<jats:p>Semantic interoperability (SI) is defined as the capability of interpreting the nature of the information exchanged inside cloud computing (CC). For SI, ontology is selected as a solution. A hierarchical structure is offered by an ontology that comprises semantic relations between the application and the cloud server (CS). Even though different methods are introduced, ontology centered on semantic relation between the application and CS is not yet attained for achieving accurate interoperability. An ontology‐centered SI in CC utilizing a modified Shell Game optimization‐centered recurrent neural network (MSGO‐RNN) is presented in this work. Here, accessing the data from the data warehouse is initiated that experiences different standardization functions for improving the data’s quality, namely, data extraction, data cleaning, data transformation, data loading, and refreshing. Then, the data are passed via the semantic layer (SL), which offers a constant way of interpreting data. Then, for enhancing the accuracy rate of interoperability along with offering a low computational time, the relevant feature is chosen utilizing genetic crossover mutation‐centered improved fertile field (GCM‐IFF) optimization. Ontology is created utilizing the Protégé tool centered on the data, and respective manipulation is executed utilizing HermiT ontology web language (OWL) reasoner. Lastly, to attain cloud interoperability, the features are trained and tested by employing the MSGO‐RNN. The experimental outcome exhibits that when compared with the top‐notch methods, an accuracy of 96.32% is acquired by the framework for choosing the CS, and less time of 22567 ms is acquired by the framework for training.</jats:p>",2024,1,,,Interoperability; Computer science; Ontology; Cloud computing; Semantic interoperability; Information retrieval; Software engineering; World Wide Web; Operating system; Philosophy; Epistemology,,,,,,http://dx.doi.org/10.1155/2024/4974938,,10.1155/2024/4974938,,,0,001-841-796-850-468; 004-105-364-124-079; 007-717-040-642-204; 010-055-225-315-54X; 016-563-083-737-817; 020-768-084-392-295; 023-947-471-425-424; 025-041-506-236-482; 026-355-689-417-005; 028-612-307-604-436; 028-674-833-238-230; 029-706-262-637-747; 032-449-176-221-159; 035-723-424-281-352; 044-083-140-230-370; 045-102-267-835-729; 047-548-353-860-33X; 053-803-758-429-604; 057-970-200-168-939; 064-643-450-181-074; 067-994-058-914-951; 069-039-865-123-117; 086-542-550-861-144; 087-634-071-950-195; 091-074-541-272-723; 091-182-521-272-054; 091-894-564-528-254; 096-554-686-204-603; 097-159-121-613-510; 098-538-671-538-89X; 103-127-105-768-597; 106-393-124-675-979; 117-188-745-096-837; 133-859-530-912-264; 150-662-328-881-182; 153-365-937-137-162; 172-291-188-156-541; 187-517-769-706-576; 199-844-101-765-422,1,true,cc-by,hybrid
184-363-463-242-846,"Formalization of a Product-Process-Resource Model within Aircraft Component Maintenance, Repair, and Overhaul",2023-07-18,2023,conference proceedings article,2023 IEEE 21st International Conference on Industrial Informatics (INDIN),,IEEE,,Maximilian Rappl; Max Luca Bergmann; Alexander Fay,"Maintenance, Repair and Overhaul (MRO) of aircraft components is a complex and critical process with high product and process variability. To ensure the safety and reliability of aircraft, it is crucial to have accurate and up-to-date information about components throughout their life-cycle. However, this information is often scattered across various systems and stakeholders, resulting in data fragmentation and inconsistency. Data integration is needed to create a unified and comprehensive view of the components life-cycle. The Product-Process-Resource (PPR) modeling framework is a cross-industry framework that provides a comprehensive view of the various dimensions involved. The framework is applied to the MRO service provider domain. This paper explores the use of standards and norms to formalize an information model based on the PPR approach to improve data integration and ensure a high level of reuse. The proposed model integrates several community maintained standards such as VDI/VDE 3682, EASA Part 145, EASA Part M, DIN 13306, DIN EN 61512, and IATA's ONE Record to provide a standardized and consistent representation of component MRO data.",25,,1,7,Component (thermodynamics); Process (computing); Computer science; Product (mathematics); Resource (disambiguation); Reliability engineering; Aircraft maintenance; Maintenance engineering; Systems engineering; Process engineering; Engineering; Aeronautics; Operating system; Computer network; Physics; Geometry; Mathematics; Thermodynamics,,,,,,http://dx.doi.org/10.1109/indin51400.2023.10218093,,10.1109/indin51400.2023.10218093,,,0,008-946-691-821-498; 011-332-548-218-671; 019-884-034-578-270; 029-745-692-648-86X; 049-391-653-020-228; 091-843-539-247-565; 101-957-379-652-559; 103-127-105-768-597; 128-708-658-156-614,0,false,,
