Authors,Title,Publication,Volume,Number,Pages,Year,Publisher
"Scott, Michael James; Summerley, Rory; Besombes, Nicolas; Connolly, Cornelia; Gawrysiak, Joey; Halevi, Tzipora; Jenny, Seth E; Miljanovic, Michael; Stange, Melissa; Taipalus, Toni; ",Foundations for esports curricula in higher education,Proceedings of the 2021 Working Group Reports on Innovation and Technology in Computer Science Education,,,27-55,2021,
"Tanjung, Afriansyah; ",The Hidden Cost of Creativity: How Poster Design Competitions Facilitate Economic and Moral Rights Appropriation in Indonesia,Dialogia Iuridica,17,2,051-081,2025,
"Orta, Pedro; Ramirez-Mendoza, Ricardo A; Ahuett-Graza, Horacio; ",The PACE experience: Global collaborative engineering course and global projects,2018 IEEE Global Engineering Education Conference (EDUCON),,,1259-1264,2018,IEEE
"Prasasd, M Rajendra; Kumar, B Santosh Pawan; Swarnamani, A; ",OBE based industry academy approach for embedded system design course,Journal of Engineering Education Transformations,,,150-156,2017,
"Zhang, Baoyi; Ma, Min-Yuan; ",Motivational factors for participation in industrial design competition,,,,,2019,
