Cites,Authors,Title,Year,Source,Publisher,ArticleURL,CitesURL,GSRank,QueryDate,Type,DOI,ISSN,CitationURL,Volume,Issue,StartPage,EndPage,ECC,CitesPerYear,CitesPerAuthor,AuthorCount,Age,Abstract,FullTextURL,RelatedURL
176,"AI Aljumah, MT Nuseir, MM Alam","Traditional marketing analytics, big data analytics and big data system quality and the success of new product development",2021,"Business Process Management …","emerald.com","https://www.emerald.com/insight/content/doi/10.1108/bpmj-11-2020-0527/full/html","https://scholar.google.com/scholar?cites=17975300678423948088&as_sdt=2005&sciodt=0,5&hl=en",102,"2026-01-23 14:38:27","","10.1108/bpmj-11-2020-0527","","",,,,,176,35.20,59,3,5,"Purpose This study investigates the impact of traditional marketing analytics and big data analytics on the success of a new product. Moreover, it assesses the mediating effects of the …","https://hal.science/hal-03538161/document","https://scholar.google.com/scholar?q=related:OCtM1LoYdfkJ:scholar.google.com/&scioq=&hl=en&as_sdt=2005&sciodt=0,5"
176,"AKH Lui, MCM Lee, EWT Ngai","Impact of artificial intelligence investment on firm value",2022,"Annals of Operations Research","Springer","https://link.springer.com/article/10.1007/s10479-020-03862-8","https://scholar.google.com/scholar?cites=1934025116106495941&as_sdt=2005&sciodt=0,5&hl=en",130,"2026-01-23 14:38:27","","10.1007/s10479-020-03862-8","","",,,,,176,44.00,59,3,4,"As artificial intelligence (AI) has recently gained momentum and attention, the interest and investment in AI have also accelerated. However, the impact of AI on firm value is rarely …","","https://scholar.google.com/scholar?q=related:xRc2oJgJ1xoJ:scholar.google.com/&scioq=&hl=en&as_sdt=2005&sciodt=0,5"
176,"M Irfan, M Wang, N Akhtar","Impact of IT capabilities on supply chain capabilities and organizational agility: a dynamic capability view",2019,"Operations Management …","search.proquest.com","https://search.proquest.com/openview/5476e01c6f2f34ad0b5dd03f05315244/1?pq-origsite=gscholar&cbl=326267","https://scholar.google.com/scholar?cites=8124701606737977402&as_sdt=2005&sciodt=0,5&hl=en",160,"2026-01-23 14:38:27","","","","",,,,,176,25.14,59,3,7,"Drawing on the dynamic capability view, this study analyzes the effects of IT capabilities on supply chain capabilities and organizational agility. Based on survey data from 218 firms in …","","https://scholar.google.com/scholar?q=related:OqCplxC9wHAJ:scholar.google.com/&scioq=&hl=en&as_sdt=2005&sciodt=0,5"
177,"JK Nwankpa, Y Roumani, P Datta","Process innovation in the digital age of business: the role of digital business intensity and knowledge management",2022,"Journal of Knowledge …","emerald.com","https://www.emerald.com/insight/content/doi/10.1108/JKM-04-2021-0277/full/html","https://scholar.google.com/scholar?cites=18035696432397108047&as_sdt=2005&sciodt=0,5&hl=en",75,"2026-01-23 14:38:27","","10.1108/JKM-04-2021-0277","","",,,,,177,44.25,59,3,4,"Purpose This paper aims to examine the dynamic relationship between digital business intensity (DBI) and process innovation through knowledge management. More specifically …","https://ujcontent.uj.ac.za/esploro/fulltext/journalArticle/Process-innovation-in-the-digital-age/9915195907691?repId=126672510007691&mId=136672500007691&institution=27UOJ_INST","https://scholar.google.com/scholar?q=related:T0PPGVmqS_oJ:scholar.google.com/&scioq=&hl=en&as_sdt=2005&sciodt=0,5"
180,"Z Wang, N Wang, X Su, S Ge","An empirical study on business analytics affordances enhancing the management of cloud computing data security",2020,"International Journal of Information …","Elsevier","https://www.sciencedirect.com/science/article/pii/S0268401218302603","https://scholar.google.com/scholar?cites=14542424759023697924&as_sdt=2005&sciodt=0,5&hl=en",154,"2026-01-23 14:38:27","","","","",,,,,180,30.00,45,4,6,"The mechanism of business analytics affordances enhancing the management of cloud computing data security is a key antecedent in improving cloud computing security. Based …","","https://scholar.google.com/scholar?q=related:BAB07kQS0ckJ:scholar.google.com/&scioq=&hl=en&as_sdt=2005&sciodt=0,5"
183,"MS Rahman, S Bag, S Gupta, U Sivarajah","Technology readiness of B2B firms and AI-based customer relationship management capability for enhancing social sustainability performance",2023,"Journal of business research","Elsevier","https://www.sciencedirect.com/science/article/pii/S0148296322009900","https://scholar.google.com/scholar?cites=7504437039864480733&as_sdt=2005&sciodt=0,5&hl=en",27,"2026-01-23 14:38:27","HTML","","","",,,,,183,61.00,46,4,3,"This study contributes to the extant literature by empirically investigating the influence of Business-to-Business (B2B) firms' technology readiness on information technology …","https://www.sciencedirect.com/science/article/pii/S0148296322009900","https://scholar.google.com/scholar?q=related:3QNoQLodJWgJ:scholar.google.com/&scioq=&hl=en&as_sdt=2005&sciodt=0,5"
184,"T Wang, X Lin, F Sheng","Digital leadership and exploratory innovation: From the dual perspectives of strategic orientation and organizational culture",2022,"Frontiers in Psychology","frontiersin.org","https://www.frontiersin.org/articles/10.3389/fpsyg.2022.902693/full","https://scholar.google.com/scholar?cites=6666609675815524447&as_sdt=2005&sciodt=0,5&hl=en",45,"2026-01-23 14:38:27","HTML","10.3389/fpsyg.2022.902693","","",,,,,184,46.00,61,3,4,"The literature on leadership is increasingly supporting the power of digital leadership in promoting corporate innovation. In spite of this, digital leadership is a noticeable omission …","https://www.frontiersin.org/articles/10.3389/fpsyg.2022.902693/full","https://scholar.google.com/scholar?q=related:X5gqzy2OhFwJ:scholar.google.com/&scioq=&hl=en&as_sdt=2005&sciodt=0,5"
184,"D Nam, J Lee, H Lee","Business analytics adoption process: An innovation diffusion perspective",2019,"International Journal of Information Management","Elsevier","https://www.sciencedirect.com/science/article/pii/S0268401218311435","https://scholar.google.com/scholar?cites=8617982694306720784&as_sdt=2005&sciodt=0,5&hl=en",140,"2026-01-23 14:38:27","","","","",,,,,184,26.29,61,3,7,"Although business analytics (BA) have been increasingly adopted into businesses, there is limited empirical research examining the drivers of each stage of BA adoption in …","","https://scholar.google.com/scholar?q=related:EKydtpk5mXcJ:scholar.google.com/&scioq=&hl=en&as_sdt=2005&sciodt=0,5"
186,"J Zhou, G Bi, H Liu, Y Fang, Z Hua","Understanding employee competence, operational IS alignment, and organizational agility–An ambidexterity perspective",2018,"Information &Management","Elsevier","https://www.sciencedirect.com/science/article/pii/S0378720618301162","https://scholar.google.com/scholar?cites=4245041044521946319&as_sdt=2005&sciodt=0,5&hl=en",198,"2026-01-23 14:38:27","","","","",,,,,186,23.25,37,5,8,"Views on whether business-information systems (IS) alignment enhances or impedes organizational agility vary. The present study addresses this paradox by examining business …","","https://scholar.google.com/scholar?q=related:zwyvu1Zq6ToJ:scholar.google.com/&scioq=&hl=en&as_sdt=2005&sciodt=0,5"
188,"L Li, Y Tong, L Wei, S Yang","Digital technology-enabled dynamic capabilities and their impacts on firm performance: Evidence from the COVID-19 pandemic",2022,"Information &Management","Elsevier","https://www.sciencedirect.com/science/article/pii/S0378720622000982","https://scholar.google.com/scholar?cites=5855519300040825497&as_sdt=2005&sciodt=0,5&hl=en",26,"2026-01-23 14:38:27","","","","",,,,,188,47.00,47,4,4,"To understand whether companies can lock in the benefits of digital technology (DT) usage during the COVID-19 pandemic, we draw on a dynamic capability view to examine how …","","https://scholar.google.com/scholar?q=related:mZpgjsf7QlEJ:scholar.google.com/&scioq=&hl=en&as_sdt=2005&sciodt=0,5"
191,"Z Cai, H Liu, Q Huang, L Liang","Developing organizational agility in product innovation: the roles of IT capability, KM capability, and innovative climate",2019,"R&D Management","Wiley Online Library","https://onlinelibrary.wiley.com/doi/abs/10.1111/radm.12305","https://scholar.google.com/scholar?cites=15700392982298412141&as_sdt=2005&sciodt=0,5&hl=en",199,"2026-01-23 14:38:27","","10.1111/radm.12305","","",,,,,191,27.29,48,4,7,"This study investigates how to leverage information technology (IT) capability to build organizational agility in the context of product innovation. A moderated mediating model is …","https://www.researchgate.net/profile/Zhao-Cai-3/publication/322038354_Developing_organizational_agility_in_product_innovation_the_roles_of_IT_capability_KM_capability_and_innovative_climate/links/5b44b632458515b4f65fd2df/Developing-organizational-agility-in-product-innovation-the-roles-of-IT-capability-KM-capability-and-innovative-climate.pdf","https://scholar.google.com/scholar?q=related:bcTurzsA49kJ:scholar.google.com/&scioq=&hl=en&as_sdt=2005&sciodt=0,5"
193,"J Cepeda, J Arias-Pérez","Information technology capabilities and organizational agility: The mediating effects of open innovation capabilities",2019,"Multinational Business Review","emerald.com","https://www.emerald.com/insight/content/doi/10.1108/mbr-11-2017-0088/full/html","https://scholar.google.com/scholar?cites=7491145101084180644&as_sdt=2005&sciodt=0,5&hl=en",176,"2026-01-23 14:38:27","","10.1108/mbr-11-2017-0088","","",,,,,193,27.57,97,2,7,"Purpose Currently, it is commonly accepted that information technology capabilities (ITC) positively influence organizational agility. Nevertheless, studies have recently started to …","https://www.emerald.com/mbr/article/27/2/198/287583","https://scholar.google.com/scholar?q=related:pMAHl8fk9WcJ:scholar.google.com/&scioq=&hl=en&as_sdt=2005&sciodt=0,5"
194,"M Ghobakhloo, A Azar","Business excellence via advanced manufacturing technology and lean-agile manufacturing",2018,"Journal of Manufacturing Technology …","emerald.com","https://www.emerald.com/jmtm/article/29/1/2/239829","https://scholar.google.com/scholar?cites=6600156015729339572&as_sdt=2005&sciodt=0,5&hl=en",194,"2026-01-23 14:38:27","HTML","","","",,,,,194,24.25,97,2,8,"Purpose The purpose of this paper is to contribute to the existing knowledge about the relationships between advanced manufacturing technology (AMT), lean manufacturing (LM) …","https://www.emerald.com/jmtm/article/29/1/2/239829","https://scholar.google.com/scholar?q=related:tGy0W-12mFsJ:scholar.google.com/&scioq=&hl=en&as_sdt=2005&sciodt=0,5"
195,"HDX Trieu, P Van Nguyen, TTM Nguyen…","Information technology capabilities and organizational ambidexterity facilitating organizational resilience and firm performance of SMEs",2023,"Asia Pacific …","Elsevier","https://www.sciencedirect.com/science/article/pii/S1029313223000258","https://scholar.google.com/scholar?cites=18390286012308157827&as_sdt=2005&sciodt=0,5&hl=en",22,"2026-01-23 14:38:27","HTML","","","",,,,,195,65.00,49,4,3,"Small and medium-sized enterprises (SMEs) face significant challenges in today's rapidly changing business landscape. Due to limited resources and managerial capabilities, some …","https://www.sciencedirect.com/science/article/pii/S1029313223000258","https://scholar.google.com/scholar?q=related:g3V2ObFrN_8J:scholar.google.com/&scioq=&hl=en&as_sdt=2005&sciodt=0,5"
200,"E Loukis, M Janssen, I Mintchev","Determinants of software-as-a-service benefits and impact on firm performance",2019,"Decision Support Systems","Elsevier","https://www.sciencedirect.com/science/article/pii/S016792361830201X","https://scholar.google.com/scholar?cites=6539793027996322123&as_sdt=2005&sciodt=0,5&hl=en",165,"2026-01-23 14:38:27","HTML","","","",,,,,200,28.57,67,3,7,"Abstract Software as a Service (SaaS) is increasingly used by firms for sourcing business application software. SaaS can enable a cost reduction and quality improvement of existing …","https://www.sciencedirect.com/science/article/pii/S016792361830201X","https://scholar.google.com/scholar?q=related:SwlMEhwDwloJ:scholar.google.com/&scioq=&hl=en&as_sdt=2005&sciodt=0,5"
204,"J Lin, L Li, XR Luo, J Benitez","How do agribusinesses thrive through complexity? The pivotal role of e-commerce capability and business agility",2020,"Decision Support Systems","Elsevier","https://www.sciencedirect.com/science/article/pii/S016792362030097X","https://scholar.google.com/scholar?cites=9623561682835689857&as_sdt=2005&sciodt=0,5&hl=en",120,"2026-01-23 14:38:27","","","","",,,,,204,34.00,51,4,6,"The recent COVID-19 pandemic has clearly shown how agricultural foods and e-commerce initiatives are critical for many organizations, regions, and countries worldwide. Despite this …","https://pmc.ncbi.nlm.nih.gov/articles/PMC7287437/pdf/main.pdf","https://scholar.google.com/scholar?q=related:gVF721zCjYUJ:scholar.google.com/&scioq=&hl=en&as_sdt=2005&sciodt=0,5"
204,"J Arias-Pérez, J Velez-Ocampo…","Strategic orientation toward digitalization to improve innovation capability: why knowledge acquisition and exploitation through external embeddedness matter",2021,"Journal of Knowledge …","emerald.com","https://www.emerald.com/insight/content/doi/10.1108/JKM-03-2020-0231/full/html","https://scholar.google.com/scholar?cites=1237491165132915771&as_sdt=2005&sciodt=0,5&hl=en",123,"2026-01-23 14:38:27","","10.1108/JKM-03-2020-0231","","",,,,,204,40.80,68,3,5,"Purpose This study aims to analyze the mediating effect of the open innovation processes of knowledge acquisition and exploitation as external embeddedness strategy on the …","https://www.emerald.com/jkm/article-pdf/25/5/1319/1744730/jkm-03-2020-0231.pdf","https://scholar.google.com/scholar?q=related:O4RufqhzLBEJ:scholar.google.com/&scioq=&hl=en&as_sdt=2005&sciodt=0,5"
206,"T Mauerhoefer, S Strese…","The impact of information technology on new product development performance",2017,"Journal of Product …","Wiley Online Library","https://onlinelibrary.wiley.com/doi/abs/10.1111/jpim.12408","https://scholar.google.com/scholar?cites=8281313912599172325&as_sdt=2005&sciodt=0,5&hl=en",195,"2026-01-23 14:38:27","","10.1111/jpim.12408","","",,,,,206,22.89,69,3,9,"Many managers expect a substantial impact of digitization on new product development (NPD) as it is an information‐intensive business process. Therefore, a better understanding …","","https://scholar.google.com/scholar?q=related:5VT5kSAj7XIJ:scholar.google.com/&scioq=&hl=en&as_sdt=2005&sciodt=0,5"
207,"J Benitez, J Llorens, J Braojos","How information technology influences opportunity exploration and exploitation firm's capabilities",2018,"Information &management","Elsevier","https://www.sciencedirect.com/science/article/pii/S037872061730438X","https://scholar.google.com/scholar?cites=1476219477632931724&as_sdt=2005&sciodt=0,5&hl=en",180,"2026-01-23 14:38:27","","","","",,,,,207,25.88,69,3,8,"Understanding how and why some firms have proficiency in exploring and exploiting opportunities is a cutting-edge research problem. Our central thesis is that information …","","https://scholar.google.com/scholar?q=related:jNfSJsuVfBQJ:scholar.google.com/&scioq=&hl=en&as_sdt=2005&sciodt=0,5"
208,"Y Sullivan, SF Wamba","Artificial intelligence and adaptive response to market changes: A strategy to enhance firm performance and innovation",2024,"Journal of Business Research","Elsevier","https://www.sciencedirect.com/science/article/pii/S0148296324000043","https://scholar.google.com/scholar?cites=10576582414320268303&as_sdt=2005&sciodt=0,5&hl=en",5,"2026-01-23 14:38:27","","","","",,,,,208,104.00,104,2,2,"This research examines how AI-powered capabilities can bring value to organizations by enhancing their Adaptive Response to Market Changes (ARMC). Utilizing insights from …","","https://scholar.google.com/scholar?q=related:D_QzL6uRx5IJ:scholar.google.com/&scioq=&hl=en&as_sdt=2005&sciodt=0,5"
218,"S Menon, M Suresh","Factors influencing organizational agility in higher education",2021,"Benchmarking: An International Journal","emerald.com","https://www.emerald.com/insight/content/doi/10.1108/BIJ-04-2020-0151/full/html","https://scholar.google.com/scholar?cites=8315456662174670497&as_sdt=2005&sciodt=0,5&hl=en",98,"2026-01-23 14:38:27","","10.1108/BIJ-04-2020-0151","","",,,,,218,43.60,109,2,5,"Purpose The purpose of this paper is to explore the factors that can facilitate agility in higher education and to analyze the interrelationship between the factors. Design/methodology …","https://www.emerald.com/bij/article/28/1/307/513435","https://scholar.google.com/scholar?q=related:oZ4T7sZvZnMJ:scholar.google.com/&scioq=&hl=en&as_sdt=2005&sciodt=0,5"
218,"A Kathuria, A Mann, J Khuntia…","A strategic value appropriation path for cloud computing",2018,"Journal of …","Taylor &Francis","https://www.tandfonline.com/doi/abs/10.1080/07421222.2018.1481635","https://scholar.google.com/scholar?cites=4714526373414137085&as_sdt=2005&sciodt=0,5&hl=en",168,"2026-01-23 14:38:27","","10.1080/07421222.2018.1481635","","",,,,,218,27.25,55,4,8,"Cloud-based information management is one of the leading competitive differentiation strategies for firms. With the increasing criticality of information management in value …","https://ink.library.smu.edu.sg/cgi/viewcontent.cgi?article=5316&context=sis_research","https://scholar.google.com/scholar?q=related:_WyPC8JcbUEJ:scholar.google.com/&scioq=&hl=en&as_sdt=2005&sciodt=0,5"
227,"CMJ Lee, N Che-Ha, SFS Alwi","Service customer orientation and social sustainability: The case of small medium enterprises",2021,"Journal of Business Research","Elsevier","https://www.sciencedirect.com/science/article/pii/S0148296319308148","https://scholar.google.com/scholar?cites=8271931199493427738&as_sdt=2005&sciodt=0,5&hl=en",127,"2026-01-23 14:38:27","","","","",,,,,227,45.40,76,3,5,"Social sustainability is an intricate subject with interrelated but distinct components. This paper measures social sustainability as an employee outcome, customer outcome and …","","https://scholar.google.com/scholar?q=related:GtJGcJnNy3IJ:scholar.google.com/&scioq=&hl=en&as_sdt=2005&sciodt=0,5"
227,"CM Felipe, DE Leidner, JL Roldán…","Impact of IS capabilities on firm performance: The roles of organizational agility and industry technology intensity",2020,"Decision …","Wiley Online Library","https://onlinelibrary.wiley.com/doi/abs/10.1111/deci.12379","https://scholar.google.com/scholar?cites=6286383599016504906&as_sdt=2005&sciodt=0,5&hl=en",129,"2026-01-23 14:38:27","","10.1111/deci.12379","","",,,,,227,37.83,57,4,6,"Drawing on the information technology (IT)‐enabled capabilities perspective, this study develops a model that extends our knowledge of the mechanisms through which IT …","","https://scholar.google.com/scholar?q=related:Sm44nZO4PVcJ:scholar.google.com/&scioq=&hl=en&as_sdt=2005&sciodt=0,5"
228,"A Khayer, N Jahan, MN Hossain…","The adoption of cloud computing in small and medium enterprises: a developing country perspective",2021,"VINE Journal of …","emerald.com","https://www.emerald.com/insight/content/doi/10.1108/VJIKMS-05-2019-0064/full/html","https://scholar.google.com/scholar?cites=14272380287787577414&as_sdt=2005&sciodt=0,5&hl=en",113,"2026-01-23 14:38:27","","10.1108/VJIKMS-05-2019-0064","","",,,,,228,45.60,57,4,5,"Purpose The purpose of this paper is to examine the determinants of cloud computing adoption in small and medium enterprises (SMEs), further, to measure the effect of cloud …","https://www.emerald.com/vjikms/article/51/1/64/457332","https://scholar.google.com/scholar?q=related:RrDd4ECuEcYJ:scholar.google.com/&scioq=&hl=en&as_sdt=2005&sciodt=0,5"
230,"R Rialti, G Marzi, M Silic, C Ciappei","Ambidextrous organization and agility in big data era: The role of business process management systems",2018,"Business process management …","emerald.com","https://www.emerald.com/insight/content/doi/10.1108/BPMJ-07-2017-0210/full/html","https://scholar.google.com/scholar?cites=13248164060309176007&as_sdt=2005&sciodt=0,5&hl=en",164,"2026-01-23 14:38:27","","10.1108/BPMJ-07-2017-0210","","",,,,,230,28.75,58,4,8,"Purpose The purpose of this paper is to explore the effect of big data analytics-capable business process management systems (BDA-capable BPMS) on ambidextrous …","https://arts.units.it/bitstream/11368/2997180/4/2997180_Marzi%20Ambidextrous%20organization-Post_print.pdf","https://scholar.google.com/scholar?q=related:xz7TZAXv2rcJ:scholar.google.com/&scioq=&hl=en&as_sdt=2005&sciodt=0,5"
233,"DM Gligor, MC Holcomb, J Feizabadi","An exploration of the strategic antecedents of firm supply chain agility: The role of a firm's orientations",2016,"International Journal of Production …","Elsevier","https://www.sciencedirect.com/science/article/pii/S0925527316300780","https://scholar.google.com/scholar?cites=10509254533304606074&as_sdt=2005&sciodt=0,5&hl=en",197,"2026-01-23 14:38:27","","","","",,,,,233,23.30,78,3,10,"Agility has been identified as one of the most salient issues of contemporary supply chain management (Lee, 2004). Despite its importance, there has been limited theory …","","https://scholar.google.com/scholar?q=related:et3IT1Ff2JEJ:scholar.google.com/&scioq=&hl=en&as_sdt=2005&sciodt=0,5"
234,"F Ciampi, M Faraoni, J Ballerini, F Meli","The co-evolutionary relationship between digitalization and organizational agility: Ongoing debates, theoretical developments and future research perspectives",2022,"Technological Forecasting and …","Elsevier","https://www.sciencedirect.com/science/article/pii/S0040162521008143","https://scholar.google.com/scholar?cites=9501108832122752118&as_sdt=2005&sciodt=0,5&hl=en",51,"2026-01-23 14:38:27","","","","",,,,,234,58.50,59,4,4,"This study is the first to provide a systematic review of the literature focused on the relationship between digitalization and organizational agility (OA). It applies the …","https://arxiv.org/pdf/2112.11822","https://scholar.google.com/scholar?q=related:dswAzyS42oMJ:scholar.google.com/&scioq=&hl=en&as_sdt=2005&sciodt=0,5"
234,"UK Bamel, N Bamel","Organizational resources, KM process capability and strategic flexibility: a dynamic resource-capability perspective",2018,"Journal of Knowledge Management","emerald.com","https://www.emerald.com/insight/content/doi/10.1108/jkm-10-2017-0460/full/html","https://scholar.google.com/scholar?cites=6350314088538018501&as_sdt=2005&sciodt=0,5&hl=en",157,"2026-01-23 14:38:27","","10.1108/jkm-10-2017-0460","","",,,,,234,29.25,117,2,8,"Purpose Strategic flexibility is largely considered a source of competitive advantage, yet strategic flexibility in relation to organizational resources and knowledge management (KM) …","https://www.researchgate.net/profile/Umesh-Bamel-2/publication/325159389_Organizational_resources_KM_process_capability_and_strategic_flexibility_a_dynamic_resource-capability_perspective/links/5b878c294585151fd13bb512/Organizational-resources-KM-process-capability-and-strategic-flexibility-a-dynamic-resource-capability-perspective.pdf","https://scholar.google.com/scholar?q=related:xZJ3owTZIFgJ:scholar.google.com/&scioq=&hl=en&as_sdt=2005&sciodt=0,5"
235,"S Zhou, Z Qiao, Q Du, GA Wang, W Fan…","Measuring customer agility from online reviews using big data text analytics",2018,"Journal of Management …","Taylor &Francis","https://www.tandfonline.com/doi/abs/10.1080/07421222.2018.1451956","https://scholar.google.com/scholar?cites=10733273051043755283&as_sdt=2005&sciodt=0,5&hl=en",144,"2026-01-23 14:38:27","","10.1080/07421222.2018.1451956","","",,,,,235,29.38,39,6,8,"Large volumes of product reviews generated by online users have important strategic value for product development. Prior studies often focus on the influence of reviews on customers …","https://www.academia.edu/download/116379514/07421222.2018.145195620240626-1-qrpwoa.pdf","https://scholar.google.com/scholar?q=related:E3W8_Pg-9JQJ:scholar.google.com/&scioq=&hl=en&as_sdt=2005&sciodt=0,5"
241,"E García-Sánchez, VJ García-Morales, R Martín-Rojas","Influence of technological assets on organizational performance through absorptive capacity, organizational innovation and internal labour flexibility",2018,"Sustainability","mdpi.com","https://www.mdpi.com/2071-1050/10/3/770","https://scholar.google.com/scholar?cites=3080791588499322692&as_sdt=2005&sciodt=0,5&hl=en",158,"2026-01-23 14:38:27","HTML","","","",,,,,241,30.13,80,3,8,"Organizational innovation is increasingly mandatory for firms to overcome their competitors. Organizational innovation is especially relevant in today's dynamic and turbulent …","https://www.mdpi.com/2071-1050/10/3/770","https://scholar.google.com/scholar?q=related:RHeDg6ArwSoJ:scholar.google.com/&scioq=&hl=en&as_sdt=2005&sciodt=0,5"
244,"V Grover, SL Tseng, W Pu","A theoretical perspective on organizational culture and digitalization",2022,"Information &Management","Elsevier","https://www.sciencedirect.com/science/article/pii/S0378720622000519","https://scholar.google.com/scholar?cites=3034329535223351354&as_sdt=2005&sciodt=0,5&hl=en",32,"2026-01-23 14:38:27","","","","",,,,,244,61.00,81,3,4,"Digitalization has fundamentally changed organizational structures and processes and affects how people interact with each other, thereby impacting organizational culture. Given …","https://wordpressua.uark.edu/vgrover/files/2024/11/1-s2.0-S0378720622000519-main.pdf","https://scholar.google.com/scholar?q=related:Osh2vqIaHCoJ:scholar.google.com/&scioq=&hl=en&as_sdt=2005&sciodt=0,5"
