Cites,Authors,Title,Year,Source,Publisher,ArticleURL,CitesURL,GSRank,QueryDate,Type,DOI,ISSN,CitationURL,Volume,Issue,StartPage,EndPage,ECC,CitesPerYear,CitesPerAuthor,AuthorCount,Age,Abstract,FullTextURL,RelatedURL
254,"P Akhtar, Z Khan, S Tarba, U Jayawickrama","The Internet of Things, dynamic data and information processing capabilities, and operational agility",2018,"… Forecasting and Social …","Elsevier","https://www.sciencedirect.com/science/article/pii/S0040162517305504","https://scholar.google.com/scholar?cites=8401368042746578965&as_sdt=2005&sciodt=0,5&hl=en",162,"2026-01-23 14:38:27","","","","",,,,,254,31.75,64,4,8,"Whilst there are promising links between the Internet of Things (IoTs), dynamic data and information processing capabilities (DDIPCs), and operational agility, scholars have not …","https://kar.kent.ac.uk/61568/1/Akhtar%20et%20al%20%202017_BJM_Repository.pdf","https://scholar.google.com/scholar?q=related:FYg697inl3QJ:scholar.google.com/&scioq=&hl=en&as_sdt=2005&sciodt=0,5"
256,"Y Chen, Y Wang, S Nevo, J Benitez…","Improving strategic flexibility with information technologies: insights for firm performance in an emerging economy",2017,"Journal of Information …","journals.sagepub.com","https://journals.sagepub.com/doi/abs/10.1057/jit.2015.26","https://scholar.google.com/scholar?cites=8457025032896613113&as_sdt=2005&sciodt=0,5&hl=en",183,"2026-01-23 14:38:27","","10.1057/jit.2015.26","","",,,,,256,28.44,51,5,9,"As the business environment becomes more turbulent, firms ponder how to become more flexible in reallocating or reconfiguring resources, processes, and strategies to respond …","","https://scholar.google.com/scholar?q=related:-YpjznVjXXUJ:scholar.google.com/&scioq=&hl=en&as_sdt=2005&sciodt=0,5"
261,"X Zhang, YY Xu, L Ma","Information technology investment and digital transformation: the roles of digital transformation strategy and top management",2023,"Business Process Management Journal","emerald.com","https://www.emerald.com/insight/content/doi/10.1108/BPMJ-06-2022-0254/full/html","https://scholar.google.com/scholar?cites=11661415932854758303&as_sdt=2005&sciodt=0,5&hl=en",9,"2026-01-23 14:38:27","","10.1108/BPMJ-06-2022-0254","","",,,,,261,87.00,87,3,3,"Purpose In the context of the digital economy, information technology (IT) investment has become a necessary way for enterprises to transform digitally. However, why and how IT …","https://www.emerald.com/bpmj/article/29/2/528/258253","https://scholar.google.com/scholar?q=related:n2vjjwGs1aEJ:scholar.google.com/&scioq=&hl=en&as_sdt=2005&sciodt=0,5"
261,"L Aldianto, G Anggadwita, A Permatasari, IR Mirzanti…","Toward a business resilience framework for startups",2021,"Sustainability","mdpi.com","https://www.mdpi.com/2071-1050/13/6/3132","https://scholar.google.com/scholar?cites=572497765903893356&as_sdt=2005&sciodt=0,5&hl=en",63,"2026-01-23 14:38:27","HTML","","","",,,,,261,52.20,52,5,5,"Covid-19 has had a significant impact on the disruption of the global economic sector, including for startup businesses. This encourages entrepreneurs to carry out a continuous …","https://www.mdpi.com/2071-1050/13/6/3132","https://scholar.google.com/scholar?q=related:bANoU6_r8QcJ:scholar.google.com/&scioq=&hl=en&as_sdt=2005&sciodt=0,5"
263,"SH Bhatti, G Santoro, J Khan, F Rizzato","Antecedents and consequences of business model innovation in the IT industry",2021,"Journal of Business Research","Elsevier","https://www.sciencedirect.com/science/article/pii/S0148296320306561","https://scholar.google.com/scholar?cites=4025096389110550660&as_sdt=2005&sciodt=0,5&hl=en",74,"2026-01-23 14:38:27","","","","",,,,,263,52.60,66,4,5,"Business model innovation has gained increasing attention from scholars in the last few years. However, there is a lack of large-scale empirical research on business model …","","https://scholar.google.com/scholar?q=related:hFCkC9cD3DcJ:scholar.google.com/&scioq=&hl=en&as_sdt=2005&sciodt=0,5"
267,"P Mikalef, A Pateli…","IT architecture flexibility and IT governance decentralisation as drivers of IT-enabled dynamic capabilities and competitive performance: The moderating effect of the …",2021,"European Journal of …","Taylor &Francis","https://www.tandfonline.com/doi/abs/10.1080/0960085X.2020.1808541","https://scholar.google.com/scholar?cites=2366714398026543674&as_sdt=2005&sciodt=0,5&hl=en",72,"2026-01-23 14:38:27","","10.1080/0960085X.2020.1808541","","",,,,,267,53.40,89,3,5,"ABSTRACT A question of central importance for researchers and practitioners is how information technology (IT) can help firms survive and thrive in turbulent and constantly …","https://www.tandfonline.com/doi/pdf/10.1080/0960085X.2020.1808541","https://scholar.google.com/scholar?q=related:OrIsozRC2CAJ:scholar.google.com/&scioq=&hl=en&as_sdt=2005&sciodt=0,5"
267,"S Liu, FTS Chan, J Yang, B Niu","Understanding the effect of cloud computing on organizational agility: An empirical examination",2018,"International Journal of Information …","Elsevier","https://www.sciencedirect.com/science/article/pii/S0268401217307090","https://scholar.google.com/scholar?cites=9391038655846747033&as_sdt=2005&sciodt=0,5&hl=en",121,"2026-01-23 14:38:27","","","","",,,,,267,33.38,67,4,8,"The emergence of cloud computing has significantly changed the model used for existing information technology and enhanced agility of a firm through its pay per use mode …","","https://scholar.google.com/scholar?q=related:mQu10earU4IJ:scholar.google.com/&scioq=&hl=en&as_sdt=2005&sciodt=0,5"
268,"S Singh, M Sharma, S Dhir","Modeling the effects of digital transformation in Indian manufacturing industry",2021,"Technology in Society","Elsevier","https://www.sciencedirect.com/science/article/pii/S0160791X21002384","https://scholar.google.com/scholar?cites=7219303653593889189&as_sdt=2005&sciodt=0,5&hl=en",33,"2026-01-23 14:38:27","","","","",,,,,268,53.60,89,3,5,"Digital transformation has become the new norm and is perceived as an important component to transform the firms' businesses. It has revolutionized the way in which firms …","","https://scholar.google.com/scholar?q=related:pbkkZmweMGQJ:scholar.google.com/&scioq=&hl=en&as_sdt=2005&sciodt=0,5"
277,"JK Nwankpa, P Datta","Balancing exploration and exploitation of IT resources: The influence of Digital Business Intensity on perceived organizational performance",2017,"European Journal of Information Systems","Taylor &Francis","https://www.tandfonline.com/doi/abs/10.1057/s41303-017-0049-y","https://scholar.google.com/scholar?cites=12272324808703679064&as_sdt=2005&sciodt=0,5&hl=en",139,"2026-01-23 14:38:27","","10.1057/s41303-017-0049-y","","",,,,,277,30.78,139,2,9,"Facing a barrage of novel information technology (IT), organizations must invest on the basis of the impact of IT capabilities on the organization's performance. This research extends …","https://www.tandfonline.com/doi/pdf/10.1057/s41303-017-0049-y","https://scholar.google.com/scholar?q=related:WBr_VmQOUKoJ:scholar.google.com/&scioq=&hl=en&as_sdt=2005&sciodt=0,5"
282,"X Wang, X Lin, B Shao","How does artificial intelligence create business agility? Evidence from chatbots",2022,"International journal of information management","Elsevier","https://www.sciencedirect.com/science/article/pii/S026840122200069X","https://scholar.google.com/scholar?cites=4333532036361526785&as_sdt=2005&sciodt=0,5&hl=en",18,"2026-01-23 14:38:27","HTML","","","",,,,,282,70.50,94,3,4,"Artificial intelligence (AI) is gaining increasing attention from business leaders today. As a primary AI tool, chatbots have seen increasing use by companies to support customer …","https://www.sciencedirect.com/science/article/pii/S026840122200069X","https://scholar.google.com/scholar?q=related:AZ4aUm3MIzwJ:scholar.google.com/&scioq=&hl=en&as_sdt=2005&sciodt=0,5"
286,"X Zhang, Y Xu, L Ma","Research on successful factors and influencing mechanism of the digital transformation in SMEs",2022,"Sustainability","mdpi.com","https://www.mdpi.com/2071-1050/14/5/2549","https://scholar.google.com/scholar?cites=5760754614084109895&as_sdt=2005&sciodt=0,5&hl=en",34,"2026-01-23 14:38:27","HTML","","","",,,,,286,71.50,95,3,4,"In the era of the digital economy, digital transformation (DT) has become a new approach for firms to gain competitive advantages in a context of intense and dynamic market …","https://www.mdpi.com/2071-1050/14/5/2549","https://scholar.google.com/scholar?q=related:RwatusxP8k8J:scholar.google.com/&scioq=&hl=en&as_sdt=2005&sciodt=0,5"
286,"C Cheng, H Zhong, L Cao","Facilitating speed of internationalization: The roles of business intelligence and organizational agility",2020,"Journal of Business Research","Elsevier","https://www.sciencedirect.com/science/article/pii/S0148296320300035","https://scholar.google.com/scholar?cites=3650953696669269543&as_sdt=2005&sciodt=0,5&hl=en",82,"2026-01-23 14:38:27","","","","",,,,,286,47.67,95,3,6,"With the aim of bridging the gap between the firm's internationalization speed research and the emerging study of business intelligence (BI), this study draws on knowledge …","","https://scholar.google.com/scholar?q=related:J_5eJQvLqjIJ:scholar.google.com/&scioq=&hl=en&as_sdt=2005&sciodt=0,5"
287,"S Sun, DJ Hall, CG Cegielski","Organizational intention to adopt big data in the B2B context: An integrated view",2020,"Industrial Marketing Management","Elsevier","https://www.sciencedirect.com/science/article/pii/S0019850118304644","https://scholar.google.com/scholar?cites=1653881478564525856&as_sdt=2005&sciodt=0,5&hl=en",90,"2026-01-23 14:38:27","","","","",,,,,287,47.83,96,3,6,"Grounded in the diffusion of innovation theory (DOI), institutional theory, configuration theory, and technology-organization-environment (TOE) framework, the study proposes a …","","https://scholar.google.com/scholar?q=related:ILdvLnHE8xYJ:scholar.google.com/&scioq=&hl=en&as_sdt=2005&sciodt=0,5"
289,"P Mikalef, N Islam, V Parida, H Singh…","Artificial intelligence (AI) competencies for organizational performance: A B2B marketing capabilities perspective",2023,"Journal of Business …","Elsevier","https://www.sciencedirect.com/science/article/pii/S0148296323003569","https://scholar.google.com/scholar?cites=8873508282660509448&as_sdt=2005&sciodt=0,5&hl=en",7,"2026-01-23 14:38:27","HTML","","","",,,,,289,96.33,58,5,3,"Abstract The deployment of Artificial Intelligence (AI) has been accelerating in several fields over the past few years, with much focus placed on its potential in Business-to-Business …","https://www.sciencedirect.com/science/article/pii/S0148296323003569","https://scholar.google.com/scholar?q=related:CFd368QIJXsJ:scholar.google.com/&scioq=&hl=en&as_sdt=2005&sciodt=0,5"
290,"SF Wamba","Impact of artificial intelligence assimilation on firm performance: The mediating effects of organizational agility and customer agility",2022,"International Journal of Information Management","Elsevier","https://www.sciencedirect.com/science/article/pii/S0268401222000780","https://scholar.google.com/scholar?cites=4458169888282917946&as_sdt=2005&sciodt=0,5&hl=en",15,"2026-01-23 14:38:27","","","","",,,,,290,72.50,290,1,4,"In the emerging literature on artificial intelligence (AI) and other disruptive technologies, the importance of technological assimilation has been recognized for high operational and …","","https://scholar.google.com/scholar?q=related:Ojxym-SZ3j0J:scholar.google.com/&scioq=&hl=en&as_sdt=2005&sciodt=0,5"
293,"H Liang, N Wang, Y Xue, S Ge","Unraveling the alignment paradox: how does business—IT alignment shape organizational agility?",2017,"Information Systems …","pubsonline.informs.org","https://pubsonline.informs.org/doi/abs/10.1287/isre.2017.0711","https://scholar.google.com/scholar?cites=7527357722100708192&as_sdt=2005&sciodt=0,5&hl=en",122,"2026-01-23 14:38:27","","10.1287/isre.2017.0711","","",,,,,293,32.56,73,4,9,"Contradictory views exist regarding whether business–information technology (IT) alignment enhances or reduces organizational agility, and no consensus has been achieved. To …","","https://scholar.google.com/scholar?q=related:YDMbc_eLdmgJ:scholar.google.com/&scioq=&hl=en&as_sdt=2005&sciodt=0,5"
320,"A Ahmed, SH Bhatti, I Gölgeci, A Arslan","Digital platform capability and organizational agility of emerging market manufacturing SMEs: The mediating role of intellectual capital and the moderating role of …",2022,"Technological Forecasting and …","Elsevier","https://www.sciencedirect.com/science/article/pii/S0040162522000452","https://scholar.google.com/scholar?cites=15741972564950026597&as_sdt=2005&sciodt=0,5&hl=en",23,"2026-01-23 14:38:27","","","","",,,,,320,80.00,80,4,4,"In this study, we untangle the relationship between digital platform capability and organizational agility in the manufacturing sector small and medium-sized enterprises …","https://pure.au.dk/portal/files/317449654/Digital_platform_capability_and_organizational_agility_of_emerging_market_manufacturing_SMEs.pdf","https://scholar.google.com/scholar?q=related:ZYnKraS4dtoJ:scholar.google.com/&scioq=&hl=en&as_sdt=2005&sciodt=0,5"
321,"R Žitkienė, M Deksnys","Organizational agility conceptual model",2018,"Montenegrin journal of economics","pdfs.semanticscholar.org","https://pdfs.semanticscholar.org/0f03/618903ec310672f7561e6896fa5113532b3b.pdf","https://scholar.google.com/scholar?cites=10917691490449716386&as_sdt=2005&sciodt=0,5&hl=en",109,"2026-01-23 14:38:27","PDF","","","",,,,,321,40.13,161,2,8,"Organizations are constantly facing change. Globalization, fast technological advances, competition, disruptive business models, emerging new markets, constantly evolving …","https://pdfs.semanticscholar.org/0f03/618903ec310672f7561e6896fa5113532b3b.pdf","https://scholar.google.com/scholar?q=related:onSP75Bug5cJ:scholar.google.com/&scioq=&hl=en&as_sdt=2005&sciodt=0,5"
332,"J Benitez, G Ray, J Henseler","Impact of information technology infrastructure flexibility on mergers and acquisitions",2018,"MIS quarterly","JSTOR","https://www.jstor.org/stable/26635030","https://scholar.google.com/scholar?cites=966651821771012024&as_sdt=2005&sciodt=0,5&hl=en",174,"2026-01-23 14:38:27","","","","",,,,,332,41.50,111,3,8,"Although mergers and acquisitions (M&A) are a common strategy to reduce costs and pursue growth, the variance in returns from M&A is very high. This research examines how …","https://research.utwente.nl/files/18861799/2018_MISQ_Benitez_Ray_Henseler_Complete.pdf","https://scholar.google.com/scholar?q=related:uDcl2rU8ag0J:scholar.google.com/&scioq=&hl=en&as_sdt=2005&sciodt=0,5"
348,"HC Chae, CE Koh, KO Park","Information technology capability and firm performance: Role of industry",2018,"Information &Management","Elsevier","https://www.sciencedirect.com/science/article/pii/S0378720617308595","https://scholar.google.com/scholar?cites=18271701403030357609&as_sdt=2005&sciodt=0,5&hl=en",101,"2026-01-23 14:38:27","","","","",,,,,348,43.50,116,3,8,"Despite several calls for considering industry in the IS value research, few studies investigated the relationship between benefits of IT and industries. This study extends Chae …","","https://scholar.google.com/scholar?q=related:aYahUZ4fkv0J:scholar.google.com/&scioq=&hl=en&as_sdt=2005&sciodt=0,5"
360,"H Shin, JN Lee, DS Kim, H Rhim","Strategic agility of Korean small and medium enterprises and its influence on operational and firm performance",2015,"International Journal of Production …","Elsevier","https://www.sciencedirect.com/science/article/pii/S0925527315002236","https://scholar.google.com/scholar?cites=17779470002586161774&as_sdt=2005&sciodt=0,5&hl=en",137,"2026-01-23 14:38:27","","","","",,,,,360,32.73,90,4,11,"This study explores the nature and role of agility as a strategic intent and its influence on operational and firm performance. Combining field interviews with the literature review, we …","","https://scholar.google.com/scholar?q=related:bpLchsRdvfYJ:scholar.google.com/&scioq=&hl=en&as_sdt=2005&sciodt=0,5"
379,"M Queiroz, PP Tallon, R Sharma, T Coltman","The role of IT application orchestration capability in improving agility and performance",2018,"The Journal of Strategic …","Elsevier","https://www.sciencedirect.com/science/article/pii/S0963868716302530","https://scholar.google.com/scholar?cites=10800168444166723361&as_sdt=2005&sciodt=0,5&hl=en",95,"2026-01-23 14:38:27","","","","",,,,,379,47.38,95,4,8,"This paper investigates how IT application orchestration–a dynamic capability encapsulating a firm's ability to refresh its application portfolio through a process of building, buying, and …","https://digitalcommons.usu.edu/cgi/viewcontent.cgi?article=1057&context=mis_facpubs","https://scholar.google.com/scholar?q=related:IdfwbPrn4ZUJ:scholar.google.com/&scioq=&hl=en&as_sdt=2005&sciodt=0,5"
380,"E Kale, A Aknar, Ö Başar","Absorptive capacity and firm performance: The mediating role of strategic agility",2019,"International journal of hospitality management","Elsevier","https://www.sciencedirect.com/science/article/pii/S0278431918300896","https://scholar.google.com/scholar?cites=8662707125227741862&as_sdt=2005&sciodt=0,5&hl=en",76,"2026-01-23 14:38:27","","","","",,,,,380,54.29,127,3,7,"The purpose of the study was to examine the mediating role of strategic agility in absorptive capacity's effects on the firm performance of accommodation establishments in Turkey. A …","https://www.academia.edu/download/108363694/479737297.pdf","https://scholar.google.com/scholar?q=related:puJxwDseOHgJ:scholar.google.com/&scioq=&hl=en&as_sdt=2005&sciodt=0,5"
383,"CJ Woodard, N Ramasubbu, FT Tschang…","Design capital and design moves: The logic of digital business strategy",2013,"Mis Quarterly","JSTOR","https://www.jstor.org/stable/43825922","https://scholar.google.com/scholar?cites=7259089252909004243&as_sdt=2005&sciodt=0,5&hl=en",169,"2026-01-23 14:38:27","","","","",,,,,383,29.46,96,4,13,"As information technology becomes integral to the products and services in a growing range of industries, there has been a corresponding surge of interest in understanding how firms …","https://papers.ssrn.com/sol3/Delivery.cfm?abstractid=2010935","https://scholar.google.com/scholar?q=related:0zV_GDd3vWQJ:scholar.google.com/&scioq=&hl=en&as_sdt=2005&sciodt=0,5"
401,"R Dubey, DJ Bryde, YK Dwivedi, G Graham…","Dynamic digital capabilities and supply chain resilience: The role of government effectiveness",2023,"International Journal of …","Elsevier","https://www.sciencedirect.com/science/article/pii/S0925527323000221","https://scholar.google.com/scholar?cites=7592489569434010990&as_sdt=2005&sciodt=0,5&hl=en",6,"2026-01-23 14:38:27","HTML","","","",,,,,401,133.67,80,5,3,"Organizations in recent times are increasingly investing in building supply chain resilience following disruptions due to natural disasters, geo-political crises, and pandemics. A lack of …","https://www.sciencedirect.com/science/article/pii/S0925527323000221","https://scholar.google.com/scholar?q=related:bgX5YgnxXWkJ:scholar.google.com/&scioq=&hl=en&as_sdt=2005&sciodt=0,5"
401,"M Ghasemaghaei, K Hassanein, O Turel","Increasing firm agility through the use of data analytics: The role of fit",2017,"Decision Support Systems","Elsevier","https://www.sciencedirect.com/science/article/pii/S0167923617301161","https://scholar.google.com/scholar?cites=4699175544392391409&as_sdt=2005&sciodt=0,5&hl=en",94,"2026-01-23 14:38:27","","","","",,,,,401,44.56,134,3,9,"Agility, which refers to a dynamic capability within firms to identify and effectively respond to threats and opportunities with speed, is considered as a main business imperative in …","","https://scholar.google.com/scholar?q=related:8Rq2pELTNkEJ:scholar.google.com/&scioq=&hl=en&as_sdt=2005&sciodt=0,5"
416,"B Kitchens, D Dobolyi, J Li, A Abbasi","Advanced customer analytics: Strategic value through integration of relationship-oriented big data",2018,"Journal of Management …","Taylor &Francis","https://www.tandfonline.com/doi/abs/10.1080/07421222.2018.1451957","https://scholar.google.com/scholar?cites=1564102168134400031&as_sdt=2005&sciodt=0,5&hl=en",81,"2026-01-23 14:38:27","","10.1080/07421222.2018.1451957","","",,,,,416,52.00,104,4,8,"As more firms adopt big data analytics to better understand their customers and differentiate their offerings from competitors, it becomes increasingly difficult to generate strategic value …","https://ahmedabbasi.com/wp-content/uploads/J/Kitchens_BigData_JMIS.pdf","https://scholar.google.com/scholar?q=related:H7gRjKLOtBUJ:scholar.google.com/&scioq=&hl=en&as_sdt=2005&sciodt=0,5"
417,"R Shams, D Vrontis, Z Belyaeva, A Ferraris…","Strategic agility in international business: A conceptual framework for “agile” multinationals",2021,"Journal of International …","Elsevier","https://www.sciencedirect.com/science/article/pii/S1075425320300351","https://scholar.google.com/scholar?cites=13072619089485328415&as_sdt=2005&sciodt=0,5&hl=en",47,"2026-01-23 14:38:27","","","","",,,,,417,83.40,83,5,5,"Strategic agility is a fuzzy concept that may be counter intuitive as well as confounding to some scholars in terms of the agile strategies' contextual issues. At the same time, the need …","https://elar.urfu.ru/bitstream/10995/111316/1/2-s2.0-85079001851.pdf","https://scholar.google.com/scholar?q=related:H3DD2MxFa7UJ:scholar.google.com/&scioq=&hl=en&as_sdt=2005&sciodt=0,5"
421,"P Mikalef, J Krogstie","Examining the interplay between big data analytics and contextual factors in driving process innovation capabilities",2020,"European Journal of Information Systems","Taylor &Francis","https://www.tandfonline.com/doi/abs/10.1080/0960085X.2020.1740618","https://scholar.google.com/scholar?cites=4252328324943082825&as_sdt=2005&sciodt=0,5&hl=en",46,"2026-01-23 14:38:27","","10.1080/0960085X.2020.1740618","","",,,,,421,70.17,211,2,6,"The potential of big data analytics in enabling improvements in business processes has urged researchers and practitioners to understand if, and under what combination of …","https://www.tandfonline.com/doi/pdf/10.1080/0960085X.2020.1740618","https://scholar.google.com/scholar?q=related:SXWQ7BROAzsJ:scholar.google.com/&scioq=&hl=en&as_sdt=2005&sciodt=0,5"
430,"CM Felipe, JL Roldán, AL Leal-Rodríguez","Impact of organizational culture values on organizational agility",2017,"Sustainability","mdpi.com","https://www.mdpi.com/2071-1050/9/12/2354","https://scholar.google.com/scholar?cites=16646745671286180503&as_sdt=2005&sciodt=0,5&hl=en",79,"2026-01-23 14:38:27","HTML","","","",,,,,430,47.78,143,3,9,"To remain competitive within the current, uncertain business scenario, it is vital for firms to develop capabilities that lead them to adapt and offer quick responses to market changes …","https://www.mdpi.com/2071-1050/9/12/2354","https://scholar.google.com/scholar?q=related:l8pIY_0eBecJ:scholar.google.com/&scioq=&hl=en&as_sdt=2005&sciodt=0,5"
437,"CM Felipe, JL Roldán, AL Leal-Rodríguez","An explanatory and predictive model for organizational agility",2016,"Journal of business research","Elsevier","https://www.sciencedirect.com/science/article/pii/S0148296316301618","https://scholar.google.com/scholar?cites=4319876572862893212&as_sdt=2005&sciodt=0,5&hl=en",99,"2026-01-23 14:38:27","","","","",,,,,437,43.70,146,3,10,"Organizational agility (OA), as a key dynamic capability, is a firm's ability to enable sensing environmental changes and responding efficiently and effectively to them. This study …","https://repositorio.uloyola.es/bitstream/handle/20.500.12412/1199/An%20explanatory%20and%20perspective%20model.pdf?sequence=1","https://scholar.google.com/scholar?q=related:nEwG99pI8zsJ:scholar.google.com/&scioq=&hl=en&as_sdt=2005&sciodt=0,5"
441,"DM Gligor, MC Holcomb…","A multidisciplinary approach to supply chain agility: Conceptualization and scale development",2013,"Journal of business …","Wiley Online Library","https://onlinelibrary.wiley.com/doi/abs/10.1111/jbl.12012","https://scholar.google.com/scholar?cites=6504501063697673171&as_sdt=2005&sciodt=0,5&hl=en",125,"2026-01-23 14:38:27","","10.1111/jbl.12012","","",,,,,441,33.92,147,3,13,"Although agility has been identified as one of the most important issues of contemporary supply chain management, the theoretical basis for understanding supply chain agility is …","https://www.academia.edu/download/42787273/2013--E__2_.pdf#page=20","https://scholar.google.com/scholar?q=related:06vZTkGhRFoJ:scholar.google.com/&scioq=&hl=en&as_sdt=2005&sciodt=0,5"
447,"K Kalaignanam, KR Tuli, T Kushwaha…","Marketing agility: The concept, antecedents, and a research agenda",2021,"Journal of …","journals.sagepub.com","https://journals.sagepub.com/doi/abs/10.1177/0022242920952760","https://scholar.google.com/scholar?cites=7193760050522595581&as_sdt=2005&sciodt=0,5&hl=en",30,"2026-01-23 14:38:27","","10.1177/0022242920952760","","",,,,,447,89.40,112,4,5,"Changes in the way customers shop, accompanied by an explosion of customer touchpoints and fast-changing competitive and technological dynamics, have led to an increased …","https://ink.library.smu.edu.sg/cgi/viewcontent.cgi?article=7991&context=lkcsb_research","https://scholar.google.com/scholar?q=related:_aDL2qZe1WMJ:scholar.google.com/&scioq=&hl=en&as_sdt=2005&sciodt=0,5"
