Cites,Authors,Title,Year,Source,Publisher,ArticleURL,CitesURL,GSRank,QueryDate,Type,DOI,ISSN,CitationURL,Volume,Issue,StartPage,EndPage,ECC,CitesPerYear,CitesPerAuthor,AuthorCount,Age,Abstract,FullTextURL,RelatedURL
115,"L Wang, XR Luo, F Lee, J Benitez","Value creation in blockchain-driven supply chain finance",2022,"Information &management","Elsevier","https://www.sciencedirect.com/science/article/pii/S0378720621000847","https://scholar.google.com/scholar?cites=9235646235383713318&as_sdt=2005&sciodt=0,5&hl=en",135,"2026-01-23 14:38:27","","","","",,,,,115,28.75,29,4,4,"The objective of this study is to explore the blockchain-enabled value creation process in supply chain finance (SCF). We analyze the roles of participants (who?), motives (why?) …","","https://scholar.google.com/scholar?q=related:Jk44i1GbK4AJ:scholar.google.com/&scioq=&hl=en&as_sdt=2005&sciodt=0,5"
118,"M Ramadan, N Bou Zakhem, H Baydoun…","Toward digital transformation and business model innovation: The nexus between leadership, organizational agility, and knowledge transfer",2023,"Administrative …","mdpi.com","https://www.mdpi.com/2076-3387/13/8/185","https://scholar.google.com/scholar?cites=1281604904035935138&as_sdt=2005&sciodt=0,5&hl=en",77,"2026-01-23 14:38:27","HTML","","","",,,,,118,39.33,30,4,3,"The post-pandemic age has heightened the importance of digitalizing organizational practices and fostering innovation for SMEs to ensure resilient business operations in a …","https://www.mdpi.com/2076-3387/13/8/185","https://scholar.google.com/scholar?q=related:ouN1t94syREJ:scholar.google.com/&scioq=&hl=en&as_sdt=2005&sciodt=0,5"
122,"J Zhou, L Hu, Y Yu, JZ Zhang, LJ Zheng","Impacts of IT capability and supply chain collaboration on supply chain resilience: empirical evidence from China in COVID-19 pandemic",2024,"Journal of Enterprise …","emerald.com","https://www.emerald.com/insight/content/doi/10.1108/jeim-03-2022-0091/full/html","https://scholar.google.com/scholar?cites=2333904713137938639&as_sdt=2005&sciodt=0,5&hl=en",84,"2026-01-23 14:38:27","","10.1108/jeim-03-2022-0091","","",,,,,122,61.00,24,5,2,"Purpose Building supply chain resilience is increasingly recognized as an effective strategy to deal with supply chain challenges, risks and disruptions. Nevertheless, it remains unclear …","https://www.emerald.com/jeim/article/37/2/777/1237683","https://scholar.google.com/scholar?q=related:z2AylvixYyAJ:scholar.google.com/&scioq=&hl=en&as_sdt=2005&sciodt=0,5"
124,"H Salmela, A Baiyere, T Tapanainen…","Digital agility: Conceptualizing agility for the digital era",2022,"Journal of the …","aisel.aisnet.org","https://aisel.aisnet.org/jais/vol23/iss5/8/","https://scholar.google.com/scholar?cites=1976778056212314146&as_sdt=2005&sciodt=0,5&hl=en",108,"2026-01-23 14:38:27","","","","",,,,,124,31.00,31,4,4,"It goes without saying that digital technologies have been forming an increasingly crucial component of companies' value offerings in recent times. In many industries, this trend has …","https://www.utupub.fi/bitstream/handle/10024/160525/Digital_Agility.pdf?sequence=1&isAllowed=y","https://scholar.google.com/scholar?q=related:InhSMCvtbhsJ:scholar.google.com/&scioq=&hl=en&as_sdt=2005&sciodt=0,5"
125,"AC Yoshikuni, R Dwivedi, RG Dultra-de-Lima…","Role of emerging technologies in accounting information systems for achieving strategic flexibility through decision-making performance: an exploratory study …",2023,"Global Journal of …","Springer","https://link.springer.com/article/10.1007/s40171-022-00334-9","https://scholar.google.com/scholar?cites=11360862649004327032&as_sdt=2005&sciodt=0,5&hl=en",66,"2026-01-23 14:38:27","HTML","10.1007/s40171-022-00334-9","","",,,,,125,41.67,31,4,3,"Nowadays, accounting departments highly rely on accounting information systems to make decisions based on current, updated, and contemporary data. And, most accounting …","https://link.springer.com/article/10.1007/s40171-022-00334-9","https://scholar.google.com/scholar?q=related:eADoB2PkqZ0J:scholar.google.com/&scioq=&hl=en&as_sdt=2005&sciodt=0,5"
125,"W Puriwat, D Hoonsopon","Cultivating product innovation performance through creativity: the impact of organizational agility and flexibility under technological turbulence",2022,"Journal of Manufacturing Technology …","emerald.com","https://www.emerald.com/jmtm/article/33/4/741/233557","https://scholar.google.com/scholar?cites=12755805389837904825&as_sdt=2005&sciodt=0,5&hl=en",145,"2026-01-23 14:38:27","HTML","","","",,,,,125,31.25,63,2,4,"Purpose This study is to compare the impact of organizational agility and flexibility on performance of each type of product innovation (radical vs incremental innovation) …","https://www.emerald.com/jmtm/article/33/4/741/233557","https://scholar.google.com/scholar?q=related:uStNPWu5BbEJ:scholar.google.com/&scioq=&hl=en&as_sdt=2005&sciodt=0,5"
129,"A Naseer, H Naseer, A Ahmad, SB Maynard…","Real-time analytics, incident response process agility and enterprise cybersecurity performance: A contingent resource-based analysis",2021,"International Journal of …","Elsevier","https://www.sciencedirect.com/science/article/pii/S026840122100027X","https://scholar.google.com/scholar?cites=13841084722941448568&as_sdt=2005&sciodt=0,5&hl=en",175,"2026-01-23 14:38:27","","","","",,,,,129,25.80,26,5,5,"Emerging paradigms of attack challenge enterprise cybersecurity with sophisticated custom-built tools, unpredictable patterns of exploitation, and an increasing ability to adapt to cyber …","","https://scholar.google.com/scholar?q=related:eNEC6ThpFcAJ:scholar.google.com/&scioq=&hl=en&as_sdt=2005&sciodt=0,5"
132,"R Wahyuningtyas, G Disastra…","Toward cooperative competitiveness for community development in Economic Society 5.0",2023,"Journal of Enterprising …","emerald.com","https://www.emerald.com/insight/content/doi/10.1108/jec-10-2021-0149/full/html","https://scholar.google.com/scholar?cites=1265439428116327375&as_sdt=2005&sciodt=0,5&hl=en",115,"2026-01-23 14:38:27","HTML","10.1108/jec-10-2021-0149","","",,,,,132,44.00,44,3,3,"Purpose Economic Society 5.0 is the answer to the challenges of the Industrial Revolution 4.0 through the creation of new value from the development of advanced technology that …","https://www.emerald.com/insight/content/doi/10.1108/jec-10-2021-0149/full/html","https://scholar.google.com/scholar?q=related:z6uljXS-jxEJ:scholar.google.com/&scioq=&hl=en&as_sdt=2005&sciodt=0,5"
132,"P Gao, J Zhang, Y Gong, H Li","Effects of technical IT capabilities on organizational agility: The moderating role of IT business spanning capability",2020,"Industrial Management &Data …","emerald.com","https://www.emerald.com/insight/content/doi/10.1108/imds-08-2019-0433/full/html","https://scholar.google.com/scholar?cites=16641272629633205532&as_sdt=2005&sciodt=0,5&hl=en",200,"2026-01-23 14:38:27","","10.1108/imds-08-2019-0433","","",,,,,132,22.00,33,4,6,"Purpose The purpose of this research is to investigate how critical managerial IT capabilities, such as IT business spanning capability, interact with two pivotal types of …","https://www.emerald.com/imds/article/120/5/941/445887","https://scholar.google.com/scholar?q=related:HMW3k0mt8eYJ:scholar.google.com/&scioq=&hl=en&as_sdt=2005&sciodt=0,5"
137,"SH Bhatti, WMHW Hussain, J Khan, S Sultan…","Exploring data-driven innovation: what's missing in the relationship between big data analytics capabilities and supply chain innovation?",2024,"Annals of Operations …","Springer","https://link.springer.com/article/10.1007/s10479-022-04772-7","https://scholar.google.com/scholar?cites=313824813668342420&as_sdt=2005&sciodt=0,5&hl=en",93,"2026-01-23 14:38:27","HTML","10.1007/s10479-022-04772-7","","",,,,,137,68.50,27,5,2,"Data-driven innovations (DDI) have significantly impacted firms' operations thanks to the massive exploitation of huge data. However, to leverage big data and achieve supply chain …","https://link.springer.com/article/10.1007/s10479-022-04772-7","https://scholar.google.com/scholar?q=related:lJpnXAHuWgQJ:scholar.google.com/&scioq=&hl=en&as_sdt=2005&sciodt=0,5"
137,"IO Raji, E Shevtshenko, T Rossi…","Industry 4.0 technologies as enablers of lean and agile supply chain strategies: an exploratory investigation",2021,"The International Journal of …","emerald.com","https://www.emerald.com/insight/content/doi/10.1108/ijlm-04-2020-0157/full/html","https://scholar.google.com/scholar?cites=1607616895813406512&as_sdt=2005&sciodt=0,5&hl=en",147,"2026-01-23 14:38:27","","10.1108/ijlm-04-2020-0157","","",,,,,137,27.40,34,4,5,"Purpose Lean and agile are essential supply chain management (SCM) strategies that enhance companies' performance. Previous studies have reported the capabilities of …","https://www.emerald.com/ijlm/article/32/4/1150/134009","https://scholar.google.com/scholar?q=related:MM_fmQxnTxYJ:scholar.google.com/&scioq=&hl=en&as_sdt=2005&sciodt=0,5"
138,"X Du, K Jiang","Promoting enterprise productivity: The role of digital transformation",2022,"Borsa Istanbul Review","Elsevier","https://www.sciencedirect.com/science/article/pii/S2214845022000588","https://scholar.google.com/scholar?cites=6732811208414363507&as_sdt=2005&sciodt=0,5&hl=en",53,"2026-01-23 14:38:27","HTML","","","",,,,,138,34.50,69,2,4,"This study employs textual analysis to assess enterprise digitalization. Moreover, it explores the effect of firm digital transformation (DT) on productivity using data from listed enterprises …","https://www.sciencedirect.com/science/article/pii/S2214845022000588","https://scholar.google.com/scholar?q=related:c39OQR_Ab10J:scholar.google.com/&scioq=&hl=en&as_sdt=2005&sciodt=0,5"
138,"DM Marchiori, RG Rodrigues, S Popadiuk…","The relationship between human capital, information technology capability, innovativeness and organizational performance: An integrated approach",2022,"… Forecasting and Social …","Elsevier","https://www.sciencedirect.com/science/article/pii/S0040162522000580","https://scholar.google.com/scholar?cites=1609181506418016751&as_sdt=2005&sciodt=0,5&hl=en",97,"2026-01-23 14:38:27","","","","",,,,,138,34.50,35,4,4,"The objective of the present study is to identify the existing relationships between the information technology (IT) human capital, IT capabilities, innovativeness, and …","https://drive.google.com/file/d/1RbF5mgLMwexbRlq4ESBfoThzs9FWCFU5/view","https://scholar.google.com/scholar?q=related:74Es5Q32VBYJ:scholar.google.com/&scioq=&hl=en&as_sdt=2005&sciodt=0,5"
138,"FC Nyamrunda, S Freeman","Strategic agility, dynamic relational capability and trust among SMEs in transitional economies",2021,"Journal of World Business","Elsevier","https://www.sciencedirect.com/science/article/pii/S1090951620301036","https://scholar.google.com/scholar?cites=14972937006618933789&as_sdt=2005&sciodt=0,5&hl=en",153,"2026-01-23 14:38:27","","","","",,,,,138,27.60,69,2,5,"Rapid growth and urbanizing populations are transforming Africa, despite environmental turbulence, uncertainty and relational complexity. Research highlights how small firms rely …","","https://scholar.google.com/scholar?q=related:HXrSo-COys8J:scholar.google.com/&scioq=&hl=en&as_sdt=2005&sciodt=0,5"
141,"XF Chen, K Siau","Business analytics/business intelligence and IT infrastructure: impact on organizational agility",2020,"Journal of Organizational and End User …","igi-global.com","https://www.igi-global.com/article/business-analyticsbusiness-intelligence-and-it-infrastructure/265237","https://scholar.google.com/scholar?cites=15311975953584271337&as_sdt=2005&sciodt=0,5&hl=en",141,"2026-01-23 14:38:27","HTML","","","",,,,,141,23.50,71,2,6,"This is an empirical research investigating the impact of business analytics (BA) and business intelligence (BI) use, IT infrastructure flexibility, and their interactions on …","https://www.igi-global.com/article/business-analyticsbusiness-intelligence-and-it-infrastructure/265237","https://scholar.google.com/scholar?q=related:6a-24gARf9QJ:scholar.google.com/&scioq=&hl=en&as_sdt=2005&sciodt=0,5"
142,"J Zhen, Z Xie, K Dong","Impact of IT governance mechanisms on organizational agility and the role of top management support and IT ambidexterity",2021,"International Journal of Accounting Information …","Elsevier","https://www.sciencedirect.com/science/article/pii/S1467089521000038","https://scholar.google.com/scholar?cites=5688999189026951613&as_sdt=2005&sciodt=0,5&hl=en",150,"2026-01-23 14:38:27","","","","",,,,,142,28.40,47,3,5,"Organizations have increasingly relied on information technology (IT) to remain agile in today's business environment. This study examines the antecedents of organizational agility …","","https://scholar.google.com/scholar?q=related:vdFv7Z5i804J:scholar.google.com/&scioq=&hl=en&as_sdt=2005&sciodt=0,5"
145,"BG Son, H Kim, D Hur, N Subramanian","The dark side of supply chain digitalisation: supplier-perceived digital capability asymmetry, buyer opportunism and governance",2021,"International Journal of …","emerald.com","https://www.emerald.com/insight/content/doi/10.1108/ijopm-10-2020-0711/full/html","https://scholar.google.com/scholar?cites=9031005261494302237&as_sdt=2005&sciodt=0,5&hl=en",155,"2026-01-23 14:38:27","","10.1108/ijopm-10-2020-0711","","",,,,,145,29.00,36,4,5,"Purpose In this paper, the authors seek to contribute to the supply chain digitalisation literature by investigating a potential dark side of supply chain digitalisation from the …","https://sussex.figshare.com/articles/journal_contribution/The_dark_side_of_supply_chain_digitalisation_supplier-_perceived_digital_capability_asymmetry_buyer_opportunism_and_governance/23482274/1/files/41191211.pdf","https://scholar.google.com/scholar?q=related:HTYN4G-TVH0J:scholar.google.com/&scioq=&hl=en&as_sdt=2005&sciodt=0,5"
146,"C Cheng, L Wang","How companies configure digital innovation attributes for business model innovation? A configurational view",2022,"Technovation","Elsevier","https://www.sciencedirect.com/science/article/pii/S0166497221001796","https://scholar.google.com/scholar?cites=9378059533273480762&as_sdt=2005&sciodt=0,5&hl=en",96,"2026-01-23 14:38:27","","","","",,,,,146,36.50,73,2,4,"Digital innovation (DI) has garnered considerable attention across a broad array of literatures. However, empirical evidence about the impact of DI on business model …","","https://scholar.google.com/scholar?q=related:Oj47W3WPJYIJ:scholar.google.com/&scioq=&hl=en&as_sdt=2005&sciodt=0,5"
146,"FP Tajudeen, D Nadarajah, NI Jaafar…","The impact of digitalisation vision and information technology on organisations' innovation",2022,"European Journal of …","emerald.com","https://www.emerald.com/insight/content/doi/10.1108/ejim-10-2020-0423/full/html","https://scholar.google.com/scholar?cites=3776017171547949583&as_sdt=2005&sciodt=0,5&hl=en",132,"2026-01-23 14:38:27","","10.1108/ejim-10-2020-0423","","",,,,,146,36.50,37,4,4,"Purpose Based on the dynamic capability theory (DCT), this study examines the role of digitalisation vision and the impact of key information technology (IT) strategies, such as IT …","https://www.emerald.com/ejim/article/25/2/607/257965","https://scholar.google.com/scholar?q=related:Dwrkf5wbZzQJ:scholar.google.com/&scioq=&hl=en&as_sdt=2005&sciodt=0,5"
148,"MM Medeiros, ACG Maçada","Competitive advantage of data-driven analytical capabilities: the role of big data visualization and of organizational agility",2022,"Management Decision","emerald.com","https://www.emerald.com/insight/content/doi/10.1108/md-12-2020-1681/full/html","https://scholar.google.com/scholar?cites=17578968913676629139&as_sdt=2005&sciodt=0,5&hl=en",149,"2026-01-23 14:38:27","","10.1108/md-12-2020-1681","","",,,,,148,37.00,74,2,4,"Purpose In the digital age, the use of data and analytical capabilities to guide business decisions and operations plays a strategic role for organizations to gain competitive …","https://www.emerald.com/md/article/60/4/953/282501","https://scholar.google.com/scholar?q=related:k3RU8RYL9fMJ:scholar.google.com/&scioq=&hl=en&as_sdt=2005&sciodt=0,5"
151,"L Moi, F Cabiddu","Leading digital transformation through an Agile Marketing Capability: the case of Spotahome",2021,"Journal of Management and Governance","Springer","https://link.springer.com/article/10.1007/s10997-020-09534-w","https://scholar.google.com/scholar?cites=15699635214261546539&as_sdt=2005&sciodt=0,5&hl=en",138,"2026-01-23 14:38:27","HTML","10.1007/s10997-020-09534-w","","",,,,,151,30.20,76,2,5,"Scholars and practitioners both acknowledge that agility is crucial in leading a digital transformation effort. However, empirical and theoretical research on agile capabilities in an …","https://link.springer.com/article/10.1007/s10997-020-09534-w","https://scholar.google.com/scholar?q=related:K-5FEQxP4NkJ:scholar.google.com/&scioq=&hl=en&as_sdt=2005&sciodt=0,5"
152,"A Bettoni, D Matteri, E Montini, B Gładysz…","An AI adoption model for SMEs: A conceptual framework",2021,"IFAC-PapersOnLine","Elsevier","https://www.sciencedirect.com/science/article/pii/S2405896321008259","https://scholar.google.com/scholar?cites=1779571319254837559&as_sdt=2005&sciodt=0,5&hl=en",142,"2026-01-23 14:38:27","","","","",,,,,152,30.40,30,5,5,"Abstract today literature proposes several models to assess the level of digitisation of a company. However, digitisation includes innumerable elements and aspects that require …","https://www.researchgate.net/profile/Elias-Montini/publication/356054939_An_AI_adoption_model_for_SMEs_a_conceptual_framework/links/6555cf0fb1398a779d909573/An-AI-adoption-model-for-SMEs-a-conceptual-framework.pdf","https://scholar.google.com/scholar?q=related:N2mosK9OshgJ:scholar.google.com/&scioq=&hl=en&as_sdt=2005&sciodt=0,5"
154,"N Saputra, N Sasanti, F Alamsjah, F Sadeli","Strategic role of digital capability on business agility during COVID-19 era",2022,"Procedia Computer Science","Elsevier","https://www.sciencedirect.com/science/article/pii/S1877050921023711","https://scholar.google.com/scholar?cites=16350193372248809596&as_sdt=2005&sciodt=0,5&hl=en",87,"2026-01-23 14:38:27","","","","",,,,,154,38.50,39,4,4,"COVID-19 is a real experience of volatile-uncertain-complex-ambiguous (VUCA) world. It has brought fundamental changes in leading people and managing business organizations …","https://www.sciencedirect.com/science/article/pii/S1877050921023711/pdf?md5=b8ea8149fc2c6eb0a20e9ae2e837d08f&pid=1-s2.0-S1877050921023711-main.pdf","https://scholar.google.com/scholar?q=related:fCDWuT6O5-IJ:scholar.google.com/&scioq=&hl=en&as_sdt=2005&sciodt=0,5"
159,"JG Cegarra-Navarro…","The effect of organizational memory on organizational agility: Testing the role of counter-knowledge and knowledge application",2020,"Journal of Intellectual …","emerald.com","https://www.emerald.com/insight/content/doi/10.1108/JIC-03-2019-0048","https://scholar.google.com/scholar?cites=3856891056602687582&as_sdt=2005&sciodt=0,5&hl=en",186,"2026-01-23 14:38:27","","10.1108/JIC-03-2019-0048","","",,,,,159,26.50,80,2,6,"Purpose Intellectual capital includes what employees know and the agility to search and retrieve knowledge (organizational agility). Organizational agility could be seen as the result …","https://repositorio.upct.es/bitstreams/9748183a-8a9f-43ad-8eb1-ac2b9819d556/download","https://scholar.google.com/scholar?q=related:XigvNvtthjUJ:scholar.google.com/&scioq=&hl=en&as_sdt=2005&sciodt=0,5"
162,"R Rialti, G Marzi, A Caputo, KA Mayah","Achieving strategic flexibility in the era of big data: The importance of knowledge management and ambidexterity",2020,"Management Decision","emerald.com","https://www.emerald.com/insight/content/doi/10.1108/MD-09-2019-1237/full/html","https://scholar.google.com/scholar?cites=11388206317390374499&as_sdt=2005&sciodt=0,5&hl=en",171,"2026-01-23 14:38:27","","10.1108/MD-09-2019-1237","","",,,,,162,27.00,41,4,6,"Purpose This research unpacks the micro-mechanisms that exist between an organisation's ability to conduct big data analytics (BDA) and its achievement of strategic flexibility …","https://usiena-air.unisi.it/bitstream/11365/1259413/1/MD%20-%20Rialti%2C%20Marzi%2C%20Caputo%2C%20Mayah%202020%20-%20Big%20Data%20KM%20copia.pdf","https://scholar.google.com/scholar?q=related:Y6bp8E4JC54J:scholar.google.com/&scioq=&hl=en&as_sdt=2005&sciodt=0,5"
165,"AI Aljumah, MT Nuseir, MM Alam","Organizational performance and capabilities to analyze big data: do the ambidexterity and business value of big data analytics matter?",2021,"Business Process Management …","emerald.com","https://www.emerald.com/insight/content/doi/10.1108/BPMJ-07-2020-0335/full/html","https://scholar.google.com/scholar?cites=15165947407550676921&as_sdt=2005&sciodt=0,5&hl=en",106,"2026-01-23 14:38:27","","10.1108/BPMJ-07-2020-0335","","",,,,,165,33.00,55,3,5,"Purpose The aim of the study is to examine the impact of the big data analytics capabilities (BDAC) on the organizational performance. The study also examines the mediating role of …","https://papers.ssrn.com/sol3/Delivery.cfm?abstractid=4014751","https://scholar.google.com/scholar?q=related:uX9QhdBEeNIJ:scholar.google.com/&scioq=&hl=en&as_sdt=2005&sciodt=0,5"
167,"L Li, J Lin, O Turel, P Liu, X Luo","The impact of e-commerce capabilities on agricultural firms' performance gains: the mediating role of organizational agility",2020,"Industrial Management &Data …","emerald.com","https://www.emerald.com/insight/content/doi/10.1108/imds-08-2019-0421/full/html","https://scholar.google.com/scholar?cites=14766055194163548421&as_sdt=2005&sciodt=0,5&hl=en",134,"2026-01-23 14:38:27","","10.1108/imds-08-2019-0421","","",,,,,167,27.83,33,5,6,"Purpose This study aimed to investigate the impact of e-commerce capabilities on agricultural firms' performance gains through organizational agility. Design/methodology …","https://www.emerald.com/imds/article/120/7/1265/390026","https://scholar.google.com/scholar?q=related:BRHuFfeQ68wJ:scholar.google.com/&scioq=&hl=en&as_sdt=2005&sciodt=0,5"
168,"A Bohnert, A Fritzsche, S Gregor","Digital agendas in the insurance industry: the importance of comprehensive approaches†",2019,"The Geneva Papers on Risk and …","Springer","https://link.springer.com/article/10.1057/s41288-018-0109-0","https://scholar.google.com/scholar?cites=81829877120659813&as_sdt=2005&sciodt=0,5&hl=en",196,"2026-01-23 14:38:27","","10.1057/s41288-018-0109-0","","",,,,,168,24.00,56,3,7,"With a growing awareness of the potential of innovation provided by digital technology, insurance companies have increasingly adopted digital agendas in their business activities …","https://www.vwrm.rw.fau.de/files/2019/03/Digital-Insurance-2018-08-16.pdf","https://scholar.google.com/scholar?q=related:ZXHK9da3IgEJ:scholar.google.com/&scioq=&hl=en&as_sdt=2005&sciodt=0,5"
169,"R Dubey, DJ Bryde, C Foropon, G Graham…","Agility in humanitarian supply chain: An organizational information processing perspective and relational view",2022,"Annals of Operations …","Springer","https://link.springer.com/article/10.1007/s10479-020-03824-0","https://scholar.google.com/scholar?cites=16872990854909883041&as_sdt=2005&sciodt=0,5&hl=en",128,"2026-01-23 14:38:27","HTML","10.1007/s10479-020-03824-0","","",,,,,169,42.25,34,5,4,"Humanitarian organizations are increasingly facing challenges in terms of improving the efficiency and the effectiveness of their disaster relief efforts. These challenges often arise …","https://link.springer.com/article/10.1007/s10479-020-03824-0","https://scholar.google.com/scholar?q=related:oXJRHcnnKOoJ:scholar.google.com/&scioq=&hl=en&as_sdt=2005&sciodt=0,5"
174,"K Eilers, C Peters, JM Leimeister","Why the agile mindset matters",2022,"Technological Forecasting and Social …","Elsevier","https://www.sciencedirect.com/science/article/pii/S0040162522001822","https://scholar.google.com/scholar?cites=6367724480765500855&as_sdt=2005&sciodt=0,5&hl=en",131,"2026-01-23 14:38:27","HTML","","","",,,,,174,43.50,58,3,4,"Volatility, uncertainty, complexity, and ambiguity (VUCA) are drivers in today's business world. To perform amid this accelerated change and the digitalization progress …","https://www.sciencedirect.com/science/article/pii/S0040162522001822","https://scholar.google.com/scholar?q=related:tx2Wd62zXlgJ:scholar.google.com/&scioq=&hl=en&as_sdt=2005&sciodt=0,5"
174,"M Kodama","Digitally transforming work styles in an era of infectious disease",2020,"International Journal of Information Management","Elsevier","https://www.sciencedirect.com/science/article/pii/S0268401220309725","https://scholar.google.com/scholar?cites=7239236602079683446&as_sdt=2005&sciodt=0,5&hl=en",136,"2026-01-23 14:38:27","","","","",,,,,174,29.00,174,1,6,"As a new perspective in this era of infectious disease confronting humanity (that cannot be avoided), and in light of research done to date, this article identifies the importance of …","https://pmc.ncbi.nlm.nih.gov/articles/PMC7307515/pdf/main.pdf","https://scholar.google.com/scholar?q=related:diP3n1XvdmQJ:scholar.google.com/&scioq=&hl=en&as_sdt=2005&sciodt=0,5"
175,"GB Dagnino, PM Picone…","Temporary competitive advantage: a state‐of‐the‐art literature review and research directions",2021,"International Journal of …","Wiley Online Library","https://onlinelibrary.wiley.com/doi/abs/10.1111/ijmr.12242","https://scholar.google.com/scholar?cites=951067299523593952&as_sdt=2005&sciodt=0,5&hl=en",118,"2026-01-23 14:38:27","","10.1111/ijmr.12242","","",,,,,175,35.00,58,3,5,"In many industries, the traditional sources of competitive advantage tend to evaporate fairly rapidly. Therefore, managers need to continually rethink and reformulate their firm …","","https://scholar.google.com/scholar?q=related:4AaYgaveMg0J:scholar.google.com/&scioq=&hl=en&as_sdt=2005&sciodt=0,5"
