Lens ID,Title,Date Published,Publication Year,Publication Type,Source Title,ISSNs,Publisher,Source Country,Author/s,Abstract,Volume,Issue Number,Start Page,End Page,Fields of Study,Keywords,MeSH Terms,Chemicals,Funding,Source URLs,External URL,PMID,DOI,Microsoft Academic ID,PMCID,Citing Patents Count,References,Citing Works Count,Is Open Access,Open Access License,Open Access Colour
001-250-904-310-342,How Clean is Safe? Improving the Effectiveness of Decontamination of Structures and People Following Chemical and Biological Incidents,2003-04-03,2003,report,,,Office of Scientific and Technical Information (OSTI),,B.M. Vogt,"This report describes a U.S. Department of Energy, (DOE) Chemical and Biological National Security Program project that sought to establish what is known about decontamination of structures, objects, and people following an exposure to chemical or biological materials. Specifically we sought to identify the procedures and protocols used to determine when and how people or buildings are considered ''clean'' following decontamination. To fulfill this objective, the study systematically examined reported decontamination experiences to determine what procedures and protocols are currently employed for decontamination, the timeframe involved to initiate and complete the decontamination process, how the contaminants were identified, the factors determining when people were (or were not) decontaminated, the problems encountered during the decontamination process, how response efforts of agencies were coordinated, and the perceived social psychological effects on people who were decontaminated or who participated in the decontamination process. Findings and recommendations from the study are intended to aid decision-making and to improve the basis for determining appropriate decontamination protocols for recovery planners and policy makers for responding to chemical and biological events.",,,,,Human decontamination; Risk analysis (engineering); Engineering; Biological materials; National security; Forensic engineering,,,,,https://ornl.gov/~webworks/cppr/y2001/rpt/114807.pdf https://digital.library.unt.edu/ark:/67531/metadc739114/ http://www.osti.gov/scitech/biblio/814553/ https://digital.library.unt.edu/ark:/67531/metadc739114/m2/1/high_res_d/814553.pdf http://web.ornl.gov/~webworks/cppr/y2001/rpt/114807.pdf https://core.ac.uk/display/71212822,http://dx.doi.org/10.2172/814553,,10.2172/814553,2119539369,,3,001-203-896-115-843; 002-160-973-175-823; 008-297-163-441-443; 009-166-475-161-041; 010-607-514-754-656; 011-151-743-010-881; 011-270-709-483-636; 015-025-939-276-487; 015-629-997-669-964; 017-785-165-848-940; 018-332-714-054-401; 019-039-730-132-282; 019-458-151-080-621; 020-317-537-639-586; 021-612-158-035-49X; 022-160-081-535-139; 023-359-753-389-301; 024-211-278-056-318; 025-563-017-376-677; 025-864-375-023-803; 028-891-671-482-02X; 029-381-925-848-623; 030-597-688-508-753; 031-191-526-360-422; 034-671-850-834-943; 036-111-744-045-075; 037-987-908-471-816; 038-199-815-065-017; 039-935-090-059-742; 040-288-061-323-388; 040-491-945-900-834; 043-526-762-853-197; 044-205-010-376-964; 044-385-532-686-012; 048-855-001-243-393; 048-992-803-462-097; 049-031-802-732-829; 049-819-423-240-836; 050-138-992-054-250; 051-510-766-183-171; 052-276-130-189-563; 052-315-945-613-045; 053-370-009-927-875; 054-320-890-300-461; 055-068-097-413-799; 056-443-332-203-870; 058-258-969-299-724; 058-369-773-327-932; 058-645-595-919-705; 061-492-510-506-404; 061-880-260-268-961; 062-818-821-898-680; 063-032-673-766-53X; 064-930-115-625-426; 065-955-374-681-200; 066-738-670-088-570; 068-374-854-966-84X; 068-570-411-764-817; 070-478-050-872-846; 072-154-423-886-717; 075-923-188-551-505; 080-359-634-079-295; 082-835-277-458-824; 086-706-871-632-260; 087-504-551-774-99X; 089-961-675-723-875; 092-286-647-680-128; 098-170-610-792-429; 098-922-171-316-947; 100-773-261-088-566; 104-684-721-575-092; 106-878-370-622-771; 107-993-761-852-355; 108-391-750-220-684; 109-164-019-522-444; 109-222-263-341-461; 110-827-057-359-959; 113-246-797-779-231; 119-816-266-098-090; 126-109-084-112-059; 128-086-608-028-493; 129-498-229-831-275; 131-872-311-597-878; 135-128-949-806-931; 136-331-589-485-854; 137-330-283-778-672; 137-909-357-652-275; 141-678-136-445-204; 146-639-488-954-280; 152-614-731-690-665; 157-385-733-281-22X; 176-581-637-453-148; 199-036-835-147-636,26,true,,green
002-250-620-488-33X,Plant Species Identification Using Computer Vision Techniques: A Systematic Literature Review,2017-01-07,2017,journal article,Archives of computational methods in engineering : state of the art reviews,18861784; 11343060,Springer Netherlands,Spain,Jana Wäldchen; Patrick Mäder,"Species knowledge is essential for protecting biodiversity. The identification of plants by conventional keys is complex, time consuming, and due to the use of specific botanical terms frustrating for non-experts. This creates a hard to overcome hurdle for novices interested in acquiring species knowledge. Today, there is an increasing interest in automating the process of species identification.;  The availability and ubiquity of relevant technologies, such as, digital cameras and mobile devices, the remote access to databases, new techniques in image processing and pattern recognition let the idea of automated species identification become reality. This paper is the first systematic literature review with the aim of a thorough analysis and comparison of primary studies on computer vision approaches for plant species identification. We identified 120 peer-reviewed studies, selected through a multi-stage process, published in the last 10 years (2005–2015). After a careful analysis of these studies, we describe the applied methods categorized according to the studied plant organ, and the studied features, i.e., shape, texture, color, margin, and vein structure. Furthermore, we compare methods based on classification accuracy achieved on publicly available datasets. Our results are relevant to researches in ecology as well as computer vision for their ongoing research. The systematic and concise overview will also be helpful for beginners in those research fields, as they can use the comparable analyses of applied methods as a guide in this complex activity.",25,2,507,543,Automated species identification; Pattern recognition (psychology); Artificial intelligence; Mobile device; Systematic review; Structure (mathematical logic); Computer vision; Computer science; Process (engineering); Identification (information); Image processing,,,,BMBF; BMBF; BfN; SNT,https://link.springer.com/content/pdf/10.1007%2Fs11831-016-9206-z.pdf https://link.springer.com/article/10.1007/s11831-016-9206-z https://dx.doi.org/10.1007%2Fs11831-016-9206-z https://paperity.org/p/79054331/plant-species-identification-using-computer-vision-techniques-a-systematic-literature https://pubmed.ncbi.nlm.nih.gov/29962832/ http://europepmc.org/abstract/MED/29962832 https://www.ncbi.nlm.nih.gov/pubmed/29962832 https://link.springer.com/article/10.1007/s11831-016-9206-z/fulltext.html https://core.ac.uk/display/81212628 http://dx.doi.org/10.1007%2Fs11831-016-9206-z https://cyberleninka.org/article/n/1477979 https://pure.mpg.de/pubman/item/item_2382530_2/component/file_2382528/BGC2577.pdf https://pure.mpg.de/pubman/faces/ViewItemOverviewPage.jsp?itemId=item_2382530 https://www.ncbi.nlm.nih.gov/pmc/articles/PMC6003396,http://dx.doi.org/10.1007/s11831-016-9206-z,29962832,10.1007/s11831-016-9206-z,2568155635,PMC6003396,4,000-810-664-544-25X; 001-221-959-319-501; 002-217-768-919-285; 003-133-148-438-614; 003-263-924-346-903; 003-945-874-653-056; 004-532-138-867-583; 004-585-504-885-407; 004-861-834-196-573; 005-456-627-366-098; 006-183-233-137-079; 006-607-064-432-822; 006-897-296-273-996; 007-124-298-945-591; 007-913-114-768-001; 008-024-451-795-250; 008-328-135-139-887; 008-428-990-429-752; 008-800-034-562-084; 010-947-960-634-364; 011-883-359-022-523; 012-657-537-842-77X; 015-460-580-825-895; 015-656-861-151-609; 016-138-197-744-92X; 016-224-243-391-362; 016-532-263-239-733; 016-747-271-222-315; 018-820-404-403-533; 019-201-660-953-001; 019-819-098-483-480; 020-168-079-956-974; 020-653-376-303-231; 020-972-902-901-863; 021-060-503-974-904; 021-970-498-909-587; 022-486-272-732-792; 023-052-887-147-176; 024-700-593-458-840; 025-477-591-855-532; 026-204-362-267-158; 027-498-485-991-958; 028-418-380-712-020; 029-259-621-797-178; 029-638-843-375-245; 029-798-586-740-741; 030-436-927-269-319; 030-917-331-624-639; 032-580-907-234-767; 033-156-942-857-568; 033-675-418-036-629; 034-423-813-302-371; 034-591-619-541-590; 034-710-965-687-866; 035-019-051-515-347; 035-794-002-613-677; 035-874-343-182-609; 036-376-798-374-687; 037-705-965-279-515; 037-844-185-289-130; 038-507-428-606-153; 040-052-071-592-468; 040-502-196-198-507; 040-626-271-225-881; 041-580-960-566-951; 043-541-666-323-554; 044-802-754-453-905; 046-197-522-761-888; 046-411-381-077-381; 047-372-836-239-285; 047-526-385-984-946; 047-812-600-322-089; 047-819-818-245-743; 048-013-878-633-741; 048-857-935-225-059; 050-694-550-319-327; 051-166-619-471-093; 052-191-500-342-113; 052-930-145-693-758; 053-530-631-788-801; 053-799-236-449-887; 054-127-787-643-488; 054-470-043-813-059; 054-543-374-196-192; 054-595-118-076-647; 056-985-482-299-755; 057-495-679-296-544; 057-961-496-789-19X; 058-310-177-830-957; 058-394-579-373-366; 059-191-174-618-739; 061-398-590-277-224; 063-411-185-404-652; 064-138-472-782-930; 064-557-235-250-304; 064-700-957-788-164; 065-188-307-970-219; 065-950-807-672-631; 066-177-997-457-609; 066-776-464-347-057; 067-163-091-503-84X; 067-663-400-152-440; 068-446-370-600-681; 071-004-313-758-693; 071-474-808-465-848; 071-743-891-827-784; 072-819-583-417-26X; 074-458-656-299-850; 075-878-587-022-301; 076-653-974-901-348; 079-097-249-129-353; 081-061-112-923-449; 081-084-986-056-886; 083-859-328-114-662; 084-724-739-825-23X; 085-341-135-651-214; 086-761-888-090-201; 090-779-756-286-296; 097-535-811-346-073; 098-440-015-522-27X; 102-055-388-105-454; 102-998-003-058-700; 105-431-475-385-20X; 105-705-391-060-585; 105-995-736-365-447; 110-127-137-067-019; 110-954-645-300-402; 111-937-666-586-245; 113-002-518-968-603; 117-749-935-558-235; 121-062-509-462-410; 123-762-112-199-01X; 125-294-784-415-684; 126-451-870-885-976; 128-013-193-594-866; 130-644-874-725-30X; 130-771-374-369-224; 132-623-089-523-85X; 133-731-722-951-679; 134-804-265-224-556; 136-272-687-258-658; 136-921-702-226-329; 139-910-013-578-64X; 140-726-995-342-518; 141-820-371-008-674; 151-315-297-607-446; 152-699-311-611-647; 152-985-917-034-984; 153-855-498-357-332; 159-936-747-750-841; 162-993-035-945-017; 163-747-964-069-683; 166-417-095-067-973; 173-779-421-031-450; 174-093-614-866-972; 181-883-933-399-830; 185-958-868-658-160; 186-081-237-537-037; 186-446-883-397-808; 187-134-217-110-530; 187-488-585-098-860,403,true,cc-by,hybrid
004-716-747-269-729,Efficacy of Individual Computer-Based Auditory Training for People with Hearing Loss: A Systematic Review of the Evidence,2013-05-10,2013,journal article,PloS one,19326203,Public Library of Science (PLoS),United States,Helen Henshaw; Melanie A. Ferguson,"Auditory training involves active listening to auditory stimuli and aims to improve performance in auditory tasks. As such, auditory training is a potential intervention for the management of people with hearing loss.; ; Objective; ; This systematic review (PROSPERO 2011: CRD42011001406) evaluated the published evidence-base for the efficacy of individual computer-based auditory training to improve speech intelligibility, cognition and communication abilities in adults with hearing loss, with or without hearing aids or cochlear implants.; ; Methods; ; A systematic search of eight databases and key journals identified 229 articles published since 1996, 13 of which met the inclusion criteria. Data were independently extracted and reviewed by the two authors. Study quality was assessed using ten pre-defined scientific and intervention-specific measures.; ; Results; ; Auditory training resulted in improved performance for trained tasks in 9/10 articles that reported on-task outcomes. Although significant generalisation of learning was shown to untrained measures of speech intelligibility (11/13 articles), cognition (1/1 articles) and self-reported hearing abilities (1/2 articles), improvements were small and not robust. Where reported, compliance with computer-based auditory training was high, and retention of learning was shown at post-training follow-ups. Published evidence was of very-low to moderate study quality.; ; Conclusions; ; Our findings demonstrate that published evidence for the efficacy of individual computer-based auditory training for adults with hearing loss is not robust and therefore cannot be reliably used to guide intervention at this time. We identify a need for high-quality evidence to further examine the efficacy of computer-based auditory training for people with hearing loss.",8,5,e62836,,Word recognition; Cognition; Active listening; Systematic review; MEDLINE; Hearing loss; Intervention (counseling); Audiology; Biology; Meta-analysis,,"Acoustic Stimulation/methods; Cognition; Hearing Loss/rehabilitation; Humans; Learning; Patient Compliance; Patient Outcome Assessment; Speech Intelligibility; Therapy, Computer-Assisted",,,https://journals.plos.org/plosone/article?id=10.1371/journal.pone.0062836 https://nottingham-repository.worktribe.com/output/715226 https://www.pubmedcentral.nih.gov/pmc/articles/PMC3651281/ http://eprints.nottingham.ac.uk/2554/ https://paperity.org/p/60570493/efficacy-of-individual-computer-based-auditory-training-for-people-with-hearing-loss-a http://ui.adsabs.harvard.edu/abs/2013PLoSO...862836H/abstract http://etheses.nottingham.ac.uk/2554/ http://europepmc.org/articles/PMC3651281 https://pubmed.ncbi.nlm.nih.gov/23675431/ https://www.ncbi.nlm.nih.gov/pmc/articles/PMC3651281/ https://dx.plos.org/10.1371/journal.pone.0062836 https://core.ac.uk/download/29029472.pdf,http://dx.doi.org/10.1371/journal.pone.0062836,23675431,10.1371/journal.pone.0062836,2017795049,PMC3651281,2,000-032-008-156-381; 001-032-477-232-072; 001-776-091-945-493; 002-465-575-200-234; 002-977-507-079-750; 003-285-918-383-940; 003-502-306-454-566; 004-248-868-952-992; 005-078-540-802-947; 008-063-807-905-548; 008-290-310-590-456; 008-849-007-116-06X; 010-382-242-965-470; 011-364-225-333-452; 011-977-049-359-515; 012-467-234-183-204; 012-778-945-763-465; 012-855-178-982-312; 013-793-778-359-95X; 014-161-647-922-926; 014-409-137-225-924; 014-951-306-673-323; 016-157-907-375-131; 016-890-687-536-141; 017-300-737-144-757; 022-721-027-122-728; 024-596-459-062-717; 025-827-871-457-974; 028-179-344-437-257; 031-409-796-613-468; 033-033-842-836-196; 033-576-456-611-379; 034-389-837-098-022; 034-889-832-676-162; 037-325-492-068-181; 038-158-345-334-970; 038-352-231-638-764; 040-601-526-705-465; 040-976-776-416-253; 043-012-094-838-371; 043-249-149-414-580; 046-222-933-300-033; 048-731-719-570-495; 049-177-887-730-348; 051-618-821-779-459; 052-012-500-721-66X; 053-139-142-165-361; 054-176-537-499-779; 054-742-043-111-360; 067-188-722-954-884; 067-294-180-388-222; 070-150-175-948-905; 071-905-266-177-076; 075-638-290-701-458; 078-792-803-667-537; 080-929-332-575-180; 082-637-709-636-552; 083-275-795-865-394; 086-191-701-453-534; 087-407-230-040-261; 088-502-513-991-907; 088-521-279-255-226; 091-722-601-719-295; 091-970-670-184-194; 099-072-225-383-044; 100-601-601-034-484; 101-209-078-890-293; 103-167-329-754-174; 103-545-424-353-227; 105-836-428-413-883; 105-839-208-015-836; 106-269-901-211-418; 107-431-107-291-800; 107-573-416-549-821; 113-807-614-377-561; 115-850-471-614-107; 118-590-256-459-053; 127-424-920-298-490; 130-128-518-565-337; 130-956-682-941-49X; 133-759-538-741-246; 145-263-237-450-396; 153-486-778-732-132; 160-979-115-525-588; 167-537-869-951-184; 172-131-582-091-931; 172-521-048-219-046; 194-452-804-994-85X; 196-563-375-497-373,242,true,cc-by,gold
005-192-831-294-152,"Justification and Interlaced Knowledge at ATLAS, CERN",,2014,journal article,Organization Science,10477039; 15265455,Institute for Operations Research and the Management Sciences (INFORMS),United States,Philipp Tuertscher; Raghu Garud; Arun Kumaraswamy,"We report on a longitudinal study of the emergence of the ATLAS detector, a complex technological system developed at CERN, Geneva. Our data show that the coordination of initial architectural choices was driven by cycles of contestation and justification that resulted in the creation of what we term interlaced knowledge-pockets of shared knowledge interwoven within and across subsystem communities at ATLAS. We also found that these justifications were possible because of the presence of a boundary infrastructure that served as a common substrate of knowledge for all ATLAS participants. Together, the boundary infrastructure and interlaced knowledge enabled participants to make co-oriented technological choices, address latent interdependencies, and minimize the incidence and severity of glitches when integrating the various subsystems.",25,6,1579,1608,Modularity; Boundary (real estate); Atlas (topology); Interdependence; New product development; Data science; Technological system; Computer science; Knowledge management; Term (time); Large Hadron Collider,collaboration; complexity; coordination; design; innovation; knowledge management; knowledge integration across boundaries; modularity; new product development; technological systems,,,,https://pennstate.pure.elsevier.com/en/publications/justification-and-interlaced-knowledge-at-atlas-cern https://www.narcis.nl/publication/RecordID/oai%3Aresearch.vu.nl%3Apublications%2Ff6fe5a17-9add-4f01-b67a-d5fd49b71c54 https://core.ac.uk/display/91264419 https://dblp.uni-trier.de/db/journals/orgsci/orgsci25.html#TuertscherGK14 https://research.vu.nl/ws/files/118770290/orsc.2013.0894.pdf https://doi.org/10.1287/orsc.2013.0894 https://EconPapers.repec.org/RePEc:inm:ororsc:v:25:y:2014:i:6:p:1579-1608 https://pubsonline.informs.org/doi/10.1287/orsc.2013.0894 https://research.vu.nl/en/publications/justification-and-interlaced-knowledge-at-atlas-cern https://ideas.repec.org/a/inm/ororsc/v25y2014i6p1579-1608.html http://dx.doi.org/10.1287/orsc.2013.0894 https://dialnet.unirioja.es/servlet/articulo?codigo=4870926 https://dx.doi.org/10.1287/orsc.2013.0894,http://dx.doi.org/10.1287/orsc.2013.0894,,10.1287/orsc.2013.0894,2163094758,,1,000-184-227-300-032; 000-543-683-079-783; 001-725-231-786-19X; 002-314-413-185-23X; 005-937-927-929-267; 006-107-788-990-722; 007-768-428-714-622; 008-140-249-992-478; 009-548-816-172-843; 009-970-029-647-938; 010-482-042-286-500; 010-656-047-738-040; 013-052-383-240-040; 015-586-822-938-491; 015-603-078-113-927; 016-819-509-262-916; 017-642-661-781-097; 019-976-954-119-42X; 020-547-429-606-617; 023-341-897-455-317; 024-085-270-622-915; 025-899-196-476-735; 027-864-269-691-78X; 029-209-397-748-519; 029-774-167-951-265; 030-753-941-740-436; 032-357-459-828-059; 033-917-433-064-774; 034-784-496-871-805; 034-978-690-241-028; 035-728-295-734-978; 035-729-682-551-13X; 036-389-751-732-697; 037-434-248-899-998; 037-695-887-996-132; 038-296-242-920-833; 038-927-681-897-522; 040-076-670-791-772; 041-687-287-313-232; 042-590-342-012-818; 044-932-466-437-594; 045-505-220-779-877; 047-029-705-852-671; 047-143-285-580-575; 048-121-164-328-17X; 049-404-011-296-580; 049-704-418-834-963; 050-323-347-069-139; 050-359-879-197-793; 050-405-450-488-904; 051-015-920-772-700; 055-498-815-134-39X; 056-112-282-363-561; 057-506-984-428-284; 058-704-179-299-946; 059-354-276-889-146; 063-831-371-509-221; 064-565-106-384-912; 065-860-505-995-356; 066-840-285-525-886; 069-653-396-772-682; 070-363-302-441-947; 071-453-403-062-255; 073-512-475-568-001; 076-290-655-165-574; 076-482-199-211-165; 077-128-840-921-280; 078-258-348-874-760; 081-075-676-811-394; 081-890-047-652-723; 083-192-640-703-303; 083-925-681-388-720; 084-407-684-454-988; 084-838-687-467-834; 084-995-084-309-350; 086-619-651-620-14X; 088-035-879-764-944; 089-095-909-195-545; 089-390-474-304-432; 089-879-669-117-921; 090-623-762-665-013; 093-958-450-144-132; 094-815-311-018-919; 096-159-964-319-743; 097-772-274-500-846; 100-466-930-952-615; 102-946-674-134-634; 104-383-774-669-763; 106-395-419-846-455; 107-390-229-971-232; 107-718-926-108-748; 109-580-577-421-86X; 113-355-334-124-565; 120-033-617-967-96X; 122-005-879-502-577; 125-611-985-399-234; 126-635-592-306-36X; 127-269-244-439-544; 127-314-112-167-962; 130-969-349-581-016; 133-246-579-068-744; 136-857-754-250-028; 147-724-863-924-60X; 148-571-180-308-199; 148-879-759-455-156; 156-469-939-824-017; 158-075-147-606-426; 158-423-634-687-92X; 164-425-651-574-456; 172-573-079-472-196; 179-472-240-613-920; 180-442-977-984-206; 180-602-075-167-16X; 186-807-839-312-222; 188-074-771-262-309; 198-714-537-278-252,89,true,,green
006-084-555-439-623,"RESTful API Testing Methodologies: Rationale, Challenges, and Solution Directions",2022-04-26,2022,journal article,Applied Sciences,20763417,MDPI AG,,Adeel Ehsan; Mohammed Ahmad M. E. Abuhaliqa; Cagatay Catal; Deepti Mishra,"<jats:p>Service-oriented architecture has evolved to be the backbone for large-scale integration between different applications and platforms. This concept has led to today’s reality of cloud services. Many of the major business platforms are providing their services to end-users and other companies as well. Companies are crafting ways to allow other businesses fast service integration and to get on board quickly in the market. REST (representational state transfer) has emerged as the standard protocol for implementing and consuming these services, which are called RESTful application programming interfaces (APIs). As the internal details of the RESTful APIs are not completely available during consumption, thorough testing has been a major challenge. Any unprecedented change in the APIs can cause the major failure of service operations, which can cause an organization to face both financial and trust losses. Research efforts have been made to alleviate testing challenges by introducing different frameworks and auto-generating unit test approaches. However, there is still a lack of an overview of the state-of-the-art in RESTful API testing. As such, the objective of this article is to identify, analyze, and synthesize the studies that have been performed related to RESTful APIs’ testing methodologies and unit test generation. With this perspective, a systematic literature review (SLR) study was conducted. In total, 16 papers were retrieved and included based on study selection criteria for in-depth analysis. This SLR discusses and categorizes different problems and solutions related to RESTful APIs’ testing and unit test generation.</jats:p>",12,9,4369,4369,Unit testing; Computer science; Cloud computing; Software engineering; Service (business); Service-oriented architecture; Engineering; World Wide Web; Web service; Software; Operating system; Economics; Economy,auto-test case generation; cloud services; JSON base services; micro services; RESTful APIs; testing frameworks,,,,https://www.mdpi.com/2076-3417/12/9/4369/pdf?version=1650968980 https://doi.org/10.3390/app12094369,http://dx.doi.org/10.3390/app12094369,,10.3390/app12094369,,,2,002-070-025-199-965; 003-679-840-009-714; 007-331-124-177-432; 008-143-300-415-400; 010-128-243-789-954; 011-549-841-786-982; 018-084-120-335-29X; 023-747-920-597-357; 029-871-995-005-551; 041-356-039-519-18X; 044-317-439-321-399; 047-774-998-622-465; 049-082-450-912-85X; 058-456-787-551-690; 066-038-518-597-648; 066-858-097-040-967; 074-108-615-022-492; 086-237-607-637-709; 096-527-671-674-270; 102-172-640-431-239; 110-619-142-027-944; 111-941-423-572-473; 123-949-790-602-357; 129-083-551-140-988; 133-721-122-712-085; 139-475-782-013-295; 151-902-852-264-398; 178-462-709-244-574; 189-048-418-083-817,75,true,cc-by,gold
