Lens ID,Title,Date Published,Publication Year,Publication Type,Source Title,ISSNs,Publisher,Source Country,Author/s,Abstract,Volume,Issue Number,Start Page,End Page,Fields of Study,Keywords,MeSH Terms,Chemicals,Funding,Source URLs,External URL,PMID,DOI,Microsoft Academic ID,PMCID,Citing Patents Count,References,Citing Works Count,Is Open Access,Open Access License,Open Access Colour
080-195-630-278-600,Protocol - realist and meta-narrative evidence synthesis: Evolving Standards (RAMESES),2011-08-16,2011,journal article,BMC medical research methodology,14712288,Springer Science and Business Media LLC,United Kingdom,Trisha Greenhalgh; Geoff Wong; Gill Westhorp; Ray Pawson,"Background; There is growing interest in theory-driven, qualitative and mixed-method approaches to systematic review as an alternative to (or to extend and supplement) conventional Cochrane-style reviews. These approaches offer the potential to expand the knowledge base in policy-relevant areas - for example by explaining the success, failure or mixed fortunes of complex interventions. However, the quality of such reviews can be difficult to assess. This study aims to produce methodological guidance, publication standards and training resources for those seeking to use the realist and/or meta-narrative approach to systematic review.",11,1,115,115,Health care; Systematic review; Narrative; MEDLINE; Quality (business); Protocol (science); Knowledge base; Management science; Delphi method; Medicine,systematic review; realist review or synthesis; meta-narrative review,Delphi Technique; Evaluation Studies as Topic; Humans; Periodicals as Topic/standards; Research Personnel/education; Research Report/standards; Systematic Reviews as Topic,,,https://pubmed.ncbi.nlm.nih.gov/21843376/ https://www.ncbi.nlm.nih.gov/pubmed/21843376 https://link.springer.com/content/pdf/10.1186%2F1471-2288-11-115.pdf https://core.ac.uk/display/30695971 https://www.phc.ox.ac.uk/publications/505555 https://bmcmedresmethodol.biomedcentral.com/articles/10.1186/1471-2288-11-115 https://paperity.org/p/57079247/protocol-realist-and-meta-narrative-evidence-synthesis-evolving-standards-rameses https://doaj.org/article/0b69484756e840efafff280d956e4de5 http://europepmc.org/articles/PMC3173389 http://health-policy-systems.biomedcentral.com/track/pdf/10.1186/1471-2288-11-115?site=health-policy-systems.biomedcentral.com https://link.springer.com/article/10.1186%2F1471-2288-11-115 https://link.springer.com/article/10.1186/1471-2288-11-115/fulltext.html https://qmro.qmul.ac.uk/xmlui/handle/123456789/2199?show=full https://www.biomedcentral.com/1471-2288/11/115/prepub https://core.ac.uk/download/30695971.pdf,http://dx.doi.org/10.1186/1471-2288-11-115,21843376,10.1186/1471-2288-11-115,2146130956,PMC3173389,1,002-674-436-982-636; 006-570-581-630-652; 006-803-762-289-224; 007-041-788-808-481; 007-322-277-565-431; 010-387-032-178-500; 011-071-337-623-412; 011-936-050-848-956; 013-207-337-650-368; 014-113-892-731-676; 015-840-390-184-083; 016-113-618-336-617; 017-275-146-650-939; 017-460-955-908-674; 018-805-648-310-338; 018-945-146-233-875; 021-944-720-672-500; 022-452-056-842-588; 022-837-222-460-532; 023-927-235-747-757; 024-454-193-940-549; 027-335-780-598-36X; 032-007-811-238-243; 038-482-175-044-720; 039-069-274-754-119; 039-554-634-677-25X; 039-856-263-989-564; 041-049-773-563-310; 044-513-473-710-820; 046-579-950-681-490; 048-796-793-720-153; 049-171-667-345-037; 053-365-189-157-444; 068-744-196-540-876; 075-468-697-411-621; 078-455-009-415-706; 093-933-207-532-863; 094-723-796-231-858; 094-768-409-524-44X; 097-890-704-935-979; 113-441-755-249-877; 118-424-842-268-205; 136-428-190-359-144; 142-898-872-010-066; 154-803-337-237-497; 155-635-471-489-536; 173-365-121-341-393; 178-815-943-721-86X,259,true,"CC BY, CC BY-NC-ND",gold
081-148-098-827-101,Computerized and Virtual Reality Cognitive Training for Individuals at High Risk of Cognitive Decline: Systematic Review of the Literature,2014-05-14,2014,journal article,The American journal of geriatric psychiatry : official journal of the American Association for Geriatric Psychiatry,15457214; 10647481,Lippincott Williams and Wilkins,United States,Hannah Coyle; Victoria Traynor; Nadia Solowij,"The aim of this study was to assess the efficacy of cognitive training, specifically computerized cognitive training (CCT) and virtual reality cognitive training (VRCT), programs for individuals living with mild cognitive impairment (MCI) or dementia and therefore at high risk of cognitive decline. After searching a range of academic databases (CINHAL, PSYCinfo, and Web of Science), the studies evaluated (N = 16) were categorized as CCT (N = 10), VRCT (N = 3), and multimodal interventions (N = 3). Effect sizes were calculated, but a meta-analysis was not possible because of the large variability of study design and outcome measures adopted. The cognitive domains of attention, executive function, and memory (visual and verbal) showed the most consistent improvements. The positive effects on psychological outcomes (N = 6) were significant reductions on depressive symptoms (N = 3) and anxiety (N = 2) and improved perceived use of memory strategy (N = 1). Assessments of activities of daily living demonstrated no significant improvements (N = 8). Follow-up studies (N = 5) demonstrated long-term improvements in cognitive and psychological outcomes (N = 3), and the intervention groups showed a plateau effect of cognitive functioning compared with the cognitive decline experienced by control groups (N = 2). CCT and VRCT were moderately effective in long-term improvement of cognition for those at high risk of cognitive decline. Total intervention time did not mediate efficacy. Future research needs to improve study design by including larger samples, longitudinal designs, and a greater range of outcome measures, including functional and quality of life measures, to assess the wider effect of cognitive training on individuals at high risk of cognitive decline.",23,4,335,359,Cognitive skill; Psychology; Cognition; Psychological intervention; Dementia; Cognitive training; Cognitive decline; Anxiety; Clinical psychology; Activities of daily living,Alzheimer; Systematic review; cognitive training; computer; dementia; mild cognitive impairment; virtual reality; systematic  review  literature  high  risk  individuals  decline  training  cognitive  reality  virtual  computerized Disciplines systematic review; Alzheimer's; virtual reality systematic review; Alzheimer's,"Cognitive Behavioral Therapy/methods; Cognitive Dysfunction/therapy; Dementia/therapy; Humans; Therapy, Computer-Assisted; Treatment Outcome; User-Computer Interface",,Illawarra Health and Medical Research Institute,https://core.ac.uk/display/37023026 https://ro.uow.edu.au/cgi/viewcontent.cgi?article=2543&context=sspapers https://www.ncbi.nlm.nih.gov/pubmed/24998488 https://www.sciencedirect.com/science/article/pii/S1064748114001390 https://ro.uow.edu.au/sspapers/1544/ https://pubmed.ncbi.nlm.nih.gov/24998488/ https://europepmc.org/article/MED/24998488,http://dx.doi.org/10.1016/j.jagp.2014.04.009,24998488,10.1016/j.jagp.2014.04.009,2047680862,,1,000-924-183-805-215; 001-725-517-732-744; 002-158-919-714-563; 005-194-965-949-934; 006-210-101-833-305; 008-814-703-886-471; 009-351-591-808-222; 009-372-079-115-059; 009-578-625-803-953; 009-674-130-017-360; 011-688-543-029-529; 011-900-041-971-093; 014-861-447-105-881; 014-997-977-227-248; 015-334-868-131-246; 016-013-141-828-279; 016-198-841-742-293; 017-298-456-037-701; 018-372-950-845-754; 018-441-204-713-529; 020-635-371-988-009; 021-193-762-787-133; 021-577-966-039-711; 021-590-687-681-927; 022-163-373-531-934; 022-452-056-842-588; 023-190-658-633-555; 023-697-844-373-331; 024-018-081-266-341; 024-023-094-073-879; 024-881-534-756-296; 025-921-219-887-720; 026-173-869-678-598; 027-072-727-314-987; 028-288-943-462-211; 030-854-595-892-236; 031-623-426-573-873; 033-122-102-077-205; 034-408-766-290-180; 037-005-360-997-509; 037-660-982-915-88X; 039-737-308-654-150; 042-432-953-198-478; 042-545-263-646-860; 042-692-408-240-491; 047-179-624-687-890; 048-536-112-681-339; 048-818-190-731-579; 049-070-490-885-675; 050-122-830-225-743; 053-890-238-199-401; 057-889-241-017-24X; 058-697-904-500-786; 061-360-190-719-35X; 061-666-249-569-686; 065-253-572-608-059; 067-715-519-706-692; 070-375-039-386-896; 070-389-087-563-583; 072-250-428-198-649; 075-792-985-826-148; 076-533-330-841-371; 077-345-961-973-491; 079-414-632-973-107; 080-178-538-116-719; 080-887-691-334-423; 083-505-301-667-234; 083-595-756-427-482; 086-528-145-400-263; 091-944-801-064-346; 095-100-968-176-679; 102-961-144-062-886; 104-725-263-687-828; 110-268-743-821-594; 110-652-373-774-343; 112-491-718-157-489; 112-636-578-912-618; 117-732-506-991-515; 117-840-200-255-361; 137-522-171-507-938; 137-606-015-579-081; 163-808-892-727-697; 173-390-710-223-111,239,true,,green
081-800-283-559-908,Safety in Vehicle Platooning: A Systematic Literature Review,,2017,journal article,IEEE Transactions on Intelligent Transportation Systems,15249050; 15580016,Institute of Electrical and Electronics Engineers (IEEE),United States,Jakob Axelsson,"Vehicle platooning has been studied for several decades, with objectives such as improved traffic throughput on existing infrastructure or reduced energy consumption. All the time, it has been apparent that safety is an important issue. However, there are no comprehensive analyses of what is needed to achieve safety in platooning, but only scattered pieces of information. This paper investigates, through a systematic literature review, what is known about safety for platooning, including what analysis methods have been used, what hazards and failures have been identified, and solution elements that have been proposed to improve safety. Based on this, a gap analysis is performed to identify outstanding questions that need to be addressed in future research. These include dealing with a business ecosystem of actors that cooperate and compete around platooning, refining safety analysis methods to make them suitable for systems-of-systems, dealing with variability in vehicles, and finding solutions to various human factors issues.",18,5,1033,1045,Engineering; Throughput (business); Vehicle engineering; Business ecosystem; Systematic review; Transport engineering; Systems analysis; Energy consumption; Gap analysis; In vehicle,,,,"Vinnova, the Swedish Agency for Innovation Systems; Volvo Group",https://trid.trb.org/view/1466301 http://www.diva-portal.org/smash/record.jsf?pid=diva2:1104429 https://ieeexplore.ieee.org/document/7547317/ https://dl.acm.org/doi/10.1109/TITS.2016.2598873 https://dblp.uni-trier.de/db/journals/tits/tits18.html#Axelsson17 https://doi.org/10.1109/TITS.2016.2598873 http://ieeexplore.ieee.org/document/7547317/,http://dx.doi.org/10.1109/tits.2016.2598873,,10.1109/tits.2016.2598873,2511722497,,1,003-644-358-082-016; 004-783-862-645-806; 006-336-792-820-813; 035-374-984-829-205; 037-323-617-976-96X; 042-873-537-831-338; 042-885-018-955-812; 045-693-341-460-61X; 046-583-483-475-445; 051-422-719-647-711; 051-607-250-632-520; 052-902-675-243-043; 055-591-452-043-734; 056-086-433-178-763; 056-236-223-261-869; 056-363-377-778-176; 064-407-905-087-70X; 066-017-624-730-868; 071-878-836-294-733; 074-141-719-314-339; 075-081-825-499-159; 088-665-925-876-207; 090-838-390-400-687; 094-463-250-218-565; 095-740-267-674-582; 101-176-260-587-612; 103-269-397-662-658; 104-257-112-902-266; 105-743-577-573-706; 109-971-859-783-146; 111-116-600-420-033; 117-773-392-809-586; 119-415-081-185-916; 122-465-355-505-504; 122-568-182-409-064; 125-415-114-371-086; 128-484-149-730-251; 133-157-600-568-352; 137-132-448-326-766; 144-141-226-799-451; 145-690-932-705-772; 165-639-338-896-002; 175-557-230-067-767; 176-487-231-358-916; 181-345-784-592-435,169,true,,green
082-550-981-052-108,"The Role of AI, Machine Learning, and Big Data in Digital Twinning: A Systematic Literature Review, Challenges, and Opportunities",,2021,journal article,IEEE Access,21693536,Institute of Electrical and Electronics Engineers (IEEE),United States,M. Mazhar Rathore; Syed Attique Shah; Dhirendra Shukla; Elmahdi Bentafat; Spiridon Bakiras,"Digital twinning is one of the top ten technology trends in the last couple of years, due to its high applicability in the industrial sector. The integration of big data analytics and artificial intelligence/machine learning (AI-ML) techniques with digital twinning, further enriches its significance and research potential with new opportunities and unique challenges. To date, a number of scientific models have been designed and implemented related to this evolving topic. However, there is no systematic review of digital twinning, particularly focusing on the role of AI-ML and big data, to guide the academia and industry towards future developments. Therefore, this article emphasizes the role of big data and AI-ML in the creation of digital twins (DTs) or DT-based systems for various industrial applications, by highlighting the current state-of-the-art deployments. We performed a systematic review on top of multidisciplinary electronic bibliographic databases, in addition to existing patents in the field. Also, we identified development-tools that can facilitate various levels of the digital twinning. Further, we designed a big data driven and AI-enriched reference architecture that leads developers to a complete DT-enabled system. Finally, we highlighted the research potential of AI-ML for digital twinning by unveiling challenges and current opportunities.",9,,32030,32052,Machine learning; Artificial intelligence; Systematic review; Multidisciplinary approach; Field (computer science); Computer science; Big data,,,,,https://dblp.uni-trier.de/db/journals/access/access9.html#RathoreSSBB21 https://doi.org/10.1109/ACCESS.2021.3060863 https://ieeexplore.ieee.org/document/9359733 https://doaj.org/article/2fc31308690143039e904cc1a6b94569,http://dx.doi.org/10.1109/access.2021.3060863,,10.1109/access.2021.3060863,3132985895,,4,000-506-047-448-290; 001-099-762-664-970; 001-323-458-581-998; 003-085-532-516-863; 003-794-813-708-249; 004-709-115-024-189; 006-077-177-575-760; 006-386-503-651-060; 006-625-302-369-283; 006-758-936-571-984; 007-177-647-420-62X; 007-825-196-973-18X; 008-307-273-883-003; 008-380-087-311-555; 008-576-237-927-473; 008-799-987-965-450; 009-050-178-150-106; 011-018-575-862-58X; 011-317-188-807-054; 012-289-024-722-32X; 013-058-817-591-030; 013-080-628-209-649; 013-170-091-591-890; 013-479-351-385-563; 013-573-509-904-732; 014-390-091-259-098; 014-944-859-039-95X; 015-855-206-819-440; 016-212-186-183-349; 016-640-302-043-919; 017-234-536-779-622; 018-526-234-270-434; 018-908-049-809-219; 020-346-727-031-267; 020-768-340-548-376; 021-091-245-927-612; 022-422-352-396-829; 023-364-673-493-287; 023-909-550-846-115; 024-697-913-965-653; 025-534-951-743-277; 026-894-865-638-396; 027-799-782-138-717; 030-471-937-653-772; 030-583-544-764-54X; 033-154-575-649-871; 033-885-613-154-562; 034-253-824-085-908; 035-358-475-696-790; 035-546-565-325-481; 036-087-894-030-592; 036-811-772-455-44X; 037-709-595-285-552; 040-547-472-782-240; 040-905-692-880-894; 042-670-917-579-71X; 043-171-719-216-547; 044-710-432-698-135; 045-251-798-551-257; 045-430-283-330-141; 046-546-595-927-01X; 046-834-560-408-718; 046-868-458-183-431; 048-364-990-517-93X; 048-849-788-613-544; 049-362-903-994-963; 051-055-504-877-518; 051-752-296-601-894; 052-297-979-829-577; 055-043-157-532-212; 055-594-150-020-899; 059-240-342-551-392; 059-786-079-109-47X; 060-699-927-237-790; 061-542-829-898-81X; 066-502-753-861-097; 067-334-623-081-03X; 068-769-555-027-048; 068-819-866-283-500; 071-152-595-696-535; 071-369-503-712-217; 072-779-621-223-025; 073-008-731-456-955; 073-060-212-503-957; 074-456-796-365-929; 077-718-475-151-539; 079-126-758-213-385; 080-004-114-509-72X; 080-081-113-977-141; 081-248-118-624-570; 082-074-081-798-794; 084-314-448-460-89X; 084-539-901-160-631; 085-360-548-865-679; 085-661-844-387-826; 085-700-776-414-798; 093-336-571-348-821; 093-960-924-523-154; 094-869-860-724-617; 095-096-161-740-778; 095-637-572-938-905; 097-485-318-728-585; 098-297-567-620-004; 099-085-864-702-059; 099-421-718-465-868; 102-498-784-946-063; 105-941-642-967-558; 106-753-936-955-294; 110-625-556-895-769; 112-970-208-055-827; 114-912-318-297-058; 117-966-841-071-670; 118-344-159-936-803; 127-597-043-339-283; 128-353-952-787-564; 128-416-009-597-79X; 131-206-117-846-231; 134-267-591-969-86X; 134-278-439-214-933; 137-250-459-674-747; 137-320-213-389-496; 138-110-628-166-092; 138-727-786-944-793; 141-049-530-527-580; 149-375-705-640-142; 151-162-978-043-178; 152-664-153-882-037; 152-908-258-985-890; 157-973-569-436-744; 159-607-829-674-443; 163-637-148-392-805; 180-476-097-706-561; 194-581-602-143-038; 198-415-864-822-606,489,true,"CC BY, CC BY-NC-ND",gold
085-056-587-927-434,Text Mining for Big Data Analysis in Financial Sector: A Literature Review,2019-02-28,2019,journal article,Sustainability,20711050,MDPI AG,Switzerland,Mirjana Pejić Bach; Živko Krstić; Sanja Seljan; Lejla Turulja,"Big data technologies have a strong impact on different industries, starting from the last decade, which continues nowadays, with the tendency to become omnipresent. The financial sector, as most of the other sectors, concentrated their operating activities mostly on structured data investigation. However, with the support of big data technologies, information stored in diverse sources of semi-structured and unstructured data could be harvested. Recent research and practice indicate that such information can be interesting for the decision-making process. Questions about how and to what extent research on data mining in the financial sector has developed and which tools are used for these purposes remains largely unexplored. This study aims to answer three research questions: (i) What is the intellectual core of the field? (ii) Which techniques are used in the financial sector for textual mining, especially in the era of the Internet, big data, and social media? (iii) Which data sources are the most often used for text mining in the financial sector, and for which purposes? In order to answer these questions, a qualitative analysis of literature is carried out using a systematic literature review, citation and co-citation analysis.",11,5,1277,,The Internet; Business; Order (exchange); Systematic review; Data science; Citation; Unstructured data; Process (engineering); Social media; Big data,big data; text mining; financial sector; data science; language,,,,https://www.mdpi.com/2071-1050/11/5/1277 https://pubag.nal.usda.gov/catalog/6528541 https://ideas.repec.org/a/gam/jsusta/v11y2019i5p1277-d209769.html https://dabar.srce.hr/islandora/object/ffzg%3A710 https://repozitorij.unizg.hr/islandora/object/ffzg%3A710 https://www.mdpi.com/2071-1050/11/5/1277/pdf https://repozitorij.ffzg.unizg.hr/islandora/object/ffzg:710 https://www.bib.irb.hr/987464 https://core.ac.uk/download/250123624.pdf,http://dx.doi.org/10.3390/su11051277,,10.3390/su11051277,2916349291,,3,000-144-836-942-958; 000-956-710-622-899; 002-174-711-315-870; 005-193-496-763-816; 005-698-012-833-552; 006-399-176-500-152; 007-257-837-027-909; 007-970-938-169-571; 008-198-487-395-099; 008-303-055-735-856; 008-659-699-155-07X; 008-702-782-690-429; 009-697-512-949-157; 014-711-631-488-436; 015-652-468-967-216; 017-300-737-144-757; 017-503-405-495-948; 018-481-487-803-319; 018-606-032-998-099; 020-039-682-314-975; 020-172-006-261-727; 020-282-869-145-534; 020-724-723-667-87X; 022-486-017-682-206; 022-823-390-114-498; 022-999-828-221-677; 023-040-827-785-856; 023-922-299-055-466; 027-070-514-735-789; 028-356-909-643-424; 029-572-749-254-94X; 030-898-431-368-029; 031-269-477-476-804; 043-000-135-018-065; 043-080-699-619-299; 045-108-562-087-679; 052-724-876-087-471; 056-079-975-939-998; 056-952-559-351-611; 057-040-097-643-496; 057-197-038-347-561; 057-577-945-717-268; 057-786-111-512-195; 058-126-892-124-306; 059-300-969-491-735; 060-484-630-631-000; 060-633-209-154-761; 066-695-427-599-541; 068-422-338-687-629; 068-744-196-540-876; 071-718-439-192-116; 079-581-520-293-682; 080-401-913-719-722; 081-104-113-973-12X; 084-966-365-801-701; 086-499-826-055-469; 087-012-636-922-356; 087-950-186-762-260; 089-671-301-409-181; 095-450-422-324-801; 095-720-687-170-980; 096-865-004-012-005; 101-920-091-044-248; 108-867-611-312-707; 113-234-864-785-642; 124-928-196-113-888; 128-897-230-344-978; 131-717-934-584-176; 132-401-716-791-05X; 135-728-981-872-014; 137-764-690-861-287; 148-395-744-852-422; 157-348-867-434-612; 163-655-731-123-177; 173-711-713-248-028; 175-097-556-084-626; 175-878-295-920-64X; 185-376-759-082-553,158,true,cc-by,gold
