Lens ID,Title,Date Published,Publication Year,Publication Type,Source Title,ISSNs,Publisher,Source Country,Author/s,Abstract,Volume,Issue Number,Start Page,End Page,Fields of Study,Keywords,MeSH Terms,Chemicals,Funding,Source URLs,External URL,PMID,DOI,Microsoft Academic ID,PMCID,Citing Patents Count,References,Citing Works Count,Is Open Access,Open Access License,Open Access Colour
023-890-366-921-907,The Future of Mine Safety: A Comprehensive Review of Anti-Collision Systems Based on Computer Vision in Underground Mines.,2023-04-26,2023,journal article,"Sensors (Basel, Switzerland)",14248220; 14243210,Multidisciplinary Digital Publishing Institute (MDPI),Switzerland,Mohamed Imam; Karim Baïna; Youness Tabii; El Mostafa Ressami; Youssef Adlaoui; Intissar Benzakour; El Hassan Abdelwahed,"Underground mining operations present critical safety hazards due to limited visibility and blind areas, which can lead to collisions between mobile machines and vehicles or persons, causing accidents and fatalities. This paper aims to survey the existing literature on anti-collision systems based on computer vision for pedestrian detection in underground mines, categorize them based on the types of sensors used, and evaluate their effectiveness in deep underground environments. A systematic review of the literature was conducted following the PRISMA (Preferred Reporting Items for Systematic Reviews and Meta-Analyses) guidelines to identify relevant research work on anti-collision systems for underground mining. The selected studies were analyzed and categorized based on the types of sensors used and their advantages and limitations in deep underground environments. This study provides an overview of the anti-collision systems used in underground mining, including cameras and lidar sensors, and their effectiveness in detecting pedestrians in deep underground environments. Anti-collision systems based on computer vision are effective in reducing accidents and fatalities in underground mining operations. However, their performance is influenced by factors, such as lighting conditions, sensor placement, and sensor range. The findings of this study have significant implications for the mining industry and could help improve safety in underground mining operations. This review and analysis of existing anti-collision systems can guide mining companies in selecting the most suitable system for their specific needs, ultimately reducing the risk of accidents and fatalities.",23,9,4294,4294,Collision; Visibility; Categorization; Pedestrian; Underground mining (soft rock); Transport engineering; Engineering; Computer science; Risk analysis (engineering); Construction engineering; Computer security; Artificial intelligence; Coal mining; Physics; Optics; Medicine; Coal; Waste management,anti-collision systems; artificial intelligence; collision avoidance; computer vision; deep learning; pedestrian detection; underground mines,,,"the National Center for Scientific and Technical Research of Morocco (CNRST) (30%); Moroccan Foundation for Advanced Science, Innovation and Research (35%); Reminex (Research Development, Engineering and Project Delivery arm), Managem Group (35%)",https://www.mdpi.com/1424-8220/23/9/4294/pdf?version=1682553855 https://doi.org/10.3390/s23094294 https://pmc.ncbi.nlm.nih.gov/articles/PMC10181612/pdf/sensors-23-04294.pdf https://www.ncbi.nlm.nih.gov/pmc/articles/10181612,http://dx.doi.org/10.3390/s23094294,37177497,10.3390/s23094294,,PMC10181612,1,001-081-102-328-618; 003-001-274-888-523; 003-019-320-166-472; 003-202-006-354-243; 003-962-772-083-771; 007-551-546-209-486; 007-713-694-212-977; 007-855-668-586-872; 008-909-533-268-049; 010-706-959-248-733; 012-393-605-740-577; 016-929-723-111-024; 017-300-737-144-757; 019-870-384-588-48X; 020-367-649-345-772; 020-399-232-353-079; 021-196-082-419-031; 021-360-232-245-594; 022-255-405-556-203; 022-345-471-654-986; 029-801-926-084-563; 029-807-313-878-595; 030-123-054-298-550; 032-306-796-034-92X; 036-309-580-675-719; 041-170-516-734-590; 042-577-125-052-956; 045-122-309-053-409; 046-118-303-495-913; 047-857-343-146-887; 048-254-076-918-785; 049-281-150-810-183; 049-805-937-056-967; 050-192-680-963-313; 050-616-746-518-068; 050-669-412-625-372; 051-910-313-912-530; 061-816-318-303-269; 062-038-330-414-47X; 062-919-307-123-340; 064-644-369-846-299; 066-017-624-730-868; 066-300-856-818-117; 067-626-525-647-065; 068-159-301-987-235; 068-870-127-511-198; 068-880-641-415-19X; 069-068-954-482-667; 069-721-193-263-580; 073-830-217-153-325; 075-845-619-106-446; 076-275-354-258-536; 079-915-166-999-873; 080-258-644-888-608; 080-734-559-175-907; 080-796-419-663-830; 084-215-653-576-935; 089-140-318-765-542; 090-300-828-894-403; 090-370-531-162-619; 090-601-588-050-322; 096-574-016-771-05X; 096-613-262-582-552; 098-926-109-358-108; 105-535-636-173-184; 110-452-122-368-707; 111-714-532-608-180; 113-683-983-301-034; 117-465-924-665-014; 120-529-529-340-453; 123-072-690-251-619; 129-499-227-209-831; 132-523-283-328-70X; 138-202-953-668-334; 141-057-567-674-453; 145-184-696-414-823; 148-767-337-200-173; 152-574-677-946-397; 153-846-891-692-597; 155-371-998-560-689; 157-153-306-994-046; 162-596-684-228-326; 167-693-771-308-283; 177-255-327-120-295; 179-276-910-330-869; 186-592-383-245-491,46,true,cc-by,gold
025-231-372-103-744,The voting model for people search,2009-06-25,2009,journal article,ACM SIGIR Forum,01635840,Association for Computing Machinery (ACM),United States,Craig Macdonald,"An expert search engine aims to assist users with their expertise need - instead of ranking documents, possible candidate experts in an enterprise organisation with relevant expertise are suggested in response to a query. This thesis investigates people search tasks such as expert search, and how persons can be ranked in response to a query, such that those with relevant expertise to the query are ranked first. The expertise areas of the persons are represented by documentary evidence of expertise, known as candidate profiles. The statement of this research work is that people search tasks in general and expert search in particular can be successfully and effectively modelled using a voting paradigm.",43,1,73,73,Ranking; Information retrieval; Data science; Statement (computer science); Computer science; Voting; Documentary evidence; Search engine,,,,,http://core.ac.uk/display/21031814 https://theses.gla.ac.uk/609/ https://dblp.uni-trier.de/db/journals/sigir/sigir43.html#Macdonald09 https://ethos.bl.uk/OrderDetails.do?uin=uk.bl.ethos.495360 https://dl.acm.org/doi/10.1145/1670598.1670616 https://core.ac.uk/download/pdf/40053805.pdf,http://dx.doi.org/10.1145/1670598.1670616,,10.1145/1670598.1670616,2062428643,,2,,34,true,,green
025-707-818-700-086,Sustainability of Low Carbon City Initiatives in China: A Comprehensive Literature Review,2019-08-11,2019,journal article,Sustainability,20711050,MDPI AG,Switzerland,Garfield Wayne Hunter; Gideon Sagoe; Daniele Vettorato; Ding Jiayu,"Low carbon city (LCC) has emerged as the latest sustainable urbanism strategy in China as a response to climate change impacts. Yet, minimal scholarships have explored the sustainability of the urban planning model towards understanding the complexity of the components. Using a two-step triangulation approach, this paper presents a structured overview of the LCC initiative in China as it relates to the transition to a sustainability paradigm. The data collection approach includes a comprehensive review of 238 articles on LCC to identify and categorize LCC components. Furthermore, discourse and framing analysis was used to develop and synthesize a conceptual framework for assimilating the components into four core sustainable development principles: Integration, implementation, equity, and scalability and replicability. The results indicate that LCC development in China is bias towards economic and environmental technological innovations and strategies. Additionally, several critical sustainability issues of LCC pilots were identified. These include a lack of social equity planning concerns for the most vulnerable population, dearth of social reforms that cater to lifestyle and behavioral change, top-down planning and decision-making processes, a technocratic rationalization planning approach, inconsistent LCC targets on inter-generational justice concerns, absence of an effective national “sharing and learning” city–city network system, and several barriers to implementation. We conclude that the applied theoretical and conceptual inquiry into the field of LCC is pertinent to mitigate climate change and achieve sustainable urban development.",11,16,4342,,Conceptual framework; Business; Framing (social sciences); Technocracy; Social equality; Sustainable urbanism; Urban planning; Sustainable development; Sustainability; Environmental planning,sustainable development; Chinese literature; low carbon city; climate change; mitigation; urban planning; systematic review; equity; sustainable energy; China,,,,https://www.mdpi.com/2071-1050/11/16/4342 https://www.mendeley.com/catalogue/aa181675-2543-3e67-9611-7ad93069f54a/ https://ideas.repec.org/a/gam/jsusta/v11y2019i16p4342-d256743.html https://www.mdpi.com/2071-1050/11/16/4342/pdf https://EconPapers.repec.org/RePEc:gam:jsusta:v:11:y:2019:i:16:p:4342-:d:256743,http://dx.doi.org/10.3390/su11164342,,10.3390/su11164342,2967614609,,1,000-162-717-037-137; 000-800-345-413-165; 001-404-602-820-178; 004-169-121-919-427; 004-971-508-552-795; 005-063-701-768-873; 005-111-622-764-51X; 005-590-264-713-050; 006-106-895-308-43X; 007-861-017-691-960; 008-279-879-909-145; 008-537-238-199-816; 008-546-269-490-459; 009-082-532-211-132; 009-092-836-184-945; 009-872-742-305-176; 009-943-149-998-210; 010-777-176-415-230; 011-013-229-444-518; 011-081-697-538-448; 011-305-075-963-765; 011-914-912-627-659; 012-132-194-747-954; 013-426-740-797-036; 013-842-864-853-880; 016-019-956-528-004; 016-417-714-708-17X; 016-752-356-583-810; 017-386-687-643-960; 020-160-648-782-729; 020-683-073-567-27X; 021-117-477-052-459; 021-689-958-139-815; 022-824-786-189-079; 023-039-246-279-594; 023-316-398-599-581; 024-144-254-159-470; 025-390-848-885-621; 026-093-358-061-166; 026-191-747-590-87X; 026-689-397-929-519; 026-790-654-575-261; 027-186-937-456-874; 027-715-182-534-379; 030-186-397-191-200; 030-187-229-524-453; 030-940-414-664-586; 032-146-230-321-655; 032-957-538-368-942; 033-776-813-122-001; 034-303-797-031-586; 034-940-336-936-341; 035-178-853-848-221; 036-301-670-621-70X; 037-265-651-360-613; 037-384-978-256-668; 037-596-077-544-990; 038-570-468-172-70X; 038-772-897-697-585; 039-127-212-318-592; 039-300-628-806-115; 039-473-997-020-068; 040-797-424-054-283; 041-783-485-823-807; 042-413-116-067-178; 043-036-787-047-050; 045-004-426-296-111; 046-337-591-538-171; 046-374-119-472-212; 046-488-786-107-214; 046-712-147-125-903; 046-886-177-552-420; 047-831-404-289-73X; 049-160-809-955-380; 050-030-402-239-075; 052-822-486-888-969; 054-112-790-945-530; 054-344-556-083-402; 054-448-634-322-795; 054-473-907-487-822; 054-521-594-957-734; 056-327-167-297-122; 057-324-873-339-572; 057-619-682-165-192; 057-639-106-236-966; 057-996-039-456-162; 059-730-932-597-982; 060-348-385-115-013; 061-566-591-431-879; 061-637-190-778-228; 062-309-467-610-078; 063-372-622-121-556; 064-850-449-906-930; 064-931-833-261-764; 068-995-285-841-466; 069-892-279-035-366; 072-745-713-846-101; 072-897-881-970-286; 073-436-810-692-156; 073-738-311-640-97X; 074-992-578-367-247; 075-560-394-775-446; 076-134-117-731-44X; 076-622-500-387-218; 077-117-424-909-537; 077-162-751-813-340; 077-365-615-249-052; 077-910-579-004-955; 077-980-285-923-642; 079-341-964-655-274; 079-406-843-733-728; 079-872-234-227-297; 082-883-078-498-707; 084-785-228-848-623; 084-969-700-345-189; 085-465-686-339-619; 085-609-783-968-484; 085-982-406-356-04X; 088-617-769-258-32X; 089-558-323-465-868; 089-849-010-199-626; 090-009-206-703-170; 090-802-337-627-714; 090-923-891-889-624; 091-627-712-352-179; 091-701-558-173-721; 092-100-140-473-527; 092-903-766-195-695; 094-303-387-370-231; 098-192-808-027-519; 098-499-946-519-93X; 099-545-687-558-037; 100-009-505-586-796; 100-124-764-813-029; 103-776-880-849-814; 105-778-057-469-059; 106-781-380-550-213; 109-482-309-634-026; 109-514-799-364-033; 113-244-834-416-415; 118-209-993-410-027; 121-265-801-754-576; 122-300-477-049-505; 123-151-219-681-858; 123-362-101-774-792; 123-895-362-350-156; 125-441-864-624-766; 125-749-138-489-097; 127-242-795-501-21X; 127-877-156-838-27X; 129-653-061-689-996; 131-512-310-625-268; 132-434-085-158-653; 133-254-385-344-202; 135-416-691-465-872; 137-092-254-486-688; 139-155-961-233-485; 139-396-583-979-964; 139-687-735-045-627; 140-492-954-682-218; 147-539-344-029-633; 147-742-942-814-264; 148-765-187-970-092; 151-980-647-925-437; 152-582-720-444-422; 156-735-722-082-461; 157-646-006-247-837; 169-226-585-001-309; 174-798-434-864-566; 176-428-280-747-387; 176-778-855-092-394; 180-186-741-811-181; 185-477-076-958-256; 193-485-143-304-595,45,true,cc-by,gold
028-284-207-945-233,"Abstracts from the 37th Annual Meeting of the Society of General Internal Medicine, 2014, San Diego, CA, USA.",2014-04-16,2014,journal article,Journal of general internal medicine,15251497; 08848734,Springer Science and Business Media LLC,Germany,Kristina M Cordasco; Jessica Zuchowski; Alison B Hamilton; Herschel Knapp; Joann O Saavedra; Donna L Washington,,29 Suppl 1,S1,1,545,Medicine; MEDLINE; Family medicine; Law; Political science,,Animals; Humans; Internal Medicine,,,https://link.springer.com/content/pdf/10.1007%2Fs11606-014-2834-9.pdf https://doi.org/10.1007/s11606-014-2834-9,http://dx.doi.org/10.1007/s11606-014-2834-9,24737224,10.1007/s11606-014-2834-9,,PMC4429500,2,,18,true,implied-oa,green
028-848-908-144-376,A survey of Web clustering engines,2009-07-30,2009,journal article,ACM Computing Surveys,03600300; 15577341,Association for Computing Machinery (ACM),United States,Claudio Carpineto; Stanislaw Osinski; Giovanni Romano; Dawid Weiss,"Web clustering engines organize search results by topic, thus offering a complementary view to the flat-ranked list returned by conventional search engines. In this survey, we discuss the issues that must be addressed in the development of a Web clustering engine, including acquisition and preprocessing of search results, their clustering and visualization. Search results clustering, the core of the system, has specific requirements that cannot be addressed by classical clustering algorithms. We emphasize the role played by the quality of the cluster labels as opposed to optimizing only the clustering structure. We highlight the main characteristics of a number of existing Web clustering engines and also discuss how to evaluate their retrieval performance. Some directions for future research are finally presented.",41,3,17,38,The Internet; Data mining; Metasearch engine; Document clustering; Information retrieval; Suffix tree clustering; Visualization; Conceptual clustering; Computer science; Cluster analysis; Search engine,H.3.3 [Information Storage and Retrieval]: Information Search and Retrieval-Clustering Algorithms; Experimentation; Measurement; Performance Information retrieval; meta search engines; text clustring; search results clustering; user interfaces,,,,https://www.hse.ru/data/2012/12/20/1303727872/1.pdf http://search.fub.it/claudio/pdf/CSUR09.pdf https://dl.acm.org/doi/10.1145/1541880.1541884 https://doi.org/10.1145/1541880.1541884 http://portal.acm.org/citation.cfm?id=1541880.1541884 https://dblp.uni-trier.de/db/journals/csur/csur41.html#CarpinetoORW09,http://dx.doi.org/10.1145/1541880.1541884,,10.1145/1541880.1541884,2095478124,,2,000-846-968-323-768; 001-159-184-276-045; 002-053-712-239-477; 002-816-953-202-467; 004-215-653-516-922; 005-625-152-951-641; 006-550-633-459-546; 006-771-672-346-287; 008-092-217-460-860; 009-216-342-229-391; 009-767-155-120-316; 010-656-047-738-040; 011-228-272-047-962; 011-239-551-972-601; 011-275-711-687-702; 011-333-285-939-024; 013-784-592-878-255; 013-843-076-427-762; 016-290-420-123-824; 016-881-303-215-951; 017-785-387-817-453; 021-004-760-971-150; 021-778-144-697-353; 024-073-899-182-39X; 024-836-919-891-541; 026-007-376-875-24X; 026-037-507-389-733; 026-935-092-586-560; 028-244-709-373-128; 031-489-171-099-57X; 037-399-661-582-07X; 037-504-469-849-303; 039-262-115-717-171; 039-501-998-261-360; 040-148-545-247-997; 040-150-949-658-47X; 040-487-531-490-60X; 042-325-334-204-361; 043-910-347-386-559; 044-395-575-720-718; 044-477-985-619-160; 044-968-646-434-387; 045-010-946-309-482; 045-319-398-508-266; 045-973-842-647-120; 046-199-101-215-116; 048-695-036-672-593; 049-540-723-980-846; 051-111-599-889-178; 052-900-924-172-321; 053-483-224-140-996; 053-616-334-003-198; 054-126-597-369-831; 055-084-425-950-818; 057-247-077-679-115; 058-124-696-428-75X; 058-447-951-116-347; 059-426-960-272-978; 062-139-359-148-77X; 063-621-039-567-029; 063-897-089-996-769; 064-731-873-628-843; 067-632-394-567-700; 068-383-899-657-279; 070-657-820-502-694; 070-701-403-505-240; 070-752-688-383-952; 072-908-183-067-509; 074-675-353-790-563; 076-679-872-147-108; 077-465-700-336-677; 077-685-255-011-819; 078-757-495-723-678; 085-688-290-377-190; 085-994-661-733-306; 088-884-683-120-529; 088-912-120-869-857; 090-108-252-351-456; 094-813-901-965-984; 096-614-348-149-375; 098-037-265-553-060; 102-289-021-455-716; 104-393-508-295-024; 105-274-214-404-445; 106-406-858-675-097; 107-362-112-311-662; 107-601-770-966-324; 108-776-737-032-125; 109-171-869-388-988; 110-964-710-349-077; 111-809-237-052-767; 112-501-291-256-432; 114-371-373-847-99X; 115-331-671-580-12X; 115-598-304-483-830; 116-860-932-349-277; 120-072-322-429-12X; 121-001-950-491-969; 123-137-942-742-700; 133-507-713-580-195; 138-017-226-621-826; 142-183-003-083-010; 144-849-331-582-645; 145-872-298-621-500; 147-145-412-992-690; 153-564-983-723-850; 158-355-644-218-260; 161-432-755-297-656; 162-963-043-628-620; 168-493-303-499-04X; 173-423-594-988-157; 174-958-996-003-442; 184-395-145-403-276; 194-131-376-222-142; 196-964-073-048-06X; 199-458-181-651-197,384,true,,green
031-826-010-496-00X,A review of LED lamp recycling process from the 10 R strategy perspective,,2021,journal article,Sustainable Production and Consumption,23525509,Elsevier BV,Netherlands,S.M. Mizanur Rahman; Stéphane Pompidou; Thècle Alix; Bertrand Laratte,"Abstract Recycling LED lamp technology requires a change from the traditional bulk material-based recovery process. Unlike preceding lighting technology, LED lamps cannot be recycled to meet the regulatory minimum recycling rate of 80% due to multi-materials, including small quantity precious metals, which reduce the sorting efficiency. Therefore, it is crucial to understand how the challenges have been approached in the scientific literature in this context. The review article investigates the circular solutions to the challenges that the end of life LED lamp management is facing. This review applies PRISMA systematic literature review to locate the relevant studies and investigate whether the proposed processes can increase the recycling rate, using the circular economy strategy as a theoretical framework. Several recycling processes have been proposed in the academic literature. However, the techniques have not been evaluated against the circular economy strategies to identify current gaps and possible ways. This review attempts to fill this gap by assessing the current approaches against the 10 R strategies (refuse, rethink, reconsider, reuse, repair, refurbish, remanufacture, repurpose, recycle and recover). The study suggests that recycling is the dominant strategy, but the higher R strategies such as reuse, repair, and remanufacture have also been discussed as potential life extension strategies. The study concludes by proposing an integrated treatment approach that focuses on higher R's (reuse, repair, refurbish, remanufacture and repurpose) instead of focusing on lower R's (e.g., recycling).",28,,1178,1191,LED lamp; Risk analysis (engineering); Strategic dominance; Reuse; Circular economy; Context (language use); Scientific literature; Computer science; Process (engineering); Life extension,,,,University of Bordeaux; European Institute of Innovation and Technology,https://www.sciencedirect.com/science/article/pii/S2352550921002244 https://sam.ensam.eu/handle/10985/20696,http://dx.doi.org/10.1016/j.spc.2021.07.025,,10.1016/j.spc.2021.07.025,3184619791,,1,000-159-238-919-311; 003-354-749-996-047; 011-005-059-483-767; 013-276-553-447-515; 017-511-637-384-016; 019-043-805-141-231; 020-683-581-288-584; 020-884-312-391-242; 021-476-379-231-095; 025-495-447-388-73X; 030-275-641-035-176; 036-112-860-853-576; 037-012-111-124-657; 044-442-988-820-425; 045-293-574-345-142; 049-315-160-799-128; 054-727-397-662-009; 057-089-190-281-896; 064-066-752-985-193; 066-017-624-730-868; 069-036-540-779-229; 072-269-490-626-245; 072-710-650-928-352; 072-995-584-719-000; 073-524-244-326-206; 077-421-553-498-128; 080-517-794-270-858; 092-251-563-239-546; 093-713-982-180-235; 094-577-423-909-328; 099-676-003-852-658; 103-032-078-549-644; 106-368-138-097-28X; 109-320-703-545-337; 111-762-664-601-673; 112-732-671-508-855; 116-196-901-765-54X; 119-059-957-973-178; 122-048-805-257-345; 122-940-597-067-236; 133-416-082-535-596; 134-496-497-830-115; 160-771-916-898-197; 169-443-599-615-708; 174-876-088-674-460; 185-091-195-579-038; 185-892-087-005-619; 190-401-760-210-455,35,true,,green
