Lens ID,Title,Date Published,Publication Year,Publication Type,Source Title,ISSNs,Publisher,Source Country,Author/s,Abstract,Volume,Issue Number,Start Page,End Page,Fields of Study,Keywords,MeSH Terms,Chemicals,Funding,Source URLs,External URL,PMID,DOI,Microsoft Academic ID,PMCID,Citing Patents Count,References,Citing Works Count,Is Open Access,Open Access License,Open Access Colour
112-458-846-697-741,Exploring the team dynamic learning process in software process tailoring performance: A theoretical perspective,2020-03-02,2020,journal article,Journal of Enterprise Information Management,17410398,Emerald,United Kingdom,Jung Chieh Lee; Chung Yang Chen,"Software process tailoring (SPT) is a knowledge- and learning-intensive activity in which a software project team customizes its software development processes to accommodate project particularities. Because SPT critically influences how a project is conducted, SPT performance should be investigated, but the extant literature lacks investigations into how team knowledge mechanisms and team environments contribute to SPT performance. To fill this gap, this study looks into a team's absorptive capacity (AC) and combines a transactive memory system (TMS) and team climate inventory (TCI) to develop a theoretical research model to facilitate the understanding of SPT performance.,This paper is a conceptual study that uses the propositional methodology with a focused review of existing literature pertaining to SPT, AC, TMS and TCI to develop a theoretical model to foster SPT performance. Because this study is conceptually established, further empirical research and studies are also suggested.,The proposed model provides guidance for firms conducting SPT. It also contributes to future research aiming to empirically understand the mechanisms behind the identified team-based knowledge and environmental enablers in the dynamic team learning process that lead to superior SPT performance.,The proposed model provides a fresh look at the dynamic capabilities theory in SPT and innovatively identifies a team's dynamic learning process to show how a team can conduct effective SPT through AC and facilitated by TMS. Environmental climates characterized by vision, participative safety, task orientation and support for innovation act as positive moderators in promoting the team dynamic learning process.",33,3,502,518,Empirical research; Transactive memory; Software development process; Process management; Project team; Absorptive capacity; Dynamic capabilities; Computer science; Process (engineering); Team learning,,,,,https://www.emerald.com/insight/content/doi/10.1108/JEIM-07-2019-0202/full/html https://scholars.ncu.edu.tw/en/publications/exploring-the-team-dynamic-learning-process-in-software-process-t,http://dx.doi.org/10.1108/jeim-07-2019-0202,,10.1108/jeim-07-2019-0202,3010153065,,0,001-184-923-574-789; 001-718-687-171-34X; 001-856-731-745-730; 002-481-029-079-094; 004-341-381-677-198; 004-354-533-640-304; 004-537-269-071-254; 007-308-204-275-109; 008-223-474-504-278; 009-523-049-378-435; 010-518-550-941-606; 012-194-224-118-934; 012-389-167-986-275; 013-391-348-674-763; 013-924-569-173-275; 014-041-849-783-091; 017-874-084-286-047; 018-327-488-081-041; 018-492-144-772-737; 023-450-318-080-139; 024-834-695-663-320; 025-227-479-529-946; 025-992-117-584-268; 026-169-050-342-031; 029-219-060-995-687; 029-237-427-263-714; 029-941-182-591-646; 030-086-011-911-175; 030-475-243-618-719; 031-077-673-593-526; 031-396-301-920-66X; 031-473-386-410-402; 032-716-805-412-497; 033-026-847-784-81X; 034-858-644-580-33X; 035-044-185-979-475; 036-236-919-665-583; 037-837-927-455-164; 040-632-068-652-803; 040-796-113-964-760; 040-903-121-112-104; 043-269-108-276-124; 044-279-914-823-300; 048-384-689-778-565; 049-360-617-110-101; 049-575-788-031-000; 053-228-611-367-850; 054-035-638-960-617; 054-194-386-202-737; 055-517-593-059-523; 055-661-229-954-931; 055-777-842-736-726; 056-641-781-600-182; 056-757-312-787-241; 057-143-122-698-360; 058-725-073-311-735; 062-225-156-570-090; 066-184-749-284-011; 066-379-008-238-616; 067-094-332-119-552; 070-982-453-898-760; 071-424-898-186-934; 072-551-758-933-107; 073-044-468-054-569; 075-469-781-400-129; 076-871-170-436-810; 077-340-218-459-370; 077-818-323-084-064; 079-409-453-098-996; 082-177-202-724-436; 084-512-552-321-707; 092-870-965-332-965; 096-218-041-070-916; 096-948-966-097-250; 100-037-110-679-97X; 100-294-259-882-658; 100-345-000-004-79X; 102-209-767-634-670; 104-782-888-971-483; 109-098-791-373-226; 110-008-410-761-190; 112-876-992-948-459; 113-731-745-645-96X; 114-917-194-094-525; 117-123-957-426-220; 119-350-464-644-193; 119-648-799-515-889; 120-792-565-097-970; 121-324-585-016-671; 122-237-923-633-017; 125-968-667-918-950; 128-442-086-856-926; 129-573-686-614-206; 136-385-658-562-811; 140-396-359-332-184; 141-828-736-005-65X; 143-157-376-868-109; 144-932-562-108-577; 146-510-972-677-548; 150-863-553-200-292; 153-563-887-015-825; 155-761-573-614-542; 160-910-067-860-879; 170-818-428-117-062; 171-515-763-286-670; 173-943-295-825-584; 175-212-849-339-902,20,false,,
113-608-281-196-890,Chapter 5 Expectations and Challenges from Scaling Agile in Mechatronics-Driven Companies – A Comparative Case Study,,2015,book chapter,Accelerating Digital Transformation,,Springer International Publishing,,Christian Berger; Ulrik Eklund,,,,119,130,Agile software development; Agile usability engineering; Mechatronics; Engineering; Software; Lean software development; Scrum; New product development; Process management; Agile Unified Process; Engineering management; Extreme programming practices; Knowledge management; Systems engineering; Software development; Computer science; Software engineering; Business; Software development process; Marketing; Control engineering; Programming language,,,,,,http://dx.doi.org/10.1007/978-3-031-10873-0_7,,10.1007/978-3-031-10873-0_7,,,0,000-169-286-996-695; 000-172-653-197-21X; 000-308-607-458-167; 000-777-443-388-685; 002-418-282-608-875; 002-652-949-750-489; 002-679-317-225-360; 003-346-707-164-146; 004-467-348-094-111; 004-580-434-517-461; 005-901-719-801-870; 006-152-239-229-845; 006-681-658-242-597; 007-476-800-156-352; 008-536-805-760-004; 010-081-393-133-162; 010-837-447-720-686; 011-781-385-458-905; 012-071-797-720-631; 012-718-180-038-258; 013-256-723-437-793; 013-433-119-922-308; 013-818-914-752-798; 014-167-757-477-314; 014-193-019-074-838; 014-366-500-074-458; 015-152-664-083-855; 015-914-502-166-963; 015-994-557-415-982; 016-274-764-329-869; 016-464-169-527-77X; 016-484-317-224-120; 016-488-178-086-941; 016-737-390-387-789; 017-402-653-573-631; 017-418-422-667-899; 017-601-654-630-863; 018-001-835-708-276; 018-310-241-038-972; 018-451-773-133-873; 018-640-156-900-507; 018-705-035-212-673; 018-711-079-020-690; 019-039-809-688-179; 019-618-174-825-497; 020-601-436-463-823; 020-689-282-645-155; 021-194-441-266-323; 021-509-052-977-846; 021-743-435-026-269; 021-829-630-584-992; 022-183-588-468-90X; 022-194-202-683-249; 022-198-978-906-065; 022-710-662-172-27X; 022-863-553-486-402; 022-982-684-642-315; 022-984-305-484-126; 023-118-736-574-364; 023-450-318-080-139; 024-106-437-551-961; 024-760-877-829-02X; 025-001-181-520-39X; 025-182-396-155-700; 026-140-424-346-848; 026-181-224-599-833; 026-199-413-083-129; 026-218-937-945-536; 026-950-014-285-573; 027-374-211-253-400; 027-719-595-242-209; 028-143-597-986-356; 028-149-443-086-74X; 028-384-897-023-989; 028-982-185-528-671; 029-470-164-013-254; 029-603-720-897-06X; 029-622-396-427-456; 029-762-470-586-979; 029-775-037-885-911; 030-749-671-791-337; 031-000-871-198-10X; 031-256-766-028-669; 031-954-836-087-292; 031-978-431-327-098; 032-144-408-611-491; 032-287-891-564-573; 032-535-666-329-809; 032-586-688-826-259; 032-728-154-591-070; 033-162-646-263-969; 033-219-235-113-944; 033-738-382-081-510; 034-270-062-522-36X; 034-512-830-226-221; 034-846-778-055-815; 034-956-903-592-538; 035-648-604-989-684; 035-656-036-900-812; 035-820-353-100-327; 035-952-671-868-766; 036-111-279-925-092; 036-353-911-320-479; 037-365-108-655-813; 037-550-015-414-716; 037-671-590-593-002; 038-217-965-731-552; 038-291-982-053-170; 038-926-924-952-385; 039-062-624-290-552; 039-423-526-846-458; 039-654-159-869-057; 039-940-706-479-670; 040-326-760-577-381; 040-558-964-696-924; 040-939-041-685-871; 041-029-768-886-619; 041-106-905-938-785; 041-225-701-959-367; 041-322-031-248-906; 041-484-996-890-948; 042-096-883-853-413; 042-532-838-100-322; 042-596-077-418-979; 043-414-409-664-065; 043-517-768-674-072; 044-048-937-857-089; 044-188-263-451-692; 044-312-084-549-104; 045-263-852-814-977; 045-908-227-279-61X; 045-976-763-976-472; 046-282-298-080-450; 046-557-180-865-199; 046-557-776-280-175; 046-601-765-159-447; 046-914-301-263-913; 047-251-248-310-822; 047-733-597-650-704; 048-534-128-459-629; 048-577-164-661-664; 048-672-340-265-472; 049-600-744-339-195; 049-618-590-801-388; 049-680-319-550-291; 049-898-294-819-937; 050-502-489-367-274; 051-703-900-610-156; 051-781-425-135-088; 052-769-538-974-755; 053-317-545-860-907; 054-024-409-090-036; 054-317-067-964-205; 054-515-584-258-365; 054-735-077-564-944; 056-114-579-806-609; 056-269-762-930-807; 056-600-010-513-207; 056-650-631-607-121; 057-230-325-483-293; 057-251-092-825-653; 057-445-245-506-908; 058-811-595-801-425; 059-241-028-987-360; 059-589-637-791-838; 059-928-431-841-936; 060-018-781-921-787; 060-040-641-546-170; 060-216-978-187-448; 060-455-060-437-894; 060-876-867-945-449; 060-996-915-355-07X; 061-610-952-698-372; 061-944-070-654-730; 062-118-784-194-483; 063-144-525-265-22X; 063-260-809-928-791; 063-466-253-949-709; 064-213-909-687-424; 064-341-472-579-928; 064-535-728-352-926; 064-971-703-460-446; 065-633-631-944-920; 065-890-051-402-348; 066-016-030-088-471; 066-314-441-756-193; 066-573-280-433-903; 066-920-674-910-147; 067-002-193-082-620; 067-371-650-288-143; 068-563-984-671-735; 069-240-567-678-362; 069-280-509-445-92X; 069-540-054-574-458; 069-552-413-643-530; 069-786-163-854-66X; 070-065-551-308-877; 070-962-428-565-536; 071-105-489-357-423; 071-275-487-792-343; 071-858-084-866-568; 071-891-963-199-313; 072-785-173-094-792; 073-129-783-199-007; 074-167-913-501-088; 074-361-451-299-231; 075-020-816-859-475; 075-617-287-848-034; 075-696-815-099-646; 075-817-363-882-143; 076-173-504-787-429; 076-310-438-453-84X; 076-350-363-015-082; 077-446-414-647-913; 077-710-519-038-356; 078-486-083-754-548; 078-650-950-002-515; 079-045-795-565-537; 079-496-270-039-377; 081-328-289-952-026; 082-436-881-704-579; 082-725-897-495-135; 083-198-370-515-499; 083-703-206-843-962; 084-527-406-536-373; 084-886-552-374-59X; 085-295-365-742-774; 085-743-359-831-275; 085-744-643-009-734; 086-129-206-991-629; 086-176-004-347-909; 086-341-446-522-651; 087-738-310-539-421; 087-828-756-573-770; 089-304-379-780-672; 090-511-454-329-492; 090-579-560-022-84X; 091-337-948-912-691; 091-365-119-156-161; 091-383-383-521-104; 091-684-594-653-608; 092-599-147-105-554; 093-226-459-315-723; 093-780-658-351-469; 094-194-861-999-353; 094-497-106-858-918; 095-172-955-201-33X; 097-038-793-599-204; 097-875-757-909-437; 098-150-269-383-155; 098-158-609-967-920; 098-460-671-483-422; 099-707-776-034-816; 101-176-260-587-612; 101-861-688-539-166; 101-973-213-756-200; 103-937-215-119-525; 105-598-611-608-194; 105-929-945-947-325; 108-629-814-540-108; 109-148-426-287-867; 111-655-049-318-469; 111-879-517-319-132; 111-919-507-697-467; 112-780-957-605-200; 112-893-010-832-938; 113-268-180-899-257; 113-304-924-108-135; 115-195-785-551-307; 115-359-809-378-632; 116-294-538-779-46X; 116-939-161-079-273; 117-319-838-440-411; 117-491-142-542-465; 117-795-919-710-070; 117-993-547-064-430; 118-006-198-269-175; 118-298-955-097-09X; 119-489-150-001-343; 121-565-003-323-872; 123-361-003-280-807; 123-486-932-417-061; 127-495-578-271-361; 128-812-297-563-950; 130-006-858-427-808; 130-774-869-496-317; 134-336-809-777-761; 135-948-291-990-78X; 137-415-923-205-067; 138-191-573-056-650; 141-533-496-478-395; 144-530-725-508-611; 144-799-256-529-058; 146-084-430-230-566; 146-740-102-844-991; 147-815-395-653-784; 149-001-597-903-809; 154-089-985-186-32X; 155-003-488-670-694; 156-518-480-818-622; 156-780-927-071-240; 157-963-679-647-674; 162-094-958-930-973; 162-482-006-983-757; 162-651-098-943-182; 163-431-104-980-046; 165-239-834-454-403; 165-530-269-631-414; 165-602-811-525-081; 167-287-296-095-798; 169-678-089-323-007; 170-597-170-983-046; 170-818-428-117-062; 173-790-703-645-28X; 174-372-150-272-835; 175-843-115-335-604; 177-636-560-055-409; 178-994-954-054-659; 181-317-336-758-341; 187-018-836-265-787; 187-535-812-910-556; 187-560-371-765-967; 194-193-802-341-923; 199-053-627-593-900,0,false,,
113-736-581-890-397,More testers - The effect of crowd size and time restriction in software testing,,2013,journal article,Information and Software Technology,09505849,Elsevier BV,Netherlands,Mika V. Mäntylä; Juha Itkonen,,55,6,986,1003,Software engineering; Machine learning; Artificial intelligence; Software verification and validation; Regression testing; White-box testing; Keyword-driven testing; Manual testing; Test strategy; Computer science; Software reliability testing; Non-regression testing,Software testing; group performance; division of labor; human factors; crowdsourcing; methods for SQA and V&V; Test Management,,,,https://www.sciencedirect.com/science/article/pii/S095058491200239X https://portal.research.lu.se/portal/en/publications/more-testers--the-effect-of-crowd-size-and-time-restriction-in-software-testing(d6ba0f9d-9277-4ac1-85a5-df4cfa7c1d9c).html https://dialnet.unirioja.es/servlet/articulo?codigo=6502170 https://www.researchgate.net/profile/Mika_Maentylae/publication/249655937_More_testers_-_The_effect_of_crowd_size_and_time_restriction_in_software_testing/links/0a85e535fb498ad5eb000000.pdf http://www.sciencedirect.com/science/article/pii/S095058491200239X http://lup.lub.lu.se/record/3815290 https://research.aalto.fi/en/publications/more-testers--the-effect-of-crowd-size-and-time-restriction-in-software-testing(5a8e7a8d-e938-424f-8608-7f800ed5329f).html https://dl.acm.org/doi/10.1016/j.infsof.2012.12.004,http://dx.doi.org/10.1016/j.infsof.2012.12.004,,10.1016/j.infsof.2012.12.004,2033466942,,0,002-104-529-693-417; 002-671-227-022-352; 003-504-877-108-99X; 004-036-182-561-976; 006-232-855-393-366; 006-405-234-671-397; 006-584-400-240-258; 008-473-475-194-197; 008-708-634-890-944; 010-370-553-354-265; 010-589-166-011-410; 013-530-915-293-009; 014-267-129-756-476; 015-682-464-559-538; 015-996-312-958-11X; 016-474-803-700-138; 017-069-596-204-314; 020-533-950-465-600; 022-140-740-701-957; 023-450-318-080-139; 023-621-686-886-682; 024-239-629-239-445; 024-487-506-908-736; 031-733-065-829-120; 031-950-914-731-787; 033-251-278-972-968; 037-276-635-557-399; 037-657-474-727-025; 043-206-619-608-508; 043-807-724-617-709; 044-404-964-703-729; 044-502-833-366-442; 047-360-200-362-87X; 047-831-665-759-20X; 048-540-118-537-807; 049-397-115-481-34X; 054-450-885-975-099; 055-678-228-551-525; 060-299-665-294-230; 062-503-665-593-28X; 064-577-692-438-191; 067-715-519-706-692; 068-847-562-221-851; 069-612-876-883-348; 073-402-258-811-928; 075-174-330-632-424; 076-483-968-109-005; 078-190-474-507-867; 080-160-542-601-033; 086-568-749-600-035; 087-024-456-042-747; 089-398-191-075-576; 094-521-141-346-675; 096-012-259-652-800; 097-546-727-513-32X; 097-858-220-189-64X; 098-198-637-528-024; 103-734-146-864-475; 110-596-784-441-347; 111-066-714-236-741; 111-212-027-839-80X; 112-820-331-455-291; 119-740-846-393-741; 123-561-008-477-496; 126-038-059-475-004; 126-229-362-010-236; 129-351-966-121-453; 134-039-502-046-269; 139-032-988-220-465; 142-701-246-684-90X; 144-028-496-904-739; 145-440-616-713-429; 155-738-346-326-043; 165-638-552-157-492; 168-945-827-070-230; 178-384-778-047-100; 181-043-228-751-569; 193-178-753-603-429; 199-315-486-905-516,36,false,,
115-534-591-177-656,Research on Graphic User Interface Automation Testing Technology Based on Cloud Platform,2019-11-01,2019,journal article,Journal of Physics: Conference Series,17426588; 17426596,IOP Publishing,United Kingdom,Xin Liu,"<jats:title>Abstract</jats:title>;                <jats:p>As the soul of computer, software has more and more important influence on human beings. GUI (Graphical User Interface) technology is widely used because of its friendly interface and easy operation. It is an important part of software nowadays. No matter what kind of software, from requirement analysis to detailed code design stage, we need to use excellent testing technology to lay the foundation for the smooth development of software. Software testing technology has become an important branch affecting the development of software industry. Especially in the regression test conducted in the later stage of the test, it is necessary to verify whether the previously discovered problem is solved in the new version. Automating software testing can make a large number of tests programmatically repeated. Not only does it save a lot of labor, but it also improves test efficiency and guarantees the quality of the test. This paper proposes a graphical user interface automation test technology for cloud platforms, which provides assurance for testers to easily create and flexibly maintain test code.</jats:p>",1345,5,052082,,Human–computer interaction; Automation; Graphical user interface; Computer science; Cloud computing,,,,,https://ui.adsabs.harvard.edu/abs/2019JPhCS1345e2082L/abstract,http://dx.doi.org/10.1088/1742-6596/1345/5/052082,,10.1088/1742-6596/1345/5/052082,2989622084,,0,001-177-264-883-725; 003-116-155-616-39X; 014-904-483-816-418; 015-817-062-488-509; 023-450-318-080-139; 028-610-865-828-910; 029-194-233-104-603; 029-273-344-395-699; 033-561-395-066-239; 033-971-640-801-009; 052-737-148-628-658; 056-258-445-229-618; 061-083-829-630-741; 072-571-691-642-02X; 072-745-509-078-846; 090-357-691-857-317; 117-927-323-455-445; 118-270-802-527-357; 118-782-230-673-429; 131-889-011-988-114; 142-672-810-408-026; 159-052-814-268-227,0,true,,gold
118-554-555-353-023,GUI testing of Android applications: Investigating the impact of the number of testers on different exploratory testing strategies,2023-12-11,2023,journal article,Journal of Software: Evolution and Process,20477473; 20477481,Wiley,United Kingdom,Sergio Di Martino; Anna Rita Fasolino; Luigi Libero Lucio Starace; Porfirio Tramontana,"<jats:title>Abstract</jats:title><jats:p>Graphical user interface (GUI) testing plays a pivotal role in ensuring the quality and functionality of mobile apps. In this context, exploratory testing (ET), a distinctive methodology in which individual testers pursue a creative, and experience‐based approach to test design, is often used as an alternative or in addition to traditional scripted testing. Managing the exploratory testing process is a challenging task that can easily result either in wasteful spending or in inadequate software quality, due to the relative unpredictability of exploratory testing activities, which depend on the skills and abilities of individual testers. A number of works have investigated the diversity of testers' performance when using ET strategies, often in a crowdtesting setting. These works, however, investigated ET effectiveness in detecting bugs, and not in scenarios in which the goal is to generate a re‐executable test suite, as well. Moreover, less work has been conducted on evaluating the impact of adopting different exploratory testing strategies. As a first step toward filling this gap in the literature, in this work, we conduct an empirical evaluation involving four open‐source Android apps and 20 masters students that we believe can be representative of practitioners partaking in exploratory testing activities. The students were asked to generate test suites for the apps using a capture and replay tool and different exploratory testing strategies. We then compare the effectiveness, in terms of aggregate code coverage that different‐sized groups of students using different exploratory testing strategies may achieve. Results provide deeper insights into code coverage dynamics to project managers interested in using exploratory approaches to test simple Android apps, on which they can make more informed decisions.</jats:p>",36,7,,,Computer science; Graphical user interface testing; Android (operating system); Exploratory research; Test strategy; Manual testing; Software testing; Test suite; Empirical research; Context (archaeology); Test script; Quality (philosophy); Software engineering; Human–computer interaction; Software; User experience design; Test case; Software development; User interface design; Machine learning; Programming language; Operating system; Software construction; Paleontology; Philosophy; Regression analysis; Epistemology; Sociology; Biology; Anthropology,,,,,https://onlinelibrary.wiley.com/doi/pdfdirect/10.1002/smr.2640 https://doi.org/10.1002/smr.2640,http://dx.doi.org/10.1002/smr.2640,,10.1002/smr.2640,,,0,000-753-625-765-254; 000-997-775-806-745; 002-671-227-022-352; 006-061-152-468-655; 009-451-270-055-889; 011-716-211-995-531; 023-079-772-271-273; 023-450-318-080-139; 023-621-686-886-682; 024-487-506-908-736; 031-037-417-543-646; 046-720-306-042-516; 048-123-542-721-42X; 048-540-118-537-807; 053-323-380-687-309; 056-128-257-352-074; 057-531-497-394-704; 062-249-595-358-039; 063-458-510-231-053; 066-312-731-945-858; 066-855-735-062-631; 068-279-466-242-289; 073-028-680-437-014; 075-125-213-383-325; 075-174-330-632-424; 075-737-232-663-258; 078-522-131-170-199; 081-868-692-748-743; 082-597-956-517-75X; 084-054-524-858-771; 088-048-235-648-246; 102-659-437-465-753; 107-933-728-061-792; 109-242-722-740-882; 111-463-736-823-479; 112-525-691-179-612; 115-325-461-884-255; 116-255-221-067-542; 140-250-121-189-806; 142-701-246-684-90X; 161-915-698-170-814; 163-014-338-571-731; 181-043-228-751-569; 197-340-614-968-426,2,true,cc-by,hybrid
120-591-021-018-882,Towards a Model of Testers' Cognitive Processes: Software Testing as a Problem Solving Approach,2020-07-17,2020,preprint,arXiv: Software Engineering,,,,Eduard Paul Enoiu; Gerald Tukseferi; Robert Feldt,"Software testing is a complex, intellectual activity based (at least) on analysis, reasoning, decision making, abstraction and collaboration performed in a highly demanding environment. Naturally, it uses and allocates multiple cognitive resources in software testers. However, while a cognitive psychology perspective is increasingly used in the general software engineering literature, it has yet to find its place in software testing. To the best of our knowledge, no theory of software testers' cognitive processes exists. Here, we take the first step towards such a theory by presenting a cognitive model of software testing based on how problem solving is conceptualized in cognitive psychology. Our approach is to instantiate a general problem solving process for the specific problem of creating test cases. We then propose an experiment for testing our cognitive test design model. The experiment makes use of verbal protocol analysis to understand the mechanisms by which human testers choose, design, implement and evaluate test cases. An initial evaluation was then performed with five software engineering master students as subjects. The results support a problem solving-based model of test design for capturing testers' cognitive processes.",,,,,Test design; Software engineering; Test case; Cognitive resource theory; Cognitive model; Cognition; Software; Computer science; Cognitive test,,,,,http://ui.adsabs.harvard.edu/abs/2020arXiv200708927E/abstract https://arxiv.org/abs/2007.08927 https://arxiv.org/pdf/2007.08927.pdf,http://ui.adsabs.harvard.edu/abs/2020arXiv200708927E/abstract,,,3042707592,,0,004-960-413-020-637; 007-964-798-419-91X; 012-692-762-167-524; 022-219-215-631-059; 022-271-437-624-493; 023-450-318-080-139; 028-497-147-841-326; 030-295-086-364-971; 034-846-778-055-815; 035-030-699-853-805; 045-369-877-155-037; 047-493-708-252-048; 060-587-291-443-153; 060-948-531-114-721; 063-592-916-976-490; 073-565-898-687-693; 074-068-553-954-847; 074-618-948-831-685; 075-174-330-632-424; 087-222-811-693-526; 092-586-333-824-47X; 115-864-766-553-281; 126-377-854-205-085; 129-478-512-123-946; 137-724-527-270-624; 159-087-497-196-791; 172-559-110-463-861,1,true,,unknown
