Lens ID,Title,Date Published,Publication Year,Publication Type,Source Title,ISSNs,Publisher,Source Country,Author/s,Abstract,Volume,Issue Number,Start Page,End Page,Fields of Study,Keywords,MeSH Terms,Chemicals,Funding,Source URLs,External URL,PMID,DOI,Microsoft Academic ID,PMCID,Citing Patents Count,References,Citing Works Count,Is Open Access,Open Access License,Open Access Colour
033-121-426-271-632,Chapter 8 Recognizing Lines of Code Violating Company-Specific Coding Guidelines Using Machine Learning,,2019,book chapter,Accelerating Digital Transformation,,Springer International Publishing,,Miroslaw Ochodek; Regina Hebig; Wilhelm Meding; Gert Frost; Miroslaw Staron,,,,211,251,Codebase; Code review; Computer science; Source lines of code; Source code; Static program analysis; Coding (social sciences); KPI-driven code analysis; Code (set theory); Software quality; Software engineering; Software; Artificial intelligence; Machine learning; Software development; Programming language; Statistics; Mathematics; Set (abstract data type),,,,,,http://dx.doi.org/10.1007/978-3-031-10873-0_11,,10.1007/978-3-031-10873-0_11,,,0,000-169-286-996-695; 000-172-653-197-21X; 000-308-607-458-167; 000-777-443-388-685; 002-418-282-608-875; 002-652-949-750-489; 002-679-317-225-360; 003-346-707-164-146; 003-353-668-200-559; 004-467-348-094-111; 004-580-434-517-461; 005-901-719-801-870; 006-152-239-229-845; 006-681-658-242-597; 006-895-310-658-835; 007-476-800-156-352; 008-049-266-530-075; 008-536-805-760-004; 009-877-942-574-656; 010-081-393-133-162; 010-122-908-411-87X; 010-837-447-720-686; 011-781-385-458-905; 012-063-697-313-81X; 012-071-797-720-631; 012-718-180-038-258; 013-256-723-437-793; 013-433-119-922-308; 013-818-914-752-798; 014-167-757-477-314; 014-193-019-074-838; 014-366-500-074-458; 015-023-679-060-153; 015-152-664-083-855; 015-256-390-711-442; 015-914-502-166-963; 015-994-557-415-982; 016-274-764-329-869; 016-456-277-928-730; 016-464-169-527-77X; 016-484-317-224-120; 016-488-178-086-941; 016-492-368-231-304; 016-737-390-387-789; 017-402-653-573-631; 017-418-422-667-899; 017-601-654-630-863; 018-001-835-708-276; 018-310-241-038-972; 018-451-773-133-873; 018-640-156-900-507; 018-705-035-212-673; 018-711-079-020-690; 019-039-809-688-179; 019-618-174-825-497; 019-799-380-461-247; 020-192-221-223-748; 020-601-436-463-823; 020-689-282-645-155; 021-194-441-266-323; 021-509-052-977-846; 021-743-435-026-269; 021-829-630-584-992; 022-183-588-468-90X; 022-194-202-683-249; 022-198-978-906-065; 022-286-171-834-689; 022-710-662-172-27X; 022-863-553-486-402; 022-982-684-642-315; 022-984-305-484-126; 023-118-736-574-364; 023-450-318-080-139; 024-106-437-551-961; 024-760-877-829-02X; 024-888-342-333-83X; 024-995-964-434-276; 025-001-181-520-39X; 025-182-396-155-700; 026-127-836-616-545; 026-140-424-346-848; 026-181-224-599-833; 026-199-413-083-129; 026-218-937-945-536; 026-950-014-285-573; 027-374-211-253-400; 027-719-595-242-209; 028-143-597-986-356; 028-149-443-086-74X; 028-384-897-023-989; 028-982-185-528-671; 029-074-246-291-130; 029-470-164-013-254; 029-603-720-897-06X; 029-622-396-427-456; 029-762-470-586-979; 029-775-037-885-911; 029-818-025-066-932; 030-749-671-791-337; 031-000-871-198-10X; 031-256-766-028-669; 031-954-836-087-292; 031-978-431-327-098; 032-144-408-611-491; 032-287-891-564-573; 032-446-129-514-035; 032-535-666-329-809; 032-586-688-826-259; 032-697-875-700-733; 032-728-154-591-070; 032-777-701-463-483; 033-162-646-263-969; 033-219-235-113-944; 033-738-382-081-510; 034-270-062-522-36X; 034-512-830-226-221; 034-846-778-055-815; 034-956-903-592-538; 035-603-972-337-445; 035-648-604-989-684; 035-656-036-900-812; 035-820-353-100-327; 035-952-671-868-766; 036-111-279-925-092; 036-176-485-896-12X; 036-353-911-320-479; 037-365-108-655-813; 037-550-015-414-716; 037-671-590-593-002; 037-710-991-091-678; 038-217-965-731-552; 038-291-982-053-170; 038-327-000-975-072; 038-926-924-952-385; 039-062-624-290-552; 039-423-526-846-458; 039-654-159-869-057; 039-940-706-479-670; 040-303-931-016-65X; 040-326-760-577-381; 040-558-964-696-924; 040-939-041-685-871; 041-029-768-886-619; 041-106-905-938-785; 041-225-701-959-367; 041-322-031-248-906; 041-484-996-890-948; 042-096-883-853-413; 042-532-838-100-322; 042-596-077-418-979; 043-414-409-664-065; 043-517-768-674-072; 043-686-534-376-926; 044-048-937-857-089; 044-182-455-336-149; 044-188-263-451-692; 044-202-765-794-757; 044-312-084-549-104; 045-263-852-814-977; 045-908-227-279-61X; 045-976-763-976-472; 046-282-298-080-450; 046-557-180-865-199; 046-557-776-280-175; 046-601-765-159-447; 046-914-301-263-913; 047-251-248-310-822; 047-733-597-650-704; 048-250-164-511-493; 048-534-128-459-629; 048-577-164-661-664; 048-672-340-265-472; 049-600-744-339-195; 049-618-590-801-388; 049-680-319-550-291; 049-898-294-819-937; 050-502-489-367-274; 051-703-900-610-156; 051-781-425-135-088; 052-769-538-974-755; 053-317-545-860-907; 054-024-409-090-036; 054-317-067-964-205; 054-515-584-258-365; 054-735-077-564-944; 055-870-071-121-825; 056-114-579-806-609; 056-269-762-930-807; 056-600-010-513-207; 056-650-631-607-121; 056-849-151-863-589; 057-230-325-483-293; 057-251-092-825-653; 057-445-245-506-908; 057-568-082-379-392; 058-778-302-696-181; 058-811-595-801-425; 059-241-028-987-360; 059-589-637-791-838; 059-928-431-841-936; 060-018-781-921-787; 060-040-641-546-170; 060-216-978-187-448; 060-455-060-437-894; 060-876-867-945-449; 060-996-915-355-07X; 061-610-952-698-372; 061-866-612-132-646; 061-944-070-654-730; 062-118-784-194-483; 062-593-679-828-774; 063-144-525-265-22X; 063-260-809-928-791; 063-466-253-949-709; 064-213-909-687-424; 064-341-472-579-928; 064-535-728-352-926; 064-971-703-460-446; 065-633-631-944-920; 065-890-051-402-348; 066-016-030-088-471; 066-314-441-756-193; 066-351-174-178-327; 066-436-352-356-353; 066-573-280-433-903; 066-920-674-910-147; 067-002-193-082-620; 067-371-650-288-143; 068-563-984-671-735; 069-240-567-678-362; 069-280-509-445-92X; 069-540-054-574-458; 069-552-413-643-530; 069-786-163-854-66X; 070-065-551-308-877; 070-962-428-565-536; 071-105-489-357-423; 071-275-487-792-343; 071-858-084-866-568; 071-891-963-199-313; 072-785-173-094-792; 073-129-783-199-007; 074-167-913-501-088; 074-361-451-299-231; 075-020-816-859-475; 075-617-287-848-034; 075-696-815-099-646; 075-817-363-882-143; 076-141-841-751-420; 076-173-504-787-429; 076-310-438-453-84X; 076-350-363-015-082; 077-446-414-647-913; 077-710-519-038-356; 078-486-083-754-548; 078-650-950-002-515; 079-006-158-744-40X; 079-045-795-565-537; 079-496-270-039-377; 081-328-289-952-026; 082-436-881-704-579; 082-725-897-495-135; 083-198-370-515-499; 083-703-206-843-962; 083-722-735-229-363; 084-527-406-536-373; 084-886-552-374-59X; 085-295-365-742-774; 085-359-510-808-478; 085-743-359-831-275; 085-744-643-009-734; 086-129-206-991-629; 086-176-004-347-909; 086-341-446-522-651; 087-738-310-539-421; 087-828-756-573-770; 089-304-379-780-672; 090-511-454-329-492; 090-579-560-022-84X; 091-337-948-912-691; 091-365-119-156-161; 091-383-383-521-104; 091-684-594-653-608; 092-599-147-105-554; 093-063-549-165-454; 093-226-459-315-723; 093-780-658-351-469; 094-194-861-999-353; 094-497-106-858-918; 095-172-955-201-33X; 097-038-793-599-204; 097-875-757-909-437; 098-150-269-383-155; 098-158-609-967-920; 098-460-671-483-422; 098-964-351-936-583; 099-707-776-034-816; 100-499-184-803-693; 101-176-260-587-612; 101-861-688-539-166; 101-973-213-756-200; 103-937-215-119-525; 105-598-611-608-194; 105-929-945-947-325; 108-629-814-540-108; 109-148-426-287-867; 111-655-049-318-469; 111-879-517-319-132; 111-919-507-697-467; 112-780-957-605-200; 112-893-010-832-938; 113-268-180-899-257; 113-304-924-108-135; 115-195-785-551-307; 115-359-809-378-632; 116-294-538-779-46X; 116-939-161-079-273; 117-319-838-440-411; 117-491-142-542-465; 117-795-919-710-070; 117-993-547-064-430; 118-006-198-269-175; 118-298-955-097-09X; 119-489-150-001-343; 121-565-003-323-872; 123-361-003-280-807; 123-486-932-417-061; 127-495-578-271-361; 128-812-297-563-950; 130-006-858-427-808; 130-774-869-496-317; 134-336-809-777-761; 135-948-291-990-78X; 137-415-923-205-067; 138-191-573-056-650; 140-144-899-636-444; 141-533-496-478-395; 143-206-902-554-360; 144-530-725-508-611; 144-799-256-529-058; 146-084-430-230-566; 146-740-102-844-991; 147-815-395-653-784; 149-001-597-903-809; 154-089-985-186-32X; 155-003-488-670-694; 156-518-480-818-622; 156-780-927-071-240; 157-963-679-647-674; 162-094-958-930-973; 162-482-006-983-757; 162-651-098-943-182; 163-431-104-980-046; 164-770-960-620-089; 165-239-834-454-403; 165-530-269-631-414; 165-602-811-525-081; 167-287-296-095-798; 168-929-050-003-820; 169-678-089-323-007; 170-597-170-983-046; 170-818-428-117-062; 173-790-703-645-28X; 174-372-150-272-835; 175-843-115-335-604; 177-636-560-055-409; 178-994-954-054-659; 181-317-336-758-341; 187-018-836-265-787; 187-535-812-910-556; 187-560-371-765-967; 194-193-802-341-923; 199-053-627-593-900,3,false,,
034-019-350-907-934,HCI (40) - Applying Exploratory Testing and Ad-Hoc Usability Inspection to Improve the Ease of Use of a Mobile Power Consumption Registration App: An Experience Report,2021-11-20,2021,book chapter,Lecture Notes in Computer Science,03029743; 16113349,Springer International Publishing,Germany,José Eduardo; Anderson Matheus Passos Paiva; Victor Rogerio Sousa Ferreira; Simara Vieira da Rocha; Italo Santos; Luis Rivero; João Dallyson Sousa de Almeida; Geraldo Braz; Anselmo Cardoso de Paiva; Aristofenes Silva; Hugo Daniel Castro Silva Nogueira; E. Monteiro; Eduardo Camacho Fernandes,"As the number of mobile devices has increased, software development teams have focused on releasing mobile applications, allowing users to carry out transactions, access information and improve their lifestyle more efficiently. Nevertheless, even when providing useful means for carrying out daily tasks, users report dissatisfaction or frustration when using these applications. For energy companies, mobile applications that fail to provide both usefulness and ease of use may reduce their adoption and an increase in the company’s workload, as users will require company workers to solve problems they could solve on their own. In this paper, we report how we applied exploratory testing and ad-hoc usability inspection to identify improvement opportunities during the development of a mobile application that would allow users to measure their power consumption, supporting social distancing in the context of the COVID-19 pandemic. After identified a set of functional and usability problems, the development team redesigned the application, which was perceived as both useful and easy to use from the point of view of the managers that requested it. Also, we report lessons learned that are useful for practitioners willing to replicate this experience.",,,326,341,Set (psychology); Usability; Mobile device; Process management; Usability inspection; Workload; Context (language use); Computer science; Exploratory testing; Software development,,,,,https://link.springer.com/chapter/10.1007/978-3-030-90238-4_23 https://rd.springer.com/chapter/10.1007/978-3-030-90238-4_23,http://dx.doi.org/10.1007/978-3-030-90238-4_23,,10.1007/978-3-030-90238-4_23,3215775148,,0,013-485-093-061-179; 020-982-602-852-261; 021-724-939-723-46X; 023-450-318-080-139; 040-575-485-698-185; 045-036-429-288-770; 069-439-397-365-571; 082-437-101-805-163; 105-198-424-671-03X; 106-115-577-192-451; 109-607-855-113-478; 127-625-756-550-009; 129-460-165-138-338; 136-408-409-840-912; 157-045-029-154-031; 176-213-591-269-935; 183-123-028-851-023,0,false,,
036-658-104-610-522,ICSE (Companion Volume) - Vulnerability detection is just the beginning,,2021,conference proceedings article,2021 IEEE/ACM 43rd International Conference on Software Engineering: Companion Proceedings (ICSE-Companion),,IEEE,,Sarah Elder,"Vulnerability detection plays a key role in secure software development [1]--[4]. There are many different vulnerability detection tools and techniques to choose from, and insufficient information on which vulnerability detection techniques to use and when. The goal of this research is to assist managers and other decision-makers on software projects in making informed choices about the use of different software vulnerability detection techniques through empirical analysis of the efficiency and effectiveness of each technique. We will examine the relationships between the vulnerability detection technique used to find a vulnerability, the type of vulnerability found, the exploitability of the vulnerability, and the effort needed to fix a vulnerability on two projects where we ensure all vulnerabilities found have been fixed. We will then examine how these relationships are seen in Open Source Software more broadly where practitioners may use different vulnerability detection techniques, or may not fix all vulnerabilities found due to resource constraints.",,,304,308,Risk analysis (engineering); Project management; Vulnerability; Key (cryptography); Software; Vulnerability detection; Resource constraints; Computer science; Software development; Security management,,,,National Science Foundation,https://www.computer.org/csdl/proceedings-article/icse-companion/2021/121900a304/1sET7HK8t4k https://doi.org/10.1109/ICSE-Companion52605.2021.00133 https://www.arxiv-vanity.com/papers/2103.05160/ https://dblp.uni-trier.de/db/journals/corr/corr2103.html#abs-2103-05160 https://arxiv.org/pdf/2103.05160 https://arxiv.org/abs/2103.05160,http://dx.doi.org/10.1109/icse-companion52605.2021.00133,,10.1109/icse-companion52605.2021.00133,3163780595,,0,003-336-881-505-920; 010-688-476-353-68X; 013-155-727-797-486; 014-322-099-236-937; 019-345-724-858-824; 019-967-913-094-452; 020-532-652-817-028; 022-140-266-056-179; 023-450-318-080-139; 034-728-767-249-908; 040-313-060-696-774; 040-816-299-083-587; 043-389-154-349-474; 047-384-952-545-472; 070-877-269-668-178; 071-387-042-368-992; 086-462-963-512-129; 087-633-737-497-549; 092-555-975-241-987; 115-155-258-364-052; 121-840-153-189-393; 127-368-643-865-149; 143-450-766-652-007; 166-891-349-429-830; 170-347-819-721-146,2,true,,green
037-007-096-500-549,Vulnerability Detection is Just the Beginning,2021-03-09,2021,preprint,arXiv: Software Engineering,,,,Sarah Elder,"Vulnerability detection plays a key role in secure software development. There are many different vulnerability detection tools and techniques to choose from, and insufficient information on which vulnerability detection techniques to use and when. The goal of this research is to assist managers and other decision-makers on software projects in making informed choices about the use of different software vulnerability detection techniques through empirical analysis of the efficiency and effectiveness of each technique. We will examine the relationships between the vulnerability detection technique used to find a vulnerability, the type of vulnerability found, the exploitability of the vulnerability, and the effort needed to fix a vulnerability on two projects where we ensure all vulnerabilities found have been fixed. We will then examine how these relationships are seen in Open Source Software more broadly where practitioners may use different vulnerability detection techniques, or may not fix all vulnerabilities found due to resource constraints.",,,,,Risk analysis (engineering); Vulnerability; Key (cryptography); Software; Vulnerability detection; Computer science; Software development; Vulnerability (computing),,,,,https://ui.adsabs.harvard.edu/abs/2021arXiv210305160E/abstract https://arxiv.org/abs/2103.05160 https://arxiv.org/pdf/2103.05160.pdf,https://ui.adsabs.harvard.edu/abs/2021arXiv210305160E/abstract,,,3133938692,,0,010-688-476-353-68X; 013-155-727-797-486; 014-322-099-236-937; 019-967-913-094-452; 020-532-652-817-028; 022-140-266-056-179; 023-450-318-080-139; 034-728-767-249-908; 040-313-060-696-774; 040-816-299-083-587; 043-389-154-349-474; 047-384-952-545-472; 070-877-269-668-178; 071-387-042-368-992; 086-462-963-512-129; 087-633-737-497-549; 092-555-975-241-987; 115-155-258-364-052; 121-840-153-189-393; 143-450-766-652-007; 166-891-349-429-830; 170-347-819-721-146,0,true,,unknown
039-103-021-082-971,SEAA - The MaLET Model — Maturity Levels for Exploratory Testing,,2021,conference proceedings article,2021 47th Euromicro Conference on Software Engineering and Advanced Applications (SEAA),,IEEE,,Torvald Martensson; Daniel Ståhl; Antonio Martini; Jan Bosch,"Based on multiple series of interviews and workshops, this paper presents the MaLET model – a representation of the typical evolution path for companies who successfully adopt exploratory testing. The model provides a step-by-step approach to systematically improve exploratory testing over time, and shows how and why capabilities may regress. The MaLET model was validated through a series of interviews with 20 interviewees from eight case study companies in separate industry segments. The interviews also revealed examples on improvement initiatives that had failed in the companies, showing that improvement initiatives tend to fail if they are not planned in an order corresponding to the maturity levels in the model. The MaLET model was well received by the interviewees during the validation, describing the model as sound, relevant and useful in practice.",,,78,85,Order (exchange); Process management; Continuous delivery; Continuous integration; Software testing; Maturity (finance); Computer science; Exploratory testing,,,,,https://research.chalmers.se/en/publication/527186,http://dx.doi.org/10.1109/seaa53835.2021.00019,,10.1109/seaa53835.2021.00019,3207988166,,0,009-375-308-716-960; 013-818-914-752-798; 015-023-679-060-153; 016-484-317-224-120; 019-039-809-688-179; 020-192-221-223-748; 022-286-171-834-689; 023-450-318-080-139; 026-218-937-945-536; 028-149-443-086-74X; 028-982-185-528-671; 029-762-470-586-979; 032-144-408-611-491; 032-184-414-249-405; 034-846-778-055-815; 057-034-942-505-306; 057-251-092-825-653; 059-252-874-203-311; 059-694-898-303-69X; 060-216-978-187-448; 061-944-070-654-730; 066-573-280-433-903; 090-511-454-329-492; 093-433-215-757-789; 117-795-919-710-070; 119-006-837-846-538; 131-823-586-333-125; 155-003-488-670-694; 164-417-443-387-760; 186-081-237-537-037; 195-148-971-453-698,2,false,,
040-760-466-294-198,The qualitative factor in software testing: A systematic mapping study of qualitative methods,,2025,journal article,Journal of Systems and Software,01641212; 18731228,Elsevier BV,Netherlands,Baris Ardic; Carolin Brandt; Ali Khatami; Mark Swillus; Andy Zaidman,,227,,112447,112447,Computer science; Software engineering; Factor (programming language); Software; Qualitative research; Software testing; Reliability engineering; Engineering; Programming language; Sociology; Social science,,,,Dutch Research Council; Swiss National Science Foundation,,http://dx.doi.org/10.1016/j.jss.2025.112447,,10.1016/j.jss.2025.112447,,,0,000-777-738-898-770; 001-078-884-177-713; 001-188-781-428-062; 003-560-460-927-742; 006-183-568-576-41X; 007-841-959-217-068; 009-312-170-200-954; 011-087-146-366-659; 014-237-243-271-053; 014-521-221-889-328; 016-268-420-513-549; 017-190-614-215-186; 017-638-249-434-681; 018-222-674-707-385; 018-336-111-527-562; 019-000-446-851-716; 019-647-284-589-707; 020-519-461-911-808; 020-525-596-056-627; 020-533-950-465-600; 023-450-318-080-139; 023-991-338-993-973; 025-226-394-658-613; 025-324-380-630-299; 028-898-402-232-964; 029-017-541-918-484; 035-089-603-100-101; 037-550-015-414-716; 038-121-658-014-91X; 039-628-205-384-730; 039-648-935-837-728; 042-770-099-006-335; 043-760-262-086-61X; 046-295-403-569-956; 052-921-299-963-429; 058-335-810-307-573; 061-157-267-818-927; 062-974-740-395-63X; 065-690-170-280-682; 066-017-624-730-868; 067-712-156-846-43X; 068-027-981-205-668; 068-048-204-965-307; 070-395-471-382-112; 074-794-718-731-42X; 076-078-226-449-327; 082-057-105-724-411; 083-896-444-210-531; 085-335-765-366-169; 085-359-510-808-478; 086-341-446-522-651; 087-059-234-278-447; 093-305-945-022-569; 094-093-759-638-559; 095-400-766-602-937; 096-157-062-523-789; 102-126-411-580-647; 102-645-281-017-550; 104-495-849-056-889; 104-860-368-955-43X; 106-398-579-460-74X; 107-250-220-990-731; 108-472-112-374-19X; 112-675-555-577-070; 113-220-843-205-963; 117-795-919-710-070; 118-264-699-416-219; 121-271-295-947-99X; 121-354-511-898-613; 126-432-377-333-533; 130-010-738-757-134; 148-846-617-993-169; 149-123-748-637-903; 152-986-690-746-518; 154-518-016-373-09X; 174-361-143-363-700,1,true,cc-by,hybrid
040-881-088-307-596,Dynamic updates of mobile apps using JavaScript,2015-01-01,2015,,,,,,Simon Spetz-Nyström,"Updates are a natural part of the life cycle of an application. The traditional way of updating an application by stopping it, replacing it with the new version and restarting it is lacking in many ways. There have been previous research in the field of dynamic software updates (DSU) that attempt to salvage this problem by updating the app while running. Most of the previous research have focused on static languages like C and Java, research with dynamic languages have been lacking.This thesis takes advantage of the dynamic features of JavaScript in order to allow for dynamic updates of applications for mobile devices. The solution is implemented and used to answer questions about how correctness can be ensured and what state transfer needs to be manually written by a programmer. The conclusion is that most failures that occur as the result of an update and is in need of a manually written state transfer can be put into one of three categories. To verify correctness of an update tests for these types of failures should be performed.",,,,,Mobile device; Programming language; Order (business); Programmer; Field (computer science); Computer science; State (computer science); JavaScript; Java; Correctness; Database,,,,,http://www.diva-portal.org/smash/record.jsf?pid=diva2:821400,http://www.diva-portal.org/smash/record.jsf?pid=diva2:821400,,,1022832805,,0,000-169-286-996-695; 005-997-898-722-383; 011-716-211-995-531; 012-545-803-871-105; 023-450-318-080-139; 025-117-130-055-736; 026-578-833-260-881; 035-450-940-083-87X; 039-839-997-960-782; 043-817-636-418-856; 044-365-572-338-225; 052-236-198-843-561; 068-575-300-510-681; 103-692-688-586-921; 116-121-862-618-435; 129-478-512-123-946; 132-682-357-340-268; 156-499-286-324-134; 160-014-655-586-049; 163-672-745-223-819; 166-306-364-333-044,0,false,,
040-948-626-335-361,QUATIC - The Human Factors of the Agile Software Tester.,2020-08-31,2020,book chapter,Communications in Computer and Information Science,18650929; 18650937,Springer International Publishing,Germany,Lucas Paruch; Viktoria Stray; Raluca Florea,"Although there has been extensive research on the technological aspects of the software testers, little investigation has been conducted within human factors determinant for the software testing role. The current paper explores the human factors of the software testers working in agile projects, through a qualitative study focusing on the perception of these factors, in a software service company. We interviewed 13 agile team members; 6 testers, 5 developers, and 2 designers. Additionally, we observed 11 meetings and observed the teams at work. Our results show that the following six traits are pivotal for the software testing role, seen by working agile software professionals: able to see the whole picture, having good communication skills, being detailed-oriented, structured, creative, and adaptable. Based on our results, we propose how organizations may think when recruiting agile software testers, how the traits may be used as a reference for those considering a software testing career.",,,474,487,Engineering management; Agile software development; Qualitative research; Perception; Software; Software testing; Communication skills; Character traits; Computer science; Soft skills,,,,,https://link.springer.com/content/pdf/10.1007%2F978-3-030-58793-2_38.pdf https://link.springer.com/chapter/10.1007/978-3-030-58793-2_38,http://dx.doi.org/10.1007/978-3-030-58793-2_38,,10.1007/978-3-030-58793-2_38,3082829350,,0,001-475-707-598-671; 002-500-441-033-523; 003-586-534-776-074; 009-680-287-873-561; 013-329-682-847-116; 014-049-090-242-762; 014-490-131-540-473; 016-219-146-729-329; 023-450-318-080-139; 026-948-341-622-220; 027-697-657-786-240; 032-350-839-001-641; 036-863-475-012-188; 037-558-004-373-556; 040-575-485-698-185; 056-487-553-193-818; 058-490-082-223-987; 068-448-292-180-712; 069-185-100-975-76X; 081-727-051-993-299; 085-478-280-726-259; 094-173-446-356-059; 095-054-629-860-877; 102-854-273-198-76X; 106-809-790-909-956; 117-978-014-894-081; 132-426-334-633-727; 151-776-893-032-062; 157-125-377-065-537; 160-518-861-649-96X; 172-235-308-356-980; 180-380-056-815-714,2,false,,
