Lens ID,Title,Date Published,Publication Year,Publication Type,Source Title,ISSNs,Publisher,Source Country,Author/s,Abstract,Volume,Issue Number,Start Page,End Page,Fields of Study,Keywords,MeSH Terms,Chemicals,Funding,Source URLs,External URL,PMID,DOI,Microsoft Academic ID,PMCID,Citing Patents Count,References,Citing Works Count,Is Open Access,Open Access License,Open Access Colour
069-256-518-289-13X,Chapter 6 Lightweight Consistency Checking for Agile Model-Based Development in Practice,,2019,book chapter,Accelerating Digital Transformation,,Springer International Publishing,,Robbert Jongeling; Federico Ciccozzi; Antonio Cicchetti; Jan Carlson,,,,131,151,Computer science; Consistency (knowledge bases); Agile software development; Software engineering; Consistency model; Context (archaeology); Abstraction; Programming language; Correctness; Artificial intelligence; Paleontology; Philosophy; Epistemology; Biology,,,,,,http://dx.doi.org/10.1007/978-3-031-10873-0_8,,10.1007/978-3-031-10873-0_8,,,0,000-169-286-996-695; 000-172-653-197-21X; 000-308-607-458-167; 000-777-443-388-685; 002-418-282-608-875; 002-652-949-750-489; 002-679-317-225-360; 003-346-707-164-146; 003-353-668-200-559; 004-467-348-094-111; 004-580-434-517-461; 005-901-719-801-870; 006-152-239-229-845; 006-681-658-242-597; 006-895-310-658-835; 007-476-800-156-352; 008-049-266-530-075; 008-536-805-760-004; 009-877-942-574-656; 010-081-393-133-162; 010-122-908-411-87X; 010-837-447-720-686; 011-781-385-458-905; 012-063-697-313-81X; 012-071-797-720-631; 012-718-180-038-258; 013-256-723-437-793; 013-433-119-922-308; 013-818-914-752-798; 014-167-757-477-314; 014-193-019-074-838; 014-366-500-074-458; 015-023-679-060-153; 015-152-664-083-855; 015-256-390-711-442; 015-914-502-166-963; 015-994-557-415-982; 016-274-764-329-869; 016-456-277-928-730; 016-464-169-527-77X; 016-484-317-224-120; 016-488-178-086-941; 016-492-368-231-304; 016-737-390-387-789; 017-402-653-573-631; 017-418-422-667-899; 017-601-654-630-863; 018-001-835-708-276; 018-310-241-038-972; 018-451-773-133-873; 018-640-156-900-507; 018-705-035-212-673; 018-711-079-020-690; 019-039-809-688-179; 019-618-174-825-497; 019-799-380-461-247; 020-192-221-223-748; 020-601-436-463-823; 020-689-282-645-155; 021-194-441-266-323; 021-509-052-977-846; 021-743-435-026-269; 021-829-630-584-992; 022-183-588-468-90X; 022-194-202-683-249; 022-198-978-906-065; 022-286-171-834-689; 022-710-662-172-27X; 022-863-553-486-402; 022-982-684-642-315; 022-984-305-484-126; 023-118-736-574-364; 023-450-318-080-139; 024-106-437-551-961; 024-760-877-829-02X; 024-888-342-333-83X; 024-995-964-434-276; 025-001-181-520-39X; 025-182-396-155-700; 026-127-836-616-545; 026-140-424-346-848; 026-181-224-599-833; 026-199-413-083-129; 026-218-937-945-536; 026-950-014-285-573; 027-374-211-253-400; 027-719-595-242-209; 028-143-597-986-356; 028-149-443-086-74X; 028-384-897-023-989; 028-982-185-528-671; 029-074-246-291-130; 029-470-164-013-254; 029-603-720-897-06X; 029-622-396-427-456; 029-762-470-586-979; 029-775-037-885-911; 029-818-025-066-932; 030-749-671-791-337; 031-000-871-198-10X; 031-256-766-028-669; 031-954-836-087-292; 031-978-431-327-098; 032-144-408-611-491; 032-287-891-564-573; 032-446-129-514-035; 032-535-666-329-809; 032-586-688-826-259; 032-697-875-700-733; 032-728-154-591-070; 032-777-701-463-483; 033-162-646-263-969; 033-219-235-113-944; 033-738-382-081-510; 034-270-062-522-36X; 034-512-830-226-221; 034-846-778-055-815; 034-956-903-592-538; 035-603-972-337-445; 035-648-604-989-684; 035-656-036-900-812; 035-820-353-100-327; 035-952-671-868-766; 036-111-279-925-092; 036-176-485-896-12X; 036-353-911-320-479; 037-365-108-655-813; 037-550-015-414-716; 037-671-590-593-002; 037-710-991-091-678; 038-217-965-731-552; 038-291-982-053-170; 038-327-000-975-072; 038-926-924-952-385; 039-062-624-290-552; 039-423-526-846-458; 039-654-159-869-057; 039-940-706-479-670; 040-303-931-016-65X; 040-326-760-577-381; 040-558-964-696-924; 040-939-041-685-871; 041-029-768-886-619; 041-106-905-938-785; 041-225-701-959-367; 041-322-031-248-906; 041-484-996-890-948; 042-096-883-853-413; 042-532-838-100-322; 042-596-077-418-979; 043-414-409-664-065; 043-517-768-674-072; 043-686-534-376-926; 044-048-937-857-089; 044-182-455-336-149; 044-188-263-451-692; 044-202-765-794-757; 044-312-084-549-104; 045-263-852-814-977; 045-908-227-279-61X; 045-976-763-976-472; 046-282-298-080-450; 046-557-180-865-199; 046-557-776-280-175; 046-601-765-159-447; 046-914-301-263-913; 047-251-248-310-822; 047-733-597-650-704; 048-250-164-511-493; 048-534-128-459-629; 048-577-164-661-664; 048-672-340-265-472; 049-600-744-339-195; 049-618-590-801-388; 049-680-319-550-291; 049-898-294-819-937; 050-502-489-367-274; 051-703-900-610-156; 051-781-425-135-088; 052-769-538-974-755; 053-317-545-860-907; 054-024-409-090-036; 054-317-067-964-205; 054-515-584-258-365; 054-735-077-564-944; 055-870-071-121-825; 056-114-579-806-609; 056-269-762-930-807; 056-600-010-513-207; 056-650-631-607-121; 056-849-151-863-589; 057-230-325-483-293; 057-251-092-825-653; 057-445-245-506-908; 057-568-082-379-392; 058-778-302-696-181; 058-811-595-801-425; 059-241-028-987-360; 059-589-637-791-838; 059-928-431-841-936; 060-018-781-921-787; 060-040-641-546-170; 060-216-978-187-448; 060-455-060-437-894; 060-876-867-945-449; 060-996-915-355-07X; 061-610-952-698-372; 061-866-612-132-646; 061-944-070-654-730; 062-118-784-194-483; 062-593-679-828-774; 063-144-525-265-22X; 063-260-809-928-791; 063-466-253-949-709; 064-213-909-687-424; 064-341-472-579-928; 064-535-728-352-926; 064-971-703-460-446; 065-633-631-944-920; 065-890-051-402-348; 066-016-030-088-471; 066-314-441-756-193; 066-351-174-178-327; 066-436-352-356-353; 066-573-280-433-903; 066-920-674-910-147; 067-002-193-082-620; 067-371-650-288-143; 068-563-984-671-735; 069-240-567-678-362; 069-280-509-445-92X; 069-540-054-574-458; 069-552-413-643-530; 069-786-163-854-66X; 070-065-551-308-877; 070-962-428-565-536; 071-105-489-357-423; 071-275-487-792-343; 071-858-084-866-568; 071-891-963-199-313; 072-785-173-094-792; 073-129-783-199-007; 074-167-913-501-088; 074-361-451-299-231; 075-020-816-859-475; 075-617-287-848-034; 075-696-815-099-646; 075-817-363-882-143; 076-141-841-751-420; 076-173-504-787-429; 076-310-438-453-84X; 076-350-363-015-082; 077-446-414-647-913; 077-710-519-038-356; 078-486-083-754-548; 078-650-950-002-515; 079-006-158-744-40X; 079-045-795-565-537; 079-496-270-039-377; 081-328-289-952-026; 082-436-881-704-579; 082-725-897-495-135; 083-198-370-515-499; 083-703-206-843-962; 083-722-735-229-363; 084-527-406-536-373; 084-886-552-374-59X; 085-295-365-742-774; 085-359-510-808-478; 085-743-359-831-275; 085-744-643-009-734; 086-129-206-991-629; 086-176-004-347-909; 086-341-446-522-651; 087-738-310-539-421; 087-828-756-573-770; 089-304-379-780-672; 090-511-454-329-492; 090-579-560-022-84X; 091-337-948-912-691; 091-365-119-156-161; 091-383-383-521-104; 091-684-594-653-608; 092-599-147-105-554; 093-063-549-165-454; 093-226-459-315-723; 093-780-658-351-469; 094-194-861-999-353; 094-497-106-858-918; 095-172-955-201-33X; 097-038-793-599-204; 097-875-757-909-437; 098-150-269-383-155; 098-158-609-967-920; 098-460-671-483-422; 098-964-351-936-583; 099-707-776-034-816; 100-499-184-803-693; 101-176-260-587-612; 101-861-688-539-166; 101-973-213-756-200; 103-937-215-119-525; 105-598-611-608-194; 105-929-945-947-325; 108-629-814-540-108; 109-148-426-287-867; 111-655-049-318-469; 111-879-517-319-132; 111-919-507-697-467; 112-780-957-605-200; 112-893-010-832-938; 113-268-180-899-257; 113-304-924-108-135; 115-195-785-551-307; 115-359-809-378-632; 116-294-538-779-46X; 116-939-161-079-273; 117-319-838-440-411; 117-491-142-542-465; 117-795-919-710-070; 117-993-547-064-430; 118-006-198-269-175; 118-298-955-097-09X; 119-489-150-001-343; 121-565-003-323-872; 123-361-003-280-807; 123-486-932-417-061; 127-495-578-271-361; 128-812-297-563-950; 130-006-858-427-808; 130-774-869-496-317; 134-336-809-777-761; 135-948-291-990-78X; 137-415-923-205-067; 138-191-573-056-650; 140-144-899-636-444; 141-533-496-478-395; 143-206-902-554-360; 144-530-725-508-611; 144-799-256-529-058; 146-084-430-230-566; 146-740-102-844-991; 147-815-395-653-784; 149-001-597-903-809; 154-089-985-186-32X; 155-003-488-670-694; 156-518-480-818-622; 156-780-927-071-240; 157-963-679-647-674; 162-094-958-930-973; 162-482-006-983-757; 162-651-098-943-182; 163-431-104-980-046; 164-770-960-620-089; 165-239-834-454-403; 165-530-269-631-414; 165-602-811-525-081; 167-287-296-095-798; 168-929-050-003-820; 169-678-089-323-007; 170-597-170-983-046; 170-818-428-117-062; 173-790-703-645-28X; 174-372-150-272-835; 175-843-115-335-604; 177-636-560-055-409; 178-994-954-054-659; 181-317-336-758-341; 187-018-836-265-787; 187-535-812-910-556; 187-560-371-765-967; 194-193-802-341-923; 199-053-627-593-900,0,false,,
070-440-144-381-470,Understanding Problem Solving in Software Testing: An Exploration of Tester Routines and Behavior,2023-09-19,2023,book chapter,Lecture Notes in Computer Science,03029743; 16113349,Springer Nature Switzerland,Germany,Eduard Paul Enoiu; Gregory Gay; Jameel Esber; Robert Feldt,,,,143,159,Computer science; Task (project management); Process (computing); Software; Software engineering; Cognition; Software performance testing; System integration testing; Human–computer interaction; Software development; Software construction; Systems engineering; Programming language; Engineering; Psychology; Neuroscience,,,,,,http://dx.doi.org/10.1007/978-3-031-43240-8_10,,10.1007/978-3-031-43240-8_10,,,0,007-964-798-419-91X; 012-692-762-167-524; 015-215-746-672-675; 023-450-318-080-139; 030-757-777-617-206; 037-550-015-414-716; 047-493-708-252-048; 047-572-113-961-430; 063-592-916-976-490; 067-430-505-363-693; 137-724-527-270-624; 172-559-110-463-861,0,false,,
072-469-106-267-759,Is Human Factors Being Studied in Software Testing?: Review of the Literature,2023-12-02,2023,conference proceedings article,2023 IEEE 8th International Conference on Recent Advances and Innovations in Engineering (ICRAIE),,IEEE,,Nursyuhaila Yahaya; Nor Shahida Mohamad Yusop; Marshima Mohd Rosli,"Software engineering is a human-centric activity influenced by human aspects such as age, gender, culture, language, attitudes, behaviors, and skills. While many of the studies in the software engineering area focused on the effect of human aspects in requirement engineering, design, and software development, only a limited number of studies are available investigating the relationship between human aspects and software testing. This study aims to explore the state of the art of human aspects in software testing, particularly to identify human factors studied in previous studies and how those human aspects affect software testing activities. A literature review was conducted on live reputable online databases, and we considered studies from 1994 to 2023. As a result, a total of 38 primary studies were identified. From the 38 studies, test execution was found to be the most researched software testing area related to human aspects, while test design and defect reporting were found to be the least researched. Among the seven categories of human aspects consisting of personality, experience, knowledge, hard skills, soft skills, personal characteristics, and teamwork values that we found, personality was the most studied. The results of this work are of interest to researchers in human-centric software engineering, particularly in software testing. Additionally, software organizations or employers can use the findings to support recruitment and staff management or improvise software testing processes for better software quality.",,,1,6,Computer science; Software testing; Software; Software engineering; Programming language,,,,,,http://dx.doi.org/10.1109/icraie59459.2023.10468409,,10.1109/icraie59459.2023.10468409,,,0,001-475-707-598-671; 009-699-997-725-010; 015-085-720-803-152; 017-874-084-286-047; 023-450-318-080-139; 046-031-810-237-781; 046-616-892-345-041; 064-591-697-476-331; 064-851-270-797-863; 074-030-200-793-503; 084-717-694-088-946; 130-219-199-860-93X; 156-509-047-896-481; 172-235-308-356-980; 182-061-224-459-208,1,false,,
072-881-804-971-254,Hand Jitter Reduction Algorithm Software Test Automation Using Robotic Arm,,2018,journal article,IEEE Access,21693536,Institute of Electrical and Electronics Engineers (IEEE),United States,Debdeep Banerjee; Kevin Yu; Garima Aggarwal,"Hand jitter reduction (HJR) is an algorithm developed to offset the jitter effect caused by camera users. The hand jitter algorithm can be added and implemented in digital signal processing using hardware acceleration to execute these noise reduction algorithms. HJR involves the detection of noise in the camera images and the application of noise reduction algorithms to smoothen these noises. HJR tests are critical for validating the authenticity of the HJR algorithm. The challenge here is to be able to simulate similar motions to what a real-world user would experience while using the camera. We have inducted and programmed a robotic arm to simulate real-world user motions. We have developed software to simulate different motions, such as the generation of sine waves, and we also generate a randomized motion that is a combination of different motions, such as a sine wave, a cosine wave, and vertical, horizontal, and angular motions. In the robotic arm setup, the robot comprises six joints, and we can rotate the joints to generate a specific motion. We have developed an algorithm to find the locations of joints depending on the motion we need to simulate. For example, if we need a 30° rotation while the camera is at a specific location, we can calculate the joint value for specific joints in the robotic arm. The goal of HJR tests is also to categorize the results of the camera as having acceptable or non-acceptable results based on the induced motions. The test automation has immensely helped us to objectively benchmark the performance of the algorithm over several software builds. We have provided test results of computer vision use cases of camera panorama to show the effect of hand jitter on the quality of the software.",6,,23582,23590,Algorithm; Hardware acceleration; Jitter; Robotic arm; Noise reduction; Software; Computer science; Sine wave; Digital signal processing; Robot,,,,,https://ieeexplore.ieee.org/document/8344744/ https://dblp.uni-trier.de/db/journals/access/access6.html#BanerjeeYA18a,http://dx.doi.org/10.1109/access.2018.2829466,,10.1109/access.2018.2829466,2800729456,,1,001-207-593-510-959; 009-546-246-934-279; 011-852-596-087-791; 012-476-917-725-214; 013-001-552-327-594; 018-729-300-210-019; 023-450-318-080-139; 032-416-960-112-289; 032-539-301-073-810; 034-827-337-034-273; 034-846-778-055-815; 041-592-810-476-06X; 042-931-650-716-473; 045-085-941-898-851; 053-680-109-815-591; 061-083-829-630-741; 064-326-772-807-229; 066-194-223-984-469; 068-385-766-565-839; 069-150-452-456-963; 073-028-680-437-014; 079-270-379-349-342; 081-157-190-402-864; 085-222-053-257-238; 095-413-033-619-937; 102-048-148-936-86X; 104-926-827-064-767; 106-698-912-110-829; 123-735-106-476-486; 124-389-543-099-321; 129-888-962-329-732; 134-288-420-805-353; 137-394-048-909-401; 139-214-020-282-979; 162-354-075-783-736,11,true,"CC BY, CC BY-NC-ND",gold
073-028-680-437-014,ISSTA - Sapienz: multi-objective automated testing for Android applications,2016-07-18,2016,conference proceedings article,Proceedings of the 25th International Symposium on Software Testing and Analysis,,ACM,,Ke Mao; Mark Harman; Yue Jia,"We introduce Sapienz, an approach to Android testing that uses multi-objective search-based testing to automatically explore and optimise test sequences, minimising length, while simultaneously maximising coverage and fault revelation. Sapienz combines random fuzzing, systematic and search-based exploration, exploiting seeding and multi-level instrumentation. Sapienz significantly outperforms (with large effect size) both the state-of-the-art technique Dynodroid and the widely-used tool, Android Monkey, in 7/10 experiments for coverage, 7/10 for fault detection and 10/10 for fault-revealing sequence length. When applied to the top 1,000 Google Play apps, Sapienz found 558 unique, previously unknown crashes. So far we have managed to make contact with the developers of 27 crashing apps. Of these, 14 have confirmed that the crashes are caused by real faults. Of those 14, six already have developer-confirmed fixes.",,,94,105,Fuzz testing; Fault detection and isolation; Large effect size; Computer science; Android (operating system); Real-time computing,Android; Test generation; Search-based software testing,,,University College London; Engineering and Physical Sciences Research Council,https://discovery.ucl.ac.uk/id/eprint/1508043/ https://dblp.uni-trier.de/db/conf/issta/issta2016.html#MaoHJ16 https://core.ac.uk/display/81675367 https://doi.acm.org/10.1145/2931037.2931054 https://dl.acm.org/doi/10.1145/2931037.2931054 https://doi.org/10.1145/2931037.2931054 https://dl.acm.org/citation.cfm?id=2931054 https://core.ac.uk/download/pdf/81675367.pdf,http://dx.doi.org/10.1145/2931037.2931054,,10.1145/2931037.2931054,2463553622,,6,000-541-797-292-217; 001-177-264-883-725; 009-375-308-716-960; 009-546-246-934-279; 011-830-340-616-541; 012-476-917-725-214; 013-001-552-327-594; 013-502-397-427-856; 017-315-484-377-297; 017-756-055-114-038; 018-729-300-210-019; 021-662-651-711-485; 023-000-975-515-261; 023-079-772-271-273; 023-450-318-080-139; 025-156-573-157-688; 028-386-562-832-45X; 029-134-041-667-44X; 031-030-626-242-071; 032-539-301-073-810; 034-827-337-034-273; 034-846-778-055-815; 034-920-802-709-157; 037-824-773-984-828; 040-663-049-023-317; 041-641-770-481-873; 044-295-844-689-731; 045-211-539-408-660; 048-208-804-860-730; 048-948-043-824-279; 049-414-363-071-413; 061-083-829-630-741; 062-102-036-828-595; 079-270-379-349-342; 079-940-699-403-598; 081-157-190-402-864; 085-222-053-257-238; 091-675-775-402-133; 097-533-429-436-394; 103-060-664-744-811; 104-032-282-554-287; 104-926-827-064-767; 107-933-728-061-792; 110-057-728-014-356; 117-138-334-202-046; 124-289-730-283-927; 125-038-468-182-492; 126-455-522-231-317; 129-888-962-329-732; 134-288-420-805-353; 159-596-780-126-639; 162-354-075-783-736; 194-630-889-628-865,512,true,,green
