Title,Abstract,Authors,Year,Venue,DOI,Cited by,Actions
"Towards a Unified Framework for Digital Platforms and Knowledge Sharing in Agile IT Environments","Effective Knowledge sharing is essential for agile teams and yet its implementation remains a critical challenge in the fast-paced IT industry. While existing digital platforms are widely adopted to facilitate this process, their success varies significantly. This paper illustrates a novel integrated socio-technical framework which moves beyond a purely technological perspective. Further this paper argues that the efficacy of digital platforms is contingent upon and moderated by two main enabling factors. Thus, this paper synthesizes existing knowledge to delineate how the interplay among people, processes and technology drives successful knowledge sharing, within agile teams.","Vimeshi Silva; T. Sandanayake; Dinesh Samarasinghe; Chathura Ranaweera","2025","2025 10th International Conference on Information Technology Research (ICITR)","10.1109/icitr69413.2025.11353873","-","Include"
"Challenges and Practices for Knowledge Transfer in Global Software Development: An Updated Literature Review","In recent years, the evolution of technology and the increasing globalization of work have significantly transformed the software development industry. Global Software Development (GSD) has become a prevalent practice, enabling companies to reduce costs, leverage time zone differences for continuous development, and access diverse talent pools worldwide. However, knowledge transfer among distributed teams remains a significant challenge, often resulting in inefficiencies, project delays, and decreased software quality. As organizations increasingly rely on geographically dispersed teams, understanding the barriers to effective knowledge transfer in GSD is essential. This study is motivated by the need to reassess knowledge transfer in GSD, especially considering recent advancements in communication tools, collaboration platforms, and the widespread shift to remote work. While previous studies, such as those conducted by Zahedi et al. (2016), have examined knowledge transfer challenges and practices in GSD, the rapid technological and organizational shifts over the past decade necessitate an updated literature review. This work aims to provide a comprehensive overview of distributed teams’ challenges in knowledge transfer and the emerging practices to address these issues. A systematic literature review was conducted, building on the work of Zahedi et al. (2016) by analyzing research published between 2014 and 2024. The study followed a rigorous research protocol, utilizing the Scopus database to identify relevant papers and extract key insights. The findings highlight persistent challenges, including communication barriers, cultural differences, time zone constraints, and difficulties managing knowledge within distributed teams. Social and organizational factors hinder effective knowledge transfer, such as a lack of trust and inadequate coordination. The literature points to several best practices for facilitating knowledge transfer, including on-site visits for remote employees, synchronous and asynchronous communication tools, structured documentation, training programs, and establishing communities of practice. This study contributes to the field by offering an updated perspective on knowledge transfer in GSD, providing valuable insights for organizations aiming to optimize their global collaboration strategies. Future work should compare these findings with previous studies to track the evolution of knowledge transfer practices over time and explore new organizational approaches that have emerged in response to the changing dynamics of distributed software development.","Marcos Vinícius Benigno; M. Argôlo; C. E. Barbosa; Lucas Nóbrega; Luiz Felipe Martinez; Yuri Oliveira; Jano Moreira de Souza","2025","European Conference on Knowledge Management","10.34190/eckm.26.1.3663","-","Include"
"Information Technology Management System of Sharing Knowledge Between Universities Using Systematic Literature Review","Knowledge is a vital resource for academic institutions, driving innovation dan development. However, universities face challenges in effective knowledge sharing due to cultural barriers, lack of trust, and technological constraints. This research, conducted using a Systematic Literature Review (SLR), identifies key variables influencing knowledge sharing, highlights challenges, and proposes solutions to foster collaboration. The findings reveal that cultural barriers, such as competitive organizational environments and technological constraints, including high costs and user-friendly systems, significantly hinder knowledge sharing. To address these issues, the study recommends implementing user-friendly technologies, promoting collaboration through seminars and workshops, and encouraging cross-departmental projects. These solutions provide actionable insights to enhance knowledge sharing frameworks and support innovation across academic institutions","R. Fernando; Hendi Sama","2025","Jurnal Teknologi  Dan Sistem Informasi Bisnis","10.47233/jteksis.v7i1.1733","-","Include"
"Updating a Systematic Literature Review on Knowledge Management Diagnostics in Software Development Organizations","Context: In the rapidly evolving software development landscape, organizations face the constant challenge to work with the generated knowledge. Knowledge Management (KM) can be applied to efficiently manage the knowledge in software development organizations and ensure the product quality. However, although there are several KM approaches, carrying out a KM diagnosis in the organizations can identify which knowledge activities present the best cost-benefit for the organization. There are several KM approaches suggested in the literature. But it is quite relevant to carry out a KM diagnosis in the organizations to clearly identify which knowledge activities can present the best cost-benefit aspect within the organizations. A Systematic Literature Review (SLR) was published in 2018, presenting evidence on KM diagnosis in software development organizations. From an assessment of this SLR and the current state of this research topic, we noticed that the 2018’ SLR needed maintenance with an update. Objective: This study aims to update and extend the results produced in this previous SLR. Method: We conducted the 2018 SLR update, considering a new database, backward and forward snowballing, and more analyses of the extracted data. Results: From the SLR update, 16 new studies on KM diagnoses in Software Engineering context were identified. Conclusion: In Software Engineering, consolidated models continue lacking for applying KM diagnostics. Moreover, computational approaches to provide automated support in the diagnosis application and analysis are not quite well explored.","Daniela dos Santos Alves; Deivid José Smek; É. Souza; K. Felizardo; N. L. Vijaykumar","2024","Brazilian Symposium on Software Quality","10.1145/3701625.3701652","1","Include"
"Knowledge Management Diagnosis in Software Organizations: A Systematic Literature Review Extension","Context: Effective Knowledge Management (KM) is vital for tech companies where developers frequently switch, risking the loss of valuable experience. Diagnosing its current state, assessing practices, and understanding applied methodologies in organizations is essential to succeed in KM. Problem: Given the dynamism witnessed in KM, a Systematic Literature Review (SLR) is necessary, and we found an outdated SLR on this topic until 2018. Objective: We extended the SLR to identify the current state-of-the-art KM within organizations and research niches to accurately depict the current management practices. Method: We extended the 2018 SLR, incorporating two additional databases to update this review and allow us to select new studies produced after the original review. IS Theory: This work was conceived under the auspices of the theory of organizational knowledge creation, aiming to understand the influence of KM on the development of information systems (IS) today. Summary of Results: We evidenced 29 studies on KM Diagnosis in software development organizations. Conclusion: Results show significant changes in applying learning to organizational culture through KM. Internal techniques, not tools or literature models, are now prevalent in km development. Agile methodology is a central focus in KM studies. The same holds for software architectures, with minimal application of KM in their selection and development. Contributions and Impact in the IS area: We believe in identifying KM strategies that facilitate the formation of new teams, transmitting knowledge and experiences, developing new products, and maintaining existing ISs.","Wesley Souza; Williamson Silva; G. Guedes","2024","Brazilian Symposium on Information Systems","10.1145/3658271.3658273","-","Include"
"Implementing a Simplified Risk Management Approach in Agile Software Development: An Experience Report","Agile software development projects often overlook risk management. Besides that, the lack of risk management could lead to problems such as delays, budget overruns, and even project termination, especially in distributed software development. In this paper, we address this topic in an industrial context. We implemented a simplified method to manage risks in distributed agile software development projects at Betabit company. The risk management approach proposed includes identifying, recording, and monitoring the risks faced by the company during its projects, enabling the creation of action plans to handle the risks. We assessed the acceptance of the method by applying the Technology Acceptance Model (TAM) questionnaire and open questions among the professionals who used it. The research results showed that the model was well accepted, with 90.1% of participants agreeing that it was useful in risk prevention and management. The benefits found were a broader view of projects, effective communication among teams, knowledge sharing, task clarification, and a structured approach to risk management. The challenging part is to learn how to use the method. Besides that, all respondents would recommend the proposed method to other companies, showing the potential of the method to manage risks in agile software projects.","Julio Cesar dos Santos; Vicente Pinto Alves Coelho; Felipe Mello Fonseca; D. S. Mendonça","2023","Brazilian Symposium on Software Quality","10.1145/3629479.3629516","1","Include"
"JavaScript Quiz Game","This paper recounts my experience creating a JavaScript quiz software that contains multiple quiz executions. All of these modules have been enciphered collectively and are structurally distinct from the antedating bones. These were erected in stages, with each bone being distinct from the one before it. Each of them has a score system (in some form) that allows druggies to compare their results to those of others. This, in my opinion, is the primary provocation for taking the quiz, and the stoner is given an objective score grounded on their capability position. HTML (HyperText Markup Language), CSS (Slinging Style Wastes), JS (JavaScript), API (Operation Programming Interface) (Operation Programming Interface)","Gurpartap Singh; Anup Lal Yadav; S. Sehgal","2022","International Conference Control and Robots","10.1109/iccr56254.2022.9996042","-","Include"
"Real Time Object Detection","Introducing YOLO, another way to deal with object identification. Previous object detection function re-uses separators to create location. All things considered, we present the identification object as a repetitive problem in geographically separated jump boxes and related class opportunities. All acquisition pipes are an independent entity, they may be well developed to begin to finish directly on-site operations. Our integrated design is very fast. Our Consequences should be discarded photo rotations continuously at 45 edge every second. An additional moderate practice of the organization, YOLO, processes 155 shocking casings per second. Compared to the best class identification frameworks, YOLO makes many limitations yet very different to expect misleading sides on the basis. Finally, YOLO learns the typical presentation of articles. It overcomes other local techniques, including SSD and R-CNN, while summarizing from conventional images to as diverse as art.","Simranjeet Kaur; Anup Lal Yadav; A. Joshi","2022","International Conference Control and Robots","10.1109/iccr56254.2022.9995738","117","Include"
"Sorting Algorithm visualizer","Visual learning is one of the most effective ways to grasp the knowledge of anything. Algorithm visualization demonstrates operation of logic in a pictorial manner, this enhances the knowledge and simplifies the understanding. In this paper, We address the need for a pictorial explanation of algorithms and suggest solution to visualize sorting algorithms by building a web application and explore probable future directions based on our own findings and observations using objective checklist of the web application.","Aditya Thakkar; Kavita; Sonali Dash; Sanjeev Kumar Joshi","2022","International Conference Control and Robots","10.1109/iccr56254.2022.9996059","8","Include"
"Hospital Management System Based on IoT","An overall organization of the Internet of Things (IoT) will be the future organization, which associates objects of various application fields, usefulness and innovation. These items are remarkably addressable and utilize standard correspondence convention and impart in a heterogeneous network environment. Anytime, wherever interfacing anything, thought got out huge headways in the medical services space. This paper examines the actual situation of a brilliant independent HOSPITAL MANAGEMENT SYSTEM using of IoT. The paper targets clarifying the innovation drivers exhaustively behind the IoT and medical services with the data on information demonstrating clinical gadgets, information approval of basic occurrence information, planning of existing IoT information into various other related framework information, work process or the interaction stream behind the specialized tasks of the distant gadget coordination, the design of the organization, middleware, data sets, application administrations. The difficulties and the related arrangement in this field are examined with the use case.","Meraj Ahmed; Navneet Kaur; S. Gairola","2022","International Conference Control and Robots","10.1109/iccr56254.2022.9995904","1","Include"
"Performance and stability Comparison of React and Flutter: Cross-platform Application Development","Application development is a very important aspect when it comes to business. From small-scale companies to Fortune Companies everyone has an application through which they are running their business whether it is a web-based application or Mobile Application. Now the Mobile market is majorly captured by two Operating systems Android and iOS. Initially, to develop an application for a single project for both Systems separately, companies need to hire separate developers. But ReactJs is a Cross-Platform Application development library and is used to create a frontend for applications. It is majorly used by Facebook, Instagram, Pinterest, etc. It is JavaScript Library. Now Google has also launched its pure cross-platform framework called Flutter. Flutter uses Dart programming language to run. An open-source framework created by Google in 2017 to create applications from a single codebase. This research paper presents the study and comparison of the two most famous cross-platform application development technologies. It starts by discussing the basic functions of the application development methodologies. Followed by, it contains a comparison of the performance of the applications developed by these technologies. After that Stability of applications made by the flutter and React Native is checked on different parameters. There is an implementation of an application using Flutter and React Native which will be used for performance analysis between two applications running Android and Web platforms","Kamal Kishore; Shanu Khare; Vaibhav Uniyal; Sahil Verma","2022","International Conference Control and Robots","10.1109/iccr56254.2022.9996039","14","Include"
"Agile Lifestyle of Development","An iterative technique to software development and management that facilitates teams delivering value to their customers rapidly and with fewer problems. Agile method is extensively used in different corporate industry level projects as a light development strategy that aims to meet the changing needs. Short-term repetitions are best used for successful product development. Conventional software development processes do not seem to be very effective in managing rapid change of needs. Aside from the benefits of Agile, criticism of the agile approach claims that it fails to identify structural and aesthetic issues and is therefore hesitant to offer minor decisions throughout the design process. Here, in the middle of this research paper, we try to identify the effects of a much better approach in terms of efficiency and pace to s consistent software development procedure within an organizational and cultural framework.","Ayushi; Damandeep Kaur; S. Sehgal","2022","International Conference Control and Robots","10.1109/iccr56254.2022.9996014","1","Include"
"Influencing factors on knowledge sharing in virtual teams","BACKGROUND: The importance of virtual work is growing. Especially in knowledge-intensive, dynamic and international sectors, virtual teams have become an ubiquitous work form, promising more flexibility and higher performance. To solve complex problems they have to share and assimilate knowledge, but it is difficult in virtual contexts to overcome social distance and to avoid communication issues. Knowledge sharing in virtual teams may be more prone to errors and take more time. OBJECTIVE: Current studies mainly consider a one-sided perspective, either focusing on technical or human influencing factors for effective knowledge sharing in virtual teams, but not on the interaction between these. This study addresses that gap by exploring success-critical factors for knowledge sharing by using the socio-technical systems-approach. METHODS: The database of the study consists of 26 in-depth interviews. The interviews were partially structured and based on the Critical Incident Technique. Using a deductive categorization scheme consisting of four main categories and 21 subcategories, the frequencies and overlaps of influencing factors on successful knowledge sharing in virtual teams were examined. RESULTS: Each critical incident reported included factors from all four main categories (technology, structure, people and task) with specific frequencies and connections. Structural influencing factors as well as technological factors are mentioned particularly frequently together. CONCLUSION: The results of the study underline the importance of an integrated socio-technical view on knowledge sharing in virtual teams. Technical and social factors need to be considered simultaneously. The findings can be used for designing and optimizing knowledge sharing processes in virtual teams.","Stephanie Tietz; K. Werner","2022","Work","10.3233/wor-211241","2","Include"
"The learning effect on organizational performance during a crisis: a serial mediation analysis with knowledge creation, storage and sharing","PurposeThe aim of this study is to investigate the serially mediating effect of knowledge management (KM) practices (namely, knowledge creation, storage and sharing) on the organizational learning (OL) and organizational performance (OP) relationships during a crisis.Design/methodology/approachBased on theories-of-action, knowledge-based and resource-based theories, this study proposed a sequential mediation model where OL underlying mechanisms through which KM practices have facilitated OP during the crisis. The sample dataset contains 440 responses collected from the managers of the software development companies in Pakistan. The authors used Hayes Process macro with SPSS to test the study hypotheses.FindingsThe results of the study reveal that knowledge creation, storage and sharing serially mediate the relationships between OL and OP. These findings strengthen the argument suggesting that OL plays the key role in KM that helps software companies to mend their performance in times of crisis.Originality/valueThis study contributes to the KM literature in two ways: (1) grounded on the study's proposed framework, organizations can improve and manage their businesses in times of crisis and (2) learn how to generate new knowledge in response to business crises.","U. Qadri; M. Ghani; Shumaila Bibi; A. Tahir; M. Farooq; Abdul Rauf Kashif","2021","European Journal of Management and Business Economics","10.1108/ejmbe-03-2021-0107","17","Include"
"Importance of Secure Software Development Processes and Tools for Developers","In this research paper of secure software systems, authors have discussed what the proper development process is when it comes to creating a secure software, which will be suited for developers and relevent stakeholders alike. Secure Software Development Process for Developers is of crucial importance for software engineers as more and more software-based devices are becoming commonly available, and cloud services are evolving which require for the software to be constantly connected to the internet. With this in mind, Secure Software Development needs to be transformed to something most developers can rely upon to make applied software safe and have the capability to mitigate against potential attacks by hackers. Furthermore, in this paper, existing Secure Software Development Process ideas and implementations are reviewed and investigated using the research paper pool available online. Thereafter, an approach is proposed to enhance the security aspect in software development process to resolve security issues. Lastly, the paper concludes with final remarks on practical implementation of security features in software development phases for production of secure and reliable software programs and systems.","Muhammad Danish Roshaidie; W. Liang; Calvin Goh Kai Jun; Kok Yew; Fatima-tuz-Zahra","2020","arXiv.org","10.48550/arxiv.2012.15153","5","Include"
"Risk Assessment, Threat Modeling and Security Testing in SDLC","The software development process is considered as one of the key guidelines in the creation of said software and this approach is necessary for providing a more efficient yet satisfactory output. Without separation of work into distinct stages, it may lead to many delays and inefficiency of the project process where this disorganization can directly affect the product quality and reliability. Moreover, with this methodology established as the standard for any project, there are bound to be missteps specifically in regard to the involvement of security due to the lack of awareness. Therefore, the aim of this research is to identify and elaborate the findings and understanding of the security integrated into the process of software development as well as the related individual roles in ensuring that this security is maintained. Through thorough analysis and review of literature, an effort has been made through this paper to showcase the correct processes and ways for securing the software development process. At the same time, certain issues that pertain to this subject have been discussed together with proposing appropriate solutions. Furthermore, in depth discussion is carried out regarding methods such as security testing, risk assessment, threat modeling and other techniques that are able to create a more secure environment and systematic approach in a software development process.","Alya Hannah; A. Kamal; Caryn Chuah; Yi-Chun Yen; Gan Jia; Hui","2020","arXiv.org","10.48550/arxiv.2012.07226","11","Include"
"Bureaucratic Corruptive Behavior: Causes And Motivation of State Civil Aparatures in Indonesia","The main problem in this study is that the Corruption Perception Index (CPI) is still high. This is 
because the corrupt behavior and motivation of the state apparatus still occurs in Indonesia. The purpose of this 
study is to determine the causes and motivations of corruption that have occurred in the Bandung area. This study 
uses interviews and data collection from speakers. Researchers discovered that corrupt behavior is caused by 
behavior in the work environment, motivated by the greed of individuals or groups in the bureaucracy. The results 
of the study concluded that corrupt behavior led to accustomed and massive action, making this an extraordinary 
behavior with the involvement of the community, business and the bureaucracy itself. The researchers recommends 
that the treatment be consistent with the short and medium term plans and the long term patterns, all of which 
depend on the government as a policy maker in tackling corruption, naturally by relevant stakeholders, both the 
community , business, the involvement of bureaucracy itself, including the involvement of non-governmental 
organizations in the fight against corruption. and other related settings.","Nanang Suparman","2020","International Journal of Psychosocial Rehabilitation","10.37200/ijpr/v24i4/pr201627","5","Include"
"A theoretical literature review on knowledge management framework","-","Villy Satria Praditha; M. Lubis","2024","PROCEEDINGS OF THE 6TH INTERNATIONAL CONFERENCE ON COMPUTING AND APPLIED INFORMATICS 2022","10.1063/5.0199320","-","Include"
