Title,Abstract,Authors,Year,Venue,DOI,Cited by,Actions
"A Risk Management Framework for Large Scale Scrum using Metadata Outer Request Management Methodology","—Recently, most software projects became naturally Distributed Agile Development (DAD) projects. The main benefits of DAD projects are cost-saving and being close to markets due to their distributed nature, such as in large-scale Scrum (LeSS). Developing LeSS projects leads to the emergence of challenges in risk management, especially the team collaboration challenges, where there is no standardized process for teams to communicate collaboratively. Team collaboration and the knowledge sharing is a vital resource for a large Scrum team's success. Hence, finding a dynamic technique that facilitates team collaboration in the LeSS environment is necessary. This paper proposes a risk management framework for LeSS using outer metadata requests. The proposed framework manages the outer requests amongst the distributed team. Therefore, it avoids missing team collaboration, risks, and threats to project completion. It also contributes to exchanging team skills and experience. The proposed framework is evaluated by applying it to two different case studies for large-scale Scrum projects. The evaluation results are given. The evaluation proved the effectiveness of the proposed framework.","Rehab Adel; Hany Harb; Ayman Elshenawy","2022","International Journal of Advanced Computer Science and Applications","10.14569/ijacsa.2022.0130315","3","Include"
"Globally Renewable Energy Consumption Sources","Electricity consumption will be part of a large conversation about connected with international electricity demand in the next two decades. Renewable energy sources and climate change modify minimization and offer a good estimation for the technological, scientific, environmentally friendly, financial, and also societal aspects. This research is the extended version of the research presented in IGI global book Role of IoT in Green Energy Systems, 2015. A full assessment related to any profile minimization options will likely involve an evaluation of respective potential alongside minimization with the bargain with sustainable development as well as all associated risks and costs.","S. Saeed; Noor Zaman Jhanjhi; Memood Naqvi","2021","Advances in environmental engineering and green technologies book series","10.4018/978-1-7998-6709-8.ch014","-","Include"
"Analyzing the Relationship between Explicit Knowledge Sharing and Human Resource Performance Efficiency: Evaluating the Moderating Role of Trust","-","Qaiser S Khan; Dr. Yasir Kamal; Dr. Sonia Sethi; Azhar M. Khan; Dr. Mohib; Ullah; R. Ali","2021","-","-","-","Include"
"Towards Requirements Elicitation and Analysis Model for Distributed Audience","Requirement’s elicitation is a challenging activity and the most important activity for the software development process. Requirement elicitation is the process of gathering information from the user and stakeholders. By reviewing the literature review, there are many challenges involved in the elicitation process, i.e., lack of proper communication and knowledge transfer between software stakeholders. Most of the companies are moving towards a globally distributed environment. Some many problems and challenges occur due to temporal, geographic, and socio-cultural diversity among stakeholders. This study proposes a new approach to the requirements elicitation and analysis phase in a distributed environment with the knowledge management technique that improves the software development process. The purpose of the paper is to develop a distributed framework based on eliciting and analyzing the customer's requirements by implementing a knowledge management technique that efficiently handles and manages the resources of an organization. This study aims to improve the elicitation and analysis process by using knowledge management techniques in a distributed environment. Thus, this study improves software development architecture. The feasibility and effectiveness of the proposed approach were evaluated in an empirical study with encouraging results.","Muhammad Nadim; R. Latif; Khalid Hussain; Noor Zaman Jhanjhi; Mehedi Masud; Saleh Yahya Alyahyan; R. Habeeb","2021","Turkish Online Journal of Qualitative Inquiry","-","1","Include"
"A Framework for Software Customization in Global Software Development (GSD)","-","Muhammad Nadim; R. Latif; Khalid Hussain; Noor Zaman Jhanjhi; Mehedi Masud; Saleh Yahya; Alyahyan; M. Humayun; Saleh Yahya Alyahyan","2021","-","-","1","Include"
"Securing Software Systems: A Survey","<jats:p>This paper aims to discuss the standard guidelines of the development process of secure software and will give justification on different types and ways of the software development processes. Additionally, a survey is conducted, the aim of which is to observe user behavior towards software system usage, user attitude in terms of privacy and policy awareness, security and privacy concerns. This is followed by discussion on how to secure software systems in development stage.</jats:p>","Yong Weixiong","2020","-","10.36227/techrxiv.12319598","2","Include"
