Lens ID,Title,Date Published,Publication Year,Publication Type,Source Title,ISSNs,Publisher,Source Country,Author/s,Abstract,Volume,Issue Number,Start Page,End Page,Fields of Study,Keywords,MeSH Terms,Chemicals,Funding,Source URLs,External URL,PMID,DOI,Microsoft Academic ID,PMCID,Citing Patents Count,References,Citing Works Count,Is Open Access,Open Access License,Open Access Colour
140-667-301-551-925,4-Level MOFs and Bootstrapping Tools,2026-03-26,2026,book chapter,Science of Software Product Lines,,ACM,,Don Batory,,,,,,,,,,,,http://dx.doi.org/10.1145/3731302.3731325,,10.1145/3731302.3731325,,,0,000-229-938-371-255; 000-748-128-067-977; 001-865-268-412-137; 002-169-263-959-253; 002-205-483-637-075; 002-255-906-649-445; 002-319-389-249-311; 003-142-013-605-897; 003-196-924-988-132; 004-060-683-531-361; 004-482-850-549-607; 004-750-216-209-785; 005-242-858-648-814; 005-787-176-176-338; 006-762-106-092-249; 007-051-721-082-515; 007-278-283-280-322; 007-296-507-865-91X; 007-561-563-388-059; 007-857-119-988-675; 008-089-445-684-041; 008-105-182-774-519; 009-132-412-302-833; 009-193-279-479-355; 009-222-096-833-470; 009-385-333-386-237; 009-963-926-891-214; 010-094-351-411-200; 010-889-314-905-956; 011-107-096-509-484; 011-283-753-736-189; 011-816-359-478-803; 012-189-735-535-135; 012-656-156-785-463; 013-071-761-362-39X; 013-132-797-429-249; 013-900-012-248-237; 014-751-082-836-237; 014-934-066-319-741; 015-226-102-797-433; 017-041-319-238-343; 017-051-677-527-742; 017-051-959-794-62X; 017-606-814-036-568; 018-559-707-085-513; 018-650-071-946-118; 018-689-712-347-616; 019-018-332-749-866; 019-572-858-318-049; 019-732-858-440-327; 020-236-617-980-384; 020-644-184-568-839; 020-671-278-806-889; 021-816-732-751-357; 022-470-447-336-585; 022-678-979-843-484; 022-955-585-690-019; 023-874-214-691-305; 024-278-805-719-23X; 024-465-265-477-439; 024-944-096-656-425; 025-150-921-689-713; 025-163-903-373-136; 025-911-311-841-806; 027-468-667-135-338; 028-181-437-566-771; 028-280-354-839-571; 028-842-796-453-934; 029-071-271-146-687; 029-333-663-690-785; 029-848-076-258-990; 030-385-191-512-541; 030-772-108-912-414; 030-917-539-799-470; 031-105-226-986-999; 031-129-151-280-356; 031-359-847-242-693; 031-784-273-355-767; 031-869-969-333-569; 031-965-323-329-405; 032-406-139-656-567; 032-462-357-185-456; 032-718-848-450-548; 033-044-037-001-069; 034-394-623-276-563; 034-939-673-570-805; 035-240-415-123-620; 035-440-795-325-211; 037-227-999-502-953; 037-310-651-809-636; 037-503-614-956-099; 038-848-160-636-620; 038-864-372-635-54X; 039-378-951-152-270; 039-447-029-989-569; 039-709-906-200-476; 040-449-847-120-851; 040-913-419-983-534; 041-104-687-776-108; 041-269-622-385-996; 041-272-266-008-357; 041-863-663-936-741; 042-622-135-414-869; 042-816-519-096-535; 043-007-115-590-234; 043-139-888-310-171; 043-160-293-353-523; 043-396-923-365-31X; 043-624-172-749-954; 043-650-538-736-453; 043-847-352-946-654; 044-097-146-718-307; 045-987-114-195-530; 046-877-082-572-408; 046-892-263-737-609; 047-043-145-856-965; 047-323-591-942-595; 048-331-636-212-681; 048-411-907-235-552; 048-419-886-242-45X; 048-658-344-492-276; 048-931-996-697-503; 049-077-164-958-21X; 050-414-627-616-751; 050-850-724-190-28X; 050-876-041-527-301; 051-517-217-335-47X; 051-646-830-883-07X; 052-023-680-699-845; 053-452-106-485-449; 053-835-347-647-443; 054-401-676-383-539; 054-441-852-289-864; 054-883-951-610-295; 055-152-904-810-195; 055-448-564-667-611; 055-540-178-817-37X; 055-548-343-326-184; 055-656-481-395-004; 055-899-127-132-320; 057-523-155-227-607; 057-751-697-453-97X; 057-890-484-196-930; 058-718-786-525-252; 058-899-810-107-719; 059-456-389-235-189; 060-313-672-110-637; 060-466-598-197-646; 062-307-037-193-797; 062-534-240-244-641; 062-872-520-990-00X; 064-056-106-878-730; 064-589-797-800-087; 066-458-503-104-207; 068-380-878-504-106; 068-471-263-286-089; 068-486-141-755-504; 069-339-117-566-742; 069-352-676-298-63X; 069-571-004-858-26X; 070-158-350-725-087; 070-340-751-715-155; 070-549-986-121-789; 070-754-895-065-77X; 070-917-938-048-106; 071-839-076-158-779; 072-637-054-953-465; 072-701-654-564-301; 073-499-300-785-22X; 073-966-322-121-23X; 074-190-909-660-233; 076-153-740-768-969; 077-031-653-276-991; 077-949-490-328-361; 078-550-202-637-883; 078-900-816-005-124; 079-362-475-992-694; 079-854-934-124-599; 080-250-362-030-105; 080-348-424-813-240; 080-659-458-377-772; 081-154-850-047-404; 081-643-899-696-736; 082-334-901-799-804; 083-030-924-089-497; 083-632-018-006-870; 086-074-342-406-177; 086-194-638-161-814; 086-541-599-856-245; 086-952-590-055-915; 087-409-363-189-94X; 087-694-304-804-725; 088-203-789-087-716; 088-672-754-896-670; 088-819-298-704-818; 089-397-395-129-156; 090-691-710-180-369; 091-677-607-489-873; 091-742-515-811-819; 092-351-828-990-158; 092-377-232-820-882; 092-597-199-745-554; 092-813-517-441-681; 093-003-826-573-444; 093-995-120-092-387; 094-080-784-868-310; 094-313-147-425-677; 096-143-144-439-065; 096-810-350-965-468; 098-023-799-012-579; 098-280-776-807-982; 098-737-143-970-365; 098-749-482-195-461; 099-246-585-475-003; 099-255-956-289-58X; 101-559-391-997-222; 101-878-780-220-036; 102-829-582-718-533; 103-024-104-421-768; 103-101-180-655-191; 103-446-473-468-043; 105-522-218-098-254; 105-603-865-999-221; 105-703-734-654-985; 107-229-177-725-310; 107-975-552-546-686; 109-263-014-645-887; 109-415-565-341-871; 109-460-512-355-404; 109-467-552-124-303; 109-521-872-260-595; 109-846-219-660-356; 110-165-117-659-743; 110-357-917-400-541; 110-509-289-947-502; 111-805-458-835-185; 111-959-744-391-134; 113-646-852-571-277; 113-837-626-019-777; 114-191-551-163-454; 116-317-110-770-148; 116-439-349-772-466; 117-241-599-120-340; 117-245-280-328-13X; 117-252-893-843-834; 120-535-209-471-885; 120-732-118-510-394; 121-050-196-819-221; 121-267-014-361-449; 121-844-909-084-048; 122-366-897-619-81X; 123-549-944-845-122; 123-864-239-033-532; 123-932-168-512-799; 124-364-047-257-094; 124-449-060-032-562; 124-579-470-037-556; 125-424-724-258-499; 126-687-680-603-73X; 130-708-228-525-901; 131-115-921-945-835; 132-178-773-685-350; 133-454-155-788-939; 134-268-455-181-693; 134-401-647-883-163; 135-779-946-626-803; 135-828-306-557-406; 137-508-785-341-847; 137-559-912-561-253; 138-366-705-995-169; 139-330-264-873-706; 141-238-738-655-517; 141-478-768-983-194; 142-531-373-871-012; 143-140-980-818-211; 144-817-877-897-458; 145-047-367-057-553; 146-135-756-650-891; 147-441-517-186-026; 147-633-945-229-391; 149-187-110-367-804; 150-616-114-756-661; 152-985-217-285-686; 153-839-124-331-859; 154-550-982-498-232; 155-224-414-961-754; 155-401-428-919-914; 155-968-907-651-676; 156-644-867-736-071; 160-578-585-725-94X; 161-195-306-121-659; 164-648-700-796-388; 167-387-188-329-823; 167-896-065-369-695; 167-908-227-905-872; 171-033-413-740-288; 178-254-900-665-08X; 182-402-784-068-515; 185-828-449-097-658; 192-492-511-762-629; 199-954-780-463-027,0,false,,
141-828-526-921-035,Towards Rapid Design of Compartmental Models,2024-09-22,2024,conference proceedings article,Proceedings of the ACM/IEEE 27th International Conference on Model Driven Engineering Languages and Systems,,ACM,,Zahra Fiyouzisabah; Jessie Galasso; Marios Fokaefs; Michalis Famelis,"In times of crisis, epidemiologists can come under great pressure to model rapidly evolving diseases and to produce analyses about the effects of potential public health interventions. Taking previously developed, tested, and validated model components as the base on which to prototype new infectious disease models can save precious time and effort. However, there is currently no systematic process for quickly navigating a corpus of existing epidemiological models or identifying and reusing their most useful components. In this paper, we propose a vision to accelerate the creation of prototype compartmental models for infectious diseases. We outline a semi-automated process that epidemiologists can use to create prototypes that have been partially completed with reused fragments from existing models. Epidemiologists can thus focus on modelling the novel aspects of an ongoing public health crisis, as opposed to aspects of it that are already more or less well understood in previous work. Our approach comprises five steps in total, including identifying useful components in a corpus of infectious disease models, generating potential candidate prototypes, and organizing them in a formal data structure that allows navigation and exploration by the modellers. We outline 13 challenges ahead and discuss potential solutions based on formal modelling techniques.",,,1041,1045,Computer science,,,,Wellcome Trust,,http://dx.doi.org/10.1145/3652620.3688340,,10.1145/3652620.3688340,,,0,010-227-909-667-253; 011-598-987-379-459; 014-887-367-780-41X; 019-018-332-749-866; 024-043-309-806-91X; 027-005-529-725-590; 033-837-225-385-004; 069-151-821-791-527; 084-512-771-972-091; 085-479-124-736-222; 098-154-763-556-072; 110-533-439-708-84X; 137-508-785-341-847,0,false,,
143-617-546-268-988,SESR-Eval: Dataset for Evaluating LLMs in the Title-Abstract Screening of Systematic Reviews,2025-10-02,2025,conference proceedings article,2025 ACM/IEEE International Symposium on Empirical Software Engineering and Measurement (ESEM),,IEEE,,Aleksi Huotala; Miikka Kuutila; Mika Mäntylä,"Background: The use of large language models (LLMs) in the title-abstract screening process of systematic reviews (SRs) has shown promising results, but suffers from limited performance evaluation. Aims: Create a benchmark dataset to evaluate the performance of LLMs in the title-abstract screening process of SRs. Provide evidence whether using LLMs in title-abstract screening in software engineering is advisable. Method: We start with 169 SR research artifacts and find 24 of those to be suitable for inclusion in the dataset. Using the dataset we benchmark title-abstract screening using 9 LLMs. Results: We present the SESR-Eval (Software Engineering Systematic Review Evaluation) dataset containing 34,528 labeled primary studies, sourced from 24 secondary studies published in software engineering (SE) journals. Most LLMs performed similarly and the differences in screening accuracy between secondary studies are greater than differences between LLMs. The cost of using an LLM is relatively low - less than 40 per secondary study even for the most expensive model. Conclusions: Our benchmark enables monitoring AI performance in the screening task of SRs in software engineering. At present, LLMs are not yet recommended for automating the title-abstract screening process, since accuracy varies widely across secondary studies, and no LLM managed a high recall with reasonable precision. In future, we plan to investigate factors that influence LLM screening performance between studies.",,,1,12,Benchmark (surveying); Systematic review; Computer science; Task (project management); Process (computing); Plan (archaeology); Risk assessment; Medicine; Risk analysis (engineering); MEDLINE; Software; Inclusion (mineral); Baseline (sea); Machine learning; Data science; Artificial intelligence; Systematic error,,,,,,http://dx.doi.org/10.1109/esem64174.2025.00053,,10.1109/esem64174.2025.00053,,,0,000-020-527-317-513; 002-137-698-068-031; 005-643-189-141-73X; 005-837-821-260-974; 006-257-805-258-204; 007-050-139-903-803; 012-278-816-485-525; 018-728-327-798-735; 018-745-109-806-754; 021-617-139-554-692; 029-818-771-227-793; 035-973-711-669-87X; 039-868-093-827-56X; 040-575-485-698-185; 040-750-169-696-554; 048-862-024-698-53X; 049-555-556-417-74X; 055-236-719-472-188; 059-058-601-772-907; 065-003-705-220-161; 072-116-842-618-082; 073-640-541-761-042; 073-979-776-613-960; 080-098-228-926-572; 081-111-048-284-779; 087-733-242-684-113; 090-433-610-965-255; 102-728-755-760-519; 111-927-924-258-238; 115-437-707-790-299; 127-968-352-654-826; 130-493-784-445-915; 131-214-830-370-080; 136-768-165-802-07X; 137-364-963-140-299; 137-508-785-341-847; 139-257-551-679-924; 140-329-304-269-501; 143-617-546-268-988; 145-589-616-945-524; 151-038-874-897-242; 164-117-874-816-788; 169-423-289-516-503; 181-573-467-902-30X; 188-856-222-762-526,2,false,,
143-741-030-504-132,Unleashing the Power of Implicit Feedback in Software Product Lines: Benefits Ahead,2023-10-22,2023,conference proceedings article,Proceedings of the 22nd ACM SIGPLAN International Conference on Generative Programming: Concepts and Experiences,,ACM,,Raul Medeiros; Oscar Díaz; David Benavides,"Software Product Lines (SPLs) facilitate the development of a complete range of software products through systematic reuse. Reuse involves not only code but also the transfer of knowledge gained from one product to others within the SPL. This transfer includes bug fixing, which, when encountered in one product, affects the entire SPL portfolio. Similarly, feedback obtained from the usage of a single product can inform beyond that product to impact the entire SPL portfolio. Specifically, implicit feedback refers to the automated collection of data on software usage or execution, which allows for the inference of customer preferences and trends. While implicit feedback is commonly used in single-product development, its application in SPLs has not received the same level of attention. This paper promotes the investigation of implicit feedback in SPLs by identifying a set of SPL activities that can benefit the most from it. We validate this usefulness with practitioners using a questionnaire-based approach (n=8). The results provide positive insights into the advantages and practical implications of adopting implicit feedback at the SPL level.",,,113,121,Computer science; Reuse; Software; Portfolio; Product (mathematics); Set (abstract data type); Software engineering; Code reuse; New product development; Inference; Programming language; Artificial intelligence; Engineering; Economics; Mathematics; Geometry; Waste management; Financial economics; Marketing; Business,,,,Ministerio de Ciencia e Innovación; Ministerio de Ciencia e Innovación; Ministerio de Ciencia e Innovación; Junta de Andalucía; Ministerio de Ciencia e Innovación,,http://dx.doi.org/10.1145/3624007.3624058,,10.1145/3624007.3624058,,,0,004-845-837-734-437; 013-821-311-690-396; 016-481-843-997-55X; 020-814-436-066-990; 021-169-664-939-279; 023-004-627-057-987; 025-932-158-299-290; 028-303-558-042-15X; 029-191-359-714-075; 036-469-238-210-599; 046-882-952-806-762; 047-177-923-819-145; 049-326-437-912-845; 056-712-955-725-07X; 056-908-426-179-127; 057-523-155-227-607; 060-952-172-848-169; 062-118-784-194-483; 073-027-044-194-440; 079-074-364-299-129; 083-930-226-789-553; 092-456-510-851-992; 093-640-091-413-416; 096-120-177-804-573; 108-975-003-108-452; 114-526-008-042-003; 137-508-785-341-847; 142-445-348-781-364; 146-090-252-549-558; 166-625-755-395-54X; 173-758-327-474-703,1,false,,
146-303-277-929-609,Software Product Lines,2026-03-26,2026,book chapter,Science of Software Product Lines,,ACM,,Don Batory,,,,,,,,,,,,http://dx.doi.org/10.1145/3731302.3731308,,10.1145/3731302.3731308,,,0,000-229-938-371-255; 000-748-128-067-977; 001-865-268-412-137; 002-169-263-959-253; 002-205-483-637-075; 002-255-906-649-445; 002-319-389-249-311; 003-142-013-605-897; 003-196-924-988-132; 004-060-683-531-361; 004-482-850-549-607; 004-750-216-209-785; 005-242-858-648-814; 005-787-176-176-338; 006-762-106-092-249; 007-051-721-082-515; 007-278-283-280-322; 007-296-507-865-91X; 007-561-563-388-059; 007-857-119-988-675; 008-089-445-684-041; 008-105-182-774-519; 009-132-412-302-833; 009-193-279-479-355; 009-222-096-833-470; 009-385-333-386-237; 009-963-926-891-214; 010-094-351-411-200; 010-889-314-905-956; 011-107-096-509-484; 011-283-753-736-189; 011-816-359-478-803; 012-189-735-535-135; 012-656-156-785-463; 013-071-761-362-39X; 013-132-797-429-249; 013-900-012-248-237; 014-751-082-836-237; 014-934-066-319-741; 015-226-102-797-433; 017-041-319-238-343; 017-051-677-527-742; 017-051-959-794-62X; 017-606-814-036-568; 018-559-707-085-513; 018-650-071-946-118; 018-689-712-347-616; 019-018-332-749-866; 019-572-858-318-049; 019-732-858-440-327; 020-236-617-980-384; 020-644-184-568-839; 020-671-278-806-889; 021-816-732-751-357; 022-470-447-336-585; 022-678-979-843-484; 022-955-585-690-019; 023-874-214-691-305; 024-278-805-719-23X; 024-465-265-477-439; 024-944-096-656-425; 025-150-921-689-713; 025-163-903-373-136; 025-911-311-841-806; 027-468-667-135-338; 028-181-437-566-771; 028-280-354-839-571; 028-842-796-453-934; 029-071-271-146-687; 029-333-663-690-785; 029-848-076-258-990; 030-385-191-512-541; 030-772-108-912-414; 030-917-539-799-470; 031-105-226-986-999; 031-129-151-280-356; 031-359-847-242-693; 031-784-273-355-767; 031-869-969-333-569; 031-965-323-329-405; 032-406-139-656-567; 032-462-357-185-456; 032-718-848-450-548; 033-044-037-001-069; 034-394-623-276-563; 034-939-673-570-805; 035-240-415-123-620; 035-440-795-325-211; 037-227-999-502-953; 037-310-651-809-636; 037-503-614-956-099; 038-848-160-636-620; 038-864-372-635-54X; 039-378-951-152-270; 039-447-029-989-569; 039-709-906-200-476; 040-449-847-120-851; 040-913-419-983-534; 041-104-687-776-108; 041-269-622-385-996; 041-272-266-008-357; 041-863-663-936-741; 042-622-135-414-869; 042-816-519-096-535; 043-007-115-590-234; 043-139-888-310-171; 043-160-293-353-523; 043-396-923-365-31X; 043-624-172-749-954; 043-650-538-736-453; 043-847-352-946-654; 044-097-146-718-307; 045-987-114-195-530; 046-877-082-572-408; 046-892-263-737-609; 047-043-145-856-965; 047-323-591-942-595; 048-331-636-212-681; 048-411-907-235-552; 048-419-886-242-45X; 048-658-344-492-276; 048-931-996-697-503; 049-077-164-958-21X; 050-414-627-616-751; 050-850-724-190-28X; 050-876-041-527-301; 051-517-217-335-47X; 051-646-830-883-07X; 052-023-680-699-845; 053-452-106-485-449; 053-835-347-647-443; 054-401-676-383-539; 054-441-852-289-864; 054-883-951-610-295; 055-152-904-810-195; 055-448-564-667-611; 055-540-178-817-37X; 055-548-343-326-184; 055-656-481-395-004; 055-899-127-132-320; 057-523-155-227-607; 057-751-697-453-97X; 057-890-484-196-930; 058-718-786-525-252; 058-899-810-107-719; 059-456-389-235-189; 060-313-672-110-637; 060-466-598-197-646; 062-307-037-193-797; 062-534-240-244-641; 062-872-520-990-00X; 064-056-106-878-730; 064-589-797-800-087; 066-458-503-104-207; 068-380-878-504-106; 068-471-263-286-089; 068-486-141-755-504; 069-339-117-566-742; 069-352-676-298-63X; 069-571-004-858-26X; 070-158-350-725-087; 070-340-751-715-155; 070-549-986-121-789; 070-754-895-065-77X; 070-917-938-048-106; 071-839-076-158-779; 072-637-054-953-465; 072-701-654-564-301; 073-499-300-785-22X; 073-966-322-121-23X; 074-190-909-660-233; 076-153-740-768-969; 077-031-653-276-991; 077-949-490-328-361; 078-550-202-637-883; 078-900-816-005-124; 079-362-475-992-694; 079-854-934-124-599; 080-250-362-030-105; 080-348-424-813-240; 080-659-458-377-772; 081-154-850-047-404; 081-643-899-696-736; 082-334-901-799-804; 083-030-924-089-497; 083-632-018-006-870; 086-074-342-406-177; 086-194-638-161-814; 086-541-599-856-245; 086-952-590-055-915; 087-409-363-189-94X; 087-694-304-804-725; 088-203-789-087-716; 088-672-754-896-670; 088-819-298-704-818; 089-397-395-129-156; 090-691-710-180-369; 091-677-607-489-873; 091-742-515-811-819; 092-351-828-990-158; 092-377-232-820-882; 092-597-199-745-554; 092-813-517-441-681; 093-003-826-573-444; 093-995-120-092-387; 094-080-784-868-310; 094-313-147-425-677; 096-143-144-439-065; 096-810-350-965-468; 098-023-799-012-579; 098-280-776-807-982; 098-737-143-970-365; 098-749-482-195-461; 099-246-585-475-003; 099-255-956-289-58X; 101-559-391-997-222; 101-878-780-220-036; 102-829-582-718-533; 103-024-104-421-768; 103-101-180-655-191; 103-446-473-468-043; 105-522-218-098-254; 105-603-865-999-221; 105-703-734-654-985; 107-229-177-725-310; 107-975-552-546-686; 109-263-014-645-887; 109-415-565-341-871; 109-460-512-355-404; 109-467-552-124-303; 109-521-872-260-595; 109-846-219-660-356; 110-165-117-659-743; 110-357-917-400-541; 110-509-289-947-502; 111-805-458-835-185; 111-959-744-391-134; 113-646-852-571-277; 113-837-626-019-777; 114-191-551-163-454; 116-317-110-770-148; 116-439-349-772-466; 117-241-599-120-340; 117-245-280-328-13X; 117-252-893-843-834; 120-535-209-471-885; 120-732-118-510-394; 121-050-196-819-221; 121-267-014-361-449; 121-844-909-084-048; 122-366-897-619-81X; 123-549-944-845-122; 123-864-239-033-532; 123-932-168-512-799; 124-364-047-257-094; 124-449-060-032-562; 124-579-470-037-556; 125-424-724-258-499; 126-687-680-603-73X; 130-708-228-525-901; 131-115-921-945-835; 132-178-773-685-350; 133-454-155-788-939; 134-268-455-181-693; 134-401-647-883-163; 135-779-946-626-803; 135-828-306-557-406; 137-508-785-341-847; 137-559-912-561-253; 138-366-705-995-169; 139-330-264-873-706; 141-238-738-655-517; 141-478-768-983-194; 142-531-373-871-012; 143-140-980-818-211; 144-817-877-897-458; 145-047-367-057-553; 146-135-756-650-891; 147-441-517-186-026; 147-633-945-229-391; 149-187-110-367-804; 150-616-114-756-661; 152-985-217-285-686; 153-839-124-331-859; 154-550-982-498-232; 155-224-414-961-754; 155-401-428-919-914; 155-968-907-651-676; 156-644-867-736-071; 160-578-585-725-94X; 161-195-306-121-659; 164-648-700-796-388; 167-387-188-329-823; 167-896-065-369-695; 167-908-227-905-872; 171-033-413-740-288; 178-254-900-665-08X; 182-402-784-068-515; 185-828-449-097-658; 192-492-511-762-629; 199-954-780-463-027,0,false,,
147-529-405-460-349,Applying Graph Neural Networks to Learn Graph Configuration Spaces,2025-02-04,2025,conference proceedings article,Proceedings of the 19th International Working Conference on Variability Modelling of Software-Intensive Systems,,ACM,,Michael Mittermaier; Takfarinas Saber; Goetz Botterweck,,,,68,76,Computer science; Graph; Theoretical computer science; Artificial intelligence,,,,"Taighde Éireann – Research Ireland, Lero, the Research Ireland Centre for Software",https://dl.acm.org/doi/pdf/10.1145/3715340.3715444 https://doi.org/10.1145/3715340.3715444,http://dx.doi.org/10.1145/3715340.3715444,,10.1145/3715340.3715444,,,0,003-201-733-153-857; 006-342-036-776-483; 009-003-595-043-596; 015-101-574-812-09X; 019-018-332-749-866; 028-823-837-074-778; 030-865-338-149-226; 033-840-953-083-722; 035-689-883-663-185; 043-435-460-922-165; 045-327-642-894-024; 048-331-636-212-681; 048-775-075-006-462; 061-065-523-494-469; 062-042-954-903-783; 068-315-091-723-312; 080-616-742-691-080; 101-692-574-682-197; 126-470-205-637-036; 137-508-785-341-847; 138-794-414-842-235; 146-682-756-337-46X; 169-045-487-931-286; 172-732-493-983-763,2,true,cc-by,gold
150-990-086-050-855,Towards incremental build of software configurations,2022-05-21,2022,conference proceedings article,Proceedings of the ACM/IEEE 44th International Conference on Software Engineering: New Ideas and Emerging Results,,ACM,,Georges Aaron Randrianaina; Djamel Eddine Khelladi; Olivier Zendra; Mathieu Acher,"Building software is a crucial task to compile, test, and deploy software systems while continuously ensuring quality. As software is more and more configurable, building multiple configurations is a pressing need, yet, costly and challenging to instrument. The common practice is to independently build (a.k.a., clean build) a software for a subset of configurations. While incremental build has been considered for software evolution and relatively small modifications of the source code, it has surprisingly not been considered for software configurations. In this vision paper, we formulate the hypothesis that incremental build can reduce the cost of exploring the configuration space of software systems. We detail how we apply incremental build for two real-world application scenarios and conduct a preliminary evaluation on two case studies, namely x264 and Linux Kernel. For x264, we found that one can incrementally build configurations in an order such that overall build time is reduced. Nevertheless, we could not find any optimal order with the Linux Kernel, due to a high distance between random configurations. Therefore, we show it is possible to control the process of generating configurations: we could reuse commonality and gain up to 66% of build time compared to only clean builds.",,,101,105,Computer science; Software; Software construction; Software evolution; Linux kernel; Software development; Kernel (algebra); Reuse; Code reuse; Software framework; Software engineering; Software quality; Process (computing); Software system; Distributed computing; Operating system; Engineering; Mathematics; Waste management; Combinatorics,,,,,https://dl.acm.org/doi/pdf/10.1145/3510455.3512792 https://doi.org/10.1145/3510455.3512792 https://hal.science/hal-03558479/document https://hal.science/hal-03558479,http://dx.doi.org/10.1145/3510455.3512792,,10.1145/3510455.3512792,,,0,022-040-770-818-63X; 025-117-130-055-736; 025-163-903-373-136; 028-081-599-781-37X; 028-579-907-263-047; 036-778-479-311-277; 038-848-160-636-620; 041-128-444-168-796; 043-650-538-736-453; 049-140-016-083-692; 050-954-832-513-468; 054-441-852-289-864; 065-156-158-280-153; 066-216-151-745-921; 073-092-785-169-913; 077-075-249-772-824; 078-942-863-180-57X; 086-952-590-055-915; 090-998-787-355-039; 092-665-008-431-117; 094-739-879-393-082; 098-272-962-603-473; 123-932-168-512-799; 129-951-197-056-149; 134-401-647-883-163; 137-508-785-341-847; 157-704-073-958-041; 172-756-064-685-414; 177-977-135-029-862,5,true,,gold
