id,abstract,apc_list.value,apc_paid.value,authorships.author.display_name,authorships.author.id,authorships.author.orcid,authorships.countries,authorships.institutions.display_name,authorships.institutions.id,authorships.is_corresponding,best_oa_location.license,citation_normalized_percentile.value,cited_by_count,corresponding_institution_ids,display_name,doi,funders.display_name,fwci,is_retracted,language,open_access.is_oa,open_access.oa_status,primary_location.source.display_name,primary_location.source.host_organization,primary_location.source.host_organization_name,primary_location.source.id,primary_location.source.issn_l,primary_location.source.type,primary_topic.display_name,publication_date,publication_year,type
https://openalex.org/W1975675278,,,,Claes Wohlin,https://openalex.org/A5037810527,https://orcid.org/0000-0003-0460-5253,SE,Blekinge Institute of Technology,https://openalex.org/I52719799,True,,0.99983628,3735,https://openalex.org/I52719799,Guidelines for snowballing in systematic literature studies and a replication in software engineering,https://doi.org/10.1145/2601248.2601268,Lunds Universitet,147.607,False,en,False,closed,,,,,,,Software Engineering Techniques and Practices,2014-05-13,2014,article
https://openalex.org/W2019955851,"Systematic studies of the literature can be done in different ways. In particular, different guidelines propose different first steps in their recommendations, e.g. start with search strings in different databases or start with the reference lists of a starting set of papers.",,,Samireh Jalali|Claes Wohlin,https://openalex.org/A5062749444|https://openalex.org/A5037810527,|https://orcid.org/0000-0003-0460-5253,SE|SE,Blekinge Institute of Technology|Blekinge Institute of Technology,https://openalex.org/I52719799|https://openalex.org/I52719799,True|False,other-oa,0.99796551,619,https://openalex.org/I52719799,Systematic literature studies,https://doi.org/10.1145/2372251.2372257,,46.2894,False,en,True,green,,,,,,,Software Engineering Techniques and Practices,2012-09-19,2012,article
https://openalex.org/W2133933998,,3350,,He Zhang|Muhammad Ali Babar|Paolo Tell,https://openalex.org/A5100420137|https://openalex.org/A5058693284|https://openalex.org/A5077923832,https://orcid.org/0000-0002-9159-5331|https://orcid.org/0000-0001-6653-6076|https://orcid.org/0000-0001-7391-0046,AU|DK|DK,Data61|UNSW Sydney|IT University of Copenhagen|IT University of Copenhagen,https://openalex.org/I42894916|https://openalex.org/I31746571|https://openalex.org/I83467386|https://openalex.org/I83467386,True|False|False,,0.98754523,545,https://openalex.org/I31746571|https://openalex.org/I42894916,Identifying relevant studies in software engineering,https://doi.org/10.1016/j.infsof.2010.12.010,Australian Government|Australian Research Council,14.9988,False,en,False,closed,Information and Software Technology,https://openalex.org/P4310320990,Elsevier BV,https://openalex.org/S205010575,0950-5849,journal,Software Engineering Research,2010-12-29,2010,article
https://openalex.org/W2066253558,,,,Tony Gorschek|Per Garre|Stig Larsson|Claes Wohlin,https://openalex.org/A5047199297|https://openalex.org/A5015330691|https://openalex.org/A5009306701|https://openalex.org/A5037810527,https://orcid.org/0000-0002-3646-235X||https://orcid.org/0000-0002-0921-0878|https://orcid.org/0000-0003-0460-5253,SE|SE|SE|CH|SE,Blekinge Institute of Technology|Blekinge Institute of Technology|Danaher (Sweden)|ABB (Sweden)|ABB (Switzerland),https://openalex.org/I52719799|https://openalex.org/I52719799|https://openalex.org/I4210160385|https://openalex.org/I4210086503|https://openalex.org/I885143765,True|False|False|False,,0.9941586,341,https://openalex.org/I52719799,A Model for Technology Transfer in Practice,https://doi.org/10.1109/ms.2006.147,,24.3376,False,en,False,closed,IEEE Software,https://openalex.org/P4310320439,IEEE Computer Society,https://openalex.org/S6725529,0740-7459,journal,Technology Assessment and Management,2006-11-01,2006,article
https://openalex.org/W2113533445,,2290,,Forrest Shull|Jeffrey C. Carver|Sira Vegas|Natália Juristo,https://openalex.org/A5027573308|https://openalex.org/A5005826696|https://openalex.org/A5076034572|https://openalex.org/A5056117323,|https://orcid.org/0000-0002-7824-9151|https://orcid.org/0000-0001-8535-9386|https://orcid.org/0000-0002-2465-7141,US|US|ES|ES,Fraunhofer USA Center Mid-Atlantic CMA|Mississippi State University|Universidad Politécnica de Madrid|Universidad Politécnica de Madrid,https://openalex.org/I4210162509|https://openalex.org/I99041443|https://openalex.org/I88060688|https://openalex.org/I88060688,True|False|False|False,,0.99608815,318,https://openalex.org/I4210162509,The role of replications in Empirical Software Engineering,https://doi.org/10.1007/s10664-008-9060-1,,31.4928,False,en,False,closed,Empirical Software Engineering,https://openalex.org/P4310319900,Springer Science+Business Media,https://openalex.org/S109852484,1382-3256,journal,Software Engineering Research,2008-01-28,2008,article
https://openalex.org/W2494902551,,3350,,Vahid Garousi|Kai Petersen|Barış Özkan,https://openalex.org/A5000712015|https://openalex.org/A5071394068|https://openalex.org/A5023204635,https://orcid.org/0000-0001-6590-7576|https://orcid.org/0000-0002-1532-8223|https://orcid.org/0000-0002-5489-6274,TR|SE|TR,Hacettepe University|Blekinge Institute of Technology|Atilim University,https://openalex.org/I66514158|https://openalex.org/I52719799|https://openalex.org/I45542416,True|False|False,other-oa,0.99808538,238,https://openalex.org/I66514158,Challenges and best practices in industry-academia collaborations in software engineering: A systematic literature review,https://doi.org/10.1016/j.infsof.2016.07.006,,44.8543,False,en,True,green,Information and Software Technology,https://openalex.org/P4310320990,Elsevier BV,https://openalex.org/S205010575,0950-5849,journal,Software Engineering Techniques and Practices,2016-07-30,2016,article
https://openalex.org/W2014079492,"Background: Systematic literature studies are commonly used in software engineering. There are two main ways of conducting the searches for these type of studies; they are snowballing and database searches. In snowballing, the reference list (backward snowballing - BSB) and citations (forward snowballing - FSB) of relevant papers are reviewed to identify new papers whereas in a database search, different databases are searched using predefined search strings to identify new papers. Objective: Snowballing has not been in use as extensively as database search. Hence it is important to evaluate its efficiency and reliability when being used as a search strategy in literature studies. Moreover, it is important to compare it to database searches. Method: In this paper, we applied snowballing in a literature study, and reflected on the outcome. We also compared database search with backward and forward snowballing. Database search and snowballing were conducted independently by different researchers. The searches of our literature study were compared with respect to the efficiency and reliability of the findings. Results: Out of the total number of papers found, snowballing identified 83% of the papers in comparison to 46% of the papers for the database search. Snowballing failed to identify a few relevant papers, which potentially could have been addressed by identifying a more comprehensive start set. Conclusion: The efficiency of snowballing is comparable to database search. It can potentially be more reliable than a database search however, the reliability is highly dependent on the creation of a suitable start set.",,,Deepika Badampudi|Claes Wohlin|Kai Petersen,https://openalex.org/A5018797669|https://openalex.org/A5037810527|https://openalex.org/A5071394068,https://orcid.org/0000-0002-6215-1774|https://orcid.org/0000-0003-0460-5253|https://orcid.org/0000-0002-1532-8223,SE|SE|SE,Blekinge Institute of Technology|Blekinge Institute of Technology|Blekinge Institute of Technology,https://openalex.org/I52719799|https://openalex.org/I52719799|https://openalex.org/I52719799,True|False|False,other-oa,0.9952668,221,https://openalex.org/I52719799,Experiences from using snowballing and database searches in systematic literature studies,https://doi.org/10.1145/2745802.2745818,,29.6717,False,en,True,green,,,,,,,Software Engineering Research,2015-04-27,2015,article
https://openalex.org/W2008411739,"Background: Systematic literature reviews and systematic mapping studies are becoming increasingly common in software engineering, and hence it becomes even more important to better understand the reliability of such studies. Objective: This paper presents a study of two systematic mapping studies to evaluate the reliability of mapping studies and point out some challenges related to this type of study in software engineering. Method: The research is based on an in-depth case study of two published mapping studies on software product line testing. Results: We found that despite the fact that the two studies are addressing the same topic, there are quite a number of differences when it comes to papers included and in terms of classification of the papers included in the two mapping studies. Conclusions: From this we conclude that although mapping studies are important, their reliability cannot simply be taken for granted. Based on the findings we also provide four conjectures that further research has to address to make secondary studies (systematic mapping studies and systematic literature reviews) even more valuable to both researchers and practitioners.",3560,,Claes Wohlin|Per Runeson|Paulo Anselmo da Mota Silveira Neto|Emelie Engström|Ivan Machado|Eduardo Santana de Almeida,https://openalex.org/A5037810527|https://openalex.org/A5087032437|https://openalex.org/A5088049727|https://openalex.org/A5085978732|https://openalex.org/A5060475953|https://openalex.org/A5055793778,https://orcid.org/0000-0003-0460-5253|https://orcid.org/0000-0003-2795-4851|https://orcid.org/0000-0003-0197-8249|https://orcid.org/0000-0001-6736-9425|https://orcid.org/0000-0001-9027-2293|https://orcid.org/0000-0002-9312-6715,SE|SE||SE|BR|BR,Blekinge Institute of Technology|Lund University||Lund University|Universidade Federal da Bahia|Universidade Federal da Bahia,https://openalex.org/I52719799|https://openalex.org/I187531555||https://openalex.org/I187531555|https://openalex.org/I126158947|https://openalex.org/I126158947,True|False|False|False|False|False,other-oa,0.99548588,210,https://openalex.org/I52719799,On the reliability of mapping studies in software engineering,https://doi.org/10.1016/j.jss.2013.04.076,,30.9156,False,en,True,green,Journal of Systems and Software,https://openalex.org/P4310320990,Elsevier BV,https://openalex.org/S37879656,0164-1212,journal,Software Engineering Research,2013-05-04,2013,article
https://openalex.org/W2030522107,,2290,,Óscar Dieste|Anna Grimán|Natália Juristo,https://openalex.org/A5004737603|https://openalex.org/A5051035209|https://openalex.org/A5056117323,https://orcid.org/0000-0002-3060-7853|https://orcid.org/0000-0002-9092-6952|https://orcid.org/0000-0002-2465-7141,ES|VE|ES,Universidad Politécnica de Madrid|Simón Bolívar University|Universidad Politécnica de Madrid,https://openalex.org/I88060688|https://openalex.org/I629287|https://openalex.org/I88060688,True|False|False,,0.98838856,191,https://openalex.org/I88060688,Developing search strategies for detecting relevant experiments,https://doi.org/10.1007/s10664-008-9091-7,,16.8143,False,en,False,closed,Empirical Software Engineering,https://openalex.org/P4310319900,Springer Science+Business Media,https://openalex.org/S109852484,1382-3256,journal,Software Engineering Research,2008-11-11,2008,article
https://openalex.org/W2022507817,Collaboration between industry and academia supports improvement and innovation in industry and helps to ensure industrial relevance in academic research. This article presents an exploratory study of the factors for successful collaboration between industry and academia in software research.,,,Claes Wohlin|Aybüke Aurum|Lefteris Angelis|Laura Phillips|Yvonne Dittrich|Tony Gorschek|Håkan Grahn|Kennet Henningsson|Simon Kågström|Graham Low|Per Rovegard|Piotr Tomaszewski|Christine Van Toorn|Jeff Winter,https://openalex.org/A5037810527|https://openalex.org/A5000503974|https://openalex.org/A5008070273|https://openalex.org/A5050272709|https://openalex.org/A5033163346|https://openalex.org/A5047199297|https://openalex.org/A5032002580|https://openalex.org/A5001380771|https://openalex.org/A5074314159|https://openalex.org/A5113594013|https://openalex.org/A5052462733|https://openalex.org/A5056102667|https://openalex.org/A5077908164|https://openalex.org/A5052500422,https://orcid.org/0000-0003-0460-5253|https://orcid.org/0000-0003-2416-4555|https://orcid.org/0000-0002-6677-4039|https://orcid.org/0000-0003-3186-6598|https://orcid.org/0000-0003-4757-3394|https://orcid.org/0000-0002-3646-235X|https://orcid.org/0000-0001-9947-1088|||||https://orcid.org/0000-0001-7877-2121||https://orcid.org/0000-0002-2444-527X,SE|AU|GR||DK|SE|SE|AU|SE|CN|AU|IT|AU|SE|AU|SE|SE,Blekinge Institute of Technology|UNSW Sydney|Aristotle University of Thessaloniki||IT University of Copenhagen|Blekinge Institute of Technology|Blekinge Institute of Technology|Blekinge Institute of Technology|UNSW Sydney|Insight (China)|UNSW Sydney|Ericsson (Italy)|UNSW Sydney|Ericsson (Sweden)|Blekinge Institute of Technology|UNSW Sydney|Blekinge Institute of Technology|Blekinge Institute of Technology,https://openalex.org/I52719799|https://openalex.org/I31746571|https://openalex.org/I21370196||https://openalex.org/I83467386|https://openalex.org/I52719799|https://openalex.org/I52719799|https://openalex.org/I52719799|https://openalex.org/I31746571|https://openalex.org/I4210099567|https://openalex.org/I31746571|https://openalex.org/I4210126170|https://openalex.org/I31746571|https://openalex.org/I1306339040|https://openalex.org/I52719799|https://openalex.org/I31746571|https://openalex.org/I52719799|https://openalex.org/I52719799,True|False|False|False|False|False|False|False|False|False|False|False|False|False,other-oa,0.99656786,182,https://openalex.org/I52719799,The Success Factors Powering Industry-Academia Collaboration,https://doi.org/10.1109/ms.2011.92,University of New South Wales,30.5708,False,en,True,green,IEEE Software,https://openalex.org/P4310320439,IEEE Computer Society,https://openalex.org/S6725529,0740-7459,journal,"Research, Science, and Academia",2011-08-03,2011,article
https://openalex.org/W3010782494,,3350,,Érica Mourão|João Felipe Pimentel|Leonardo Murta|Marcos Kalinowski|Emília Mendes|Claes Wohlin,https://openalex.org/A5002203924|https://openalex.org/A5010003572|https://openalex.org/A5102931782|https://openalex.org/A5062526200|https://openalex.org/A5103878525|https://openalex.org/A5037810527,https://orcid.org/0000-0001-7916-0143|https://orcid.org/0000-0001-6680-7470|https://orcid.org/0000-0002-5173-1247|https://orcid.org/0000-0003-1445-3425||https://orcid.org/0000-0003-0460-5253,BR|BR|BR|BR|SE|SE,Universidade Federal Fluminense|Universidade Federal Fluminense|Universidade Federal Fluminense|Pontifícia Universidade Católica do Rio de Janeiro|Blekinge Institute of Technology|Blekinge Institute of Technology,https://openalex.org/I161127581|https://openalex.org/I161127581|https://openalex.org/I161127581|https://openalex.org/I2699952|https://openalex.org/I52719799|https://openalex.org/I52719799,False|False|False|True|False|False,,0.99495793,182,https://openalex.org/I2699952,On the performance of hybrid search strategies for systematic literature reviews in software engineering,https://doi.org/10.1016/j.infsof.2020.106294,,24.2213,False,en,True,green,Information and Software Technology,https://openalex.org/P4310320990,Elsevier BV,https://openalex.org/S205010575,0950-5849,journal,Software Engineering Research,2020-03-09,2020,article
https://openalex.org/W3034832379,"Systematic Literature Reviews (SLRs) have been adopted within Software Engineering (SE) for more than a decade to provide meaningful summaries of evidence on several topics. Many of these SLRs are now potentially not fully up-to-date, and there are no standard proposals on how to update SLRs in SE. The objective of this paper is to propose guidelines on how to best search for evidence when updating SLRs in SE, and to evaluate these guidelines using an SLR that was not employed during the formulation of the guidelines. To propose our guidelines, we compare and discuss outcomes from applying different search strategies to identify primary studies in a published SLR, an SLR update, and two replications in the area of effort estimation. These guidelines are then evaluated using an SLR in the area of software ecosystems, its update and a replication. The use of a single iteration forward snowballing with Google Scholar, and employing as a seed set the original SLR and its primary studies is the most cost-effective way to search for new evidence when updating SLRs. Furthermore, the importance of having more than one researcher involved in the selection of papers when applying the inclusion and exclusion criteria is highlighted through the results. Our proposed guidelines formulated based upon an effort estimation SLR, its update and two replications, were supported when using an SLR in the area of software ecosystems, its update and a replication. Therefore, we put forward that our guidelines ought to be adopted for updating SLRs in SE.",3350,3350,Claes Wohlin|Emília Mendes|Katia Romero Felizardo|Marcos Kalinowski,https://openalex.org/A5037810527|https://openalex.org/A5103878525|https://openalex.org/A5043877845|https://openalex.org/A5062526200,https://orcid.org/0000-0003-0460-5253||https://orcid.org/0000-0001-9080-4165|https://orcid.org/0000-0003-1445-3425,SE|SE|BR|BR,Blekinge Institute of Technology|Blekinge Institute of Technology|Universidade Tecnológica Federal do Paraná|Pontifical Catholic University of Rio de Janeiro,https://openalex.org/I52719799|https://openalex.org/I52719799|https://openalex.org/I1283613182|https://openalex.org/I2699952,True|False|False|False,cc-by-nc-nd,0.99088067,138,https://openalex.org/I52719799,Guidelines for the search strategy to update systematic literature reviews in software engineering,https://doi.org/10.1016/j.infsof.2020.106366,Conselho Nacional de Desenvolvimento Científico e Tecnológico,16.4233,False,en,True,hybrid,Information and Software Technology,https://openalex.org/P4310320990,Elsevier BV,https://openalex.org/S205010575,0950-5849,journal,Software Engineering Research,2020-06-10,2020,article
https://openalex.org/W1980710855,,2290,,Barbara Kitchenham|Pearl Brereton|Mark Turner|Mahmood Niazi|Stephen Linkman|Rialette Pretorius|David Budgen,https://openalex.org/A5012102325|https://openalex.org/A5007624202|https://openalex.org/A5001344018|https://openalex.org/A5041382184|https://openalex.org/A5111517058|https://openalex.org/A5027093536|https://openalex.org/A5061755008,https://orcid.org/0000-0002-6134-8460||https://orcid.org/0000-0002-8520-4779|https://orcid.org/0000-0001-7318-7644|||https://orcid.org/0000-0001-7143-0241,GB|GB|GB|GB|GB|GB|GB,Keele University|Keele University|Keele University|Keele University|Keele University|Durham University|Durham University,https://openalex.org/I56007636|https://openalex.org/I56007636|https://openalex.org/I56007636|https://openalex.org/I56007636|https://openalex.org/I56007636|https://openalex.org/I190082696|https://openalex.org/I190082696,True|False|False|False|False|False|False,cc-by,0.97412291,114,https://openalex.org/I56007636,Refining the systematic literature review process—two participant-observer case studies,https://doi.org/10.1007/s10664-010-9134-8,University of Technology Sydney|Universidade de São Paulo|Engineering and Physical Sciences Research Council,8.6366,False,en,True,green,Empirical Software Engineering,https://openalex.org/P4310319900,Springer Science+Business Media,https://openalex.org/S109852484,1382-3256,journal,Software Engineering Research,2010-06-24,2010,article
https://openalex.org/W2522451690,,,,Katia Romero Felizardo|Emília Mendes|Marcos Kalinowski|Érica Ferreira de Souza|Nandamudi L. Vijaykumar,https://openalex.org/A5043877845|https://openalex.org/A5103878525|https://openalex.org/A5062526200|https://openalex.org/A5050603863|https://openalex.org/A5042368174,https://orcid.org/0000-0001-9080-4165||https://orcid.org/0000-0003-1445-3425|https://orcid.org/0000-0002-5425-145X|https://orcid.org/0000-0002-9025-0841,BR|SE|BR|BR|BR,Universidade Tecnológica Federal do Paraná|Blekinge Institute of Technology|Universidade Federal Fluminense|Universidade Tecnológica Federal do Paraná|National Institute for Space Research,https://openalex.org/I1283613182|https://openalex.org/I52719799|https://openalex.org/I161127581|https://openalex.org/I1283613182|https://openalex.org/I80849659,True|False|False|False|False,,0.98777271,100,https://openalex.org/I1283613182,Using Forward Snowballing to update Systematic Reviews in Software Engineering,https://doi.org/10.1145/2961111.2962630,,14.4914,False,en,False,closed,,,,,,,Software Engineering Research,2016-09-08,2016,article
https://openalex.org/W2775303056,,,,Érica Mourão|Marcos Kalinowski|Leonardo Murta|Emília Mendes|Claes Wohlin,https://openalex.org/A5002203924|https://openalex.org/A5062526200|https://openalex.org/A5102931782|https://openalex.org/A5103878525|https://openalex.org/A5037810527,https://orcid.org/0000-0001-7916-0143|https://orcid.org/0000-0003-1445-3425|https://orcid.org/0000-0002-5173-1247||https://orcid.org/0000-0003-0460-5253,BR|BR|BR|SE|SE,Universidade Federal Fluminense|Universidade Federal Fluminense|Pontifical Catholic University of Rio de Janeiro|Blekinge Institute of Technology|Blekinge Institute of Technology,https://openalex.org/I161127581|https://openalex.org/I161127581|https://openalex.org/I2699952|https://openalex.org/I52719799|https://openalex.org/I52719799,True|False|False|False|False,,0.97574096,73,https://openalex.org/I161127581,Investigating the Use of a Hybrid Search Strategy for Systematic Reviews,https://doi.org/10.1109/esem.2017.30,,8.1003,False,en,False,closed,,,,,,,Software Engineering Research,2017-11-01,2017,article
https://openalex.org/W1741569902,"In systematic reviews, the number of articles found by search strings tend to be very large. In order to limit the number of articles to handle manually, we investigate a search strategy based on references between papers. We first identify a “take-off paper” which is the starting point for the search and then we follow the references from that paper. We also investigate “cardinal papers”, i.e. papers that are referenced by many authors, and let the references to those papers guide the selection in the systematic review. We evaluate the search strategies on three published systematic reviews. The results vary greatly between the three studied systematic reviews, from 88% reduction to 92% extension of the original paper set.",,,Mats Skoglund|Per Runeson,https://openalex.org/A5090950796|https://openalex.org/A5087032437,|https://orcid.org/0000-0003-2795-4851,SE|SE,Lund University|Lund University,https://openalex.org/I187531555|https://openalex.org/I187531555,True|False,cc-by,0.98953041,69,https://openalex.org/I187531555,Reference-based search strategies in systematic reviews,https://doi.org/10.14236/ewic/ease2009.4,VINNOVA|Vetenskapsrådet,17.767,False,en,True,hybrid,Electronic workshops in computing,https://openalex.org/P4310311871,British Computer Society,https://openalex.org/S4220651901,1477-9358,journal,Software Engineering Research,2009-01-01,2009,article
https://openalex.org/W2059149317,"Background: Action research is a well-established research methodology. It is following a post-positivist research philosophy grounded in critical thinking. The methodology is driven by practical problems, emphasis participatory research, and develops practically useful solutions in an iterative manner.",,,Kai Petersen|Çiğdem Gencel|Negin Asghari|Dejan Baca|Stefanie Betz,https://openalex.org/A5071394068|https://openalex.org/A5033698104|https://openalex.org/A5065848296|https://openalex.org/A5041924350|https://openalex.org/A5057087037,https://orcid.org/0000-0002-1532-8223|https://orcid.org/0000-0003-0115-8902|||https://orcid.org/0000-0002-3613-5893,SE|IT|SE|SE|DE,Blekinge Institute of Technology|Free University of Bozen-Bolzano|Ericsson (Sweden)|Ericsson (Sweden)|Karlsruhe Institute of Technology,https://openalex.org/I52719799|https://openalex.org/I171543936|https://openalex.org/I1306339040|https://openalex.org/I1306339040|https://openalex.org/I102335020,True|False|False|False|False,other-oa,0.97812693,67,https://openalex.org/I52719799,Action research as a model for industry-academia collaboration in the software engineering context,https://doi.org/10.1145/2647648.2647656,,10.2559,False,en,True,green,,,,,,,Software Engineering Techniques and Practices,2014-09-16,2014,article
https://openalex.org/W4239828870,,,,Claes Wohlin,https://openalex.org/A5037810527,https://orcid.org/0000-0003-0460-5253,SE,Blekinge Institute of Technology,https://openalex.org/I52719799,True,,0.98285348,48,https://openalex.org/I52719799,Empirical software engineering research with industry: Top 10 challenges,https://doi.org/10.1109/cesi.2013.6618469,,12.1342,False,en,False,closed,,,,,,,Software Engineering Research,2013-05-01,2013,article
