Cites,Authors,Title,Year,Source,Publisher,ArticleURL,CitesURL,GSRank,QueryDate,Type,DOI,ISSN,CitationURL,Volume,Issue,StartPage,EndPage,ECC,CitesPerYear,CitesPerAuthor,AuthorCount,Age,Abstract,FullTextURL,RelatedURL
0,"A Sivaanpu, K Punithakumar, R Zheng…","Speckle Noise Reduction Techniques in Ultrasound Imaging: A comprehensive review of the last two decades (2005–2024)",2025,"Computer Methods and …","Elsevier","https://www.sciencedirect.com/science/article/pii/S0169260725005668","",13,"2026-01-15 11:47:48","","","","",,,,,0,0.00,0,4,1,"Ultrasound imaging has become a widely used medical modality over the past few decades. Despite technological advances, ultrasound images are susceptible to inherent noise that …","","https://scholar.google.com/scholar?q=related:I66bHP7kYvwJ:scholar.google.com/&scioq=&hl=en&as_sdt=2005&sciodt=0,5"
0,"M Havakeshian, Y Labiche","On Software Testing Reference Ontologies",2025,"Journal of Systems and Software","Elsevier","https://www.sciencedirect.com/science/article/pii/S0164121225004285","",20,"2026-01-15 11:47:48","","","","",,,,,0,0.00,0,2,1,"Software testing manipulates various artifacts, such as application and test code, requirements, test objectives and results, that are important to stakeholders such as …","","https://scholar.google.com/scholar?q=related:IqBNJoclElUJ:scholar.google.com/&scioq=&hl=en&as_sdt=2005&sciodt=0,5"
0,"K Veena, N Jigeesh","Potential influence of performance management on knowledge management in the light of organisational learning-an empirical study in Indian software industry",2025,"International Journal of Knowledge …","inderscienceonline.com","https://www.inderscienceonline.com/doi/abs/10.1504/IJKL.2025.148774","",28,"2026-01-15 11:47:48","","10.1504/IJKL.2025.148774","","",,,,,0,0.00,0,2,1,"Almost all kinds of industries accepted and adopted organisational learning to improve the performance of individual employees, groups of employees (teams) and the organisation as …","","https://scholar.google.com/scholar?q=related:Dz3JKM_52GwJ:scholar.google.com/&scioq=&hl=en&as_sdt=2005&sciodt=0,5"
0,"MFN Mohammad, R Abdullah…","Development and validation of a questionnaire for measuring the sustainability factors of quality management systems",2025,"… of Productivity and …","inderscienceonline.com","https://www.inderscienceonline.com/doi/abs/10.1504/IJPQM.2025.148467","",31,"2026-01-15 11:47:48","","10.1504/IJPQM.2025.148467","","",,,,,0,0.00,0,3,1,"This study elaborates on the development of a questionnaire as a survey instrument for measuring the sustainability factors of quality management systems. The scope covers the …","","https://scholar.google.com/scholar?q=related:NG2T5HNVkFoJ:scholar.google.com/&scioq=&hl=en&as_sdt=2005&sciodt=0,5"
0,"EA Elfaiz","The Barriers of Knowledge Acquisition and Knowledge Transfer in Software Companies: A Systematic Literature Review",2025,"Journal of Innovation Information Technology and …","ejournal.pnc.ac.id","https://ejournal.pnc.ac.id/index.php/jinita/article/view/2522","",38,"2026-01-15 11:47:48","","","","",,,,,0,0.00,0,1,1,"","https://ejournal.pnc.ac.id/index.php/jinita/article/download/2522/939","https://scholar.google.com/scholar?q=related:LgCTdqD3OHUJ:scholar.google.com/&scioq=&hl=en&as_sdt=2005&sciodt=0,5"
0,"M Havakeshian","Streamlining Test Processes with Applied AI: Integrating and Analyzing Test Data for Cost Reduction in 5G and Beyond-an Industry Perspective",2025,"","carleton.scholaris.ca","https://carleton.scholaris.ca/items/a9bbc4fa-b690-41b8-ad66-161c4d5cc78e/full","",49,"2026-01-15 11:47:48","","","","",,,,,0,0.00,0,1,1,"In the rapidly evolving telecommunications industry, organizations face the challenge of ensuring that a diverse range of products perform effectively across various configurations …","https://carleton.scholaris.ca/bitstreams/f14f3d12-49a3-432c-a4d8-c8d7b7392fd0/download","https://scholar.google.com/scholar?q=related:CJoCX56RxSYJ:scholar.google.com/&scioq=&hl=en&as_sdt=2005&sciodt=0,5"
0,"S Heigl","Predicting mutation-scores with a cheap quality model",2023,"","repositum.tuwien.at","https://repositum.tuwien.at/handle/20.500.12708/186965","",57,"2026-01-15 11:47:48","","","","",,,,,0,0.00,0,1,3,"Keeping a good test-suite is important, otherwise a software project may get unmaintainable. There are several techniques to determine the quality of a test-suite, with mutation testing …","https://repositum.tuwien.at/bitstream/20.500.12708/186965/1/Heigl%20Stefan%20-%202023%20-%20Predicting%20Mutation-Scores%20with%20a%20Cheap%20Quality%20Model.pdf","https://scholar.google.com/scholar?q=related:ZMSCuZOdW5kJ:scholar.google.com/&scioq=&hl=en&as_sdt=2005&sciodt=0,5"
0,"M Chugh","A Deep Drive into Knowledge Management for Improving Software Process and Product: Visions and Research Directions",2022,"Proceedings of 3rd International Conference on …","Springer","https://link.springer.com/chapter/10.1007/978-981-19-2828-4_2","",60,"2026-01-15 11:47:48","","10.1007/978-981-19-2828-4_2","","",,,,,0,0.00,0,1,4,"Software engineering organizations strive to develop the high-quality software. To accomplish the goal of the developing a high-quality software, the software process has to …","","https://scholar.google.com/scholar?q=related:ZQ7xj0gd5EUJ:scholar.google.com/&scioq=&hl=en&as_sdt=2005&sciodt=0,5"
0,"MAA Feris, K Goffin, O Zwikael, D Fan","Research Online",,"academia.edu","","https://www.academia.edu/download/98735808/viewcontent.pdf","",63,"2026-01-15 11:47:48","PDF","","","",,,,,0,0.00,0,4,,"R&D plays a crucial role in developing new products, the commercialisation of which can drive corporate growth. Over three decades, research has focused the new product …","https://www.academia.edu/download/98735808/viewcontent.pdf","https://scholar.google.com/scholar?q=related:zn6fvNASbHgJ:scholar.google.com/&scioq=&hl=en&as_sdt=2005&sciodt=0,5"
0,"RA Aguilar, N Garcia, JC Díaz","A Systematic Mapping Study in the area of Software Testing",2022,"International Journal of …","search.proquest.com","https://search.proquest.com/openview/ef77e4c540551d39977c838a0d08791a/1?pq-origsite=gscholar&cbl=696410","",65,"2026-01-15 11:47:48","","","","",,,,,0,0.00,0,3,4,"This article offers an overview of the research developed in the last decade in the area of software testing. Systematic Literature Mapping was used as a research methodology, and …","","https://scholar.google.com/scholar?q=related:FSb3ASsGLooJ:scholar.google.com/&scioq=&hl=en&as_sdt=2005&sciodt=0,5"
0,"NA Yahaya, MA Abdulgabber…","An Evolutionary Approach to Software Testing Ontology Development",2022,"International Journal of …","academia.edu","https://www.academia.edu/download/93040809/IJIT_V8I5P1.pdf","",70,"2026-01-15 11:47:48","PDF","","","",,,,,0,0.00,0,3,4,"ABSTRACT Software Testing Ontology (STO) serves as a formal representation of the vocabulary to be used in descriptions pertaining to software testing knowledge area. The …","https://www.academia.edu/download/93040809/IJIT_V8I5P1.pdf","https://scholar.google.com/scholar?q=related:7trOozsL-bEJ:scholar.google.com/&scioq=&hl=en&as_sdt=2005&sciodt=0,5"
0,"S Vasanthapriyan","Investigating Software Testing Practices in Software Development Organizations: Sri Lankan Experience",2020,"Software Engineering for Agile Application …","igi-global.com","https://www.igi-global.com/chapter/investigating-software-testing-practices-in-software-development-organizations/250446","",71,"2026-01-15 11:47:48","","","","",,,,,0,0.00,0,1,6,"Software testing, which is a knowledge-intensive and collaborative activity, is a sub-area of software engineering. Software testing knowledge can be applied to different testing tasks …","","https://scholar.google.com/scholar?q=related:IFAtLmWm1GQJ:scholar.google.com/&scioq=&hl=en&as_sdt=2005&sciodt=0,5"
0,"M Murugan","The role of cultural intelligence in facilitating tacit knowledge sharing in Australian information and communication technology organisations",2020,"","research.usq.edu.au","https://research.usq.edu.au/item/q6497/the-role-of-cultural-intelligence-in-facilitating-tacit-knowledge-sharing-in-australian-information-and-communication-technology-organisations","",72,"2026-01-15 11:47:48","","","","",,,,,0,0.00,0,1,6,"In a world of rapidly changing technology, ICT companies require significant tacit knowledge transfer for product development and innovation as well as for sustainable and competitive …","https://research.usq.edu.au/download/4c92d1011bacacae5d569e1f160d3a531741c572013756b63f8e742dbedd0b65/2087705/Mutharasu%20Murugan%20U1064799_DBA%20Thesis%20Final.pdf","https://scholar.google.com/scholar?q=related:26X9TObjRZkJ:scholar.google.com/&scioq=&hl=en&as_sdt=2005&sciodt=0,5"
0,"J REZAEENOUR","The knowledge management Research studies in the age of cloud computing",2019,"","Technology of Education Journal","","",73,"2026-01-15 11:47:48","CITATION","","","",,,,,0,0.00,0,1,7,"","","https://scholar.google.com/scholar?q=related:FXeDemeKmm4J:scholar.google.com/&scioq=&hl=en&as_sdt=2005&sciodt=0,5"
0,"CJLR Teixeira","Knowledge Engineering Architecture for the Analysis of Organizational Log Data: a software tool for log data analysis",2018,"","comum.rcaap.pt","https://comum.rcaap.pt/entities/publication/a86a5786-ba52-4d61-af52-7d0954451ceb","",74,"2026-01-15 11:47:48","","","","",,,,,0,0.00,0,1,8,"Organisation log data are generate by software and can provide help to maintenance team addressing issues reported by the client. Once an application is in production, there are …","https://comum.rcaap.pt/bitstreams/64ce6929-82ee-490e-bc30-6f5fce6875dd/download","https://scholar.google.com/scholar?q=related:s9sVFlN70n0J:scholar.google.com/&scioq=&hl=en&as_sdt=2005&sciodt=0,5"
0,"T Lucero, JF Pacheco Torres","ESCUELA DE POSGRADO",,"","","","",75,"2026-01-15 11:47:48","CITATION","","","",,,,,0,0.00,0,2,,"","","https://scholar.google.com/scholar?q=related:8ZHA3AEE4f8J:scholar.google.com/&scioq=&hl=en&as_sdt=2005&sciodt=0,5"
0,"SK Weerathunga, S Vasanthapriyan","Knowledge Management Involvement in Improving Human Resource Management of the Organizations",2018,"","192.248.104.6","http://192.248.104.6/handle/345/2677","",76,"2026-01-15 11:47:48","","","","",,,,,0,0.00,0,2,8,"Human Resource Management is identified as essential for driving the human resource of any organization towards the success. Since they possess the knowledge required to …","http://192.248.104.6/bitstream/handle/345/2677/IRC2018%28410-414%29.pdf?sequence=1&isAllowed=y","https://scholar.google.com/scholar?q=related:v4-tB9DCWNUJ:scholar.google.com/&scioq=&hl=en&as_sdt=2005&sciodt=0,5"
0,"MS Hirani","An investigation of clinical knowledge management practices at the Aga Khan University Hospital, Nairobi",2016,"","Strathmore University","","",78,"2026-01-15 11:47:48","CITATION","","","",,,,,0,0.00,0,1,10,"","","https://scholar.google.com/scholar?q=related:0nO8e6hSnSsJ:scholar.google.com/&scioq=&hl=en&as_sdt=2005&sciodt=0,5"
0,"GA dos Reis Martins, EF de Souza","Um estudo do modelo das Sete Dimensões da Gestão do Conhecimento em indústrias de software",2022,"Simpósio Brasileiro de …","sol.sbc.org.br","https://sol.sbc.org.br/index.php/sbqs_estendido/article/view/23328","",79,"2026-01-15 11:47:48","","","","",,,,,0,0.00,0,2,4,"As empresas de desenvolvimento de software apresentam atividades que geram uma quantidade considerável de conhecimento. Os princípios da Gestão do Conhecimento (GC) …","https://sol.sbc.org.br/index.php/sbqs_estendido/article/download/23328/23155","https://scholar.google.com/scholar?q=related:wEVGltsLBGcJ:scholar.google.com/&scioq=&hl=en&as_sdt=2005&sciodt=0,5"
0,"D Silva, D Ferreira","Aprendizagem Corporativa em Teste de Software: Uma Revisao Sistemática da Literatura",2019,"Anais do Workshop de Informática na …","milanesa.ime.usp.br","http://milanesa.ime.usp.br/rbie/index.php/wie/article/view/8638","",81,"2026-01-15 11:47:48","","","","",,,,,0,0.00,0,2,7,"Software products developed by Brazilian organizations have stood out in the global IT market. Due to the existing flaws, these companies need to improve the quality of their …","http://milanesa.ime.usp.br/rbie/index.php/wie/article/viewFile/8638/6199","https://scholar.google.com/scholar?q=related:wZE8yhtIT3YJ:scholar.google.com/&scioq=&hl=en&as_sdt=2005&sciodt=0,5"
0,"AJ Rohling, VVG Neto, EY Nakagawa…","Evoluçao Arquitetural em Sistemas de Controle de Satélites",2019,"… Brasileiro de Software …","sol.sbc.org.br","https://sol.sbc.org.br/index.php/cbsoft_estendido/article/view/7661","",82,"2026-01-15 11:47:48","","","","",,,,,0,0.00,0,4,7,"Resumo Sistemas de Controle de Satélites (SCS) são responsáveis por manter o funcionando adequado dos satélites em órbita. Esses sistemas estão em constante …","https://sol.sbc.org.br/index.php/cbsoft_estendido/article/download/7661/7538","https://scholar.google.com/scholar?q=related:xWlnde-xTVIJ:scholar.google.com/&scioq=&hl=en&as_sdt=2005&sciodt=0,5"
0,"رضایی نور جلال, عسگری محمدسعید","مطالعات تحقیقاتی مدیریت دانش در عصر پردازش ابری‎",,"2019‎","فناوری آموزش‎","","",83,"2026-01-15 11:47:48","CITATION","","","",,,,,0,0.00,0,2,,"","","https://scholar.google.com/scholar?q=related:F3S03c81omsJ:scholar.google.com/&scioq=&hl=en&as_sdt=2005&sciodt=0,5"
0,"D de Autoría","Estrategia de Gestión del Conocimiento para el Laboratorio de Pruebas de Software de la Universidad de las Ciencias Informáticas",,"researchgate.net","","https://www.researchgate.net/profile/Celia-Soulary-Reyes/publication/316558394_Estrategia_de_Gestion_del_Conocimiento_para_el_Laboratorio_de_Pruebas_de_Software_de_la_Universidad_de_las_Ciencias_Informaticas/links/590407aaaca272116d2fcbf7/Estrategia-de-Gestion-del-Conocimiento-para-el-Laboratorio-de-Pruebas-de-Software-de-la-Universidad-de-las-Ciencias-Informaticas","",84,"2026-01-15 11:47:48","DOC","","","",,,,,0,0.00,0,1,,"La gestión del conocimiento constituye un factor clave en las organizaciones que realizan pruebas de software externas. Dado el papel predominante que desempeñan las personas …","https://www.researchgate.net/profile/Celia-Soulary-Reyes/publication/316558394_Estrategia_de_Gestion_del_Conocimiento_para_el_Laboratorio_de_Pruebas_de_Software_de_la_Universidad_de_las_Ciencias_Informaticas/links/590407aaaca272116d2fcbf7/Estrategia-de-Gestion-del-Conocimiento-para-el-Laboratorio-de-Pruebas-de-Software-de-la-Universidad-de-las-Ciencias-Informaticas","https://scholar.google.com/scholar?q=related:ASTAbi7DbB4J:scholar.google.com/&scioq=&hl=en&as_sdt=2005&sciodt=0,5"
0,"V Malý, L Burita, K Halouzka, V Ondryhal","The Knowledge Management Systems Based on Topic Maps Theory",2017,"Advances in Military Technology","","","",86,"2026-01-15 11:47:48","CITATION","","","",,,,,0,0.00,0,4,9,"","","https://scholar.google.com/scholar?q=related:tKQTI7dQM-IJ:scholar.google.com/&scioq=&hl=en&as_sdt=2005&sciodt=0,5"
0,"J Rezaeenour, MS Asgari","شزوــــمآ يرواـــنف‎",,"","","","",87,"2026-01-15 11:47:48","CITATION","","","",,,,,0,0.00,0,2,,"","","https://scholar.google.com/scholar?q=related:-Be6HrnwnHYJ:scholar.google.com/&scioq=&hl=en&as_sdt=2005&sciodt=0,5"
1,"DS Alves, DJ Smek, ÉF Souza, KR Felizardo…","Updating a Systematic Literature Review on Knowledge Management Diagnostics in Software Development Organizations",2024,"Proceedings of the XXIII …","dl.acm.org","https://dl.acm.org/doi/abs/10.1145/3701625.3701652","https://scholar.google.com/scholar?cites=11527204463441764604&as_sdt=2005&sciodt=0,5&hl=en",47,"2026-01-15 11:47:48","","10.1145/3701625.3701652","","",,,,,1,0.50,0,5,2,"Context: In the rapidly evolving software development landscape, organizations face the constant challenge to work with the generated knowledge. Knowledge Management (KM) …","https://dl.acm.org/doi/pdf/10.1145/3701625.3701652","https://scholar.google.com/scholar?q=related:_GC-wGLb-J8J:scholar.google.com/&scioq=&hl=en&as_sdt=2005&sciodt=0,5"
1,"P Premananthan…","Deep Learning-Based Mitosis Detection in Breast Cancer Histopathology Images: A Mapping Study",2024,"… Research Conference on …","ieeexplore.ieee.org","https://ieeexplore.ieee.org/abstract/document/10550511/","https://scholar.google.com/scholar?cites=3259653874781551429&as_sdt=2005&sciodt=0,5&hl=en",51,"2026-01-15 11:47:48","","","","",,,,,1,0.50,1,2,2,"Mitosis detection refers to the process of identifying and locating mitotic cells within histological or microscopic images. Mitosis, a crucial stage in the cell cycle, involves cell …","","https://scholar.google.com/scholar?q=related:RXsUwe2dPC0J:scholar.google.com/&scioq=&hl=en&as_sdt=2005&sciodt=0,5"
1,"FO Ibitowa, SO Akinola","Knowledge Management in Software Testing",2021,"University of Ibadan Journal of Science …","journals.ui.edu.ng","http://journals.ui.edu.ng/index.php/uijslictr/article/view/731","https://scholar.google.com/scholar?cites=1017267716201669818&as_sdt=2005&sciodt=0,5&hl=en",58,"2026-01-15 11:47:48","","","","",,,,,1,0.20,1,2,5,"Software testing aids in the assessment and improvement of software quality. Software testers employ a variety of techniques to uncover more defects with the least amount of …","https://journals.ui.edu.ng/index.php/uijslictr/article/download/731/652","https://scholar.google.com/scholar?q=related:umSsIZkPHg4J:scholar.google.com/&scioq=&hl=en&as_sdt=2005&sciodt=0,5"
1,"CN Turcanu","Knowledge Models for Software Testing in Robotics",2022,"… of International Conference on Information Technology …","Springer","https://link.springer.com/chapter/10.1007/978-981-16-7618-5_42","https://scholar.google.com/scholar?cites=13237725505789773917&as_sdt=2005&sciodt=0,5&hl=en",59,"2026-01-15 11:47:48","","10.1007/978-981-16-7618-5_42","","",,,,,1,0.25,1,1,4,"Robots are very complex systems requiring intensive testing before being released as final products on the market. Moreover, due to the fast pace of robotics technological …","","https://scholar.google.com/scholar?q=related:XUi6BjbZtbcJ:scholar.google.com/&scioq=&hl=en&as_sdt=2005&sciodt=0,5"
1,"MM Shongwe","Knowledge Management in Learning Software SMMEs in KwaZulu-Natal, South Africa",2017,"","University of KwaZulu-Natal …","","https://scholar.google.com/scholar?cites=9984507623225451688&as_sdt=2005&sciodt=0,5&hl=en",66,"2026-01-15 11:47:48","CITATION","","","",,,,,1,0.11,1,1,9,"","","https://scholar.google.com/scholar?q=related:qGSIe8gYkIoJ:scholar.google.com/&scioq=&hl=en&as_sdt=2005&sciodt=0,5"
1,"L Buřita, K Halouzka, V Malý…","Knowledge management systems based on topic maps theory",2017,"Advances in Military …","publikace.k.utb.cz","https://publikace.k.utb.cz/handle/10563/1007489","https://scholar.google.com/scholar?cites=4894661836970480138&as_sdt=2005&sciodt=0,5&hl=en",68,"2026-01-15 11:47:48","","","","",,,,,1,0.11,0,4,9,"The aim of the paper is to summarize the experience gained from the research and the constructions of the Knowledge Management Systems (KMS) based on the ontology …","https://publikace.k.utb.cz/bitstream/handle/10563/1007489/Fulltext_1007489.pdf?sequence=1","https://scholar.google.com/scholar?q=related:ClJJ-AFV7UMJ:scholar.google.com/&scioq=&hl=en&as_sdt=2005&sciodt=0,5"
1,"M Dadkhah","Semantic-based test case generation",2016,"2016 IEEE International Conference on Software …","ieeexplore.ieee.org","https://ieeexplore.ieee.org/abstract/document/7515489/","https://scholar.google.com/scholar?cites=3686781917006165165&as_sdt=2005&sciodt=0,5&hl=en",69,"2026-01-15 11:47:48","","","","",,,,,1,0.10,1,1,10,"Software testing is a major V&V activity that revolves around quality test cases. Generating quality test cases is inherently knowledge intensive, tedious and expensive task that is …","","https://scholar.google.com/scholar?q=related:rXR8v54UKjMJ:scholar.google.com/&scioq=&hl=en&as_sdt=2005&sciodt=0,5"
1,"OMB Herrera, ML Trujillo…","Las buenas prácticas y las TI en la gestión del conocimiento de las Pymes Colombia",2017,"Revista Espacios","es.revistaespacios.com","http://es.revistaespacios.com/a17v38n03/a17v38n03p07.pdf","https://scholar.google.com/scholar?cites=1215185240548655227&as_sdt=2005&sciodt=0,5&hl=en",77,"2026-01-15 11:47:48","PDF","","","",,,,,1,0.11,0,3,9,"El objetivo del artículo presente es explicar la relación existente entre las buenas prácticas y las TI para la gestión del conocimiento de las pymes de Colombia, la cual parte de un …","http://es.revistaespacios.com/a17v38n03/a17v38n03p07.pdf","https://scholar.google.com/scholar?q=related:e0Azt4k03RAJ:scholar.google.com/&scioq=&hl=en&as_sdt=2005&sciodt=0,5"
1,"A Bonora, KR Felizardo, ÉF de Souza, N Vijaykumar","Replications on the use of graphical abstracts to support study selection in systematic mapping studies.",2021,"CIbSE","","","https://scholar.google.com/scholar?cites=110217092375485443&as_sdt=2005&sciodt=0,5&hl=en",85,"2026-01-15 11:47:48","CITATION","","","",,,,,1,0.20,0,4,5,"","","https://scholar.google.com/scholar?q=related:A5w3j9yRhwEJ:scholar.google.com/&scioq=&hl=en&as_sdt=2005&sciodt=0,5"
2,"A Edin, M Qorbanzada","An Ambidextrous Approach to User Acceptance Testing Management and Automation: How software customers can optimize their processes to explore new …",2022,"","diva-portal.org","https://www.diva-portal.org/smash/record.jsf?pid=diva2:1700684","https://scholar.google.com/scholar?cites=17555529304130802872&as_sdt=2005&sciodt=0,5&hl=en",36,"2026-01-15 11:47:48","","","","",,,,,2,0.50,1,2,4,"User acceptance tests are tests that are executed by companies that are updating or integrating a new IT system. The system is usually procured by another company which has …","https://www.diva-portal.org/smash/get/diva2:1700684/FULLTEXT01.pdf","https://scholar.google.com/scholar?q=related:uFStkOPEofMJ:scholar.google.com/&scioq=&hl=en&as_sdt=2005&sciodt=0,5"
2,"M Chugh","A Research Perspective on Integrating Knowledge Management for Software Engineering",2021,"2021 5th International Conference on Information …","ieeexplore.ieee.org","https://ieeexplore.ieee.org/abstract/document/9702377/","https://scholar.google.com/scholar?cites=12058947464680316095&as_sdt=2005&sciodt=0,5&hl=en",44,"2026-01-15 11:47:48","","","","",,,,,2,0.40,2,1,5,"The software development organizations strive to develop quality software to survive and gain competitive edge in the unpredictable competitive environment. However, common …","","https://scholar.google.com/scholar?q=related:vxxe_dP8WacJ:scholar.google.com/&scioq=&hl=en&as_sdt=2005&sciodt=0,5"
2,"ÉF Souza, RA Falbo, MS Specimille…","Experience report on developing an ontology-based approach for knowledge management in software testing",2020,"Proceedings of the XIX …","dl.acm.org","https://dl.acm.org/doi/abs/10.1145/3439961.3439993","https://scholar.google.com/scholar?cites=5160190605015238163&as_sdt=2005&sciodt=0,5&hl=en",53,"2026-01-15 11:47:48","","10.1145/3439961.3439993","","",,,,,2,0.33,1,4,6,"Software testing is a knowledge intensive process. Thus, Knowledge Management (KM) emerges as a means to manage testing knowledge, and, consequently, to improve software …","https://dl.acm.org/doi/pdf/10.1145/3439961.3439993","https://scholar.google.com/scholar?q=related:E8Y98QOunEcJ:scholar.google.com/&scioq=&hl=en&as_sdt=2005&sciodt=0,5"
2,"JO dos Santos, GA dos Reis Martins…","Perceptions of knowledge management in Brazilian software development companies",2022,"… Ibero-Americano em …","sol.sbc.org.br","https://sol.sbc.org.br/index.php/cibse/article/view/20975","https://scholar.google.com/scholar?cites=4834078648146913831&as_sdt=2005&sciodt=0,5&hl=en",54,"2026-01-15 11:47:48","","","","",,,,,2,0.50,1,3,4,"The software development companies conduct activities that generate a considerable amount of knowledge. Knowledge Management (KM) allows working with the generated …","https://sol.sbc.org.br/index.php/cibse/article/download/20975/20801","https://scholar.google.com/scholar?q=related:J-oYH-sYFkMJ:scholar.google.com/&scioq=&hl=en&as_sdt=2005&sciodt=0,5"
2,"HM Idrus, N Ali","Towards development of software testing competency framework to empower software testers' profession",2018,"Int. J. Eng. Technol.(UAE)","researchgate.net","https://www.researchgate.net/profile/Hariaty-Mohd-Idrus/publication/330192971_Towards_Development_of_Software_Testing_Competency_Framework_to_Empower_Software_Testers%27_Profession/links/6020b9b4a6fdcc37a80e6559/Towards-Development-of-Software-Testing-Competency-Framework-to-Empower-Software-Testers-Profession.pdf","https://scholar.google.com/scholar?cites=3836979835650015597&as_sdt=2005&sciodt=0,5&hl=en",61,"2026-01-15 11:47:48","PDF","","","",,,,,2,0.25,1,2,8,"Separation of job functions between developers and testers due to enforcement of Software Quality Assurance (SQA) concept in software development has created worldwide demands …","https://www.researchgate.net/profile/Hariaty-Mohd-Idrus/publication/330192971_Towards_Development_of_Software_Testing_Competency_Framework_to_Empower_Software_Testers%27_Profession/links/6020b9b4a6fdcc37a80e6559/Towards-Development-of-Software-Testing-Competency-Framework-to-Empower-Software-Testers-Profession.pdf","https://scholar.google.com/scholar?q=related:bYFB0tSwPzUJ:scholar.google.com/&scioq=&hl=en&as_sdt=2005&sciodt=0,5"
2,"T Garrepalli","Knowledge Management in software testing",2015,"","diva-portal.org","https://www.diva-portal.org/smash/record.jsf?pid=diva2:869051","https://scholar.google.com/scholar?cites=15581790248248607548&as_sdt=2005&sciodt=0,5&hl=en",62,"2026-01-15 11:47:48","HTML","","","",,,,,2,0.18,2,1,11,"Knowledge Management in Software Testing diva-portal.org Digitala Vetenskapliga Arkivet Simple search Advanced search - Research publicationsAdvanced search - Student theses …","https://www.diva-portal.org/smash/record.jsf?pid=diva2:869051","https://scholar.google.com/scholar?q=related:PAOBx6yjPdgJ:scholar.google.com/&scioq=&hl=en&as_sdt=2005&sciodt=0,5"
