Cites,Authors,Title,Year,Source,Publisher,ArticleURL,CitesURL,GSRank,QueryDate,Type,DOI,ISSN,CitationURL,Volume,Issue,StartPage,EndPage,ECC,CitesPerYear,CitesPerAuthor,AuthorCount,Age,Abstract,FullTextURL,RelatedURL
18,"KR Felizardo, AYI da Silva, ÉF de Souza…","Evaluating strategies for forward snowballing application to support secondary studies updates: emergent results",2018,"Proceedings of the xxxii …","dl.acm.org","https://dl.acm.org/doi/abs/10.1145/3266237.3266240","https://scholar.google.com/scholar?cites=10154177780334085840&as_sdt=2005&sciodt=0,5&hl=en",23,"2026-01-15 11:47:48","","10.1145/3266237.3266240","","",,,,,18,2.25,5,4,8,"Context: Secondary studies should be updated from time to time to include new evidence to preserve their value. It is recognized that one search technique to update secondary studies …","http://bibdigital.sid.inpe.br/sid.inpe.br/mtc-m21c/2018/09.17.12.56","https://scholar.google.com/scholar?q=related:0Eb6XuTi6owJ:scholar.google.com/&scioq=&hl=en&as_sdt=2005&sciodt=0,5"
21,"BM Napoleão, ÉF de Souza, GA Ruiz…","Synthesizing researches on Knowledge Management and Agile Software Development using the Meta-ethnography method",2021,"Journal of Systems and …","Elsevier","https://www.sciencedirect.com/science/article/pii/S0164121221000704","https://scholar.google.com/scholar?cites=13910046755059994973&as_sdt=2005&sciodt=0,5&hl=en",11,"2026-01-15 11:47:48","","","","",,,,,21,4.20,5,4,5,"Context: Software development processes are considered as knowledge intensive and therefore Knowledge Management (KM) can be applied to efficiently manage the knowledge …","","https://scholar.google.com/scholar?q=related:XRFtPNNpCsEJ:scholar.google.com/&scioq=&hl=en&as_sdt=2005&sciodt=0,5"
21,"CPC Maciel, ÉF de Souza, R de Almeia Falbo…","Knowledge management diagnostics in software development organizations: a systematic literature review",2018,"Proceedings of the XVII …","dl.acm.org","https://dl.acm.org/doi/abs/10.1145/3275245.3275260","https://scholar.google.com/scholar?cites=4447162593910347025&as_sdt=2005&sciodt=0,5&hl=en",17,"2026-01-15 11:47:48","","10.1145/3275245.3275260","","",,,,,21,2.63,5,4,8,"Context: Managing knowledge is one of the main challenges for software development organizations. Thus, the principles of Knowledge Management (KM) are presented as …","https://dl.acm.org/doi/pdf/10.1145/3275245.3275260","https://scholar.google.com/scholar?q=related:EVVuLNF-tz0J:scholar.google.com/&scioq=&hl=en&as_sdt=2005&sciodt=0,5"
24,"Z Sun, C Hu, C Li, L Wu","Domain ontology construction and evaluation for the entire process of software testing",2020,"IEEE Access","ieeexplore.ieee.org","https://ieeexplore.ieee.org/abstract/document/9253652/","https://scholar.google.com/scholar?cites=8501790012146863686&as_sdt=2005&sciodt=0,5&hl=en",10,"2026-01-15 11:47:48","","","","",,,,,24,4.00,6,4,6,"As an important part of software engineering, software testing is a knowledge-intensive work. In the process of software testing, inconsistent knowledge expression, diverse …","https://ieeexplore.ieee.org/iel7/6287639/8948470/09253652.pdf","https://scholar.google.com/scholar?q=related:Rk76vPhs_HUJ:scholar.google.com/&scioq=&hl=en&as_sdt=2005&sciodt=0,5"
29,"N Khoshniat, A Jamarani, A Ahmadzadeh…","Nature-inspired metaheuristic methods in software testing",2024,"Soft Computing","Springer","https://link.springer.com/article/10.1007/s00500-023-08382-8","https://scholar.google.com/scholar?cites=5333713881409801546&as_sdt=2005&sciodt=0,5&hl=en",3,"2026-01-15 11:47:48","","10.1007/s00500-023-08382-8","","",,,,,29,14.50,7,4,2,"Software quality is becoming a momentous challenge in software engineering processes, and software testing has a pivotal role in its measurements. Nature-inspired metaheuristic …","https://www.researchgate.net/profile/Mostafa-Haghi-Kashani/publication/371379291_Nature-inspired_metaheuristic_methods_in_software_testing/links/6481a6f879a7223765182c53/Nature-inspired-metaheuristic-methods-in-software-testing.pdf","https://scholar.google.com/scholar?q=related:Sk0AE4QoBUoJ:scholar.google.com/&scioq=&hl=en&as_sdt=2005&sciodt=0,5"
30,"SD Costa, MP Barcellos, RA Falbo","Ontologies in human–computer interaction: A systematic literature review",2021,"Applied Ontology","journals.sagepub.com","https://journals.sagepub.com/doi/abs/10.3233/AO-210255","https://scholar.google.com/scholar?cites=15852072086313508773&as_sdt=2005&sciodt=0,5&hl=en",6,"2026-01-15 11:47:48","","10.3233/AO-210255","","",,,,,30,6.00,10,3,5,"Human–Computer Interaction (HCI) is a multidisciplinary area that involves a diverse body of knowledge and a complex landscape of concepts, which can lead to semantic problems …","https://dev.nemo.inf.ufes.br/hcion/paper-pdf/10.3233.AO-210255.pdf","https://scholar.google.com/scholar?q=related:pR-aGpPf_dsJ:scholar.google.com/&scioq=&hl=en&as_sdt=2005&sciodt=0,5"
34,"S Teixeira, BA Agrizzi, JG Pereira Filho…","Modeling and automatic code generation for wireless sensor network applications using model-driven or business process approaches: A systematic mapping study",2017,"Journal of Systems and …","Elsevier","https://www.sciencedirect.com/science/article/pii/S0164121217301255","https://scholar.google.com/scholar?cites=3433634138579304981&as_sdt=2005&sciodt=0,5&hl=en",12,"2026-01-15 11:47:48","","","","",,,,,34,3.78,9,4,9,"This systematic mapping study investigates the modeling and automatic code generation initiatives for wireless sensor network applications based on the IEEE 802.15. 4 standard …","","https://scholar.google.com/scholar?q=related:FYKsjg64pi8J:scholar.google.com/&scioq=&hl=en&as_sdt=2005&sciodt=0,5"
45,"HH Qiu, LG Liu","A study on the evolution of carbon capture and storage technology based on knowledge mapping",2018,"Energies","mdpi.com","https://www.mdpi.com/1996-1073/11/5/1103","https://scholar.google.com/scholar?cites=14048411481503594621&as_sdt=2005&sciodt=0,5&hl=en",9,"2026-01-15 11:47:48","HTML","","","",,,,,45,5.63,23,2,8,"As a useful technical measure to deal with the problem of carbon dioxide (CO2) emissions, carbon capture and storage (CCS) technology has been highly regarded in both theory and …","https://www.mdpi.com/1996-1073/11/5/1103","https://scholar.google.com/scholar?q=related:fXiKjc_79cIJ:scholar.google.com/&scioq=&hl=en&as_sdt=2005&sciodt=0,5"
47,"K Wnuk, T Garrepalli","Knowledge management in software testing: a systematic snowball literature review",2018,"e-Informatica Software Engineering …","yadda.icm.edu.pl","https://yadda.icm.edu.pl/baztech/element/bwmeta1.element.baztech-fd27294c-dc79-4c73-a97a-9fd519b0a713","https://scholar.google.com/scholar?cites=10016090599045724182&as_sdt=2005&sciodt=0,5&hl=en",8,"2026-01-15 11:47:48","","","","",,,,,47,5.88,24,2,8,"Background: Software testing benefits from the usage of Knowledge Management (KM) methods and principles. Thus, there is a need to adopt KM to the software testing core …","https://yadda.icm.edu.pl/baztech/element/bwmeta1.element.baztech-fd27294c-dc79-4c73-a97a-9fd519b0a713/c/wnuk_knowledge_1_2018.pdf","https://scholar.google.com/scholar?q=related:Fvg_ElVNAIsJ:scholar.google.com/&scioq=&hl=en&as_sdt=2005&sciodt=0,5"
53,"ÉF Souza, RA Falbo, NL Vijaykumar","ROoST: R eference O ntology on S oftware T esting",2017,"Applied Ontology","journals.sagepub.com","https://journals.sagepub.com/doi/abs/10.3233/AO-170177","https://scholar.google.com/scholar?cites=644237464936786622&as_sdt=2005&sciodt=0,5&hl=en",7,"2026-01-15 11:47:48","","10.3233/AO-170177","","",,,,,53,5.89,18,3,9,"Software testing is a complex and critical process for achieving product quality. Its importance has been increasing and well recognized, and there is a growing concern in …","https://www.researchgate.net/profile/Ricardo-Falbo/publication/314268288_ROoST_Reference_Ontology_on_Software_Testing/links/5a39336d45851501268dc799/ROoST-Reference-Ontology-on-Software-Testing.pdf","https://scholar.google.com/scholar?q=related:viqOoI_K8AgJ:scholar.google.com/&scioq=&hl=en&as_sdt=2005&sciodt=0,5"
61,"F Gurcan, GGM Dalveren, NE Cagiltay, D Roman…","Evolution of software testing strategies and trends: Semantic content analysis of software research corpus of the last 40 years",2022,"IEEE …","ieeexplore.ieee.org","https://ieeexplore.ieee.org/abstract/document/9910177/","https://scholar.google.com/scholar?cites=2939600485289153549&as_sdt=2005&sciodt=0,5&hl=en",1,"2026-01-15 11:47:48","","","","",,,,,61,15.25,12,5,4,"From the early days of computer systems to the present, software testing has been considered as a crucial process that directly affects the quality and reliability of software …","https://ieeexplore.ieee.org/iel7/6287639/6514899/09910177.pdf","https://scholar.google.com/scholar?q=related:DdQ5ExGPyygJ:scholar.google.com/&scioq=&hl=en&as_sdt=2005&sciodt=0,5"
62,"M Dadkhah, S Araban, S Paydar","A systematic literature review on semantic web enabled software testing",2020,"Journal of Systems and Software","Elsevier","https://www.sciencedirect.com/science/article/pii/S0164121219302596","https://scholar.google.com/scholar?cites=17158178045450192579&as_sdt=2005&sciodt=0,5&hl=en",4,"2026-01-15 11:47:48","","","","",,,,,62,10.33,21,3,6,"Software testing, as a major verification and validation activity which revolves around quality tests, is a knowledge-intensive activity. Hence, it is reasonable to expect that it can be …","","https://scholar.google.com/scholar?q=related:wwb3PwYYHu4J:scholar.google.com/&scioq=&hl=en&as_sdt=2005&sciodt=0,5"
80,"LAF Gomes, R da Silva Torres, ML Côrtes","Bug report severity level prediction in open source software: A survey and research opportunities",2019,"Information and software …","Elsevier","https://www.sciencedirect.com/science/article/pii/S0950584919301648","https://scholar.google.com/scholar?cites=9396920810546140304&as_sdt=2005&sciodt=0,5&hl=en",2,"2026-01-15 11:47:48","","","","",,,,,80,11.43,27,3,7,"Context: The severity level attribute of a bug report is considered one of the most critical variables for planning evolution and maintenance in Free/Libre Open Source Software. This …","","https://scholar.google.com/scholar?q=related:kBQUr7CRaIIJ:scholar.google.com/&scioq=&hl=en&as_sdt=2005&sciodt=0,5"
86,"R de Almeida Falbo","Mapeamento sistemático",2018,"Retrieved October","claudiaboeres.pbworks.com","http://claudiaboeres.pbworks.com/w/file/fetch/133747116/Mapeamento%20Sistem%C3%A1tico%20%20v1.0.pdf","https://scholar.google.com/scholar?cites=6292281122388973314&as_sdt=2005&sciodt=0,5&hl=en",14,"2026-01-15 11:47:48","PDF","","","",,,,,86,10.75,86,1,8,"Estudos secundários visam revisar estudos primários relativos a certas questões de pesquisa, com o objetivo específico de integrar e sintetizar evidências relacionadas a essas …","http://claudiaboeres.pbworks.com/w/file/fetch/133747116/Mapeamento%20Sistem%C3%A1tico%20%20v1.0.pdf","https://scholar.google.com/scholar?q=related:AhfkxlesUlcJ:scholar.google.com/&scioq=&hl=en&as_sdt=2005&sciodt=0,5"
210,"EY Nakagawa, KRF Scannavino, SCPF Fabbri…","Revisão sistemática da literatura em engenharia de software: teoria e prática",2017,"","Elsevier Brasil","","https://scholar.google.com/scholar?cites=10977159804569288240&as_sdt=2005&sciodt=0,5&hl=en",80,"2026-01-15 11:47:48","CITATION","","","",,,,,210,23.33,53,4,9,"","","https://scholar.google.com/scholar?q=related:MH4Myq60VpgJ:scholar.google.com/&scioq=&hl=en&as_sdt=2005&sciodt=0,5"
