Lens ID,Title,Date Published,Publication Year,Publication Type,Source Title,ISSNs,Publisher,Source Country,Author/s,Abstract,Volume,Issue Number,Start Page,End Page,Fields of Study,Keywords,MeSH Terms,Chemicals,Funding,Source URLs,External URL,PMID,DOI,Microsoft Academic ID,PMCID,Citing Patents Count,References,Citing Works Count,Is Open Access,Open Access License,Open Access Colour
049-361-367-553-763,Enhancing software development through project‐based learning and the quality of planning,2020-09-04,2020,journal article,R&D Management,00336807; 14679310,Wiley,United Kingdom,Marco Antônio Amaral Féris; Keith Goffin; Ofer Zwikael; Di Fan,"<jats:p>R&amp;D plays a crucial role in developing new products, the commercialisation of which can drive corporate growth. Over three decades, research has focused the new product development (NPD) process and it is known that developing new products is a knowledge‐intensive, risky activity. Since industry surveys show that many NPD projects, particularly software‐based ones, fail to meet their schedules and objectives. Consequently, today’s R&amp;D managers still need ways to plan and conduct NPD more effectively. Project‐based Learning (PBL) – the generation of specific technical and process knowledge during and after a project – is a potential way to improve NPD. Therefore, this paper investigated the research question: Does PBL enhance the quality of planning in subsequent software development projects? The study used a sample of 47 software development projects at three multinational organisations. Significantly, the findings show that PBL does enhance the quality of planning of subsequent software development projects. In particular, the quality of planning is increased in projects with high levels of uncertainty; where team members work in a project‐based structure with strong collaboration; and when the pressure to deliver projects is high. The contribution of the research at a theoretical level is that it identified an important link between learning and the quality of planning in subsequent NPD projects. At a practical level, the study identifies specific steps R&amp;D managers can take to improve the performance of software development projects, with all their associated challenges.</jats:p>",51,5,447,467,Engineering management; Business; Quality (business); Project-based learning; Software development,,,,,https://onlinelibrary.wiley.com/doi/10.1111/radm.12435 https://ro.uow.edu.au/balpapers/53/ https://dspace.lib.cranfield.ac.uk/handle/1826/16010 https://research.polyu.edu.hk/en/publications/enhancing-software-development-through-project-based-learning-and,http://dx.doi.org/10.1111/radm.12435,,10.1111/radm.12435,3083164110,,0,000-110-540-042-891; 001-647-170-604-856; 002-732-259-227-850; 002-744-610-223-880; 002-827-768-117-109; 006-871-272-174-55X; 010-783-826-302-782; 011-115-802-818-55X; 011-866-478-174-058; 015-927-015-493-951; 016-849-046-085-833; 017-117-621-150-391; 017-279-093-022-549; 017-732-612-565-127; 018-954-682-964-035; 019-146-411-572-436; 019-793-862-304-351; 020-038-906-769-326; 021-841-692-609-608; 021-979-187-689-047; 023-062-044-282-985; 024-068-710-411-042; 024-075-105-636-409; 025-152-502-060-67X; 027-242-789-624-963; 031-307-112-855-507; 032-619-688-603-395; 036-236-919-665-583; 036-281-399-106-085; 038-063-974-078-525; 038-522-085-869-589; 042-512-768-703-41X; 043-682-996-795-385; 044-517-864-292-628; 044-670-059-708-994; 045-989-473-472-033; 046-263-997-040-745; 047-457-704-610-065; 048-194-367-765-406; 048-266-138-858-174; 048-610-061-839-724; 048-754-556-737-669; 048-816-613-750-036; 048-910-885-033-832; 050-761-450-670-600; 051-161-858-118-526; 051-972-445-375-064; 052-315-272-206-102; 054-565-982-742-107; 055-526-004-888-476; 057-665-911-976-763; 058-570-825-942-342; 059-293-273-952-422; 059-398-819-508-747; 061-602-896-004-937; 062-416-200-051-805; 064-315-304-367-409; 065-427-608-608-809; 065-711-811-363-067; 066-225-356-061-042; 068-218-750-527-477; 069-729-527-612-549; 071-944-031-614-472; 073-019-614-462-612; 074-446-735-521-343; 077-340-218-459-370; 078-540-178-072-94X; 078-545-680-815-713; 080-021-978-779-473; 081-864-142-624-625; 083-192-640-703-303; 083-247-225-561-032; 083-275-954-249-741; 083-884-422-749-933; 085-686-323-192-67X; 090-299-465-450-743; 091-554-853-227-166; 093-810-742-297-682; 094-829-129-171-498; 095-426-802-674-627; 096-579-411-609-813; 098-023-500-096-30X; 103-729-330-746-579; 106-888-718-140-490; 107-819-028-082-331; 110-510-842-185-282; 111-911-827-992-143; 115-028-791-766-509; 118-894-976-543-280; 121-198-541-582-36X; 121-429-952-515-677; 121-871-071-455-290; 123-498-859-171-509; 124-607-214-353-58X; 126-674-647-232-321; 128-797-454-046-007; 129-359-357-071-039; 129-957-060-179-647; 130-219-823-219-16X; 135-680-815-304-863; 150-938-175-675-007; 152-886-694-371-743; 153-605-693-510-038; 155-009-628-601-525; 166-649-051-981-301; 172-575-632-454-663; 177-879-670-606-239; 183-521-027-263-83X,9,false,,
050-190-179-106-511,Machine Learning Approaches for Emotion Classification of Music: A Systematic Literature Review,,2019,conference proceedings article,2019 International Conference on Advancements in Computing (ICAC),,IEEE,,Charles Joseph; Sugeeswari Lekamge,"Music is ubiquitous in every corner of the world. Fundamental mechanisms for how a listener perceives emotions in music as well as the way in which the emotional goal of a composer is expressed through music have been widely explored. Not only humans but also machines can recognize emotions in music once they are trained. As a result, various machine learning approaches are tested by previous researchers for their capability in music emotion recognition. To identify the current status of research and the research gaps in the above domain, we conducted a systematic literature review, through which we investigated several key aspects including types of music, acoustic features, feature extraction mechanisms, classification algorithms, and their performance. Six electronic databases were searched for studies published until 2018. Initial set of studies comprised of 198 studies from which 14 were selected for detailed analysis. Findings revealed that a considerable number of studies have used western music whereas other cultural-specific music still remains to be explored. Acoustic features pertaining to pitch, intensity, timbre, tempo, rhythm, melody, and harmony have been commonly used. While Support Vector Machine, Naive Bayes, and k-Nearest Neighbor are among the frequently used standard classifiers, Fuzzy classifiers and ensemble learning also have been attempted. The discrepancies among the classifier performances reported in previous studies could be partially attributed to the differences in the key aspects we have considered. The study makes a significant contribution by providing a comprehensive and up-to-date review of the previous attempts made in the selected domain.",,,334,339,Statistical classification; Machine learning; Support vector machine; Artificial intelligence; Systematic review; Emotion classification; Timbre; Computer science; Ensemble learning; Naive Bayes classifier; Feature extraction,,,,,http://xplorestaging.ieee.org/ielx7/9099124/9103334/09103378.pdf?arnumber=9103378 http://ieeexplore.ieee.org/xpls/abs_all.jsp?arnumber=9103378,http://dx.doi.org/10.1109/icac49085.2019.9103378,,10.1109/icac49085.2019.9103378,3031785634,,0,000-866-886-460-468; 010-316-976-978-347; 019-063-654-302-015; 019-998-297-992-495; 021-173-320-548-807; 023-511-944-289-016; 024-450-926-738-420; 031-307-112-855-507; 037-223-280-511-586; 052-323-219-864-712; 057-101-205-881-827; 069-432-498-430-369; 076-626-747-173-658; 077-588-631-796-10X; 080-068-218-835-207; 100-448-281-412-766; 102-301-541-203-802; 102-586-704-861-431; 104-625-692-317-907; 112-287-790-990-418; 114-587-299-904-10X; 126-441-587-752-255; 140-352-112-507-988; 161-559-489-746-428,5,false,,
050-705-186-332-795,ICST - Semantic-Based Test Case Generation,,2016,conference proceedings article,"2016 IEEE International Conference on Software Testing, Verification and Validation (ICST)",,IEEE,,Mahboubeh Dadkhah,"Software testing is a major V&V activity that revolves around quality test cases. Generating quality test cases is inherently knowledge intensive, tedious and expensive task that is traditionally done by humans. Therefore, a great deal of research has been done to facilitate and automate test case generation as much as possible. Given the knowledge intensity of software test case generation, various knowledge management techniques, such as semantic-based techniques, are applicable. The main focus of our research is automatic generation of quality test cases using available knowledge from the early stages of software development, i.e. the RE. Our goal is to develop a semantic web enabled framework for integrating knowledge from various requirement models to generate effective and efficient test cases automatically. We are going to apply semantic technology to facilitate the test case generation process by means of ontologies and Web of Data.",,,377,378,Software mining; Software engineering; Software quality; Data mining; Test case; Semantic analytics; Semantic Web Stack; Computer science; Social Semantic Web; Semantic technology; Test Management Approach,,,,,https://dblp.uni-trier.de/db/conf/icst/icst2016.html#Dadkhah16 https://www.computer.org/csdl/proceedings-article/icst/2016/1827a377/12OmNscxj2o https://ieeexplore.ieee.org/document/7515489/,http://dx.doi.org/10.1109/icst.2016.47,,10.1109/icst.2016.47,2493378016,,0,031-307-112-855-507; 047-056-795-930-461; 059-386-931-093-707; 094-700-827-561-47X; 135-829-768-361-410,1,false,,
052-837-913-945-529,Innovative Behaviour of Employees in Organizations: A Mapping Study,2018-12-23,2018,journal article,International Journal of Multidisciplinary Studies,24656380; 2362079x,Sri Lanka Journals Online (JOL),,Shanmuganathan Vasanthapriyan,"Innovative behaviour can be referred as the introduction and application of new ideas, products, processes, and procedures to a person's work role or an organization. The aim of this mapping study is to investigate the areas regarding innovative behaviour of employees in software companies and also to find the research gap by using existing studies from 2008 to 2017. Aspects such as publication year and source, research type, factors affecting innovations and employee innovative behaviour and technologies have been concerned. The study was done by searching five electronic databases. Then the initial result ended up with 487 studies. After applying selection criteria to that result, a total number of 11 studies were selected. In the next stage snowballing and direct search was done to publications of researchers and research groups that accomplished these studies. This resulted in adding 6 more papers. Finally, 17 studies were identified addressing the research topic and answering research questions. A lot of studies were found regarding innovations in organizations and there were few studies about innovative behaviour of employees, but mapping study clearly shows an increase in the interest of the research topic in the recent years. Thus employees are the driving forces of innovations, most of the research papers discussing about innovations have also focused on the employee innovative behaviour. Besides, papers have discussed the factors affecting the employee innovative behaviour. Some of those papers have proposed innovative models to improve innovations. So as the conclusion, the findings show that innovative behaviour of employees is a very important area to consider to enhance innovations in organizations and also more studies should be done regarding the research topic. KEYWORDS: Innovative behaviour, Innovations, Knowledge sharing",5,2,1,,Business; Knowledge sharing; Direct search; Mapping study; Research groups; Work role; Research questions; Knowledge management,Innovative behaviour; Innovations; Knowledge sharing,,,,https://ijms.sljol.info/articles/10.4038/ijms.v5i2.95/galley/185/download/ https://journals.sjp.ac.lk/index.php/ijms/article/view/3939/3101 https://ijms.sljol.info/articles/10.4038/ijms.v5i2.95/ https://journals.sjp.ac.lk/index.php/ijms/article/view/3939,http://dx.doi.org/10.4038/ijms.v5i2.95,,10.4038/ijms.v5i2.95,2973199121,,0,000-080-838-488-605; 004-073-529-710-92X; 005-652-042-304-148; 029-766-335-921-066; 031-307-112-855-507; 032-858-730-719-737; 038-057-053-768-037; 050-955-388-889-50X; 052-073-198-988-097; 054-583-897-885-989; 057-788-761-586-099; 064-721-996-967-985; 068-019-909-285-659; 092-933-097-564-269; 098-079-173-495-196; 103-775-234-511-590; 104-982-446-287-453; 113-435-241-951-940; 118-277-281-385-606; 122-638-775-674-067; 156-991-960-574-712; 177-046-582-374-769,0,true,cc-by,gold
053-743-885-428-717,Effect of knowledge management on software product experience with mediating effect of perceived software process improvement: An empirical study for Indian software industry:,2019-03-06,2019,journal article,Journal of Information Science,01655515; 17416485,SAGE Publications,United States,Mitali Chugh; Nitin Chanderwal; Rajesh Kumar Upadhyay; Devendra Kumar Punia,"The software development industry is characterised by swift innovation and competition. To survive, software engineering (SE) organisations need to develop high-quality software products in a timel...",46,2,258,272,Swift; Empirical research; Information technology; Engineering; Product (category theory); Software development process; Process management; Software; Competition (economics); Software development,,,,,https://dl.acm.org/doi/abs/10.1177/0165551519833610 https://doi.org/10.1177/0165551519833610 https://dblp.uni-trier.de/db/journals/jis/jis46.html#ChughCUP20 https://journals.sagepub.com/doi/10.1177/0165551519833610 http://journals.sagepub.com/doi/10.1177/0165551519833610,http://dx.doi.org/10.1177/0165551519833610,,10.1177/0165551519833610,2921409122,,0,007-839-984-559-526; 008-446-415-484-631; 010-783-826-302-782; 012-385-759-934-550; 013-269-121-185-026; 013-501-632-641-218; 021-965-068-666-013; 024-043-679-120-974; 027-770-283-569-011; 029-774-167-951-265; 031-307-112-855-507; 033-171-354-077-456; 035-018-844-492-38X; 038-073-831-425-349; 043-682-996-795-385; 045-119-187-307-855; 046-590-173-499-594; 048-046-915-487-343; 049-146-340-681-253; 049-342-167-477-395; 051-975-164-698-08X; 052-791-125-558-412; 054-797-666-783-372; 057-654-866-650-006; 058-821-081-159-26X; 066-268-783-309-348; 075-569-789-055-76X; 088-714-399-709-780; 091-870-420-142-380; 093-810-742-297-682; 104-276-089-803-81X; 111-542-804-210-267; 114-692-916-460-538; 116-953-447-460-185; 118-073-241-227-289; 120-652-544-549-072; 122-445-928-318-805; 123-231-737-873-737; 125-536-403-362-363; 137-855-393-490-356; 138-387-124-266-796; 140-804-613-125-421; 162-304-105-889-385; 164-305-373-926-194; 178-466-301-231-970; 187-258-275-192-92X,7,false,,
059-600-217-432-833,Social Capital and Knowledge Networks of Software Developers: A Case Study,,2019,journal article,Journal of Database Management,10638016; 15338010,IGI Global,United States,VenuGopal Balijepally; Sridhar P. Nerur,"<jats:p>Software development is a problem-solving activity, where ideas are combined in complex ways to create a software product that embodies new knowledge. In this endeavor, software developers constantly look for actionable knowledge to help solve the problem at hand. While knowledge management efforts in the software development domain traditionally involved technical initiatives such as knowledge repositories, experience factories, and lessons-to-learn databases, there is a growing appreciation in the software community of the role of developers' personal knowledge networks in software development. However, research is scarce on the nature of these networks, the knowledge resources accessed from these networks, and the differences, if any, between developers of different experience levels. This research seeks to fill this void. Based on a case study in a software development organization, this research explores the nature of knowledge networks of developers from a social capital perspective. Specifically, it examines the structural and relational dimensions of developers' knowledge networks, identifies the specific actionable knowledge resources accessed from these networks, and explores how entry-level and more experienced developers differ along these dimensions. The findings from the qualitative analysis, backed by limited quantitative analysis of the case study data underpin the discussion, implications for practice and future research directions.</jats:p>",30,4,41,80,Business; Software; Knowledge management; Social capital,,,,,https://www.igi-global.com/article/social-capital-and-knowledge-networks-of-software-developers/241831 https://doi.org/10.4018/JDM.2019100103 https://dblp.uni-trier.de/db/journals/jdm/jdm30.html#BalijepallyN19,http://dx.doi.org/10.4018/jdm.2019100103,,10.4018/jdm.2019100103,2985040530,,0,000-165-299-237-569; 000-706-745-286-862; 001-441-531-697-231; 004-215-918-891-948; 005-364-991-769-063; 005-533-220-320-772; 005-676-423-222-177; 006-187-556-994-073; 007-668-566-281-898; 008-728-829-557-090; 009-323-427-611-139; 010-965-326-417-302; 011-409-696-624-228; 012-523-454-264-229; 013-347-232-816-266; 014-163-355-620-992; 014-412-025-671-468; 014-529-023-735-367; 014-656-403-425-135; 015-283-718-177-508; 016-075-957-665-082; 017-642-661-781-097; 017-748-431-508-576; 020-888-200-021-317; 021-789-320-697-058; 021-965-068-666-013; 022-774-738-500-720; 023-855-715-569-195; 024-721-937-340-84X; 025-164-557-431-739; 025-380-678-358-052; 026-118-385-750-651; 028-227-313-661-276; 028-352-589-463-572; 028-533-991-914-32X; 030-086-011-911-175; 031-307-112-855-507; 032-290-447-413-987; 032-368-365-798-577; 033-693-361-850-839; 033-754-595-184-388; 034-702-120-144-00X; 035-002-102-217-753; 035-132-655-632-91X; 036-236-919-665-583; 036-384-405-139-273; 037-257-260-164-332; 037-498-702-875-594; 038-786-731-166-618; 041-033-770-057-520; 042-689-895-423-959; 045-041-339-561-995; 045-119-187-307-855; 047-311-946-082-398; 049-164-429-988-947; 050-075-921-936-250; 050-192-696-850-532; 050-342-174-041-587; 051-975-164-698-08X; 052-028-885-031-323; 054-260-564-749-86X; 055-623-644-389-901; 056-109-986-272-468; 056-403-706-364-120; 056-499-921-069-596; 058-498-986-401-922; 058-821-081-159-26X; 059-063-907-715-629; 059-449-825-149-119; 059-551-061-563-184; 060-848-359-620-21X; 062-510-573-122-320; 063-875-669-124-660; 067-336-276-489-987; 067-546-384-039-014; 068-180-610-166-090; 069-114-706-362-142; 070-098-517-654-937; 070-292-941-425-921; 070-298-475-262-690; 071-959-323-767-085; 074-654-837-520-778; 074-984-271-066-765; 075-853-099-990-126; 081-017-778-263-338; 081-024-840-470-561; 082-072-383-458-614; 085-809-120-358-892; 086-282-326-816-519; 087-160-282-581-172; 093-810-742-297-682; 094-218-582-997-615; 095-803-532-667-312; 096-277-967-721-057; 097-302-670-958-107; 097-518-770-864-522; 098-094-745-228-145; 098-157-487-409-60X; 100-176-249-875-107; 101-873-479-365-583; 102-173-989-149-273; 103-190-169-911-93X; 103-921-020-610-932; 104-135-459-735-705; 105-065-497-247-417; 108-548-771-367-178; 111-819-171-804-346; 113-869-819-799-905; 116-977-674-420-382; 118-697-850-485-836; 119-393-479-650-756; 120-927-749-163-317; 122-445-928-318-805; 124-887-521-017-702; 125-899-945-985-787; 128-057-604-380-243; 138-162-263-123-536; 138-531-750-657-050; 143-612-109-419-511; 144-604-325-349-091; 150-411-544-320-375; 159-872-528-826-658; 161-315-953-850-886; 164-488-016-737-533; 169-879-220-790-577; 170-179-989-648-316; 173-340-996-870-318; 175-664-767-683-619; 177-879-670-606-239; 180-813-779-294-458; 187-550-180-759-653; 189-852-626-609-868; 192-249-010-541-617; 195-275-947-903-603,1,false,,
062-647-645-065-044,SBES - Evaluating strategies for forward snowballing application to support secondary studies updates: emergent results,2018-09-17,2018,conference proceedings article,Proceedings of the XXXII Brazilian Symposium on Software Engineering,,ACM,,Katia Romero Felizardo; Anderson Y. Iwazaki da Silva; Érica Ferreira de Souza; Nandamudi Lankalapalli Vijaykumar; Elisa Yumi Nakagawa,"Context: Secondary studies should be updated from time to time to include new evidence to preserve their value. It is recognized that one search technique to update secondary studies is forward snowballing and that the number of studies identified is dependent on the electronic databases selected. However, there is no consensus on what electronic database is most appropriate for applying forward snowballing. Objective: The main goal of this study is to evaluate the use of different electronic databases for applying forward snowballing to update secondary studies. Method: Six updates were performed using forward snowballing with support from two electronic databases, one specific (IEEE Xplore) and the other generic (Google Scholar) and three combinations were evaluated to obtain new evidence during secondary studies updating: (1) searching using Google Scholar as electronic database; (2) searching using IEEE Xplore as electronic database; and (3) searching using both, IEEE Xplore and Google Scholar as complementary electronic databases. Results: The use of a specific electronic database is not indicated for forward snowballing application to update SLRs, since many relevant studies may not be identified. However, the use of a generic database is sufficient to discover the majority of the studies. Conclusions: The emergent contribution of our work to the body of knowledge in the SLR field is to add empirical evidence regarding the use of different electronic databases to support forward snowballing application during secondary studies updates. These results should help reviewers when they decide to find evidences to update their SLRs.",,,184,189,Empirical evidence; Body of knowledge; Systematic review; Information retrieval; Context (language use); Electronic database; Field (computer science); Computer science,,,,CNPq Brazil,https://dl.acm.org/doi/10.1145/3266237.3266240 https://dblp.uni-trier.de/db/conf/sbes/sbes2018.html#FelizardoSSVN18 https://doi.org/10.1145/3266237.3266240,http://dx.doi.org/10.1145/3266237.3266240,,10.1145/3266237.3266240,2890983471,,0,008-323-736-023-705; 008-579-010-761-812; 015-085-720-803-152; 029-354-547-046-696; 031-307-112-855-507; 052-084-111-072-267; 056-730-427-293-575; 083-576-977-185-276; 132-223-682-075-856; 155-346-867-607-737; 157-862-256-200-755; 194-512-093-506-304,9,false,,
064-760-449-786-263,Deep Learning-Based Mitosis Detection in Breast Cancer Histopathology Images: A Mapping Study,2024-04-04,2024,conference proceedings article,2024 International Research Conference on Smart Computing and Systems Engineering (SCSE),,IEEE,,Premisha Premananthan; Mauran Kanagarathnam,"Mitosis detection refers to the process of identifying and locating mitotic cells within histological or microscopic images. Mitosis, a crucial stage in the cell cycle, involves cell division, and detecting mitotic figures is particularly important in various fields, especially in cancer diagnosis and research. Pathologists takes more time to detect the mitosis in traditional way, also there may be huge variants between experts. As a result, there has been significant interest in developing automated methods for mitosis detection in histopathology images. Several automatic mitosis detection techniques have been proposed in recent years. Five electronic research databases were searched in order to complete the mapping investigation. We took into account research articles released between January 2013 and May 2023. There were 227 studies in the first batch of results. A total of 79 studies were chosen from this set. We conducted a direct search of research organizations' and individuals' publications as well as snowballing techniques to find the 73 researchers who completed these investigations. 79 papers addressing Deep learning-based mitotic detection in breast cancer were found through the mapping project, and these have been examined to gather pertinent data for a number of research concerns. This mapping study will help the future researchers to easily identify the relevance within each study and will lead to continuous advancements in deep learning architectures and algorithms will likely lead to improved accuracy and efficiency in mitosis detection. Refinement of models, such as convolutional neural networks (CNNs) and more sophisticated architectures, may enhance the ability to detect mitotic figures with higher precision.",,,1,5,Histopathology; Breast cancer; Artificial intelligence; Computer science; Cancer; Medicine; Pathology; Internal medicine,,,,,,http://dx.doi.org/10.1109/scse61872.2024.10550511,,10.1109/scse61872.2024.10550511,,,0,015-543-355-399-029; 017-186-256-689-477; 017-946-784-991-361; 031-307-112-855-507; 032-010-500-087-369; 036-367-293-477-07X; 039-146-189-481-677; 039-452-951-438-191; 046-210-697-295-851; 119-832-202-769-668; 120-215-553-587-737; 122-157-902-540-305; 124-092-329-490-55X; 184-654-618-323-596,1,false,,
