Cites,Authors,Title,Year,Source,Publisher,ArticleURL,CitesURL,GSRank,QueryDate,Type,DOI,ISSN,CitationURL,Volume,Issue,StartPage,EndPage,ECC,CitesPerYear,CitesPerAuthor,AuthorCount,Age,Abstract,FullTextURL,RelatedURL
0,"E Flores","Integrating Environmental Cost Information in Logistics Network Management: A Case study for Volvo Logistics",2009,"","academia.edu","https://www.academia.edu/download/94533692/gupea_2077_20848_1.pdf","",547,"2026-05-05 09:36:02","HTML","","","",,,,,0,0.00,0,1,17,"We would like to thank our family and friends for the support and encouragement they have provided us throughout this thesis. Even though they may be far away, they are always there …","https://www.academia.edu/download/94533692/gupea_2077_20848_1.pdf","https://scholar.google.com/scholar?q=related:rpK7fY0Cd9IJ:scholar.google.com/&scioq=&hl=en&as_sdt=2005&sciodt=0,5"
11,"T Nagle, D Sammon, C Doyle","Insights into practitioner design science research",2017,"International Conference on Design …","Springer","https://link.springer.com/chapter/10.1007/978-3-319-59144-5_25","https://scholar.google.com/scholar?cites=14395264772108760053&as_sdt=2005&sciodt=0,5&hl=en",197,"2026-05-05 09:36:02","","10.1007/978-3-319-59144-5_25","","",,,,,11,1.22,4,3,9,"Building on two previous papers that focused on the concept of Practitioner Design Science Research [,], this paper:(i) presents the Practitioners Design Science Research (PDSR) …","","https://scholar.google.com/scholar?q=related:9bM8dQpBxscJ:scholar.google.com/&scioq=&hl=en&as_sdt=2005&sciodt=0,5"
9,"JT Nosek","Insider as action researcher",2007,"Information systems action research: An applied view …","Springer","https://link.springer.com/chapter/10.1007/978-0-387-36060-7_18","https://scholar.google.com/scholar?cites=15532260929601544218&as_sdt=2005&sciodt=0,5&hl=en",276,"2026-05-05 09:36:02","","10.1007/978-0-387-36060-7_18","","",,,,,9,0.47,9,1,19,"Usually, the action researcher is someone who is external to the organization, provides expertise in an organizational intervention, and systematically evaluates the intervention to …","","https://scholar.google.com/scholar?q=related:GiCUowWtjdcJ:scholar.google.com/&scioq=&hl=en&as_sdt=2005&sciodt=0,5"
1,"K Vlasenko, O Rovenska, I Lovianova, O Kondratyeva…","Inquiry-based learning for enhancing students' interest in mathematical research: a case study on approximation theory and Fourier series",2023,"","ekmair.ukma.edu.ua","https://ekmair.ukma.edu.ua/items/ade94028-f8d4-42ed-960a-df89b9ab30f5","https://scholar.google.com/scholar?cites=5364002728564303964&as_sdt=2005&sciodt=0,5&hl=en",327,"2026-05-05 09:36:02","","","","",,,,,1,0.33,0,5,3,"This paper investigates how to develop students' interest in mathematical research by using inquiry-based learning (IBL) as a pedagogical approach. We conducted a case study on the …","https://ekmair.ukma.edu.ua/bitstreams/6d6fcfd9-8954-46a0-b1a1-431fb814a8a8/download","https://scholar.google.com/scholar?q=related:XChN2g_EcEoJ:scholar.google.com/&scioq=&hl=en&as_sdt=2005&sciodt=0,5"
2,"ML Trigos, RAB Lavarda","Inovação aberta e estratégia aberta sob a perspectiva da estratégia como prática: um ensaio teórico",2024,"Revista Eletrônica de Ciência …","periodicosibepes.org.br","https://periodicosibepes.org.br/index.php/recadm/article/view/3837","https://scholar.google.com/scholar?cites=8313929459252574753&as_sdt=2005&sciodt=0,5&hl=en",202,"2026-05-05 09:36:02","","","","",,,,,2,1.00,1,2,2,"Resumo A Open Strategy (OS) emerge como um fenômeno que tem permitido à organização se adequar ao conceito que incorpora práticas de Open Innovation (OI) com …","https://periodicosibepes.org.br/index.php/recadm/article/viewFile/3837/1215","https://scholar.google.com/scholar?q=related:IbpnSssCYXMJ:scholar.google.com/&scioq=&hl=en&as_sdt=2005&sciodt=0,5"
0,"EC Schjetne, ST Andersen","Innovation Processes in Indigenous Communities in the North-Cultural, Psychological and Technological Knowledge in Practice",2016,"International Conference on Culture …","Springer","https://link.springer.com/chapter/10.1007/978-3-319-50109-3_6","",495,"2026-05-05 09:36:02","","10.1007/978-3-319-50109-3_6","","",,,,,0,0.00,0,2,10,"The paper addresses psychological knowledge in innovation processes in rural areas in the North. The empirical base is the introduction of an innovation program realized through the …","https://inria.hal.science/hal-01619327/file/435890_1_En_6_Chapter.pdf","https://scholar.google.com/scholar?q=related:lLsFH1pUvdcJ:scholar.google.com/&scioq=&hl=en&as_sdt=2005&sciodt=0,5"
9,"MK Svangren, A Ananjeva, JS Persson, L Krog…","Infrastructuring in digital transformation: An action case study of district heating",2021,"","aisel.aisnet.org","https://aisel.aisnet.org/ecis2021_rp/29/","https://scholar.google.com/scholar?cites=1840059351780540563&as_sdt=2005&sciodt=0,5&hl=en",166,"2026-05-05 09:36:02","","","","",,,,,9,1.80,2,5,5,"Digital transformation is reshaping the public sector's provision of the physical, information, and human infrastructures that make a society function. Therefore, we need to understand …","https://scholar.archive.org/work/5rxmasdehnf7tl4fwecg4wlmx4/access/wayback/https://aisel.aisnet.org/cgi/viewcontent.cgi?article=1028&context=ecis2021_rp","https://scholar.google.com/scholar?q=related:k8CDPDs0iRkJ:scholar.google.com/&scioq=&hl=en&as_sdt=2005&sciodt=0,5"
27,"HD Frederiksen, L Mathiassen","Information-centric assessment of software metrics practices",2005,"IEEE Transactions on …","ieeexplore.ieee.org","https://ieeexplore.ieee.org/abstract/document/1468405/?casa_token=iH17rJUJUhgAAAAA:OUHY2_Rx2ONlkahIzEFJmMMxfqN4H4KwrjR9ZEmc4fiDgPcFdQPA5KengVHhQkw0IYOfXS3SyYSz","https://scholar.google.com/scholar?cites=2443156487536435665&as_sdt=2005&sciodt=0,5&hl=en",177,"2026-05-05 09:36:02","","","","",,,,,27,1.29,14,2,21,"This paper presents an approach to enhance managerial usage of software metrics programs. The approach combines an organizational problem-solving process with a view …","https://ieeexplore.ieee.org/iel5/17/31494/01468405.pdf?casa_token=11fLwromtAwAAAAA:Pxsah-v09Mo61LfM-DoRkOAKKNxurg11gHdnWlxiIsoIwU9J-a5k2vV4TGuj921jYUwUN7IIJbL1","https://scholar.google.com/scholar?q=related:0eFMiuHV5yEJ:scholar.google.com/&scioq=&hl=en&as_sdt=2005&sciodt=0,5"
161,"H Taylor, E Artman, JP Woelfer","Information technology project risk management: bridging the gap between research and practice",2012,"Journal of Information …","journals.sagepub.com","https://journals.sagepub.com/doi/abs/10.1057/jit.2011.29?casa_token=bJgkqDvXu1EAAAAA:lZ0m6EOOc98QG59FuIOB4NaSuc0_Wsxp6SIej7A3B_bx9DWewZWgyi7pFD2fSknjuHLTjU11IMzeMQI","https://scholar.google.com/scholar?cites=12160838073794309848&as_sdt=2005&sciodt=0,5&hl=en",35,"2026-05-05 09:36:02","","10.1057/jit.2011.29","","",,,,,161,11.50,54,3,14,"The gap between research and practice is strikingly evident in the area of information technology (IT) project risk management. In spite of extensive research for over 30 years into …","https://journals.sagepub.com/doi/pdf/10.1057/jit.2011.29?casa_token=znoGiq9PKaYAAAAA:ng0eeTHw5WAgt4noYl96HdbXTNUxFUHh5uROxPCDq2W_xRwvludelY_vT0s0Eqh5oLq7ARHCLctUAQQ","https://scholar.google.com/scholar?q=related:2C6OF8z5w6gJ:scholar.google.com/&scioq=&hl=en&as_sdt=2005&sciodt=0,5"
0,"R Shishakly","Information Technology in Education Management (ITEM): Zayed's School Information System (ZSIS) Implementation Model (United Arab Emirates)",2005,"","search.proquest.com","https://search.proquest.com/openview/0a10a33ae4ecca852f33f520450efa28/1?pq-origsite=gscholar&cbl=2026366&diss=y","",544,"2026-05-05 09:36:02","BOOK","","","",,,,,0,0.00,0,1,21,"This piece of research concentrates on the area of School Information Systems (SIS) Implementation Framework. Implementation is a concept used in the literature on …","","https://scholar.google.com/scholar?q=related:uzWIczrQuOMJ:scholar.google.com/&scioq=&hl=en&as_sdt=2005&sciodt=0,5"
4,"H Taylor, JP Woelfer, E Artman","Information Technology Governance in Practice: A Project Management Office's Use of Early Risk Assessment as a Relational Mechanism",2012,"International Journal of Information …","igi-global.com","https://www.igi-global.com/article/content/68849","https://scholar.google.com/scholar?cites=10616570495601112302&as_sdt=2005&sciodt=0,5&hl=en",350,"2026-05-05 09:36:02","","","","",,,,,4,0.29,1,3,14,"This paper compares implementation frameworks for Information Technology (IT) governance and functions of a Project Management Office (PMO). While there are …","https://scholar.archive.org/work/6hxdp2nh3rek7mtgoprvn76cp4/access/wayback/http://pdfs.semanticscholar.org/8f2e/268d51a420b7d95b67add440075482283068.pdf","https://scholar.google.com/scholar?q=related:7nQy452iVZMJ:scholar.google.com/&scioq=&hl=en&as_sdt=2005&sciodt=0,5"
0,"P Seetharaman, J Cranefield","Information systems in India: Dare to cross",2019,"Information Systems","api.taylorfrancis.com","https://api.taylorfrancis.com/content/chapters/edit/download?identifierName=doi&identifierValue=10.4324/9780429202933-1&type=chapterpdf","",478,"2026-05-05 09:36:02","","","","",,,,,0,0.00,0,2,7,"The pluralistic nature of the information systems discipline can hardly be exaggerated. Yet, there is an increasing tendency to engage in debates on the need for a more emphatic …","","https://scholar.google.com/scholar?q=related:fIIu6UWlfSoJ:scholar.google.com/&scioq=&hl=en&as_sdt=2005&sciodt=0,5"
54,"A Mursu","Information systems development in developing countries: Risk management and sustainability analysis in Nigerian software companies",2002,"","jyx.jyu.fi","https://jyx.jyu.fi/jyx/Record/jyx_123456789_13249","https://scholar.google.com/scholar?cites=15731125791956802805&as_sdt=2005&sciodt=0,5&hl=en",125,"2026-05-05 09:36:02","BOOK","","","",,,,,54,2.25,54,1,24,"The expectations of IT for socio-economic and human development in developing countries have been high, but the real benefits and the positive impacts have been somewhat …","https://jyx.jyu.fi/bitstreams/90a9fc4f-44e3-426d-a062-d56d7e4862c0/download","https://scholar.google.com/scholar?q=related:9RySio8vUNoJ:scholar.google.com/&scioq=&hl=en&as_sdt=2005&sciodt=0,5"
0,"JNL Barata","Information systems and quality management systems: researching lifecycle synergies",2015,"","search.proquest.com","https://search.proquest.com/openview/19971c9d0f08ff104f17cc5b1c9fea55/1?pq-origsite=gscholar&cbl=2026366&diss=y","",509,"2026-05-05 09:36:02","","","","",,,,,0,0.00,0,1,11,"Information systems and quality management systems: researching lifecycle synergies Page 1 Imagem João Nuno Lopes Barata Information systems and quality management systems …","https://www.academia.edu/download/94608828/Information_20systems_20and_20quality_20management_20systems.pdf","https://scholar.google.com/scholar?q=related:d_frMyKy4HIJ:scholar.google.com/&scioq=&hl=en&as_sdt=2005&sciodt=0,5"
2,"SD Scagnelli","Information Communication Technology (ICT) e azienda. Analisi, valutazione e orientamento agli stakeholders.",2017,"","iris.unito.it","https://iris.unito.it/handle/2318/1664003","https://scholar.google.com/scholar?cites=3194481942191028468&as_sdt=2005&sciodt=0,5&hl=en",465,"2026-05-05 09:36:02","BOOK","","","",,,,,2,0.22,2,1,9,"Negli ultimi vent'anni, le Tecnologie dell'Informazione e della Comunicazione, ovvero dell'Information and Communication Technology (ICT), hanno subito uno sviluppo …","","https://scholar.google.com/scholar?q=related:9DiyvWYUVSwJ:scholar.google.com/&scioq=&hl=en&as_sdt=2005&sciodt=0,5"
53,"D Marijan, S Sen","Industry–academia research collaboration and knowledge co-creation: Patterns and anti-patterns",2022,"ACM Transactions on Software Engineering and …","dl.acm.org","https://dl.acm.org/doi/abs/10.1145/3494519","https://scholar.google.com/scholar?cites=12628949297358471313&as_sdt=2005&sciodt=0,5&hl=en",21,"2026-05-05 09:36:02","","10.1145/3494519","","",,,,,53,13.25,27,2,4,"Increasing the impact of software engineering research in the software industry and the society at large has long been a concern of high priority for the software engineering …","https://dl.acm.org/doi/pdf/10.1145/3494519","https://scholar.google.com/scholar?q=related:kYB4k3kKQ68J:scholar.google.com/&scioq=&hl=en&as_sdt=2005&sciodt=0,5"
82,"D Marijan, A Gotlieb","Industry-Academia research collaboration in software engineering: The Certus model",2021,"Information and software technology","Elsevier","https://www.sciencedirect.com/science/article/pii/S0950584920302184","https://scholar.google.com/scholar?cites=2909269670895131073&as_sdt=2005&sciodt=0,5&hl=en",24,"2026-05-05 09:36:02","HTML","","","",,,,,82,16.40,41,2,5,"Context: Research collaborations between software engineering industry and academia can provide significant benefits to both sides, including improved innovation capacity for …","https://www.sciencedirect.com/science/article/pii/S0950584920302184","https://scholar.google.com/scholar?q=related:wZmFCVrNXygJ:scholar.google.com/&scioq=&hl=en&as_sdt=2005&sciodt=0,5"
5,"J Magnusson, H Enquist…","Incumbents and challengers: conflicting institutional logics in SaaS ERP business models",2012,"Journal of Service …","pdfs.semanticscholar.org","https://pdfs.semanticscholar.org/9d2c/5dacdcce5c9f437e475eda1d48509098aeaf.pdf","https://scholar.google.com/scholar?cites=6107802266334421337&as_sdt=2005&sciodt=0,5&hl=en",354,"2026-05-05 09:36:02","PDF","","","",,,,,5,0.36,2,3,14,"With a shift in the architecture for the design and delivery of information systems (IS), new business models are emerging. Professional analysts predict that by the end of 2012, a …","https://pdfs.semanticscholar.org/9d2c/5dacdcce5c9f437e475eda1d48509098aeaf.pdf","https://scholar.google.com/scholar?q=related:WWEw-8xFw1QJ:scholar.google.com/&scioq=&hl=en&as_sdt=2005&sciodt=0,5"
77,"BW Young, L Mathiassen, E Davidson","Inconsistent and incongruent frames during IT-enabled change: An action research study into sales process innovation",2016,"Journal of the Association …","aisel.aisnet.org","https://aisel.aisnet.org/jais/vol17/iss7/1/","https://scholar.google.com/scholar?cites=13539268866863008439&as_sdt=2005&sciodt=0,5&hl=en",56,"2026-05-05 09:36:02","","","","",,,,,77,7.70,26,3,10,"Integrating research on the social construction of technology and social cognitive processes in organizations, technology frame of reference (TFR) theory has helped researchers …","https://www.academia.edu/download/102361984/viewcontent.pdf","https://scholar.google.com/scholar?q=related:twrg30wl5bsJ:scholar.google.com/&scioq=&hl=en&as_sdt=2005&sciodt=0,5"
13,"JH Kietzmann","In touch out in the field. Coalescence and interactive innovation of technology for mobile work",2007,"","search.proquest.com","https://search.proquest.com/openview/a217a63e62ebfd99afd0679cde1d9da9/1?pq-origsite=gscholar&cbl=2026366","https://scholar.google.com/scholar?cites=3993897687209058622&as_sdt=2005&sciodt=0,5&hl=en",278,"2026-05-05 09:36:02","BOOK","","","",,,,,13,0.68,13,1,19,"Today, more than 90% of Britons own a mobile phone handset. Yet, the popularity of mobile telephony is a fairly recent phenomenon, with the first mobile phone call in the UK made …","","https://scholar.google.com/scholar?q=related:PqFZM8ksbTcJ:scholar.google.com/&scioq=&hl=en&as_sdt=2005&sciodt=0,5"
0,"JH Kietzmann","In Touch out in the Field",,"academia.edu","","https://www.academia.edu/download/25675263/Jan_Kietzmann_PhD.pdf","",497,"2026-05-05 09:36:02","PDF","","","",,,,,0,0.00,0,1,,"Today, more than 90% of Britons own a mobile phone handset. Yet, the popularity of mobile telephony is a fairly recent phenomenon, with the first mobile phone call in the UK made …","https://www.academia.edu/download/25675263/Jan_Kietzmann_PhD.pdf","https://scholar.google.com/scholar?q=related:pNSqRp7S6TMJ:scholar.google.com/&scioq=&hl=en&as_sdt=2005&sciodt=0,5"
1,"G Goldkuhl, J Lagsten","In search for an innovation theory: A practical theory for inquiry and co-learning",2014,"the 3rd International workshop on IT Artefact …","diva-portal.org","https://www.diva-portal.org/smash/record.jsf?pid=diva2:783855","https://scholar.google.com/scholar?cites=15441867311564873539&as_sdt=2005&sciodt=0,5&hl=en",444,"2026-05-05 09:36:02","","","","",,,,,1,0.08,1,2,12,"Innovations are usually conceived as new technical products aimed for commercial markets. However, the interest for innovations in the public sector is increasing and accompanying …","https://www.diva-portal.org/smash/get/diva2:783855/FULLTEXT01.pdf","https://scholar.google.com/scholar?q=related:Q1-KXoGITNYJ:scholar.google.com/&scioq=&hl=en&as_sdt=2005&sciodt=0,5"
28,"G Tjørnehøj, L Mathiassen","Improvisation during process-technology adoption: a longitudinal study of a software firm",2010,"Journal of Information …","journals.sagepub.com","https://journals.sagepub.com/doi/abs/10.1057/jit.2009.20?casa_token=EvUCv4iIbe8AAAAA:Mg5_JRwnJvuGaGpNIFRasc02-2b2aXsUdC_DwVFoptypE6zyjm-N2xx3WXwlNB4bXgtrRIrKmxthA1A","https://scholar.google.com/scholar?cites=18374028747705230951&as_sdt=2005&sciodt=0,5&hl=en",167,"2026-05-05 09:36:02","","10.1057/jit.2009.20","","",,,,,28,1.75,14,2,16,"Most software firms struggle to take advantage of the potential benefits of software process improvement (SPI) as they adopt this technology into the complex and dynamic realities of …","https://journals.sagepub.com/doi/pdf/10.1057/jit.2009.20?casa_token=xPss0TEOinEAAAAA:HtvRHY7RHR3CRrueGxbh39r_3cIFzNB2u_c3jLV6THJKq5i6BIp2GWCGysTTUFHLfZm2V3alfYnYp2k","https://scholar.google.com/scholar?q=related:ZybJ18up_f4J:scholar.google.com/&scioq=&hl=en&as_sdt=2005&sciodt=0,5"
201,"JE Frisk, F Bannister","Improving the use of analytics and big data by changing the decision-making culture: a design approach",2017,"Management Decision","emerald.com","https://www.emerald.com/md/article-abstract/55/10/2074/288173","https://scholar.google.com/scholar?cites=15955819637174765203&as_sdt=2005&sciodt=0,5&hl=en",13,"2026-05-05 09:36:02","","","","",,,,,201,22.33,101,2,9,"Purpose Evolving digital technologies continue to enable new ways to collect and analyze data and this has led some researchers to claim that skillful use of data analytics and big …","https://www.emerald.com/md/article/55/10/2074/288173","https://scholar.google.com/scholar?q=related:kwYBJmx1bt0J:scholar.google.com/&scioq=&hl=en&as_sdt=2005&sciodt=0,5"
5,"MH Jensen, PA Nielsen, JS Persson","Improving the impact of big data analytics projects with benefits dependency networks",2023,"Scandinavian Journal of …","aisel.aisnet.org","https://aisel.aisnet.org/sjis/vol35/iss1/2/","https://scholar.google.com/scholar?cites=8778816430777893839&as_sdt=2005&sciodt=0,5&hl=en",223,"2026-05-05 09:36:02","","","","",,,,,5,1.67,2,3,3,"Big data analytics is the next frontier in creating digital opportunities for businesses. However, analytics projects rarely deliver the intended benefits for the organizations that …","https://www.researchgate.net/profile/John-Persson/publication/375773987_Improving_the_impact_of_Big_Data_Analytics_Projects_with_Benefits_Dependency_Networks/links/655c783c3fa26f66f4194665/Improving-the-impact-of-Big-Data-Analytics-Projects-with-Benefits-Dependency-Networks.pdf","https://scholar.google.com/scholar?q=related:zwPhGAif1HkJ:scholar.google.com/&scioq=&hl=en&as_sdt=2005&sciodt=0,5"
80,"A Börjesson, L Mathiassen","Improving software organizations: agility challenges and implications",2005,"Information Technology &People","emerald.com","https://www.emerald.com/insight/content/doi/10.1108/09593840510633329/full/html","https://scholar.google.com/scholar?cites=15511116604697837195&as_sdt=2005&sciodt=0,5&hl=en",87,"2026-05-05 09:36:02","","10.1108/09593840510633329","","",,,,,80,3.81,40,2,21,"Purpose–The paper seeks to explore the impact of events in Software Process Improvement (SPI) environments based on a longitudinal study of a requirements management initiative …","https://www.emerald.com/itp/article-pdf/18/4/359/2707991/09593840510633329.pdf","https://scholar.google.com/scholar?q=related:i36t3F6OQtcJ:scholar.google.com/&scioq=&hl=en&as_sdt=2005&sciodt=0,5"
0,"SM Kamran","Improving Recurrent Software Development: A Contextualist Inquiry Into Release Cycle Management",2014,"","ScholarWorks@ Georgia State …","","",520,"2026-05-05 09:36:02","CITATION","","","",,,,,0,0.00,0,1,12,"","","https://scholar.google.com/scholar?q=related:008p9NpAtH8J:scholar.google.com/&scioq=&hl=en&as_sdt=2005&sciodt=0,5"
2,"NP Napier","Improving practices in a small software firm: an ambidextrous perspective",2007,"","dl.acm.org","https://dl.acm.org/doi/abs/10.5555/1467407","https://scholar.google.com/scholar?cites=13857145095218311493&as_sdt=2005&sciodt=0,5&hl=en",421,"2026-05-05 09:36:02","BOOK","10.5555/1467407","","",,,,,2,0.11,2,1,19,"Despite documented best practices and specialized tools, software organizations struggle to deliver quality software that is on time, within budget, and meets customer requirements …","","https://scholar.google.com/scholar?q=related:RbGIuQt4TsAJ:scholar.google.com/&scioq=&hl=en&as_sdt=2005&sciodt=0,5"
0,"L Mathiassen","Improving IT Project Management: An Appreciative Approach",2003,"New Directions for Evaluation","researchgate.net","https://www.researchgate.net/profile/Lars-Mathiassen/publication/228501834_Improving_IT_project_management_An_appreciative_approach/links/09e4150ed692b46e00000000/Improving-IT-project-management-An-appreciative-approach.pdf","",565,"2026-05-05 09:36:02","PDF","","","",,,,,0,0.00,0,1,23,"Contrary to the basic tenants of the information technology project management literature, this research adopts a positive stance towards current practices. We report from a one-year …","https://www.researchgate.net/profile/Lars-Mathiassen/publication/228501834_Improving_IT_project_management_An_appreciative_approach/links/09e4150ed692b46e00000000/Improving-IT-project-management-An-appreciative-approach.pdf","https://scholar.google.com/scholar?q=related:PsSbsQW6pEUJ:scholar.google.com/&scioq=&hl=en&as_sdt=2005&sciodt=0,5"
16,"JS Persson, J Nørbjerg, PA Nielsen","Improving ISD agility in fast-moving software organizations",2016,"","aisel.aisnet.org","https://aisel.aisnet.org/ecis2016_rp/96/","https://scholar.google.com/scholar?cites=13388204961172966525&as_sdt=2005&sciodt=0,5&hl=en",169,"2026-05-05 09:36:02","","","","",,,,,16,1.60,5,3,10,"Fast-moving software organizations must respond quickly to changing technological options and mar-ket trends while delivering high-quality services at competitive prices. Improving …","https://research.cbs.dk/files/46756392/jacob_n_rbjerg_improving_isd_agility_finalpublishedversion.pdf","https://scholar.google.com/scholar?q=related:fUzWenp1zLkJ:scholar.google.com/&scioq=&hl=en&as_sdt=2005&sciodt=0,5"
0,"R Lindekilde","Improving geographically distributed collaboration by transforming people's implicit theories through experiential learning activities",,"","","","",605,"2026-05-05 09:36:02","CITATION","","","",,,,,0,0.00,0,1,,"","","https://scholar.google.com/scholar?q=related:7k7H7i_24wwJ:scholar.google.com/&scioq=&hl=en&as_sdt=2005&sciodt=0,5"
9,"I Andersson, K Nilsson","Improving diffusion practices in a software organization",2002,"Proceedings of the 35th Annual …","ieeexplore.ieee.org","https://ieeexplore.ieee.org/abstract/document/994418/?casa_token=Zc7Qqyj60hwAAAAA:0Py3g7kivKGV27mTt36gDw7JXgRHGqVqby3p0iRGw_DSd32h6d5CBZCLEjwAfIgLY9PKxuNNOL8E","https://scholar.google.com/scholar?cites=5070281412928288016&as_sdt=2005&sciodt=0,5&hl=en",332,"2026-05-05 09:36:02","","","","",,,,,9,0.38,5,2,24,"Methods and tools that support systems development (SD) are usually motivated by a promise of better quality or increased productivity. In large software organizations …","https://ieeexplore.ieee.org/iel5/7798/21442/00994418.pdf?casa_token=RC1dqMjjoLEAAAAA:7bDBq0uzBhhWP6hGsKpFFtm6VxzWB10OOT-WCkx0OXzFZ1kOy5i26eeS29pcEK6-foBkMog0bR87","https://scholar.google.com/scholar?q=related:EDXb4BRCXUYJ:scholar.google.com/&scioq=&hl=en&as_sdt=2005&sciodt=0,5"
1,"A Börjesson","Improve by Improving the Improvers",2004,"th Information Systems Research in Scandinavia …","","","https://scholar.google.com/scholar?cites=10278134681124149525&as_sdt=2005&sciodt=0,5&hl=en",599,"2026-05-05 09:36:02","CITATION","","","",,,,,1,0.05,1,1,22,"","","https://scholar.google.com/scholar?q=related:FRkHXglFo44J:scholar.google.com/&scioq=&hl=en&as_sdt=2005&sciodt=0,5"
20,"A Borjesson","Improve by improving software process improvers",2006,"International Journal of Business Information …","inderscienceonline.com","https://www.inderscienceonline.com/doi/abs/10.1504/IJBIS.2006.008602","https://scholar.google.com/scholar?cites=15238813062348783298&as_sdt=2005&sciodt=0,5&hl=en",238,"2026-05-05 09:36:02","","10.1504/IJBIS.2006.008602","","",,,,,20,1.00,20,1,20,"With business environments constantly changing, organisations and individuals must execute and learn in parallel to ensure they can solve today's problems and plan for …","","https://scholar.google.com/scholar?q=related:wr7h070je9MJ:scholar.google.com/&scioq=&hl=en&as_sdt=2005&sciodt=0,5"
303,"WG Tan, A Cater-Steel, M Toleman","Implementing IT service management: a case study focussing on critical success factors",2009,"Journal of Computer …","Taylor &Francis","https://www.tandfonline.com/doi/abs/10.1080/08874417.2009.11645379","https://scholar.google.com/scholar?cites=7785337459696530242&as_sdt=2005&sciodt=0,5&hl=en",23,"2026-05-05 09:36:02","","10.1080/08874417.2009.11645379","","",,,,,303,17.82,101,3,17,"Queensland Health, a large Australian government agency, implemented a centralised IT service management model based on the ITIL framework. This paper presents an in-depth …","https://www.academia.edu/download/71685357/IMPLEMENTING_IT_SERVICE_MANAGEMENT_A_CAS20211006-24620-373lch.pdf","https://scholar.google.com/scholar?q=related:QvPAzSsTC2wJ:scholar.google.com/&scioq=&hl=en&as_sdt=2005&sciodt=0,5"
