Cites,Authors,Title,Year,Source,Publisher,ArticleURL,CitesURL,GSRank,QueryDate,Type,DOI,ISSN,CitationURL,Volume,Issue,StartPage,EndPage,ECC,CitesPerYear,CitesPerAuthor,AuthorCount,Age,Abstract,FullTextURL,RelatedURL
12,"C Sørensen","Scandinavian versus UK research.",2003,"Scandinavian Journal of Information Systems","researchgate.net","https://www.researchgate.net/profile/Carsten-Sorensen/publication/220531846_Scandinavian_Versus_UK_Research/links/02e7e52aa0857930a1000000/Scandinavian-Versus-UK-Research.pdf","https://scholar.google.com/scholar?cites=13479703351670517015&as_sdt=2005&sciodt=0,5&hl=en",249,"2026-05-05 09:36:02","PDF","","","",,,,,12,0.52,12,1,23,"This debate outlines some of the institutional aspects of perceived research quality and the potential implications on academic behaviour across Scandinavia and the United Kingdom …","https://www.researchgate.net/profile/Carsten-Sorensen/publication/220531846_Scandinavian_Versus_UK_Research/links/02e7e52aa0857930a1000000/Scandinavian-Versus-UK-Research.pdf","https://scholar.google.com/scholar?q=related:F632oceGEbsJ:scholar.google.com/&scioq=&hl=en&as_sdt=2005&sciodt=0,5"
4,"J Lemmergaard","Roles in the ISD process: a collaborative approach",2008,"Journal of Enterprise Information Management","emerald.com","https://www.emerald.com/jeim/article/21/5/543/223775","https://scholar.google.com/scholar?cites=12654604913338447373&as_sdt=2005&sciodt=0,5&hl=en",401,"2026-05-05 09:36:02","HTML","","","",,,,,4,0.22,4,1,18,"Purpose Looking at the Scandinavian information systems development (ISD) approach in contrast to more traditional ISD approaches, this paper reflects on experiences of the roles of …","https://www.emerald.com/jeim/article/21/5/543/223775","https://scholar.google.com/scholar?q=related:DXZzKB8wnq8J:scholar.google.com/&scioq=&hl=en&as_sdt=2005&sciodt=0,5"
0,"E Frisk","Revealing knowledge networks from computer mediated communication in organizations",2009,"","aisel.aisnet.org","https://aisel.aisnet.org/cgi/viewcontent.cgi?article=1077&context=ecis2009","",568,"2026-05-05 09:36:02","","","","",,,,,0,0.00,0,1,17,"Managers continually invest in new information technology (IT) but the question of organizational value still seems vague. One explanation is poor evaluation. In practice the …","","https://scholar.google.com/scholar?q=related:PRGj_zRVxiwJ:scholar.google.com/&scioq=&hl=en&as_sdt=2005&sciodt=0,5"
12,"H Lefebvre, C Legner","Rethinking Data Governance-A Viable System Model",2024,"Thirty-second European conference on …","serval.unil.ch","https://serval.unil.ch/notice/serval:BIB_21A0385A64E2","https://scholar.google.com/scholar?cites=16940246729866674114&as_sdt=2005&sciodt=0,5&hl=en",62,"2026-05-05 09:36:02","","","","",,,,,12,6.00,6,2,2,"Data governance is a prerequisite for organizations wanting to harness the strategic potential of data. Although the conceptual foundations of data governance have reached a …","https://serval.unil.ch/resource/serval:BIB_21A0385A64E2.P001/REF.pdf","https://scholar.google.com/scholar?q=related:wv8sxaXYF-sJ:scholar.google.com/&scioq=&hl=en&as_sdt=2005&sciodt=0,5"
8,"A Ndayikengurukiye, A Ez-Zahout…","Resource optimisation in cloud computing: comparative study of algorithms applied to recommendations in a big data analysis architecture",2021,"Journal of Automation …","yadda.icm.edu.pl","https://yadda.icm.edu.pl/baztech/element/bwmeta1.element.baztech-340aa7eb-1521-4f1a-940b-ec5d9bc5b385","https://scholar.google.com/scholar?cites=5522303797601188621&as_sdt=2005&sciodt=0,5&hl=en",172,"2026-05-05 09:36:02","","","","",,,,,8,1.60,3,3,5,"Recommender systems (RS) have emerged as a means of providing relevant content to users, whether in social networking, health, education, or elections. Furthermore, with the …","https://yadda.icm.edu.pl/baztech/element/bwmeta1.element.baztech-340aa7eb-1521-4f1a-940b-ec5d9bc5b385/c/Ndayikengurukiye.pdf","https://scholar.google.com/scholar?q=related:DTvPpQsqo0wJ:scholar.google.com/&scioq=&hl=en&as_sdt=2005&sciodt=0,5"
0,"SM Kiura","Resonance Facilitating Steps in Power Intensive Contexts: Project Establishment Experiences in the Kenyan Health Sector",2009,"","ediss.sub.uni-hamburg.de","https://ediss.sub.uni-hamburg.de/handle/ediss/2702","",540,"2026-05-05 09:36:02","CITATION","","","",,,,,0,0.00,0,1,17,"This research extends the existing knowledge as relates to praxis of information systems development in a specific context using methodological approaches developed in a different …","https://ediss.sub.uni-hamburg.de/bitstream/ediss/2702/1/Salesio-Diss-2009.pdf","https://scholar.google.com/scholar?q=related:Mr8VpwKxPHQJ:scholar.google.com/&scioq=&hl=en&as_sdt=2005&sciodt=0,5"
2,"J Eschler, H Taylor, S Palkar","Researching Dynamic Phenomena in Complex Organizations: Collaborative Practice Research with Theory Triangulation",2015,"2015 48th Hawaii International …","ieeexplore.ieee.org","https://ieeexplore.ieee.org/abstract/document/7070376/?casa_token=FRIP0bAwkQgAAAAA:gp1VQtW4f-JLa9zlYkrouAKTTHD57QKsIDG3OktxT6VpSa3YIERwcBRysYY8TPudUesCRzHKo2xe","https://scholar.google.com/scholar?cites=2525093088631582868&as_sdt=2005&sciodt=0,5&hl=en",404,"2026-05-05 09:36:02","","","","",,,,,2,0.18,1,3,11,"In this paper, we present a practice research strategy for collaboration with practitioners to execute valid and reliable research in the field while providing valuable, theory-based …","https://ieeexplore.ieee.org/iel7/7068092/7069647/07070376.pdf?casa_token=B50txOxptVEAAAAA:NrJil2Pai_Q2hmWIkZ5X1vJBUjcxOBNDnt3_bD_569dbMBq0CM3I9iMr7FKYrToGFgdl5HAHAgHc","https://scholar.google.com/scholar?q=related:lPCtHMnuCiMJ:scholar.google.com/&scioq=&hl=en&as_sdt=2005&sciodt=0,5"
17,"Y Dittrich, J Nørbjerg, P Tell, L Bendix","Researching cooperation and communication in continuous software engineering",2018,"Proceedings of the 11th …","dl.acm.org","https://dl.acm.org/doi/abs/10.1145/3195836.3195856","https://scholar.google.com/scholar?cites=8232706290744414543&as_sdt=2005&sciodt=0,5&hl=en",152,"2026-05-05 09:36:02","","10.1145/3195836.3195856","","",,,,,17,2.13,4,4,8,"Continuous Software Engineering (CSE)---continuous development and deployment of software---and DevOps---the close cooperation or integration of operations and software …","https://dl.acm.org/doi/pdf/10.1145/3195836.3195856","https://scholar.google.com/scholar?q=related:T9Hxr8ByQHIJ:scholar.google.com/&scioq=&hl=en&as_sdt=2005&sciodt=0,5"
7,"S Cronholm, H Göbel, A Shrestha","Researcher-practitioner collaboration in action design research",2024,"Australasian Journal of …","diva-portal.org","https://www.diva-portal.org/smash/record.jsf?pid=diva2:1899624","https://scholar.google.com/scholar?cites=2616290887998485596&as_sdt=2005&sciodt=0,5&hl=en",64,"2026-05-05 09:36:02","","","","",,,,,7,3.50,2,3,2,"Abstract Action Design Research (ADR) is a well-known research method within Design Science Research (DSR). An essential characteristic of the ADR method is the need for …","https://www.diva-portal.org/smash/get/diva2:1899624/FULLTEXT01.pdf","https://scholar.google.com/scholar?q=related:XLQ9cLPuTiQJ:scholar.google.com/&scioq=&hl=en&as_sdt=2005&sciodt=0,5"
84,"RM Davison, MG Martinsons…","Research perspectives: Improving action research by integrating methods",2021,"Journal of the Association …","aisel.aisnet.org","https://aisel.aisnet.org/jais/vol22/iss3/1/","https://scholar.google.com/scholar?cites=11426404144665865428&as_sdt=2005&sciodt=0,5&hl=en",4,"2026-05-05 09:36:02","","","","",,,,,84,16.80,28,3,5,"Action research (AR) has developed extensively since the 1970s. We reviewed the AR literature within the information systems (IS) discipline and found 16 different methods …","https://www.researchgate.net/profile/Maris-Martinsons/post/Organizational_Development-Best_Practices_descriptive_to_prescriptive/attachment/61adb7a5d248c650edb6d830/AS%3A1097914793369602%401638774693729/download/Improving+AR+by+integrating+methods+JAIS+2021.pdf","https://scholar.google.com/scholar?q=related:1Czcpge-kp4J:scholar.google.com/&scioq=&hl=en&as_sdt=2005&sciodt=0,5"
0,"R Kasauli","Requirements Engineering Challenges of Supporting Agile Teams in System Development",2018,"","research.chalmers.se","https://research.chalmers.se/en/publication/506108","",479,"2026-05-05 09:36:02","","","","",,,,,0,0.00,0,1,8,"Context: Agile methods have attracted many companies due to their reported benefits of short time-to-market and improved quality outputs. In the systems development context …","https://research.chalmers.se/publication/506108/file/506108_Fulltext.pdf","https://scholar.google.com/scholar?q=related:rC95to-s9O8J:scholar.google.com/&scioq=&hl=en&as_sdt=2005&sciodt=0,5"
0,"RK Namisanvu","Requirements Engineering Challenges of Supporting Agile Teams in System Development",2018,"","search.proquest.com","https://search.proquest.com/openview/782dee99311cf92720babf0d86adfa62/1?pq-origsite=gscholar&cbl=18750&diss=y","",486,"2026-05-05 09:36:02","","","","",,,,,0,0.00,0,1,8,"Context: Agile methods have attracted many companies due to their reported benefits of short time-to-market and improved quality outputs. In the systems development context …","","https://scholar.google.com/scholar?q=related:D5-0RvDAXs0J:scholar.google.com/&scioq=&hl=en&as_sdt=2005&sciodt=0,5"
21,"IS Wekke","Religious education and tolerance: learning process in high school of minority muslim Indonesia",2017,"","academia.edu","https://www.academia.edu/download/54434502/1-16-ismail-suardi-wekke-sabil-mokodenseho-firdaus.pdf","https://scholar.google.com/scholar?cites=14260500383285916903&as_sdt=2005&sciodt=0,5&hl=en",131,"2026-05-05 09:36:02","HTML","","","",,,,,21,2.33,21,1,9,"The plural religious phenomenon has shown the goodness perspective and the diversity universally and inclusively. The emergence of this thought, obviously, will replace products …","https://www.academia.edu/download/54434502/1-16-ismail-suardi-wekke-sabil-mokodenseho-firdaus.pdf","https://scholar.google.com/scholar?q=related:5zQUEYt558UJ:scholar.google.com/&scioq=&hl=en&as_sdt=2005&sciodt=0,5"
4,"K Syed, N Barqawi…","Release cycle management: an action research study into a software company",2019,"International Journal of …","inderscienceonline.com","https://www.inderscienceonline.com/doi/abs/10.1504/IJBIS.2019.097533","https://scholar.google.com/scholar?cites=11275475538374421228&as_sdt=2005&sciodt=0,5&hl=en",287,"2026-05-05 09:36:02","","10.1504/IJBIS.2019.097533","","",,,,,4,0.57,1,3,7,"Software is increasingly developed in a recurrent fashion. Still, we lack theoretical knowledge and conceptual models for continuously improving software release …","https://www.academia.edu/download/95618010/ijbis.2019.09753320221212-1-1h6uxm3.pdf","https://scholar.google.com/scholar?q=related:7OppGkOJepwJ:scholar.google.com/&scioq=&hl=en&as_sdt=2005&sciodt=0,5"
1,"K Syed, L Mathiassen","Release cycle management: A contextualist inquiry into recurrent software development",2014,"Fourth Annual International Conference on …","papers.ssrn.com","https://papers.ssrn.com/sol3/papers.cfm?abstract_id=2553349","https://scholar.google.com/scholar?cites=18333452335480404094&as_sdt=2005&sciodt=0,5&hl=en",438,"2026-05-05 09:36:02","","","","",,,,,1,0.08,1,2,12,"Software development is increasingly conducted in a recurrent fashion, where the same product or service is continuously being developed for the marketplace. Still, we lack …","https://papers.ssrn.com/sol3/Delivery.cfm?abstractid=2553349","https://scholar.google.com/scholar?q=related:fnjdqsOBbf4J:scholar.google.com/&scioq=&hl=en&as_sdt=2005&sciodt=0,5"
2,"S Madsen, K Bødker","Relationship management at the operational level in outsourcing",2010,"Scandinavian Conference on Information Systems","Springer","https://link.springer.com/chapter/10.1007/978-3-642-14874-3_1","https://scholar.google.com/scholar?cites=8829808869520491305&as_sdt=2005&sciodt=0,5&hl=en",422,"2026-05-05 09:36:02","","10.1007/978-3-642-14874-3_1","","",,,,,2,0.13,1,2,16,"Research suggests that achievement of a successful outsourcing relationship requires a tremendous amount of detailed management. In this paper we draw on relationship theory to …","","https://scholar.google.com/scholar?q=related:KcNcbmLIiXoJ:scholar.google.com/&scioq=&hl=en&as_sdt=2005&sciodt=0,5"
17,"P Levén, J Holmström","Regional IT innovation: a living lab approach",2012,"International Journal of Innovation …","inderscienceonline.com","https://www.inderscienceonline.com/doi/abs/10.1504/IJIRD.2012.046580","https://scholar.google.com/scholar?cites=1804036435779383273&as_sdt=2005&sciodt=0,5&hl=en",198,"2026-05-05 09:36:02","","10.1504/IJIRD.2012.046580","","",,,,,17,1.21,9,2,14,"The paper provides an integrated view of value creation in the development of new products and services related to IT. We argue that customer and end-user integration into the …","https://www.academia.edu/download/30722199/IJIRD040202-LEVEN.pdf","https://scholar.google.com/scholar?q=related:6e99hJQ5CRkJ:scholar.google.com/&scioq=&hl=en&as_sdt=2005&sciodt=0,5"
73,"A Baird, E Davidson, L Mathiassen","Reflective technology assimilation: Facilitating electronic health record assimilation in small physician practices",2017,"Journal of Management …","Taylor &Francis","https://www.tandfonline.com/doi/abs/10.1080/07421222.2017.1373003","https://scholar.google.com/scholar?cites=3961265157950580548&as_sdt=2005&sciodt=0,5&hl=en",48,"2026-05-05 09:36:02","","10.1080/07421222.2017.1373003","","",,,,,73,8.11,24,3,9,"Effectively incorporating complex technology into organizational practices requires moving beyond initial plateaus of postadoption usage. However, achieving this is especially …","","https://scholar.google.com/scholar?q=related:RKfGaKw9-TYJ:scholar.google.com/&scioq=&hl=en&as_sdt=2005&sciodt=0,5"
15,"R Halonen","Reflecting with the delone &mcclean model",2011,"","researchrepository …","https://researchrepository.universityofgalway.ie/entities/publication/7825abdb-ff16-4bc2-afca-089a0c7c3123","https://scholar.google.com/scholar?cites=5577656118023883675&as_sdt=2005&sciodt=0,5&hl=en",234,"2026-05-05 09:36:02","","","","",,,,,15,1.00,15,1,15,"This paper introduces a new approach to utilise the information system success model developed by DeLone and McLean. In practice, the new approach was to illustrate an …","https://researchrepository.universityofgalway.ie/bitstreams/45237893-c086-4060-8a15-8e63b6c808f8/download","https://scholar.google.com/scholar?q=related:mwsZCrDQZ00J:scholar.google.com/&scioq=&hl=en&as_sdt=2005&sciodt=0,5"
3,"C Kwan, L Hitchcock, T Clear, D Gotterbarn…","Refining the SoDIS® Process in the field: A COTS Project as a context for Risk Analysis",2005,"18th Annual NACCQ …","naccq.ac.nz","https://www.naccq.ac.nz/conference05/proceedings_05/papers/choon.pdf","https://scholar.google.com/scholar?cites=18193321056604870844&as_sdt=2005&sciodt=0,5&hl=en",394,"2026-05-05 09:36:02","PDF","","","",,,,,3,0.14,1,5,21,"In this paper we review the findings from an Industry collaborative research project. Software Development Impact Statements (SoDIS) have been applied to risk reduction and quality …","https://www.naccq.ac.nz/conference05/proceedings_05/papers/choon.pdf","https://scholar.google.com/scholar?q=related:vFiRzxupe_wJ:scholar.google.com/&scioq=&hl=en&as_sdt=2005&sciodt=0,5"
3,"N Smith","Reducing transformation friction: the role of organisational leadership in transformational project outcomes",2021,"","espace.library.uq.edu.au","https://espace.library.uq.edu.au/view/UQ:51e0d73","https://scholar.google.com/scholar?cites=3457539074854306566&as_sdt=2005&sciodt=0,5&hl=en",587,"2026-05-05 09:36:02","CITATION","","","",,,,,3,0.60,3,1,5,"Projects, a form of temporary organisation, comprise an increasing share of organisational activity and financial commitment. Organisational leaders initiate projects to realise strategic …","https://espace.library.uq.edu.au/view/UQ:51e0d73/s4543441_final_thesis.pdf","https://scholar.google.com/scholar?q=related:BkO5QXil-y8J:scholar.google.com/&scioq=&hl=en&as_sdt=2005&sciodt=0,5"
0,"P DUPIN, PC PASQUIRE, R STRATTON","Real estate development sites: in search for production flow stability though the application of pull systems.",2016,"","academia.edu","https://www.academia.edu/download/61047895/Pdf_MPhil-PhD_Transfer_Report_Full-Length20191028-126116-fekdx8.pdf","",503,"2026-05-05 09:36:02","PDF","","","",,,,,0,0.00,0,3,10,"The purpose of this research is to improve production flow stability of real estate development sites by complementing the existing planning systems. The research hence …","https://www.academia.edu/download/61047895/Pdf_MPhil-PhD_Transfer_Report_Full-Length20191028-126116-fekdx8.pdf","https://scholar.google.com/scholar?q=related:quqV8l2bv-AJ:scholar.google.com/&scioq=&hl=en&as_sdt=2005&sciodt=0,5"
25,"P Bjorn","Re-Negotiating Protocols: A Way to Integrate Group Ware in Collaborative Learning Settings",2003,"","aisel.aisnet.org","https://aisel.aisnet.org/ecis2003/10/","https://scholar.google.com/scholar?cites=13998874103889780148&as_sdt=2005&sciodt=0,5&hl=en",194,"2026-05-05 09:36:02","","","","",,,,,25,1.09,25,1,23,"Research is being done within the Computer Supported Collaborative Learning community to investigate how to apply the approach of Problem Oriented Project Pedagogy in distance …","https://www.academia.edu/download/44685720/Re-negotiating_protocols_a_way_to_integr20160413-8417-1ho33fj.pdf","https://scholar.google.com/scholar?q=related:tN3DCdT9RcIJ:scholar.google.com/&scioq=&hl=en&as_sdt=2005&sciodt=0,5"
2,"A Kenny","Quality, Evaluation: Policy, Theory and Practice in the Education Sector",2006,"Evaluation: Policy, Theory and Practice in the …","papers.ssrn.com","https://papers.ssrn.com/sol3/papers.cfm?abstract_id=945321","https://scholar.google.com/scholar?cites=2645715486999313523&as_sdt=2005&sciodt=0,5&hl=en",414,"2026-05-05 09:36:02","","","","",,,,,2,0.10,2,1,20,"Quality assurance procedures and evaluation processes have become dominant mainstream trends within the Irish education sectors over the last decade. Regulatory …","https://papers.ssrn.com/sol3/Delivery.cfm?abstractid=945321","https://scholar.google.com/scholar?q=related:c_xXwzd4tyQJ:scholar.google.com/&scioq=&hl=en&as_sdt=2005&sciodt=0,5"
1,"MÁ Conde-González","Proyecto Docente e Investigador. Titular de Universidad. Perfil Docente: Sistemas Operativos y Sistemas Automatizados de Reservas. Perfil Investigador …",2019,"","repositorio.grial.eu","https://repositorio.grial.eu/server/api/core/bitstreams/af9ecf82-019d-4887-ba3d-e8843f81bab3/content","https://scholar.google.com/scholar?cites=14475275629284765165&as_sdt=2005&sciodt=0,5&hl=en",491,"2026-05-05 09:36:02","PDF","","","",,,,,1,0.14,1,1,7,"1.3. 1¿ Qué es el EEES? __________________________________… 40 1.3. 2 Los créditos ECTS_____________________________… 44 1.3. 3 Organización de las …","https://repositorio.grial.eu/server/api/core/bitstreams/af9ecf82-019d-4887-ba3d-e8843f81bab3/content","https://scholar.google.com/scholar?q=related:7S1j1X2C4sgJ:scholar.google.com/&scioq=&hl=en&as_sdt=2005&sciodt=0,5"
0,"O Henfridsson, R Lindgren","Prototypes in Information Systems Action Research",,"","","","",619,"2026-05-05 09:36:02","CITATION","","","",,,,,0,0.00,0,2,,"","","https://scholar.google.com/scholar?q=related:H0GbeF7kUhIJ:scholar.google.com/&scioq=&hl=en&as_sdt=2005&sciodt=0,5"
0,"P Buijs","Proof of the Intelligent Products concept in a logistics context",2010,"","rug.nl","https://www.rug.nl/staff/p.buijs/mscthesis_paulbuijs.pdf","",537,"2026-05-05 09:36:02","PDF","","","",,,,,0,0.00,0,1,16,"Recent technological advancements, such as GPS, RFID and embedded computers, enable the possibility to obtain real-time information on individual resources and products. Due to …","https://www.rug.nl/staff/p.buijs/mscthesis_paulbuijs.pdf","https://scholar.google.com/scholar?q=related:hU1Vp7ZoAVgJ:scholar.google.com/&scioq=&hl=en&as_sdt=2005&sciodt=0,5"
3,"SSK Walkup, R Smith","Project-based development as a model for transdisciplinary research and education",2022,"Journal of Systemics, Cybernetics and Informatics","iiisci.org","https://www.iiisci.org/Journal/PDV/sci/pdfs/SA705RD22.pdf","https://scholar.google.com/scholar?cites=4307644889980674862&as_sdt=2005&sciodt=0,5&hl=en",244,"2026-05-05 09:36:02","PDF","","","",,,,,3,0.75,2,2,4,"Abstract1 Project-based educational environment that focuses on real-world problems and crosssector collaboration instills students' learning pathways with the proficiency to move …","https://www.iiisci.org/Journal/PDV/sci/pdfs/SA705RD22.pdf","https://scholar.google.com/scholar?q=related:LiPTXTTUxzsJ:scholar.google.com/&scioq=&hl=en&as_sdt=2005&sciodt=0,5"
16,"M Stromman, S Sierla, J Peltola…","Professional designers' adaptations of IEC 61499 to their individual work practices",2006,"2006 IEEE Conference …","ieeexplore.ieee.org","https://ieeexplore.ieee.org/abstract/document/4178189/?casa_token=Df3iuXzNe8AAAAAA:qj0WwJw7kcUGp1WJNzEAjvOpFPEBLwxaNpY0_MxAz9HAd8bldlDCaqd_317-EkNs98PPnb_Dvg94","https://scholar.google.com/scholar?cites=16410178319543626855&as_sdt=2005&sciodt=0,5&hl=en",277,"2026-05-05 09:36:02","","","","",,,,,16,0.80,4,4,20,"The IEC 61499 standard enables a number solutions to the same application development problem, and this can result in components that are incompatible even though they are …","https://ieeexplore.ieee.org/iel5/4178170/4178171/04178189.pdf?casa_token=ZuiaIckcVhUAAAAA:Z7zSiDUMQn-qFCAHq3qoSI6uqWjPwmwRQ1gekElDUxpnwKbxEzSLiA-BZ-e5dB-tQnJbfK_VuLvy","https://scholar.google.com/scholar?q=related:Z-w2nTyqvOMJ:scholar.google.com/&scioq=&hl=en&as_sdt=2005&sciodt=0,5"
8,"A Abdul, JM Bass, H Ghavimi…","Product innovation with scrum: A longitudinal case study",2017,"… on Information Society (i …","ieeexplore.ieee.org","https://ieeexplore.ieee.org/abstract/document/8354664/","https://scholar.google.com/scholar?cites=7279371942192641215&as_sdt=2005&sciodt=0,5&hl=en",231,"2026-05-05 09:36:02","","","","",,,,,8,0.89,2,4,9,"This paper describes the innovation processes used in a partnership between a company that provides asset integrity and maintenance management consulting services in the …","https://www.researchgate.net/profile/Julian-Bass/publication/320549001_Product_Innovation_with_Scrum_A_Longitudinal_Case_Study/links/59eb72010f7e9bfdeb70436f/Product-Innovation-with-Scrum-A-Longitudinal-Case-Study.pdf","https://scholar.google.com/scholar?q=related:v3RWsjaGBWUJ:scholar.google.com/&scioq=&hl=en&as_sdt=2005&sciodt=0,5"
0,"J Bass","Product Innovation with Scrum: A Longitudinal Case Study",,"academia.edu","","https://www.academia.edu/download/55517217/iSociety2017_Bass_Submitted.pdf","",480,"2026-05-05 09:36:02","HTML","","","",,,,,0,0.00,0,1,,"A longitudinal embedded case study has been used to investigate innovation processes at Add Latent Ltd. The company provides asset integrity and maintenance management …","https://www.academia.edu/download/55517217/iSociety2017_Bass_Submitted.pdf","https://scholar.google.com/scholar?q=related:ZtHv_m8lfwAJ:scholar.google.com/&scioq=&hl=en&as_sdt=2005&sciodt=0,5"
9,"JP Peltola, SA Sierla, MP Stromman…","Process Control with IEC 61499: Designers' Choices at Different Levels of the Application Hierarchy",2006,"2006 4th IEEE …","ieeexplore.ieee.org","https://ieeexplore.ieee.org/abstract/document/4053384/?casa_token=tU_XoK8ufZMAAAAA:YY-7rKKMXSpEG_xhqIfZ0mxLZPXrKWMe1QGj3zEbF6SPwIpC_OCfRjgeqEXhKgfiVQ3XtsnJrq__","https://scholar.google.com/scholar?cites=2336788973466067600&as_sdt=2005&sciodt=0,5&hl=en",319,"2026-05-05 09:36:02","","","","",,,,,9,0.45,2,4,20,"The IEC 61499 enables different approaches for application development, and this can undermine the emerging open knowledge economy. Developers typically try to use an …","https://ieeexplore.ieee.org/iel5/4053335/4053336/04053384.pdf?casa_token=60E9hZBBMM8AAAAA:DXy8p9CIxMGh1WYkvwlsZe-MzZxY9Znd040fTCFzs9zcXoqN5xQ3P6yQrVoMqO9dmEfieJ-Foz4k","https://scholar.google.com/scholar?q=related:kKJ-xjDxbSAJ:scholar.google.com/&scioq=&hl=en&as_sdt=2005&sciodt=0,5"
20,"PA Nielsen","Problematizing in IS design research",2020,"International Conference on Design Science Research …","Springer","https://link.springer.com/chapter/10.1007/978-3-030-64823-7_24","https://scholar.google.com/scholar?cites=16496891180634287847&as_sdt=2005&sciodt=0,5&hl=en",96,"2026-05-05 09:36:02","","10.1007/978-3-030-64823-7_24","","",,,,,20,3.33,20,1,6,"This paper is based on the interest to see how problems are addressed in information systems design research. Problems addressed by design research are often implicit …","https://vbn.aau.dk/ws/portalfiles/portal/425731430/Nielsen_problematizing_DESRIST_2020.pdf","https://scholar.google.com/scholar?q=related:5y773x-78OQJ:scholar.google.com/&scioq=&hl=en&as_sdt=2005&sciodt=0,5"
