title,abstract,authors,year,venue,journal,url,isOpenAccess,openAccessPdf,citationCount,referenceCount,isInfluential,publicationTypes,fieldsOfStudy,externalIds,influentialCitationCount,authors_names,publicationTypes_str,externalIds_str
Mobile devices compatibility testing strategy via crowdsourcing,"
Purpose
This paper aims to support small mobile application development teams or companies performing testing on a large variety of operating systems versions and mobile devices to ensure their seamless working.


Design/methodology/approach
This paper proposes a “hybrid crowdsourcing” method that leverages the power of public crowd testers. This leads to generating a novel crowdtesting workflow Developer/Tester- Crowdtesting (DT-CT) that focuses on developers and crowd testers as key elements in the testing process without the need for intermediate as managers or leaders. This workflow has been used in a novel crowdtesting platform (AskCrowd2Test). This platform enables testing the compatibility of mobile devices and applications at two different levels, high-level (device characteristics) or low-level (code). Additionally, a “crowd-powered knowledge base” has been developed that stores testing results, relevant issues and their solutions.


Findings
The comparison of the presented DT-CT workflow with the common and most recent crowdtesting workflows showed that DT-CT may positively impact the testing process by reducing time-consuming and budget spend because of the direct interaction of developers and crowd testers.


Originality/value
To authors’ knowledge, this paper is the first to propose crowdtesting workflow based on developers and public crowd testers without crowd managers or leaders, which light the beacon for the future research in this field. Additionally, this work is the first that authorizes crowd testers with a limited level of experience to participate in the testing process, which helps in studying the behaviors and interaction of end-users with apps and obtains more concrete results.
","[{'authorId': '7604764', 'name': 'Q. Naith'}, {'authorId': '1758555', 'name': 'F. Ciravegna'}]",2018.0,International Journal of Crowd Science,"{'volume': '2', 'pages': '225-246', 'name': 'Int. J. Crowd Sci.'}",https://www.semanticscholar.org/paper/169187c2e866b939857c69068cba402e2399bf0f,True,"{'url': 'https://www.emerald.com/insight/content/doi/10.1108/IJCS-09-2018-0024/full/pdf?title=mobile-devices-compatibility-testing-strategy-via-crowdsourcing', 'status': 'GOLD', 'license': 'CCBY', 'disclaimer': 'Notice: Paper or abstract available at https://api.unpaywall.org/v2/10.1108/IJCS-09-2018-0024?email=<INSERT_YOUR_EMAIL> or https://doi.org/10.1108/IJCS-09-2018-0024, which is subject to the license by the author or copyright owner provided with this content. Please go to the source to verify the license and copyright information for your use.'}",4,19,,['JournalArticle'],['Computer Science'],"{'DBLP': 'journals/ijcrowdsci/NaithC18', 'MAG': '2901225863', 'DOI': '10.1108/IJCS-09-2018-0024', 'CorpusId': 69623676}",0,"Q. Naith, F. Ciravegna",JournalArticle,"DBLP:journals/ijcrowdsci/NaithC18, MAG:2901225863, DOI:10.1108/IJCS-09-2018-0024, CorpusId:69623676"
Hybrid Crowd-powered Approach for Compatibility Testing of Mobile Devices and Applications,,"[{'authorId': '7604764', 'name': 'Q. Naith'}, {'authorId': '1758555', 'name': 'F. Ciravegna'}]",2018.0,International Conference on Crowd Science and Engineering,{'pages': '1:1-1:8'},https://www.semanticscholar.org/paper/2d64851a1f79110c14c1c5c465e513275b8ced21,True,"{'url': 'http://eprints.whiterose.ac.uk/142482/1/A_hybrid-crowd-powered.compressed.pdf', 'status': 'GREEN', 'license': None, 'disclaimer': ""Notice: The following paper fields have been elided by the publisher: {'abstract'}. Paper or abstract available at https://api.unpaywall.org/v2/10.1145/3265689.3265690?email=<INSERT_YOUR_EMAIL> or https://doi.org/10.1145/3265689.3265690, which is subject to the license by the author or copyright owner provided with this content. Please go to the source to verify the license and copyright information for your use.""}",4,28,,['JournalArticle'],['Computer Science'],"{'MAG': '2896599595', 'DBLP': 'conf/iccse/NaithC18', 'DOI': '10.1145/3265689.3265690', 'CorpusId': 53034248}",0,"Q. Naith, F. Ciravegna",JournalArticle,"MAG:2896599595, DBLP:conf/iccse/NaithC18, DOI:10.1145/3265689.3265690, CorpusId:53034248"
Serious Games Supported by Virtual Reality—Literature Review,"Serious games supported by virtual reality (VR) offer innovative solutions across diverse fields, such as education, therapy, and professional training, leveraging immersive and interactive environments to enhance engagement and learning outcomes. This paper provides a comprehensive literature review of VR-based serious games, focusing on their applications, benefits, and challenges. Key themes include the transformative impact of VR on education through improved motivation and experiential learning, therapeutic applications addressing physical and mental health, and professional training in hazardous and high-skill environments. Despite their potential, adoption is hindered by challenges such as high costs, limited accessibility, ethical concerns, and technical limitations, including cybersickness and scalability issues. This review also highlights emerging trends, including AI-driven adaptive learning, advancements in haptic feedback, and the integration of multisensory experiences, offering opportunities to address these barriers. By synthesizing current research and identifying critical gaps, this paper provides actionable recommendations for researchers and developers to maximize the impact of serious VR games in creating inclusive, effective, and scalable solutions for diverse user needs.","[{'authorId': '2346617986', 'name': 'Nadia Damianova'}, {'authorId': '2292502854', 'name': 'Santiago Berrezueta-Guzman'}]",2025.0,IEEE Access,"{'volume': '13', 'pages': '38548-38561', 'name': 'IEEE Access'}",https://www.semanticscholar.org/paper/55bf90416b0d8f335c48814666bada706a8d3605,True,"{'url': 'https://doi.org/10.1109/access.2025.3544022', 'status': 'GOLD', 'license': 'CCBY', 'disclaimer': 'Notice: Paper or abstract available at https://api.unpaywall.org/v2/10.1109/ACCESS.2025.3544022?email=<INSERT_YOUR_EMAIL> or https://doi.org/10.1109/ACCESS.2025.3544022, which is subject to the license by the author or copyright owner provided with this content. Please go to the source to verify the license and copyright information for your use.'}",19,85,,"['JournalArticle', 'Review']",['Computer Science'],"{'DBLP': 'journals/access/DamianovaB25', 'DOI': '10.1109/ACCESS.2025.3544022', 'CorpusId': 276531902}",0,"Nadia Damianova, Santiago Berrezueta-Guzman","JournalArticle, Review","DBLP:journals/access/DamianovaB25, DOI:10.1109/ACCESS.2025.3544022, CorpusId:276531902"
The digital transformation of business. Towards the datafication of the relationship with customers,"ABSTRACT Research presents an analysis of the most recent literature focused on digital transformation in business with special emphasis on the area of marketing. Within the framework of the changes that characterize the digital revolution in the Information Society, the use of Big Data is presented as the most important challenge and innovation of recent years. The use of massive data, only accessible to the largest companies, is seen as an effective tool for building customer loyalty by using data generated by the customers themselves to predict their behavior as consumers. However, this same use of data also raises ethical questions which should be explored.","[{'authorId': '1432674685', 'name': 'Cristina Fernández-Rovira'}, {'authorId': '2124495813', 'name': 'Jesús Álvarez Valdés'}, {'authorId': '146823196', 'name': 'Gemma Molleví'}, {'authorId': '2003482545', 'name': 'Ruben Nicolas-Sans'}]",2021.0,,"{'volume': '162', 'pages': '120339', 'name': 'Technological Forecasting and Social Change'}",https://www.semanticscholar.org/paper/688803925e430604bf5961dc0902001a4b50c3d0,False,"{'url': '', 'status': None, 'license': None, 'disclaimer': 'Notice: Paper or abstract available at https://api.unpaywall.org/v2/10.1016/J.TECHFORE.2020.120339?email=<INSERT_YOUR_EMAIL> or https://doi.org/10.1016/J.TECHFORE.2020.120339, which is subject to the license by the author or copyright owner provided with this content. Please go to the source to verify the license and copyright information for your use.'}",146,74,,,['Business'],"{'MAG': '3091727971', 'DOI': '10.1016/J.TECHFORE.2020.120339', 'CorpusId': 224986428}",4,"Cristina Fernández-Rovira, Jesús Álvarez Valdés, Gemma Molleví, Ruben Nicolas-Sans",,"MAG:3091727971, DOI:10.1016/J.TECHFORE.2020.120339, CorpusId:224986428"
International Journal of Crowd Science Mobile devices compatibility testing strategy via crowdsourcing,"Purpose – This paper aims to support small mobile application development teams or companies performing testing on a large variety of operating systems versions and mobile devices to ensure their seamlessworking. Design/methodology/approach – This paper proposes a “ hybrid crowdsourcing ” method that leverages the power of public crowd testers. This leads to generating a novel crowdtesting work ﬂ ow Developer/Tester-Crowdtesting (DT-CT) that focuses on developers and crowd testers as key elements in the testing process without the need for intermediate as managers or leaders. This work ﬂ ow has been used in a novel crowdtesting platform (AskCrowd2Test). This platform enables testing the compatibility of mobile devices and applications at two different levels, high-level (device characteristics) or low-level (code). Additionally, a “ crowd-powered knowledge base ” has been developed that stores testing results, relevant issues and their solutions. Findings – The comparison of the presented DT-CT work ﬂ ow with the common and most recent crowdtesting work ﬂ ows showed that DT-CT may positively impact the testing process by reducing time-consuming andbudget spendbecause of the direct interactionof developers and crowd testers. Originality/value – To authors ’ knowledge, this paper is the ﬁ rst to propose crowdtesting work ﬂ ow based on developers and public crowd testers without crowd managers or leaders, which light the beacon for the future research in this ﬁ eld. Additionally, this work is the ﬁ rst that authorizes crowd testers with a limited level of experience to participate in the testing process, which helps in studying the behaviors and interaction of end-userswith apps andobtains more concreteresults.","[{'authorId': '7604764', 'name': 'Q. Naith'}, {'authorId': '1758555', 'name': 'F. Ciravegna'}]",2019.0,,,https://www.semanticscholar.org/paper/c75859479a0fc0b6628bec88cfed31e38daaa48b,False,"{'url': '', 'status': None, 'license': None, 'disclaimer': 'Notice: Paper or abstract available at https://core.ac.uk/download/pdf/199218669.pdf, which is subject to the license by the author or copyright owner provided with this content. Please go to the source to verify the license and copyright information for your use.'}",0,23,,,,{'CorpusId': 250533193},0,"Q. Naith, F. Ciravegna",,CorpusId:250533193
Engineering Applications of Artificial Intelligence,,"[{'authorId': '2175322309', 'name': 'Lauren McMillan'}, {'authorId': '2103905190', 'name': 'Liz Varga'}]",,,,https://www.semanticscholar.org/paper/3007a06f6739ee25740e5e2f8cec5aa7c6064710,False,"{'url': '', 'status': None, 'license': None}",0,204,,['Review'],,{'CorpusId': 279241578},0,"Lauren McMillan, Liz Varga",Review,CorpusId:279241578
