"Key","Item Type","Publication Year","Author","Title","Publication Title","ISBN","ISSN","DOI","Url","Abstract Note","Date","Date Added","Date Modified","Access Date","Pages","Num Pages","Issue","Volume","Number Of Volumes","Journal Abbreviation","Short Title","Series","Series Number","Series Text","Series Title","Publisher","Place","Language","Rights","Type","Archive","Archive Location","Library Catalog","Call Number","Extra","Notes","File Attachments","Link Attachments","Manual Tags","Automatic Tags","Editor","Series Editor","Translator","Contributor","Attorney Agent","Book Author","Cast Member","Commenter","Composer","Cosponsor","Counsel","Interviewer","Producer","Recipient","Reviewed Author","Scriptwriter","Words By","Guest","Number","Edition","Running Time","Scale","Medium","Artwork Size","Filing Date","Application Number","Assignee","Issuing Authority","Country","Meeting Name","Conference Name","Court","References","Reporter","Legal Status","Priority Numbers","Programming Language","Version","System","Code","Code Number","Section","Session","Committee","History","Legislative Body"
"DWAMCS4P","journalArticle","2024","Santos, Jadson; Costa, Daniel Alencar da; McIntosh, Shane; Kulesza, Uirá","On the need to monitor continuous integration practices","Empirical Software Engineering","","","","https://api.semanticscholar.org/CorpusID:272524911","","2024","2026-01-23 19:43:10","2026-01-23 19:43:10","","","","","30","","","","","","","","","","","","","","","","","","","","","","","","","","","","","","","","","","","","","","","","","","","","","","","","","","","","","","","","","","","","","","","","","","","",""
"PR7MEIKA","journalArticle","2024","Alves, Daniela dos Santos; Smek, Deivid José; Souza, Érica Ferreira de; Felizardo, Kátia Romero; Vijaykumar, Nandamudi Lankalapalli","Updating a Systematic Literature Review on Knowledge Management Diagnostics in Software Development Organizations","Proceedings of the XXIII Brazilian Symposium on Software Quality","","","","https://api.semanticscholar.org/CorpusID:274967657","","2024","2026-01-23 19:43:10","2026-01-23 19:43:10","","","","","","","","","","","","","","","","","","","","","","","","","","","","","","","","","","","","","","","","","","","","","","","","","","","","","","","","","","","","","","","","","","","","","","","","",""
"MHYN8C5P","journalArticle","2022","Edan, Naktal Moaid; Mahmood, Basim","Usage one of Reverse Engineering Application (Node.js Web) to Construct Software Engineering Documents","Technium: Romanian Journal of Applied Sciences and Technology","","","","https://api.semanticscholar.org/CorpusID:248643153","","2022","2026-01-23 19:43:11","2026-01-23 19:43:11","","","","","","","","","","","","","","","","","","","","","","","","","","","","","","","","","","","","","","","","","","","","","","","","","","","","","","","","","","","","","","","","","","","","","","","","",""
"4MNVBTV6","journalArticle","2022","Júnior, Paulo Sérgio dos Santos; Barcellos, Monalessa Perini; Ruy, F. B.; Omêna, Moises Savedra","Flying over Brazilian Organizations with Zeppelin: A Preliminary Panoramic Picture of Continuous Software Engineering","Proceedings of the XXXVI Brazilian Symposium on Software Engineering","","","","https://api.semanticscholar.org/CorpusID:252384353","","2022","2026-01-23 19:43:11","2026-01-23 19:43:11","","","","","","","","","","","","","","","","","","","","","","","","","","","","","","","","","","","","","","","","","","","","","","","","","","","","","","","","","","","","","","","","","","","","","","","","",""
"NU45W3VN","journalArticle","2023","Khan, Habib Ullah; Afsar, Waseem; Nazir, Shah; Noor, Asra; Kundi, Mahwish; Maashi, Mashael S.; Alshahrani, Haya Mesfer","Revolutionizing software developmental processes by utilizing continuous software approaches","The Journal of Supercomputing","","","","https://api.semanticscholar.org/CorpusID:266217720","","2023","2026-01-23 19:43:11","2026-01-23 19:43:11","","9579 - 9608","","","80","","","","","","","","","","","","","","","","","","","","","","","","","","","","","","","","","","","","","","","","","","","","","","","","","","","","","","","","","","","","","","","","","","","",""
"L34HBMJ8","journalArticle","2025","Júnior, Paulo Sérgio dos Santos; Ruy, F. B.; Omêna, Moises Savedra; Barcellos, Monalessa Perini","Preliminary Panoramic View of Continuous Software Engineering Adoption in Brazilian Organizations","J. Softw. Eng. Res. Dev.","","","","https://api.semanticscholar.org/CorpusID:276708778","","2025","2026-01-23 19:43:11","2026-01-23 19:43:11","","","","","13","","","","","","","","","","","","","","","","","","","","","","","","","","","","","","","","","","","","","","","","","","","","","","","","","","","","","","","","","","","","","","","","","","","",""
"J5CKSSWG","conferencePaper","2021","Júnior, Paulo Sérgio dos Santos; Barcellos, Monalessa Perini; Almeida, João Paulo A.","An Ontology-based Approach to Enable Data-Driven Decision-Making in Agile Software Organizations","ONTOBRAS","","","","https://api.semanticscholar.org/CorpusID:245540766","","2021","2026-01-23 19:43:11","2026-01-23 19:43:11","","","","","","","","","","","","","","","","","","","","","","","","","","","","","","","","","","","","","","","","","","","","","","","","","","","","","","","","","","","","","","","","","","","","","","","","",""